"Test Name","Year","Session","Subject","Number","Question","Question_image","Option 1","Option 2","Option 3","Option 4","Answer"
"건설안전산업기사","2013","1","건설재료학","72","크롬니켈 등을 함유하며 탄소량이 적고 내식성, 내열성이 뛰어나며 건축 재료로 다방면에 사용되는 특수강은?","","동강(Copper steel)","주강(Steel casting)","스테인리스강(Stainless steel)","저탄소강(Low Carbon Steel)","3"
"건설안전산업기사","2013","1","건설재료학","73","목재의 역학적 성질에 영향을 미치는 요인과 가장 관계가 먼 것은?","","함수율","비중","나이테","옹이","3"
"건설안전산업기사","2013","1","건설재료학","74","회반죽 바름의 주원료가 아닌 것은?","","소석회","점토","모래","해초플","2"
"건설안전산업기사","2013","1","건설재료학","75","콘크리트용 골재에 관한 설명으로 옳지 않은 것은?","","골재의 조립률이란 일정 용기내에 골재가 차지하는 실제 용적의 비율이다.","일반적으로 비중이 큰 것은 공극, 흡수율이 적으므로 동결에 의한 손실도 적고 내구성이 크다.","실적율이 클수록 골재의 입도분포가 적당하여 시멘트 페이스트량이 적게 든다.","알칼리 골재반응은 골재 중의 실리카질광물이 시멘트중의 알칼리성분과 화학적으로 반응하는 것이다.","1"
"건설안전산업기사","2013","1","건설재료학","76","연질의 석재를 다듬을 때 쓰는 방법으로 양날 망치로 정다듬한 면을 일정방향으로 찍어 다듬는 돌표면 마무리 방법은?","","잔다듬","도드락다듬","혹두기","거친갈기","1"
"건설안전산업기사","2013","1","건설재료학","77","알루미늄창호(aluminium sash)에 대한 설명으로 옳지 않은 것은?","","강재창호에 비하여 경량이다.","녹슬지 않아 유지관리가 쉽다.","가공이 쉽고 기밀성이 우수하다.","알칼리성에 강하고 사용수명이 길다.","4"
"건설안전산업기사","2013","1","건설재료학","78","지하실 방수공사에 쓰이는 석유아스팔트로 가장 적합한 것은?","","아스팔타이트","스트레이트 아스팔트","레이크 아스팔트","로크 아스팔트","2"
"건설안전산업기사","2013","1","건설재료학","79","다음 중 방청도료에 해당되지 않는 것은?","","광명단","알루미늄도료","징크로메이트","오일스테인","4"
"건설안전산업기사","2013","1","건설재료학","80","다음 석재 중 내장용으로 주로 사용하는 석재는?","","대리석","화강암","안산암","점판암","1"
"건설안전산업기사","2013","1","건설안전기술","81","비계 등을 조립하는 경우 강재와 강재의 접속부 또는 교차부를 연결시키기 위한 전용철물은?","","클램프","가새","턴버클","샤클","1"
"건설안전산업기사","2013","1","건설안전기술","82","사질지반에 흙막이를 하고 터파기를 실시하면 지반수위와 터파기 저면과의 수위차에 의해 보일링현상이 발생할 수 있다. 이때 이 현상을 방지하는 방법이 아닌 것은?","","흙막이 벽의 저면타입깊이를 크게 한다.","차수성이 높은 흙막이벽을 사용한다.","웰포인트로 지하수면을 낮춘다.","주동토압을 크게 한다.","4"
"건설안전산업기사","2013","1","건설안전기술","83","포화도 80%, 함수비 28%, 흙 입자의 비중 2.7일 때 공극비를 구하면?","","0.940","0.945","0.950","0.955","2"
"건설안전산업기사","2013","1","건설안전기술","84","거푸집에 작용하는 하중 중에서 연직하중이 아닌 것은?","","거푸집의 자중","작업원의 작업하중","가설설비의 충격하중","콘크리트의 측압","4"
"건설안전산업기사","2013","1","건설안전기술","85","철골작업 시 폭우와 같은 악천후에 작업을 중지하여야 하는 강우량 기준은?","","1시간당 1mm 이상 일 때","2시간당 1mm 이상 일 때","3시간당 2mm 이상일 때","4시간당 2mm 이상 일때","1"
"건설안전산업기사","2013","1","건설안전기술","86","철골보 인양작업 시 준수사항으로 옳지 않은 것은?","","인양용 와이어로프의 체결지점은 수평부재의 1/4지점을 기준으로 한다.","인양용 와이어로프의 매달기 각도는 양변 60°를 기준으로 한다.","흔들리거나 선회하지 않도록 유도 로프로 유도한다.","후크는 용접의 경우 용접규격을 반드시 확인한다.","1"
"건설안전산업기사","2013","1","건설안전기술","87","콘크리트 타설 시 안전수칙으로 옳지 않은 것은?","","콘크리트 콜드조인트 발생을 억제하기 위하여 한 곳부터 집중타설 한다.","타설 순서 및 타설속도를 준수한다.","콘크리트 타설 도중에는 동바리, 거푸집 등의 이상유무를 확인하고 감시인을 배치한다.","진동기의 지나친 사용은 재료분리를 일으킬 수 있으므로 적절히 사용하여야 한다.","1"
"건설안전산업기사","2013","1","건설안전기술","88","유해위험 방지계획서 제출 대상 공사에 해당하는 것은?","","지상 높이가 21m인 건축물 해체공사","최대지간 거리가 50m인 교량의 건설공사","연면적 5,000$m^2$인 동물원 건설공사","깊이가 9m인 굴착공사","2"
"건설안전산업기사","2013","1","건설안전기술","89","물체의 낙하충격, 물체에의 끼임, 감전 또는 정전기의 대전에 의한 위험이 있는 작업 시 공통으로 근로자가 착용하여야 하는 보호구로 적합한 것은?","","방열복","안전대","안전화","보안경","3"
"건설안전산업기사","2013","1","건설안전기술","90","크레인의 와이어로프가 일정 한계 이상 감기지 않도록 작동을 자동으로 정지시키는 장치는?","","축해지장치","권과방지장치","비상정지장치","과부하방지장치","2"
"건설안전산업기사","2013","1","건설안전기술","91","다음 중 굴착기의 전부장치에 해당하지 않는 것은?","","붐(Boom)","암(Arm)","버킷(Bucket)","블레이드(Blade)","4"
"건설안전산업기사","2013","1","건설안전기술","92","현장 안전점검 시 흙막이 지보공의 정기점검 사항과 가장 거리가 먼 것은?","","부재의 손상·변형 부식 변위 및 탈락의 유무와 상태","부재의 설치방법과 순서","버팀대의 긴압의 정도","부재의 접속부·부착부 및 교차부의 상태","2"
"건설안전산업기사","2013","1","건설안전기술","93","건물 외벽의 도장작업을 위하여 섬유로프 등의 재료로 상부지점에서 작업용 발판을 매다는 형식의 비계는?","","달비계","단관비계","브라켓비계","이동식 비계","1"
"건설안전산업기사","2013","1","건설안전기술","94","철골용접 작업자의 전격 방지를 위한 주의사항으로 옳지 않은 것은?","","보호구와 복장을 구비하고, 기름기가 묻었거나 젖은 것은 착용하지 않을 것","작업 중지의 경우에는 스위치를 떼어 놓을 것","개로 전압이 높은 교류 용접기를 사용할 것","좁은 장소에서의 작업에서는 신체를 노출시키지 않을 것","3"
"건설안전산업기사","2013","1","건설안전기술","95","추락에 의한 위험을 방지하기 위한 안전방망의 설치기준으로 옳지 않은 것은?","","안전방망의 설치위치는 가능하면 작업면으로부터 가까운 지점에 설치할 것","건축물 등의 바깥쪽으로 설치하는 경우 망의 내민길이는 벽면으로부터 2m 이상이 되도록 할 것","안전방망은 수평으로 설치하고, 망의 처짐은 짧은 변 길이의 12% 이상이 되도록 할 것","작업면으로부터 망의 설치지점까지의 수직거리는 10m를 초과하지 아니할 것","2"
"건설안전산업기사","2013","1","건설안전기술","96","토사붕괴를 예방하기 위한 굴착면의 기울기 기준으로 옳지 않은 것은?","","습지 - 1:1~1:1.5","건지 - 1:0.5~1:1","풍화암 - 1:0.7","연암 - 1:0.5","3"
"건설안전산업기사","2013","1","건설안전기술","97","아래에서 설명하는 불도저의 명칭은?\n블레이드의 길이가 길고 낮으며 블레이드의 좌우를 전후로 25°~ 30° 각도로 회전시킬 수 있어 흙을 측면으로 보낼 수 있는 불도저","","틸트 도저","스트레이트 도저","앵글 도저","터나 도저","3"
"건설안전산업기사","2013","1","건설안전기술","98","이동식비계를 조립하여 작업을 하는 경우에 준수해야할 사항과 거리가 먼 것은?","","비계의 최상부에서 작업을 할 때에는 안전난간을 설치할 것","작업발판의 최대적재하중은 250kg을 초과하지 않도록 할것","승강용 사다리는 견고하게 설치할 것","지주부재와 수평면과의 기울기를 75° 이하로 하고, 지주부재와 지주부재 사이를 고정시키는 보조부재를 설치할 것","4"
"건설안전산업기사","2013","1","건설안전기술","99","화물자동차에서 짐을 싣는 작업 또는 내리는 작업을 할때 바닥과 짐 윗면과의 높이가 최소 얼마 이상이면 승강설비를 설치해야 하는가?","","1m","1.5m","2m","3m","3"
"건설안전산업기사","2013","1","건설안전기술","100","강관틀비계를 조립하여 사용하는 경우 벽이음의 수직방향 조립간격은?","","2m 이내마다","5m 이내마다","6m 이내마다","8m 이내마다","3"
