"Test Name","Year","Session","Subject","Number","Question","Question_image","Option 1","Option 2","Option 3","Option 4","Answer"
"건설안전기사","2008","4","건설시공학","75","다음 중 석재의 다듬기를 시공순서에 맞게 나열한 것은?","","혹떼기 - 정다듬 - 잔다듬 - 도드락다듬 - 갈기","정다듬 - 혹떼기 - 잔다듬 - 도드락다듬 - 갈기","정다듬 - 혹떼기 - 도드락다듬 - 잔다듬 - 갈기","혹떼기 - 정다듬 - 도드락다듬 - 잔다듬 - 갈기","1"
"건설안전기사","2008","4","건설시공학","76","제자리 콘크리트 말뚝지정 중 베노토 파일의 특징에 관한 설명으로 옳지 않은 것은?","","기계가 저가이고 굴착속도가 비교적 빠르다.","케이싱을 지반에 압입해 가면서 관 내부 토사를 특수한 버킷으로 굴착 배토한다.","말뚝구멍의 굴착 후에는 철근콘크리트 말뚝을 제자리치기한다.","여러 지질에 안전하고 정확하게 시공할 수 있다.","1"
"건설안전기사","2008","4","건설시공학","77","나무말뚝을 상수면 이하에 박는 이유로 가장 옳은 것은?","","부동침하를 막기 위하여","경질지반에 도달하기 위하여","부식을 막기 위하여","내진성능을 높이기 위하여","3"
"건설안전기사","2008","4","건설시공학","78","다음 중 Sliding form에 대한 설명으로 옳지 않은 것은?","","1일 5~10m 정도 수직시공이 가능하도록 시공속도가 빠르다.","마감작업이 동시에 진행되므로 공정이 단순화된다.","구조물 형태에 따른 사용 제약이 없다.","형상 및 치수가 정확하며 시공오차가 적다.","3"
"건설안전기사","2008","4","건설시공학","79","신축할 건축물의 높이의 기준이 되는 주요 가설물로 이동의 위험이 없는 인근 건물의 벽 또는 담장에 설치하는 것은?","","줄띄우기","벤치마크","규준틀","수평보기","2"
"건설안전기사","2008","4","건설시공학","80","주문받은 건설업자가 대상 계획의 기업, 금융, 토지조달, 설계, 시공 등 기타 모든 요소를 포괄하는 도급계약방식을 무엇이라 하는가?","","실비청산 보수가산도급","정액도급","공동도급","턴키도급","4"
"건설안전기사","2008","4","건설재료학","81","미장재료의 응결시간을 단축시킬 목적으로 첨가하는 대표적인 촉진제는?","","옥시카르본산","폴리알코올류","마그네시아염","염화칼슘","4"
"건설안전기사","2008","4","건설재료학","82","건조전 중량 5kg인 목재를 건조시켜 전건중량이 4kg이 되었다면 이 목재의 함수율은 몇 %인가?","","8%","20%","25%","40%","3"
"건설안전기사","2008","4","건설재료학","83","다음 시멘트의 분류 중 혼합시멘트가 아닌 것은?","","고로시멘트","팽창시멘트","실리카시멘트","플라이애쉬시멘트","2"
"건설안전기사","2008","4","건설재료학","84","도료상태의 방수재를 바탕면에 여러 번 칠하여 상당한 살두께의 방수막을 만드는 방수법은?","","도막방수","아스팔트방수","시멘트방수","시트방수","1"
"건설안전기사","2008","4","건설재료학","85","점토제품 중 소성온도가 가장 고온하고 흡수성이 매우 작으며 모자이크 타일, 위생도기 등에 주로 쓰이는 것은?","","토기","도기","석기","자기","4"
"건설안전기사","2008","4","건설재료학","86","목재, 기타 식물질을 적삭 또는 파쇄한 후 합성수지 접착제를 섞어 열압하여 인공적으로 판을 만든 목재 가공품은?","","파티클보드(particle board)","섬유판(fiber board)","파키트리보드(parquetry board)","코펜하겐리브(copenhagen rib)","1"
"건설안전기사","2008","4","건설재료학","87","운모계 광석을 800~1,000℃정도로 가열 팽창시켜 체적이 5~6배로 된 다공질 경석으로 시멘트와 배합하여 콘크리트 블록, 벽돌 등을 제조하는데 사용되는 것은?","","암면(rock wool)","질석(vermiculite)","트래버틴(travertin)","석면(asbestos)","2"
"건설안전기사","2008","4","건설재료학","88","연강 철선을 전기 용접하여 정방형 또는 장방형으로 만든 것으로 블록을 쌓을 때나 보호 콘크리트를 타설 할 때 사용하며 균열을 방지하고 교차 부분을 보강하기 위해 사용하는 금속제품은?","","와이어로프","코너비드","와이어메시","메탈폼","3"
"건설안전기사","2008","4","건설재료학","89","다음의 돌로마이트 플라스터 미장재료에 대한 설명 중 옳은 것은?","","건조수축이 커서 균열이 생기기 쉽다.","풀재를 사용하지 않으면 바름벽을 시공할 수 없다.","킨스시멘트라고도 한다.","석회보다 보수성, 시공성이 나쁘다.","1"
"건설안전기사","2008","4","건설재료학","90","아연함유량에 따른 황동의 성질에 대한 설명으로 옳지 않은 것은?","","아연함유량 50% 이상의 황동은 구조용으로 부적합하다.","인장강도는 아연함유량 15% 부근에서 최소값을 나타내고 그 이상에서 급히 증가한다.","아연함유량이 35~45%의 것은 고온 가공을 하는데 적절하다.","아연함유량 30% 부근에서 최대의 연신율을 나타낸다.","2"
"건설안전기사","2008","4","건설재료학","91","대리석의 일종으로 다공질이며 황갈색의 반문이 있고 갈면 광택이 나서 우아한 실내장식에 사용되는 것은?","","테라죠","트래버틴","석면","점판암","2"
"건설안전기사","2008","4","건설재료학","92","다음의 굳지않은 콘크리트의 성질을 표시하는 용어에 관한 설명 중 틀린 것은?","","워커빌리티(workability)는 정성적인 것으로 정량적으로 표시하기가 어렵다.","컨시스턴스(consistency)는 주로 수량에 의해서 변화하는 유동성의 정도를 의미한다.","피니셔빌리티(finishability)는 마감성의 난이를 표시하는 성질이다.","펌퍼빌리티(pumpability)는 거푸집 등의 형상에 순응하여 채우기 쉽고, 분리가 일어나지 않는 성질을 말한다.","4"
"건설안전기사","2008","4","건설재료학","93","스트레이트 아스팔트에 대한 설명 중 틀린 것은?","","연화점이 비교적 낮고 온도에 의한 변화가 크다.","주로지하실 방수공사에 사용되며, 아스팔트 루핑의 제작에 사용된다.","신장성, 점착성, 방수성이 풍부하다.","아스팔트에 동,식물유지나 광물성 분말 등을 혼합하여 만든 것이다.","4"
"건설안전기사","2008","4","건설재료학","94","다음 도료 중 내알칼리성이 가장 적은 도료는?","","페놀수지도료","멜라민수지도료","초산비닐도료","프탈산수지에나멜","4"
"건설안전기사","2008","4","건설재료학","95","강의 가공과 처리에 대한 설명 중 틀린 것은?","","강재의 열처리는 주로 단조처리를 말한다.","소정의 성질을 얻기 위해 가열과 냉각을 조합반복하여 행한 조작을 열처리라고 한다.","압연은 구조용 강재의 가공에 주로 쓰인다.","압출은 전방압출과 후방압출이 있다.","1"
"건설안전기사","2008","4","건설재료학","96","다음의 점토에 관한 설명 중 옳지 않은 것은?","","점토의 색상은 철산화물 또는 석회물질에 의해 나타난다.","점토의 가소성은 점토입자가 미세할수록 좋다.","압축강도와 인장강도는 거의 비슷하다.","소성수축은 점토 중 휘발분의 양, 조직, 용융도 등이 영향을 준다.","3"
"건설안전기사","2008","4","건설재료학","97","다음의 탄소강에 대한 설명 중 ( )안에 알맞은 것은?\n탄소강은 ( )에서 인장강도가 가장 크고 신율이 가장 작으나 상온에서 보다 굳고 취약한 청열취성(靑熱脆性)을 나타낸다.","","100℃","200~300℃","400~500℃","800℃","2"
"건설안전기사","2008","4","건설재료학","98","MDF의 특성에 관한 설명중 옳지 않은 것은?","","무게가 가볍고 습기에 강하다.","천연목재보다 강도가 크고 변형이 적다.","재질이 천연목재보다 균일하다.","한번 고정철물을 사용한 곳에는 재시공이 어렵다.","1"
"건설안전기사","2008","4","건설재료학","99","석재의 내구성에 대한 설명 중 잘못된 것은?","","조암광물이 미립자일수록 내구성이 크다.","흡수율이 큰 다공질일수록 동해를 받기 쉽다.","조암광물 중에 황화물, 철분함유광물, 탄산마그네시아, 탄산칼슘 등은 풍화되기 어렵다.","석재의 내구성은 조직, 조암광물의 종류, 기후 및 풍토, 노출상태 등에 따라 달라진다.","3"
"건설안전기사","2008","4","건설재료학","100","다음중 시멘트에 대한 설명으로 맞는 것은?","","시멘트가 풍화하면 응결이 빨라지지만, 경화후의 강도가 저하된다.","시멘트 응결은 첨가된 석고의 질과 양에 큰 영향을 받지 않는다.","시멘트의 분말도가 크고 온도가 높을수록 응결은 늦어진다.","시멘트의 수화열은 시멘트의 종류, 화학조성, 물시멘트비, 분말도 등에 의해서 달라진다.","4"
"건설안전기사","2008","4","건설안전기술","101","다음 중 수중굴착 공사에 가장 적합한 건설기계는?","","파워쇼벨","스크레이퍼","불도저","크램쉘","4"
"건설안전기사","2008","4","건설안전기술","102","이동식 비계의 가로, 세로의 길이가 각각 2m, 3m일 때 이 비계의 사용가능 최대 높이는?","","4m","8m","10m","14m","2"
"건설안전기사","2008","4","건설안전기술","103","다음 중 흙막이벽 설치공법에 속하지 않는 것은?","","강제 널말뚝 공법","지하연속벽 공법","어스앵커 공법","트렌치컷 공법","4"
"건설안전기사","2008","4","건설안전기술","104","다음 중 굴착공사표준안전작업지침에서 정한 토석붕괴의 외적 원인이 아닌 것은?","","공사에 의한 진동 및 반복 하중의 증가","절토 및 성토 높이의 증가","지표수 및 지하수의 침투에 의한 토사 중량의 증가","토석의 강도 저하","4"
"건설안전기사","2008","4","건설안전기술","105","구축하고자 하는 지하구조물이 인접구조물보다 깊은 위치에 근접하여 건설할 경우에 주변지반과 인접건축물 기초의 침하에 대한 우려 때문에 실시하는 기초보강공법은?","","H-말뚝 토류판공법","S.C.W공법","지하연속벽공법","언더피닝공법","4"
"건설안전기사","2008","4","건설안전기술","106","다음 중 산업안전기준에 관한 규칙에 따라 철골공사 작업 시 작업을 중지해야 할 경우는?","","풍속 8m/sec","강우량 1.5mm/hr","강설량 5mm/hr","지진 진도 1.0","2"
"건설안전기사","2008","4","건설안전기술","107","방망의 관리기준에 따라 ( )에 숫자가 알맞게 짝지어진 것은?\n방망의 정기시험은 사용개시 후 (①)년 이내로 하고, 그 후 (②)개월마다 1회씩 정기적으로 시험용사에 대해서 등속인장시험을 하여야 한다.","","①:1, ②:12","①:1, ②:6","①:3, ②:3","①:3, ②:6","2"
"건설안전기사","2008","4","건설안전기술","108","다음 중 강재 거푸집의 장점이 아닌 것은?","","강성이 크고 정밀도가 높다.","초기 투자비용이 낮다.","수밀성이 좋다.","전용도가 좋다.","2"
"건설안전기사","2008","4","건설안전기술","109","다음 중 고정식 크레인이 아닌 것은?","","천장 크레인","크롤러 크레인","지브 크레인","타워 크레인","2"
"건설안전기사","2008","4","건설안전기술","110","콘크리트 타설작업을 할 때 준수하여야 할 사항으로 가장 거리가 먼 것은?","","콘크리트 타설 전에 거푸집 동바리 등의 변형 변위 등을 점검하고 이상이 있는 경우 보수할 것","작업 중 거푸집 동바리 등의 이상유무를 점검하여 이상을 발견한 때에는 근로자를 대피시킬 것","진동기의 사용은 많이 할수록 균일한 콘크리트를 얻을 수 있으므로 가급적 많이 사용할 것","설계도서상의 콘크리트 양생기간을 준수하여 거푸집동바리 등을 해체할 것","3"
"건설안전기사","2008","4","건설안전기술","111","길이가 10m인 단순보의 중앙에 40kN의 힘이 작용할 때 중앙점에서의 모멘트는?","","100kNm","50kNm","150kNm","200kNm","1"
"건설안전기사","2008","4","건설안전기술","112","추락을 방지하기 위한 안전대의 종류에 대하여 등급과 사용구분이 잘못 짝지어진 것은?","","1종: U자걸이 전용","2종 : 1개걸이 전용","3종 : 1개걸이 U자걸이 공용","4종 : 추락방지대","1"
"건설안전기사","2008","4","건설안전기술","113","동력을 사용하는 항타기 또는 항발기의 도괴를 방지하기 위한 사항으로 옳지 않은 것은?","","연약한 지반에 설치할 때에는 각부 또는 기대의 침하를 방지하기 위하여 깔판 깔목 등을 사용한다.","평형추를 사용하여 안정시킬 때에는 평형추의 이동을 방지하기 위하여 가대에 견고하게 부착시킨다.","버팀대만으로 상단부분을 안정시킬 때에는 버팀대를 3개 이상으로 한다.","버팀줄만으로 상단부분을 안정시킬 때에는 버팀줄을 2개 이상으로 한다.","4"
"건설안전기사","2008","4","건설안전기술","114","정격하중이 5톤인 타워크레인 대상으로 매 2년마다 사용자가 실시 해야하는 검사는?","","완성검사","성능검사","정기검사","설계검사","3"
"건설안전기사","2008","4","건설안전기술","115","다음 중 콘크리트의 비파괴검사 방법이 아닌 것은?","","슈미트해머법","초음파속도법","염색침투 탐상법","인발법","3"
"건설안전기사","2008","4","건설안전기술","116","다음 중 안전난간의 구조 및 설치요건으로 옳지 않은 것은?","","상부난간대는 바닥면 발판 또는 경사로의 표면으로부터 90cm 이상 120cm 이하의 높이를 유지할 것","상부난간대와 중간난간대는 난간길이 전체에 걸쳐 바닥면과 평행을 유지할 것","안전난간은 임의의 점에서 임의의 방향으로 움직이는 최소 80kg이상의 하중에 견딜 수 있어야 할 것","발끝막이판은 바닥면등으로부터 10cm 이상의 높이를 유지할 것","3"
"건설안전기사","2008","4","건설안전기술","117","점토질 지반의 침하 및 압밀 재해를 막기 위하여 실시하는 지반개량 탈수공법으로 적당하지 않은 것은?","","샌드드레인 공법","생석회 공법","페이퍼드레인 공법","진동 공법","4"
"건설안전기사","2008","4","건설안전기술","118","다음 중 사다리식 통로를 설치할 때 준수해야 할 사항으로 옳지 않은 것은?","","발판과 벽과의 사이는 10cm 이상의 간격을 유지할 것","사다리식 통로의 길이가 10m 이상인 때에는 5m 이내마다 계단참을 설치할 것","이동식 사다리식 통로의 기울기는 75° 이하로 할 것","사다리의 상단은 걸쳐놓은 지점으로부터 60cm 이상 올라가도록 할 것","1"
"건설안전기사","2008","4","건설안전기술","119","산업안전보건법상 지게차 사용시 적합한 헤드가드로서의 요건으로 옳은 것은?","","강도는 지게차의 최대하중의 1.5배값의 등분포하중에 견딜 수 있을 것","상부틀의 각 개구의 폭 또는 길이가 20cm 미만일 것","운전자가 앉아서 조작하는 방식의 지게차에 있어서는 운전자 좌석의 상면에서 헤드가드의 상부틀의 하면까지의 높이가 1m 이상일 것","운전자가 서서 조작하는 방식의 지게차에 있어서는 운전석의 바닥면에서 헤드가드의 상부틀의 하면까지의 높이가 1m 이상일 것","3"
"건설안전기사","2008","4","건설안전기술","120","다음 중 철근인력운반에 대한 설명으로 옳지 않은 것은?","","긴 철근은 두 사람이 한 조가 되어 어깨메기로 운반하는 것이 좋다.","긴 철근을 운반할 때에는 중앙을 묶어 운반한다.","운반시 1인당 무게는 25kg 정도가 적당하다.","긴 철근을 한사람이 운반할 때는 한쪽을 어깨에 메고 한쪽 끝을 땅에 끌어서 운반한다.","4"