"Test Name","Year","Session","Subject","Number","Question","Question_image","Option 1","Option 2","Option 3","Option 4","Answer"
"건설안전기사","2007","2","산업안전관리론","1","안전점검의 시스템 중 4M 에 해당되는 것은?","","Man, Mangement, Macchine, Media","Man, Macchine, Maker, Management","Man, Mangement. Macchine, Material","Man, Macchine, Maker, Media","1"
"건설안전기사","2007","2","산업안전관리론","2","다음 지체검사 대상기계·기구들 중 검사주기가 서로 다른 것으로 조합된 것은?","","프레스기, 전단기","원심기, 건조설비","아세틸렌 용접장치, 로울러기","보일러, 양중기","2"
"건설안전기사","2007","2","산업안전관리론","3","무재해 운동의 3원칙 중 잠재적인 위험요인을 발견해결하기 위하여 전원이 협력하여 각자의 위치에서 의욕적으로 문제해결을 실천하는 것을 의미하는 것은?","","참가의 원칙","무의 원칙","선취의 원칙","실천의 원칙","1"
"건설안전기사","2007","2","산업안전관리론","4","상시 근로자 100명인 사업장에서 1년간 6명의 부상자가 발생하였고, 그 휴업 일수가 총 219일 이라면 강도율은 약 얼마인가?(단, 1일 9시간씩 연간 290일 근무하였다.)","","0.69","0.84","22.29","60","1"
"건설안전기사","2007","2","산업안전관리론","5","산업안전보건 표지로서 지시표지에 해당되는 색도 기준으로 옳은 것은?","","5R 4/13","5G 5.5/6","7.5PB 2.5/7.5","2.5Y 8/12","3"
"건설안전기사","2007","2","산업안전관리론","6","'Near Accident' 란 어떠한 상태의 사고를 의미하는가?","","인적 피해만 발생한 사고","물적인 피해만 발생한 사고","인적·물적 피해가 모두 발생한 사고","인적·물적 피해가 모두 발생하지 않은 사고","4"
"건설안전기사","2007","2","산업안전관리론","7","안전관리 조직 중 직계식(line type) 조직의 특징으로 볼수 없는 것은?","","소규모 사업장에 적합하다.","안전에 관한 명령지시가 빠르다.","생산라인의 관리 감독자는 주로 안전보다 생산에 관심을 가질 수 있다.","별도의 안전관리 전담요원이 직접 통제한다.","4"
"건설안전기사","2007","2","산업안전관리론","8","사고예방대책의 기본 원리 중 그 시정책의 선정에 필요한 조치 사항이 아닌 것은?","","기술적 개선","사고조사 및 점검","안전관리 행정 업무의 개선","기술 교육을 위한 훈련의 개선","2"
"건설안전기사","2007","2","산업안전관리론","9","다음의 Simonds 재해 Cost 산출공식에서 A는 무엇을 의미하는가?\n총 재해 cost = 산재보험 보상비 + [(A×휴업상해 건수) + (B×통원상해 건수) + (C×응급조치 건수) + (D×무상해사고 건수)]","","휴업상해 건수에 대한 직접 손실비","휴업상해 건수에 대한 간접 손실비","휴업상해 건수에 대한 비보험 코스트의 평균치","휴업상해 건수에 대한 비보험 코스트의 최고 액수","3"
"건설안전기사","2007","2","산업안전관리론","10","산업안전보건위원회 설치대상 사업장에서 명예산업안전 감독관의 당해 사업장에서의 업무에 해당하지 않는 것은?","","사업장에서 행하는 기계·기구 자체검사 입회","사업장 산업재해예방계획수립의 참여","산업재해발생의 급박한 위험이 있는 경우 사업주에 대한 작업중지 요청","보호구의 구입시 적격품의 선정","4"
"건설안전기사","2007","2","산업안전관리론","11","산업안전보건위원회를 구성함에 있어 사용자 위원에 해당되지 않는 자는?","","안전관리자","명예산업안전감독관","당해 사업의 대표자","보건관리자","2"
"건설안전기사","2007","2","산업안전관리론","12","다음 중 방독마스크의 정화통 종류와 외부 측면의 색채가 잘못 연결된 것은?","","일산화탄소용 - 적색","암모니아용 - 회색","유기가스용 - 흑색","아황산가스용 - 황적색","2"
"건설안전기사","2007","2","산업안전관리론","13","자체검사대상 기계·기구 분야의 자체검사원에 해당되지 않는 자는?","","안전관리자의 자격기준에 해당하는 자로서 해당 기계·설비의 취급업무에 2년 이상 종사한 자","관리감독자 또는 안전담당자로서 당해 자체검사분야의 기계·기구를 취급하는 작업에 2년 이상 종사한 자","당해 대행사업장의 자체검사대상 기계·기구분야에 한하여 안전·보건관리대행기관의 대행요원","자체검사원 양성교육을 받고 소정의 시험에 합격한자","2"
"건설안전기사","2007","2","산업안전관리론","14","산업안전보건법에서 정의하고 있는 산업재해의 내용으로 옳은 것은?","","근로자가 업무에 관계되는 건설물 설비 원재료 가스·증기·분진 등에 의하거나 작업 기타 업무에 기인하여 사망 또는 부상하거나 질병에 이환되는 것","물질 또는 타인과 접촉하였거나 각종의 물체 및 작업조건에 폭로 또는 사람의 작업행동으로 인하여 사람의 상해를 동반하는 사건이 일어나는 것","산업활동의 정상적인 진행을 저지하고 또는 방해하는 사건이 일어나는 것","결함이 있는 작업조건 및 부적성의 작업방법에 의해 초래되는 계획되지 않은 사건이 일어나는 것","1"
"건설안전기사","2007","2","산업안전관리론","15","노동부장관은 산업재해를 예방하기 위하여 필요하다고 인정될 때에 대통령령이 정하는 사업장의 산업재해 발생건수, 재해율 등을 공표할 수 있도록 하였는데 이의 기준으로 틀린 것은?","","연간 사업재해율이 규모별 동종업종의 평균재해율 이상인 모든 사업장","중대재해가 발생한 사업장","산업재해의 발생에 관한 보고를 최근 3년 이내 2회 이상 보고하지 아니한 사업장","중대산업사고가 발생한 사업장","1"
"건설안전기사","2007","2","산업안전관리론","16","조립·해체 작업장 입구에 설치하여야 할 출입금지 표지의 색체로 가장 적당한 것은?","","바탕: 노란색, 기본모형: 검정색, 관련부호 : 검정색, 그림: 검정색","바탕 : 흰색, 기본모형: 빨간색, 관련부호 : 검정색, 그림: 검정색","바탕: 흰색, 기본모형: 녹색, 관련부호 : 녹색, 그림: 검정색","바탕: 파란색, 기본모형: 빨간색, 관련부호 : 흰색, 그림: 검정색","2"
"건설안전기사","2007","2","산업안전관리론","17","전년도 어느 건설회사의 년간 국내공사 실적액이 300억원이고, 이 해의 노무비율은 0.21 이며, 이 회사의 1일 평균임금은 73000원으로 평가되었다. 이 회사의 환산재해율을 산정하기 위한 상시근로자수는 약 얼마인가? (단, 월 평균 근로일수는 24일로 한다.)","","300명","350명","400명","450명","1"
"건설안전기사","2007","2","산업안전관리론","18","A 사업장에서 지난 해 2건의 사고가 발생하여 1건(재해자수 : 5명)은 재해조사표를 작성, 보고하였지만, 1건은 재해자가 1명뿐이어서 재해조사표를 작성하지 않았으며, 보고도 하지 않았다. 동일 사업장에서 올해 1건(재해자수 : 3명)의 재해로 인하여 재해조사 중 지난 해 보고하지 않은 재해를 인지하게 된다면 이 경우 지난 해와 올 해의 재해자수는 어떻게 기록되는가?","","지난 해: 5명, 올해 3명","지난 해: 6명, 올해 3명","지난 해 5명, 올해 : 4명","지난 해 6명, 올해 4명","3"
"건설안전기사","2007","2","산업안전관리론","19","다음 중 분리식 방진마스크 2급에서 여과재의 분진 등 포집효율은 몇 % 이상이 되도록 정하여져 있는가?","","80.0","85.0","94.0","99.0","1"
"건설안전기사","2007","2","산업안전관리론","20","공구와 자재가 바닥에 어지럽게 널려 있는 작업통로를 작업자가 보행 중 공구에 걸려 넘어져 통로바닥에 머리를 부딪혔다. 이 경우 '사고유형 - 기인물 - 가해물'을 바르게 연결한 것은?","","전도 - 바닥 - 공구","낙하 - 통로 - 바닥","전도 - 공구 - 바닥","추락 - 바닥 - 공구","3"
"건설안전기사","2007","2","산업심리 및 교육","21","작업에 수반되는 피로 예방대책에 관한 설명 중 거리가 먼 것은?","","작업부하를 크게 할 것","불필요한 마찰을 배제할 것","작업속도를 적절하게 조정할 것","근로시간과 휴식을 적절하게 취할 것","1"
"건설안전기사","2007","2","산업심리 및 교육","22","자유방임형 리더쉽에 따른 집단구성원의 반응으로 볼 수 없는 것은?","","낭비 및 파손품이 많다","리더를 타인으로 간주한다","작업의 양과 질이 우수하다","개성이 강하고, 연대감이 없어진다","3"
"건설안전기사","2007","2","산업심리 및 교육","23","맥그리거(McGregor)의 X. Y 이론에 따라 관리를 하고자 할 때 X 이론에 가까운 작업자에게는 어떠한 동기부여가 가장 적절한가?","","직무의 확장","자아의 실현","보수의 인상","작업환경의 개선","3"
"건설안전기사","2007","2","산업심리 및 교육","24","매슬로우(Maslow)에 의해 발표된 인간의 욕구단계 이론 중 가장 저차원적인 욕구에 해당되는 것은?","","자아실현의 욕구","안전 욕구","생리적 욕구","사회적 욕구","3"
"건설안전기사","2007","2","산업심리 및 교육","25","인간행동의 색채조절 효과로 기대되는 것이 아닌 것은?","","작업환경 개선","생산 증진","피로 증진","작업능력 향상","3"
"건설안전기사","2007","2","산업심리 및 교육","26","산업안전보건법규에서 정하는 사업내 안전보건교육 중 건설업에 종사하지 않은 사람의 경우 실시하여야 할 특별안전보건교육과정의 교육시간으로 옳은 것은?","","1시간 이상","2시간 이상","8시간 이상","16시간 이상","4"
"건설안전기사","2007","2","산업심리 및 교육","27","교육심리학의 연구방법 중 인간의 내면에서 일어나고 있는 심리적 사고에 대하여 사물을 이용하여 인간의 성격을 알아보는 방법을 무엇이라 하는가?","","투사법","면접법","질문지법","실험법","1"
"건설안전기사","2007","2","산업심리 및 교육","28","다음 중 Project method의 장점으로 볼 수 없는 것은?","","동기부여가 충분하다.","현실적인 학습방법이다.","창조력이 생긴다.","시간과 에너지가 적게 소비된다.","4"
"건설안전기사","2007","2","산업심리 및 교육","29","다음 중 학습전이(Transference)의 조건으로 거리가 먼 것은?","","학습정도","학습자의 태도","학습시간","학습자의 지능","3"
"건설안전기사","2007","2","산업심리 및 교육","30","위험예지훈련 4R 방식 중 위험의 포인트를 결정하여 지적 확인하는 단계로 옳은 것은?","","1단계","2단계","3단계","4단계","2"
"건설안전기사","2007","2","산업심리 및 교육","31","다음 중 주의에 대한 설명으로 틀린 것은?","","주의 집중은 리듬을 가지고 변한다.","주의력을 강화하면 그 기능은 저하된다.","많은 것에 대하여 동시에 주의를 기울이기 어렵다.","주의는 중심에서 벗어나면 급격히 저하된다.","2"
"건설안전기사","2007","2","산업심리 및 교육","32","부주의의 발생 원인 중 내적 조건에 속하는 것은?","","의식의 우회","작업조건의 악화","환경조건의 악화","작업순서의 부자연성","1"
"건설안전기사","2007","2","산업심리 및 교육","33","인간의 적성을 발견하는 방법으로 가장 적당하지 않은 것은?","","작업 분석","계발적 경험","자기 이해","적성 검사","1"
"건설안전기사","2007","2","산업심리 및 교육","34","다음의 적응기제(Adjustment Mechanism) 중 방어적 기제에 해당되지 않는 것은?","","고립","승화","보상","치환","1"
"건설안전기사","2007","2","산업심리 및 교육","35","다음 중 하버드학파의 학습지도법에 속하지 않는 것은?","","지시(order)","준비(Preparation)","교시(Presentation)","총괄(Generalization)","1"
"건설안전기사","2007","2","산업심리 및 교육","36","어떤 작업을 하는데 있어서 소모하는 열량이 1시간에 420kcal 이다. 이 작업의 시간당 휴식시간은 약 얼마인가? (단, 작업시 평균 에너지는 5kcal/min, 휴식시 에너지는 1.5kcal/min 이다.)","","16분","18분","22분","24분","3"
"건설안전기사","2007","2","산업심리 및 교육","37","교육방법 중 하나인 사례연구법의 장점으로 볼 수 없는 것은?","","강의법에 비해 실제 업무 현장에의 전이를 촉진한다.","무의식적인 내용의 표현 기회를 준다.","문제를 다양한 관점에서 바라보게 된다.","커뮤니케이션 스킬이 향상된다.","2"
"건설안전기사","2007","2","산업심리 및 교육","38","착시현상 중에서 실제로는 움직이지 않는데도 움직이는 것처럼 느껴지는 심리적인 현상을 무엇이라 하는가?","","잔상","원근 착시","가현운동","침착성 및 도덕성의 결여","3"
"건설안전기사","2007","2","산업심리 및 교육","39","안전사고의 원인 중 상황성 누발자의 재해유발 원인으로 옳은 것은?","","기계설비의 결함","주의력의 산만","일관성의 원리","계속성의 원리","1"
"건설안전기사","2007","2","산업심리 및 교육","40","학습이론 중 S-R 이론에서 조건반사설에 의한 학습 이론의 원리에 해당되지 않는 것은?","","시간의 원리","기억의 원리","일관성의 원리","계속성의 원리","2"
"건설안전기사","2007","2","인간공학 및 시스템안전공학","41","인간의 심리적 조건을 충족시킴과 동시에 빛의 반사를 고려하여 기계설비의 배치에 도움이 되도록 색채를 합리적으로 사용하는 기술을 색채조절이라 한다. 다음 중 색채조절에 따라 기계의 본체에 가장 적합한 색상은?","","녹색계통","황색계통","갈색계통","청색계통","1"
"건설안전기사","2007","2","인간공학 및 시스템안전공학","42","외부로부터 별도의 반응을 요하는 여러 가지의 자극이 주어졌을 때 인간이 반응하는데 소요되는 시간을 선택 반응시간이라고 한다. 자극의 수를 N 이라 할 때 다음중 선택 반응시간 T와의 관계식으로 가장 적절하게 표현한 것은?(단, a,b는 관련 동작 유형에 관계된 실험 상수이다.)","","$T=(a+b)\cdot N$","$T=a \cdot N!+b$","$T=a+b\cdot e^N$","$T=a+b \log_2 N$","4"
"건설안전기사","2007","2","인간공학 및 시스템안전공학","43","청각적 표시장치와 시각적 표시장치 중 시각적 표시장치를 사용하는 경우로 옳은 것은?","","정보가 간단할 때","정보가 일정시간 경과 후 재참조 될 때","직무상 수신자가 자주 움직일 때","정보전달이 즉각적인 행동을 요구할 때","2"
"건설안전기사","2007","2","인간공학 및 시스템안전공학","44","다음 중 조명에 관한 설명으로 옳은 것은?","","조명이 밝을수록 생산량은 계속 증가한다.","반사광은 세밀한 작업을 하는데 도움을 준다.","독서를 하는 경우에는 직접조명이 더 효과적이다.","작업장의 경우 공간 전체에 빛이 골고루 퍼지게 하는 것이 좋다.","4"
"건설안전기사","2007","2","인간공학 및 시스템안전공학","45","다음 중 경계 및 경보신호의 설계지침으로 잘못된 것은?","","귀는 중음역에 민감하므로 500~3000Hz 의 진동수를 사용한다.","300m 이상의 장거리용으로는 1000Hz를 초과하는 진동수를 사용한다.","배경소음의 진동수와 다른 진동수의 신호를 사용한다.","주의를 환기시키기 위하여 변조된 신호를 사용한다.","2"
"건설안전기사","2007","2","인간공학 및 시스템안전공학","46","'표시장치와 이에 대응하는 조종장치 간의 위치 또는 배열이 인간의 기대와 모순되지 않아야 한다.'는 인간공학적 설계원리와 가장 관계가 깊은 것은?","","개념양립성","공간양립성","운동양립성","문화양립성","2"
"건설안전기사","2007","2","인간공학 및 시스템안전공학","47","인간의 감각 중 반응시간이 가장 빠른 것은?","","시각","통각","청각","미각","3"
"건설안전기사","2007","2","인간공학 및 시스템안전공학","48","기계나 그 부품에 파손 고장이나 기능 불량이 발생 하여도 항상 안전하게 작동할 수 있는 구조와 기능을 가진 시스템을 무엇이라 하는가?","","fail safety system","Monitoring system","Lock system","Fool proof system","1"
"건설안전기사","2007","2","인간공학 및 시스템안전공학","49","현실적으로 시스템을 사용하는 때에는 정비나 보수가 필수불가결한 작업이다. 이러한 작업들로 인해 시스템의 신뢰도 함수가 가장 크게 영향을 받는 구조는?","","대기구조","n중구조","병렬구조","직렬구조","4"
"건설안전기사","2007","2","인간공학 및 시스템안전공학","50","다음 중 최소 컷셋(Minimal cut sets)에 대한 설명으로 옳은 것은?","","컷셋 중에 타 컷셋을 포함하고 있는 것을 배제하고 남은 컷셋들을 의미한다.","어느 고장이나 에러를 일으키지 않으면 재해가 일어나지 않는 시스템의 신뢰성이다.","기본사상이 일어났을 때 정상사상(Top event)을 일으키는 기본사상의 집합이다.","기본사상이 일어나지 않을 때 정상사상(Top event)이 일어나지 않는 기본사상의 집합이다.","1"
"건설안전기사","2007","2","인간공학 및 시스템안전공학","51","그림과 같은 FT도에서 각 기본사상의 발생확률이 다음과 같을 때의 발생확률은 얼마인가?\n①의 발생확률은 0.3 ②의 발생확률은 0.4\n③의 발생확률은 0.3 ④의 발생확률은 0.5","O","0.078","0.128","0.651","0.782","1"
"건설안전기사","2007","2","인간공학 및 시스템안전공학","52","시스템의 고장을 분석하는 데에는 고장밀도함수 f(t)보다 고장률함수 λ(t)가 더 중요한 의미를 갖는다. 고장률함수 λ(t)를 바르게 표시한 것은?(단, R(t)는 신뢰도함수, F(t)는 불신뢰도함수를 의미한다.)","","$\lambda(t)=\frac{f(t)}{R(t)}$","$\lambda(t)=\frac{dR(t)}{dt}$","$\lambda(t)=\frac{f(t)}{F(t)}$","$\lambda(t)=\frac{dF(t)}{dt}$","1"
"건설안전기사","2007","2","인간공학 및 시스템안전공학","53","화학설비의 안정성 평가에서 정량적 평가의 항목에 해당되지 않는 것은?","","압력","온도","공정","설비용량","3"
"건설안전기사","2007","2","인간공학 및 시스템안전공학","54","다음 중 리스크(Risk)에 대하여 바르게 나타낸 식은?","","피해의 크기 × 발생확률","노동손실일수 / 총 노동시간","발생확률 × 총 노동시간","피해의 크기 / 재해발생건수","1"
"건설안전기사","2007","2","인간공학 및 시스템안전공학","55","다음의 불대수(Boolean Algebra) 식에서 틀린 것은?","","$A\cdot(\overline{A}+B)=\overline{A}+B$","$\overline{A+B}=\overline{A}+\overline{B}$","$A+A=A$","$A\cdot(B\cdot C)=(A\cdot B)\cdot C$","1"
"건설안전기사","2007","2","인간공학 및 시스템안전공학","56","다음 그림과 같이 7개의 기기로 구성된 시스템이 있다. 각 기기의 신뢰도가 보기와 같은 경우 이 시스템의 신뢰도는 얼마인가?\n[보기]\nA,F,G: 0.9, B,D: 0.75, C,E: 0.8","O","0.5552","0.6234","0.7427","0.9740","1"
"건설안전기사","2007","2","인간공학 및 시스템안전공학","57","손이나 특정 신체부위에 발생하는 누적손상장애(CTDs)의 발생 인자와 가장 거리가 먼 것은?","","무리한 힘","다습한 환경","장시간의 진동","반복도가 높은 작업","2"
"건설안전기사","2007","2","인간공학 및 시스템안전공학","58","조작자와 제어버튼 사이의 거리, 조작에 필요한 힘 등을 정할 때 적용되는 인체측정자료 응용원칙은 어느 것인가?","","평균치 설계원칙","최대치 설계원칙","최소치 설계원칙","조절식 설계원칙","3"
"건설안전기사","2007","2","인간공학 및 시스템안전공학","59","시스템 안전해석 방법 중 'HAZOP'에서 '완전 대체'를 의미하는 유인어는?","","NOT","REVERSE","PART OF","OTHER THAN","4"
"건설안전기사","2007","2","인간공학 및 시스템안전공학","60","다음 중 점멸-융합(flicker-fusion) 주파수의 용도로 옳은 것인가?","","야간 시력의 척도","반응 시간의 척도","피로 정도의 척도","적외선 감지 능력의 척도","3"
"건설안전기사","2007","2","건설시공학","61","콘크리트 공사의 시공과정 중 휴식시간 등으로 응결하기 시작한 콘크리트에 새로운 콘크리트를 이어칠 때 일체화가 저해되어 생기는 줄눈은?","","익스팬션 조인트(Expansion joint)","콘트롤 조인트(Control joint)","콘트락션 조인트(Contraction joint)","콜드 조인트(Cold joint)","4"
"건설안전기사","2007","2","건설시공학","62","도급업자의 선정방식 중 공개경쟁입찰의 장점으로 볼 수 없는 것은?","","일반업자에게 균등한 기회를 준다.","부적격업자에게 낙찰될 우려가 없다.","응찰자가 많으므로 담합의 소지가 적다.","경쟁으로 인한 공사비가 절감된다.","2"
"건설안전기사","2007","2","건설시공학","63","지면에 기계를 두고 깊이 8m 정도의 연약한 지반의 깊은 기초 흙파기를 할 때 사용하는 기계로 가장 적당한 것은?","","파워 쇼벨(power shovel)","백호우(back hoe)","불도우저(bull dozer)","드래그라인(drag line)","4"
"건설안전기사","2007","2","건설시공학","64","웰 포인트 공법에 관한 설명 중 틀린 것은?","","인접지반의 침하를 야기시키기 쉽다.","흙막이의 토압이 경감된다.","점토질 지반의 배수에 효과가 크다","흙의 전단저항이 증가된다.","3"
"건설안전기사","2007","2","건설시공학","65","강재말뚝공법의 장점으로 옳지 않은 것은?","","지지층에 깊이 박을 수 있다","휨 모멘트에 대한 저항이 크다.","중량이 가볍고, 단면적이 작다","부식에 따른 내구성이 우수하다.","4"
"건설안전기사","2007","2","건설시공학","66","다음 중 현장 철골 세우기 작업순서로 옳은 것은?\n(1) 앵커볼트 매립\n(2) 변형바로잡기\n(3) 볼트가조립\n(4) 세우기\n(5) 볼트본조립","","(1)-(4)-(3)-(2)-(5)","(1)-(3)-(4)-(5)-(2)","(1)-(4)-(3)-(5)-(2)","(1)-(3)-(2)-(4)-(5)","1"
"건설안전기사","2007","2","건설시공학","67","철근콘크리트 공사에서 거푸집의 간격을 일정하게 유지시키는데 사용되는 것은?","","클램프","후커","세퍼레이터","인서트","3"
"건설안전기사","2007","2","건설시공학","68","매스콘크리트의 시공에 대한 설명 중 틀린 것은?","","내부온도가 최고온도에 달한 후는 보온하여 중심부의 온도 강하 속도가 크지 않도록 양생한다.","부어넣는 콘크리트의 온도는 일반적으로 35°C 이하로서 공사시방서에 따른다.","이어붓기시간간격은 외기온이 25℃ 미만일 때는 120분으로 한다.","28일을 초과하는 재령을 기준으로 계획배합을 정할 경우, 기준으로 하는 재령은 42일까지로 한다.","4"
"건설안전기사","2007","2","건설시공학","69","철골의 공장 가공 공정순서가 바르게 된 것은?","","원척도작성-본뜨기-금매김-절단-가조립-리벳치기","원척도작성-금매김-본뜨기-절단-가조립-리벳치기","원척도작성-본뜨기-절단-금매김-구멍뚫기-리벳치기","원척도작성-금매김-본뜨기-절단-구멍뚫기-리벳치기","1"
"건설안전기사","2007","2","건설시공학","70","조적조 벽에 생기는 백화현상을 방지하기 위한 대책으로 부적합한 것은?","","줄눈 모르타르에 방수제를 바른다.","흡수율이 작고 고온소성 벽돌을 사용한다.","벽돌면에 실리콘을 뿜칠한다.","줄눈 모르타르에 석회를 사용한다.","4"
"건설안전기사","2007","2","건설시공학","71","암석의 분류상 변성암에 속하는 것은?","","안산암","반려암","사문암","석회암","3"
"건설안전기사","2007","2","건설시공학","72","벽돌의 품질을 결정하는데 가장 중요한 사항은 어느 것인가?","","흡수율 및 인장강도","흡수율 및 전단강도","흡수율 및 휨강도","흡수율 및 압축강도","4"
"건설안전기사","2007","2","건설시공학","73","품질관리(TQC)를 위한 7가지 도구 중에서 불량수, 결점수등 셀 수있는 데이터를 분류하여 항목별로 나누었을 때 어디에 집중되어 있는 가를 알기 쉽도록 한 그림 또는 표를 무엇이라 하는가?","","히스토그램","체크 시트","파레토도","산포도","2"
