"Test Name","Year","Session","Subject","Number","Question","Question_image","Option 1","Option 2","Option 3","Option 4","Answer"
"건설안전기사","2012","4","건설시공학","63","굴착용 기계 중 드래그라인에 대한 설명으로 옳지 않은 것은?","","모래 채취에 많이 사용된다.","긴붐(boom)과 로프를 이용해 굴착반경이 크다.","토질이 매우 단단한 경우에는 부적합하다.","기계의 설치 지반보다 높은 곳을 파는데 유리하다.","4"
"건설안전기사","2012","4","건설시공학","64","거푸집의 구조계산에서 거푸집의 강도 및 강성의 계산시 고려할 사항으로 가장 거리가 먼 것은?","","동바리 자중","콘크리트 시공시의 수직하중","콘크리트 시공시의 수평하중","콘크리트 측압","1"
"건설안전기사","2012","4","건설시공학","65","보강 블록조에 대한 설명으로 옳지 않은 것은?","","블록의 모르타르 접착면은 적당히 물축이기를 하여 경화에 지장이 없도록 한다.","줄눈은 통줄눈이 되게 하는 것이 보통이다.","세로 보강철근은 2~3개를 이어서 테두리 보와 기초에 정착시킨다.","1일 쌓기 높이는 1.5m 이내가 되도록 한다.","3"
"건설안전기사","2012","4","건설시공학","66","결함부위로 균열의 집중을 유도하기 위해 균열이 생길만한 구조물의 부재에 미리 결함부위를 만들어 두는 것을 무엇이라 하는가?","","신축줄눈","침하줄눈","시공줄눈","조절줄눈","4"
"건설안전기사","2012","4","건설시공학","67","건축공사 견적방법 중 가장 정확한 공사비의 산출이 가능한 견적방법은?","","단위면적당 견적","단위설비별 견적","부분별 견적","명세 견적","4"
"건설안전기사","2012","4","건설시공학","68","철골공사에서 철골부재의 용접과 관련된 용어가 아닌 것은?","","위핑(Weeping)","토크(Torque)","루트(Root)","크랙(Crack)","2"
"건설안전기사","2012","4","건설시공학","69","철골 공사 중 현장에서 보수도장이 필요한 부위로 옳지 않은 것은?","","현장 용접 부위","현장접합 재료의 손상부위","현장에서 깎기 마무리가 필요한 부위","운반 또는 양중 시 생긴 손상부위","3"
"건설안전기사","2012","4","건설시공학","70","벽돌공사에서 직교하는 벽돌벽의 한편을 나중쌓기로 할 때에는 그 부분에 벽돌물림 자리를 벽돌 한켜 걸름으로 어느정도 들여쌓는가?","","$\\frac{1}{8}B$","$\\frac{1}{4}B$","$\\frac{1}{2}B$","1B","2"
"건설안전기사","2012","4","건설시공학","71","일반 콘크리트의 슬럼프 시험 결과 중 균등한 슬럼프를 나타내는 가장 좋은 상태는?","O","image_2012_4_71_1","image_2012_4_71_2","image_2012_4_71_3","image_2012_4_71_4","1"
"건설안전기사","2012","4","건설시공학","72","하부 지반이 연약한 경우 흙파기 저면선에 대하여 흙막이 바깥에 있는 흙의 중량과 지표 적재하중을 이기지 못하고 흙이 붕괴되어서 흙막이 바깥 흙이 안으로 밀려들어와 불록하게 되는 현상은?","","히빙(heaving)","보일링(boiling)","퀵샌드(quick sand)","오픈컷(open cut)","1"
"건설안전기사","2012","4","건설시공학","73","철근 가스압접 이음 시 외관 검사 결과 불합격된 압접부의 조치 내용 중 옳지 않은 것은?","","압접면의 엇갈림이 규정값을 초과했을 때는 재가열하여 수정한다.","철근중심축의 편심량이 규정값을 초과했을 때는 압접부를 떼어내고 재압접한다.","형태가 심하게 불량하거나 또는 압접부에 유해하다고 인정되는 결함이 생긴 경우는 압접부를 잘라내고 재압접한다.","심하게 구부러졌을 때는 재가열하여 수정한다.","1"
"건설안전기사","2012","4","건설시공학","74","시공의 품질관리를 위하여 사용하는 통계적 도구가 아닌 것은?","","작업표준","파레토도","관리도","산포도","1"
"건설안전기사","2012","4","건설시공학","75","석재 사용상의 주의사항 중 옳지 않은 것은?","","동일건축물에는 동일석재로 시공하도록 한다.","석재를 다듬어 사용할 때는 그 질이 균질한 것을 사용하여야 한다.","인장 및 모멘트를 받는 곳에 보강용으로 사용한다.","외벽, 도로포장용 석재는 연석 사용을 피한다.","3"
"건설안전기사","2012","4","건설시공학","76","콘크리트 공사의 일정계획에 영향을 주는 주요 요인이 아닌 것은?","","건축물의 규모","거푸집의 존치기간 및 전용횟수","시공도(Shop Draeing) 작성 기간","강우, 강설, 바람 등의 기후 조건","3"
"건설안전기사","2012","4","건설시공학","77","기초공사에 있어 지정에 관한 설명 중 옳지 않은 것은?","","긴주춧돌 지정 지름 30cm정도의 토관을 기초 저면에 설치하고, 한옥건축에서는 주춧돌로 화강석을 사용한다.","밑창콘크리트 지정 콘크리트 설계기준강도는 15MPa 이상의 것을 두께 5~6cm 정도로 설계한다.","잡석지정 수직지지력이나 수평지지력에 대한 효과가 매우 크다.","모래지정 - 모래는 장기 허용압축강도가 $20\sim40t/m^2$ 정도로 큰 편이어서 잘다져 지정으로 쓸 경우 효과적이다.","3"
"건설안전기사","2012","4","건설시공학","78","고층 건축물 시공 시 적용되는 거푸집에 대한 설명으로 옳지 않은 것은?","","ACS(Automatic climbing system) 거푸집은 거푸집에 부착된 유압장치 시스템을 이용하여 상승한다.","ACS(Automatic climbing system) 거푸집은 초고층 건축물 시공 시 코어 선행 시공에 유리하다.","알루미늄거푸집의 주요 시공 부위는 내부벽체, 슬래브, 계단실 벽체이며, 슬래브 필러 시스템에 있어서 해체가 간편하다.","알루미늄 거푸집은 녹이 슬지 않는 장점이 있으나 전용 횟수가 적다.","4"
"건설안전기사","2012","4","건설시공학","79","경량형강공사에 사용되는 부재 중 지붕에서 지붕내력을 받는 경사진 구조부재로서 트러스와 달리 하현재가 없는 것은?","","스터드","헤더","브레이싱","래프터","4"
"건설안전기사","2012","4","건설시공학","80","다음 중 기성콘크리트 말뚝의 장·단점에 대한 설명으로 옳지 않은 것은?","","말뚝이음 부위에 대한 신뢰성이 높다.","재료의 균질성이 우수하다.","자재하중이 크므로 운반과 시공에 각별한 주의가 필요하다.","시공과정상의 항타로 인하여 자재균열의 우려가 높다.","1"
"건설안전기사","2012","4","건설재료학","81","시멘트의 수화반응에서 발생하는 수화열이 가장 낮은 시멘트는?","","보통포틀랜드시멘트","조강포틀랜드시멘트","중용열포트랜드시멘트","백색포틀랜드시멘트","3"
"건설안전기사","2012","4","건설재료학","82","활엽수의 조직에 관한 설명 중 옳지 않은 것은?","","수선은 활엽수에서는 가늘어 잘 보이지 않으나 침엽수에는 잘 나타난다.","도관은 활엽수에만 있는 관으로 변재에서 수액을 운반하는 역할을 한다.","변재는 심재보다 수피쪽에 가까이 위치한다.","목세포는 가늘고 긴 모양으로 침엽수에서는 가도관 역할을 한다.","1"
"건설안전기사","2012","4","건설재료학","83","섬유포화점에서의 목재의 함수량으로 가장 알맞은 것은?","","10%","20%","30%","50%","3"
"건설안전기사","2012","4","건설재료학","84","건축 구조재료의 요구성능에는 역학적 성능, 화학적 성능, 방내화성능 등이 있는데 그 중 역학적 성능에 해당되지 않는 것은?","","내열성","강도","강성","내피로성","1"
"건설안전기사","2012","4","건설재료학","85","다음 중 내수성(耐水性)이 가장 부족한 접착제는?","","에폭시수지","멜라민수지","페놀수지","요소수지","4"
"건설안전기사","2012","4","건설재료학","86","시멘트의 분말도에 관한 설명 중 옳지 않은 것은?","","시멘트의 분말이 미세할수록 수화반응이 느리게 진행하여 강도의 발현이 느리다.","분말이 과도하게 미세하면 풍화되기 쉽고 또한 사용후 균열이 발생하기 쉽다.","시멘트의 분말도 시험으로는 체분석법, 피크노메타법, 브레인법 등이 있다.","분말도는 시멘트의 성능 중 수화반응, 블리딩, 초기강도 등에 크게 영향을 준다.","1"
"건설안전기사","2012","4","건설재료학","87","다음 석재 중 구조용으로 가장 적합하지 않은 것은?","","사문암","화강암","안산암","사암","1"
"건설안전기사","2012","4","건설재료학","88","다음중 멤브레인(membrane) 방수에 속하지 않는 것은?","","규산질 침투성 도포방수","아스팔트 방수","합성고분자 시트 방수","도막 방수","1"
"건설안전기사","2012","4","건설재료학","89","다음 중 비강도가 가장 큰 재료는?","","비닐","소나무","연강","콘크리트","2"
"건설안전기사","2012","4","건설재료학","90","상온에서 유백색의 탄성이 있는 열가소성 수지로서 얇은 시트로 이용되는 것은?","","폴리에틸렌 수지","요소 수지","실리콘 수지","폴리우레탄 수지","1"
"건설안전기사","2012","4","건설재료학","91","어떤 재료의 초기 탄성변형량이 2.0cm 이고 크리프(creep) 변형량이 4.0cm 라면 이 재료의 크리프 계수는 얼마인가?","","0.5","1.0","2.0","4.0","3"
"건설안전기사","2012","4","건설재료학","92","다음 점토제품 중 소성온도가 가장 높고 소지의 흡수성이 가장 작은 것은?","","토기","도기","자기","석기","3"
"건설안전기사","2012","4","건설재료학","93","다음 중 유용성(油溶性) 방부제에 해당되는 것은?","","크레오소트유(ceeosote oil)","불화소다2%용액","PCP(penta-chloro phenol)","황산동1% 용액","3"
"건설안전기사","2012","4","건설재료학","94","목재를 작은 조각으로 하여 충분히 건조시킨 후 합성수지와 같은 유기질의 접착제를 첨가하여 열압제판한 목재 가공품은?","","섬유판(Fiber board)","파티클 보드(Particle board)","코르크판(Cork board)","집성목재(Glulam)","2"
"건설안전기사","2012","4","건설재료학","95","다음 중 골재의 함수상태에 관한 설명으로 옳지 않은 것은?","","함수량이란 습윤상태의 골재의 내외에 함유하는 전체수량을 말한다.","흡수량이란 표면건조 내부포수상태의 골재중에 포함하는 수량을 말한다.","유효습수량이란 절건상태와 기건상태의 골재내에 함유된 수량과의 차를 말한다.","표면수량이란 함수량과 흡수량의 차를 말한다.","3"
"건설안전기사","2012","4","건설재료학","96","보통프틀랜드시멘트와 비교한 플라이애시시멘트의 특성에 관한 설명으로 옳지 않은 것은?","","워커빌리티가 좋다.","장기강도가 낮다.","수밀성이 크다.","수화열이 낮다.","2"
"건설안전기사","2012","4","건설재료학","97","강재의 열처리 방법이 아닌 것은?","","단조","불림","담금질","뜨임질","1"
"건설안전기사","2012","4","건설재료학","98","블론 아스팔트를 용제에 녹인 것으로 액상을 하고 있으며, 아스팔트 방수의 바탕처리재로 이용되는 것은?","","아스팔트 프라이머","아스팔트 펠트","아스팔트 유제","피치","1"
"건설안전기사","2012","4","건설재료학","99","콘크리트의 수밀성에 미치는 용인에 대한 설명 중 옳은 것은?","","물시멘트비 : 물시멘트비를 크게 할수록 수밀성이 커진다.","굵은골재 최대치수: 굵은골재의 최대치수가 클수록 수밀성은 커진다.","양생방법: 초기재령에서 건조하면 수밀성은 작아진다.","혼화재료: AE제를 사용하면 수밀성이 작아진다.","3"
"건설안전기사","2012","4","건설재료학","100","코너비드(Corner Bead)의 용도와 가장 관계가 깊은 것은?","","벽의 모서리","천장 달대","거푸집","계단 손잡이","1"
"건설안전기사","2012","4","건설안전기술","101","다음 중 굴착기계가 아닌 것은?","","탬퍼","파워셔블","드래그라인","클램쉘","1"
"건설안전기사","2012","4","건설안전기술","102","암반 중 풍화암 굴착 시 굴착면의 기울기 기준으로 옳은 것은?(21년 11월 19일 변경된 규정 적용됨)","","1:1.5","1:1.1","1:1.0","1:0.8","3"
"건설안전기사","2012","4","건설안전기술","103","작업장으로 통하는 장소 또는 작업장 내에 근로자가 사용하기 위한 안전한 통로를 설치할 때 그 설치 기준으로 옳지 않은 것은?","","통로에는 75럭스(Lux) 이상의 조명시설을 하여야한다.","통로의 주요한 부분에는 통로표시를 하여야 한다.","수직갱에 가설된 통로의 길이가 10m 이상인 때에는 7m 이내마다 계단참을 설치하여야 한다.","경사가 15°를 초과하는 경우에는 미끄러지지 아니하는 구조로 하여야 한다.","3"
"건설안전기사","2012","4","건설안전기술","104","굴착공사에서 비탈면 또는 비탈면 하단을 성토하여 붕괴를 방지하는 공법은?","","배수공","배토공","공작물에 의한 방지공","압성토공","4"
"건설안전기사","2012","4","건설안전기술","105","구축하고자 하는 지하구조물이 인접구조물보다 깊은 위치에 근접하여 건설할 경우에 주변지반과 인접 건축물 기초의 침하에 대한 우려 때문에 실시하는 기초보강공법은?","","H-말뚝 토류판공법","S.C.W 공법","지하연속벽공법","언더피닝공법","4"
"건설안전기사","2012","4","건설안전기술","106","가설다리에서 이동식 크레인으로 작업 시 주의사항에 해당되지 않는 것은?","","다리강도에 대해 담당자와 함께 확인한다.","작업하중이 과하중으로 되지 않는가 확인한다.","아웃트리거가 지지기둥 바로 위에 있을 때 충분히 보강한다.","가설다리를 이동하는 경우는 진동을 크게 발생하지 않도록 하여 운전한다.","3"
"건설안전기사","2012","4","건설안전기술","107","온도가 하강함에 따라 토중수가 얼어 부피가 약 9% 정도 증대하게 됨으로써 지표면이 부풀어오르는 현상은?","","동상현상","연화현상","리칭현상","액상화현상","1"
"건설안전기사","2012","4","건설안전기술","108","터널 지보공을 설치한 경우에 수시로 점검을 하고 이상을 발견한 경우에 즉시 보강하거나 보수하여야 하는 사항과 가장 거리가 먼 것은?","","부재의 손상·변형 부식 변위의 유무와 상태","부재의 접속부 및 교차부의 상태","경보장치의 작동 상태","기둥침하의 유무 및 상태","3"
"건설안전기사","2012","4","건설안전기술","109","다음 중 운반작업 시 주의사항으로 옳지 않은 것은?","","단독으로 긴 물건을 어깨에 메고 운반할 때에는 뒤쪽을 위로 올린 상태로 운반한다.","운반시의 시선은 진행방향을 향하고 뒷걸음 운반을 하여서는 안된다.","무거운 물건을 운반할 때 무게 중심이 높은 하물은 인력으로 운반하지 않는다.","어깨높이보다 높은 위치에서 하물을 들고 운반하여서는 안된다.","1"
"건설안전기사","2012","4","건설안전기술","110","차량계 건설기계의 전도방지 조치에 해당되지 않는 것은?","","운행 경로 변경","갓길의 붕괴방지","지반의 부동침하방지","도로 폭의 유지","1"
"건설안전기사","2012","4","건설안전기술","111","최고 51m 높이의 강관비계를 세우려고 한다. 지상에서 몇 m 까지의 비계기둥을 2본으로 묶어 세워야하는가?","","10m","20m","31m","51m","2"
"건설안전기사","2012","4","건설안전기술","112","벽체 콘크리트 타설시 거푸집이 터져서 콘크리트가 쏟아지는 사고가 발생하였다. 이 사고의 발생원인으로 가장 타당한 것은?","","콘크리트를 부어 넣는 속도가 빨랐다.","진동기를 사용하지 않았다.","철근 사용량이 많았다.","시멘트 사용량이 많았다.","1"
"건설안전기사","2012","4","건설안전기술","113","다음 중 개착식 굴착방법과 거리가 먼 것은?","","타이로드 공법","어스앵커 공법","버팀대 공법","TBM 공법","4"
"건설안전기사","2012","4","건설안전기술","114","건설업 산업안전보건 관리비 중 계상비용에 해당되지 않는 것은?","","외부비계, 작업발판 등의 가설구조물 설치 소요비","근로자 건강관리비","건설재해예방 기술지도비","개인보호구 및 안전장구 구입비","1"
"건설안전기사","2012","4","건설안전기술","115","흙막이 지보공의 안전조치로 옳지 않은 것은?","","굴착배면에 배수로 설치없이 콘크리트를 타설","지하매설물에 대한 조사 실시","조립도의 작성 및 점검 철저","흙막이 지보공에 대한 조사 및 점검 철저","1"
"건설안전기사","2012","4","건설안전기술","116","철골작업 시 철골부재에서 근로자가 수직방향으로 이동하는 경우에 설치하여야 하는 고정된 승강로의 최소 답단 간격은 얼마 이내인가?","","20cm","25cm","30cm","40cm","3"
"건설안전기사","2012","4","건설안전기술","117","건설업 산업안전 보건관리비의 사용내역에 대하여 수급인 또는 자기공사자는 공사 시작 후 몇 개월마다 1회 이상 발주자 또는 감리원의 확인을 받아야 하는가?","","3개월","4개월","5개월","6개월","4"
"건설안전기사","2012","4","건설안전기술","118","철골 작업을 할 때 악천후에는 작업을 중지토록 하여야 하는데 그 기준으로 옳은 것은?","","강설량이 분당 1cm 이상인 경우","강우량이 시간당 1cm 이상인 경우","풍속이 초당 10m 이상인 경우","기온이 35℃ 이상인 경우","3"
"건설안전기사","2012","4","건설안전기술","119","해체공사에 대한 설명으로 옳지 않은 것은?","","압쇄기와 대형 브레이커(Breaker)는 파워소벨 등에 설치하여 사용한다.","철제 햄머(Hammer)는 크레인 등에 설치하여 사용한다.","핸드 브레이커(Hand breaker) 사용 시 수직보다는 경사를 주어 파쇄하는 것이 좋다.","절단톱의 회전날에는 접촉방지 커버를 설치하여야 한다.","3"
"건설안전기사","2012","4","건설안전기술","120","건설공사 시공단계에 있어서 안전관리의 문제점에 해당되는 것은?","","발주자의 조사, 설계 발주 미흡 및 감독 소홀","용역자의 조사, 설계 부실","발주자의 감독 소홀","사용자의 시설 운영관리 능력 부족","3"