"Test Name","Year","Session","Subject","Number","Question","Question_image","Option 1","Option 2","Option 3","Option 4","Answer"
"건설안전산업기사","2008","2","산업안전관리론","1","다음 중 피로의 정신적 증상으로 가장 관련이 깊은 것은?","","주의력이 감소 또는 경감된다.","작업의 효과나 작업량이 감퇴 및 저하된다.","작업에 대한 무감각·무표정·경련 등이 일어난다.","작업에 대한 몸의 자세가 흐트러지고 지치게 된다.","1"
"건설안전산업기사","2008","2","산업안전관리론","2","다음 중 재해예방의 4원칙에 해당되지 않는 것은?","","대책 선정의 원칙","손실 우연의 원칙","예방 가능의 원칙","통계 방법의 원칙","4"
"건설안전산업기사","2008","2","산업안전관리론","3","부주의 발생 현상 중 주의의 일점 집중현상과 가장 관련이 깊은 것은?","","의식의 과잉","의식의 우회","의식의 단절","의식수준의 저하","1"
"건설안전산업기사","2008","2","산업안전관리론","4","B 사업장의 도수율이 10 이고, 강도율이 1.7 이라고 하면 이 사업장의 종합재해지수(FSI)는 약 얼마인가?","","2.74","3.74","3.87","4.12","4"
"건설안전산업기사","2008","2","산업안전관리론","5","다음 중 Project Method 의 4단계를 올바르게 나열한 것은?","","계획→ 목적 수행 평가","계획 수행 목적 평가","목적 수행 계획→ 평가","목적 계획 수행 평가","4"
"건설안전산업기사","2008","2","산업안전관리론","6","매슬로우(Maslow)의 욕구 5단계 중 전쟁, 재해, 질병 등으로 부터 초래되는 위협이나 위험으로부터 자유로워 지려는 욕구에 해당하는 것은?","","자아실현의 욕구","사회적 욕구","생리적 욕구","안전 욕구","4"
"건설안전산업기사","2008","2","산업안전관리론","7","다음 중 개인적 카운슬링(Counseling) 방법으로 가장 거리가 먼 것은?","","직접적 충고","반복적 충고","설명적 방법","설득적 방법","2"
"건설안전산업기사","2008","2","산업안전관리론","8","다음 중 맥그리거(McGregor)의 X 이론에 따른 관리처방으로 볼 수 없는 것은?","","목표에 의한 관리","권위주의적 리더십 확립","경제적 보상체제의 강화","면밀한 감독과 엄격한 통제","1"
"건설안전산업기사","2008","2","산업안전관리론","9","다음 중 주의의 특징으로 볼 수 없는 것은?","","변동성","선택성","방향성","통합성","4"
"건설안전산업기사","2008","2","산업안전관리론","10","다음 중 산업안전보건법상 특별안전보건교육 대상 작업이 아닌 것은?","","주물 및 단조작업","전압이 50볼트인 정전 및 활선작업","화학설비 중 반응기, 교반기, 추출기의 사용 및 세척 작업","액화석유가스, 수소가스 등 가연성, 폭발성 가스의 발생 장치 취급작업","2"
"건설안전산업기사","2008","2","산업안전관리론","11","모랄 서베이 (Morale survey) 주요 방법 중 태도조사법에 해당하는 것은?","","사례연구법","관찰법","실험연구법","문답법","4"
"건설안전산업기사","2008","2","산업안전관리론","12","연평균 근로자수가 200명인 A 사업장에 지난 1년간 9명의 사상자가 발생하였다. 이 사업장의 연천인율은 얼마인가?","","40","45","50","55","2"
"건설안전산업기사","2008","2","산업안전관리론","13","다음 중 교육 대상자수가 많고, 교육 대상자의 학습 능력의 차이가 큰 경우 집단안전 교육방법으로서 가장 효과적인 방법은?","","문답식 교육","토의식 교육","시청각 교육","상담식 교육","3"
"건설안전산업기사","2008","2","산업안전관리론","14","다음 중 산업안전보건위원회의 구성원으로 잘못된 것은?","","해당 사업의 대표자","근로자대표가 지명하는 1인 이상의 명예산업안전 감독관","근로자대표가 지명하는 10인 이내의 해당 사업장의 근로자","해당 사업의 대표자가 지명하는 9인 이내의 해당 사업장 부서의 장","3"
"건설안전산업기사","2008","2","산업안전관리론","15","다음 중 점검시기에 의한 안전점검의 분류에 해당하지않는 것은?","","성능점검","정기점검","임시점검","특별점검","1"
"건설안전산업기사","2008","2","산업안전관리론","16","다음 중 물체의 낙하 및 비래에 의한 위험을 방지 또는 경감하고, 머리부위 감전에 의한 위험을 방지하기 위한 경우 가장 적절한 안전모의 종류는?","","A","AB","AE","BE","3"
"건설안전산업기사","2008","2","산업안전관리론","17","다음 중 허츠버그(Herzberg)의 2요인 이론에 대한 설명으로 옳은 것은?","","위생요인은 직무내용에 관련된 요인이다.","동기요인은 직무에 만족을 느끼는 주요인이다.","위생요인은 매슬로우 욕구단계 등 존경, 자아실현의 욕구와 유사하다.","동기요인은 매슬로우 욕구단계 중 생리적 욕구와 유사하다.","2"
"건설안전산업기사","2008","2","산업안전관리론","18","다음 중 토의법의 장점으로 볼 수 없는 것은?","","사고표현력을 길러 준다.","결정된 사항에 따르도록 한다.","내용에 대한 사전지식이 필요없다.","자기 스스로 사고하는 능력을 길러 준다.","3"
"건설안전산업기사","2008","2","산업안전관리론","19","산업안전보건법상 다음 [그림]의 안전·보건표지의 명칭은?","O","화재경고","인화성물질경고","폭발성물질경고","산화성물질경고","2"
"건설안전산업기사","2008","2","산업안전관리론","20","다음 중 피로 측정에 관한 감각기능검사의 측정 대상 항목과 가장 거리가 먼 것은?","","뇌파","플리커","안구운동","체온·피부온도","4"
"건설안전산업기사","2008","2","인간공학 및 시스템안전공학","21","반경 20cm 의 조종구(ball control)를 30° 움직였을 때 2cm 이동하였다면 통제표시비는 약 얼마인가?","","8.25","7.73","6.27","5.24","4"
"건설안전산업기사","2008","2","인간공학 및 시스템안전공학","22","다음 중 수치를 정확히 읽어야 할 경우에 가장 적합한 시각적 표시장치는?","","동침형","동목형","수평형","계수형","4"
"건설안전산업기사","2008","2","인간공학 및 시스템안전공학","23","화학설비에 대한 안전성 평가 단계 중 제2단계의 주요 진단 항목이 아닌 것은?","","건조물","공정계통도","중간 제품","소방설비","2"
"건설안전산업기사","2008","2","인간공학 및 시스템안전공학","24","기준의 유형 가운데 체계기준(system criteria)에 해당되지 않는 것은?","","운용비","신뢰도","시고빈도","사용상의 용이성","3"
"건설안전산업기사","2008","2","인간공학 및 시스템안전공학","25","암호체계 사용상의 일반적인 지침에서 '암호의 변별성'을 의미하는 것으로 가장 적절한 것은?","","암호화한 자극은 감지장치나 사람이 감지할 수 있어야 한다.","모든 암호의 표시는 다른 암호 표시와 구분될 수 있어야 한다.","암호를 사용할 때에는 사용자가 그 뜻을 분명히 알 수 있어야 한다.","두 가지 이상의 암호 차원을 조합해서 사용하면 정보전달이 촉진된다.","2"
"건설안전산업기사","2008","2","인간공학 및 시스템안전공학","26","어떤 음의 청취가 다른 음에 의해 방해되는 청각 현상을 무엇이라 하는가?","","debug","masking","vigilance","anthropometry","2"
"건설안전산업기사","2008","2","인간공학 및 시스템안전공학","27","다음 중 인간실수확률에 대한 추정기법에 해당하는 것은?","","OHA","PHA","HAZOP","THERP","4"
"건설안전산업기사","2008","2","인간공학 및 시스템안전공학","28","[그림]과 같은 시스템의 신뢰도는 얼마인가?","O","0.6261","0.7371","0.8481","0.9591","2"
"건설안전산업기사","2008","2","인간공학 및 시스템안전공학","29","[그림]과 같은 FT도에서 G1의 발생확률은? (단, G₂=0.1, G₃=0.2, G₄=0.3 의 발생확률을 갖는다.)","O","0.006","0.300","0.496","0.600","1"
"건설안전산업기사","2008","2","인간공학 및 시스템안전공학","30","휴먼에러 중 필요한 task 및 절차를 수행하지 않아 발생하는 에러를 무엇이라 하는가?","","time error","omission error","commission error","extraneous error","2"
"건설안전산업기사","2008","2","인간공학 및 시스템안전공학","31","[그림]에서 A는 자극의 불확실성, B는 반응의 불확실성을 나타낸다. 이 때 C 부분이 나타내는 것은?","O","전달된 정보량","불안전한 행동의 양","자극과 반응의 확실성","자극과 반응의 검출성","1"
"건설안전산업기사","2008","2","인간공학 및 시스템안전공학","32","다음 중 정적자세를 유지할 때 진전(tremor)을 감소시킬 수 있는 방법으로 거리가 먼 것은?","","시각적인 참조가 있도록 한다.","손을 심장 높이가 되도록 유지한다.","작업대상물에 기계적 마찰이 있도록 한다.","근로자가 떨지 않으려고 힘을 주어 노력한다.","4"
"건설안전산업기사","2008","2","인간공학 및 시스템안전공학","33","원자력 산업과 같이 이미 상당한 안전이 확보되어 있는 장소에서 관리, 설계, 생산, 보전 등 광범위하고 고도의 안전 달성을 목적으로 하는 시스템 해석방법은?","","ETA","FHA","MORT","FMECA","3"
"건설안전산업기사","2008","2","인간공학 및 시스템안전공학","34","다음 중 작업장의 조명 수준에 대한 설명으로 가장 적절한 것은?","","작업환경의 추천 광도비는 5: 1 정도이다.","천장은 80~90% 정도의 반사율을 가지도록 한다.","작업영역에 따라 휘도의 차이를 크게 한다.","실내표면의 반사율은 천장에서 바닥의 순으로 증가시킨다.","2"
"건설안전산업기사","2008","2","인간공학 및 시스템안전공학","35","다음 중 점광원에 적용할 때 조도를 나타낸 식으로 옳은 것은?","","$\\frac{\\text{광도}}{\\text{거리}}$","$\\frac{\\text{광도}}{(\\text{거리})^2}$","$\\frac{\\text{거리}}{\\text{광도}}$","$\\frac{(\\text{거리})^2}{\\text{광도}}$","3"
"건설안전산업기사","2008","2","인간공학 및 시스템안전공학","36","다음 중 일반적인 수공구의 설계원칙으로 볼 수 없는 것은?","","손목을 곧게 유지한다.","반복적인 손가락 동작을 피한다.","사용이 용이한 검지만을 주로 사용한다.","손잡이는 접촉면적을 가능하면 크게 한다.","3"
"건설안전산업기사","2008","2","인간공학 및 시스템안전공학","37","다음 중 인간 눈에서 빛이 가장 먼저 접촉하는 부위는?","","각막","망막","초자체","수정체","1"
"건설안전산업기사","2008","2","인간공학 및 시스템안전공학","38","다음 중 신뢰도를 구조상으로 직렬구조에 해당되는 것은?","","3발 자전거의 바퀴","건물내의 스프링클러","검사인원의 중복 투입","자동차의 브레이크 시스템","1"
"건설안전산업기사","2008","2","인간공학 및 시스템안전공학","39","다음 중 동작경제의 원칙으로 틀린 것은?","","동작의 범위는 최대로 할 것","동작은 연속된 곡선운동으로 할 것","양손은 좌우 대칭적으로 움직일 것","양손은 동시에 시작하고 동시에 끝내도록 할 것","1"
"건설안전산업기사","2008","2","인간공학 및 시스템안전공학","40","자극들간, 반응들간 혹은 자극과 반응조합의 관계가 인간의 기대와 모순되지 않는 것을 무엇이라 하는가?","","검출성","변별성","양립성","표준화","3"
"건설안전산업기사","2008","2","건설시공학","41","혼화제인 AE제가 콘크리트의 물성에 미치는 영향에 대한 설명중 옳지 않은 것은?","","동결융해에 대한 저항성이 크게 된다.","철근과의 부착강도는 커지는 경향이 있다.","시공성이 좋아진다.","단위 수량이 적게 된다.","2"
"건설안전산업기사","2008","2","건설시공학","42","제자리 콘크리트 말뚝을 시공할 때 목표지점까지 케이싱 튜브(casing tube)로 공벽(孔壁)을 보호하면서 굴착하는 공법은?","","심초말뚝공법","베노토(benoto) 말뚝공법","어스 드릴(earth drill) 말뚝공법","리버스 서큘레이션(reverse circulation) 말뚝공법","2"
"건설안전산업기사","2008","2","건설시공학","43","QC의 7대 도구 중 결함부나 기타 시공불량 등 항목을 구분하여 크기순으로 나열한 것으로, 결함항목을 집중적으로 감소시키는데 효과적으로 사용되는 것은?","","파레토도","히스토그램","산포도","관리도","1"
"건설안전산업기사","2008","2","건설시공학","44","다음 중 건축공사의 시공순서로 가장 알맞은 것은?","","흙막이 및 토공사 - 기초공사 - 방수공사 - 구체공사- 지붕공사 - 마무리공사","흙막이 및 토공사 - 기초공사 - 철근콘크리트공사 - 지붕공사 - 조적 및 미장공사 - 방수공사 - 마무리공사","흙막이 및 토공사 - 기초공사 - 조적 및 미장공사 - 철근콘크리트공사 - 지붕공사 - 방수공사 - 마무리 공사","기초공사 - 흙막이 및 토공사 - 구체공사 - 미장공사- 방수공사 - 마무리공사 - 지붕공사","2"
"건설안전산업기사","2008","2","건설시공학","45","철근콘크리트공사에서 컨시스턴시(consistency)의 정의로 옳은 것은?","","반줄질기 여하에 따르는 작업의 난이도 정도 및 재료 분리에 저항하는 정도를 나타내는 굳지 않은 콘크리트의 성질","주로 수량의 다소에 따르는 반죽이 되고 진 정도를 나타내는 굳지 않은 콘크리트의 성질","거푸집에 쉽게 다져 넣을 수 있고, 거푸집을 제거하면 천천히 변하는 굳지 않은 콘크리트의 성질","굵은골재의 최대치수 등에 따르는 마무리하기 쉬운 정도를 나타내는 굳지 않은 콘크리트의 성질","2"
"건설안전산업기사","2008","2","건설시공학","46","표준관입시험에 관한 설명 중 옳지 않은 것은?","","토질시험의 일종이다.","추의 무게는 63.5kg 이다.","N의 값이 작을수록 밀실한 토질이다.","N의 값은 30cm를 관입하는데 필요한 타격 횟수이다.","3"
"건설안전산업기사","2008","2","건설시공학","47","강관말뚝지정에 대한 설명으로 옳지 않은 것은?","","강한 타격에도 견디며 다져진 중간지층의 관통도 가능하다.","중량이 가볍고, 단면적이 작다.","이음이 강하며 길이 조절이 용이하다.","상부구조와의 결합이 용이하지 않으며 재료비가 저렴하다.","4"
"건설안전산업기사","2008","2","건설시공학","48","다음 중 콘크리트 배합을 결정하는데 있어서 직접적으로 관계가 없는 것은?","","물시멘트비","골재의강도","단위시멘트량","슬럼프값","2"
"건설안전산업기사","2008","2","건설시공학","49","기초공사를 하기 위하여 땅을 파는 일을 기초파기 또는 흙파기라 하는데. 흙파기 모양에 따라 구분한 용어가 아닌것은?","","구덩이파기(pit excavation)","줄기초파기(trenching)","온통기초파기(overall excavation)","탑다운 공법(top-down method)","4"
"건설안전산업기사","2008","2","건설시공학","50","토량 6,000㎥을 8톤 트럭으로 운반할 때 필요한 트럭 대수는?(단 톤 트럭 1대의 적재량 $6m^3$ 이고 트럭은 5회 운행함)","","120대","150대","180대","200대","4"
"건설안전산업기사","2008","2","건설시공학","51","철근콘크리트공사에서 수직 거푸집의 상호간 간격을 유지하는 데 사용하는 것은?","","박리제(form oil)","세퍼레이터(separator)","스페이서(spacer)","서포트(support)","2"
"건설안전산업기사","2008","2","건설시공학","52","단가 도급계약 제도에 대한 설명으로 옳지 않는 것은?","","시급한 공사인 경우 계약을 간단히 할 수 있다.","설계변경으로 인한 수량증감의 계산이 어렵고 일식 도급보다 복잡하다.","공사비가 높아질 염려가 있다.","총공사비를 예측하기 힘들다.","2"
"건설안전산업기사","2008","2","건설시공학","53","내외관을 소정의 깊이까지 박은 후 내관을 빼내고, 외관내에 콘크리트를 투입하여 내관으로 다지면서 점차 외관도 뽑아 올려 콘크리트를 구근형으로 만들어 완성하는 현장 타설 콘크리트 파일은?","","심플렉스파일","컴프레솔파일","페테스탈파일","레이몬드파일","3"
"건설안전산업기사","2008","2","건설시공학","54","철근콘크리트에서 이어붓기 위치로 틀리게 기술된 것은?","","기둥이음의 기둥은 중간에서 수평으로 한다.","아치의 이음은 아치축에 직각으로 설치한다.","보, 바닥판 이음은 그 스팬의 중앙 부근에서 수직으로 한다.","벽은 개구부 등 끊기 좋은 위치에서 수직 또는 수평으로 한다.","1"
"건설안전산업기사","2008","2","건설시공학","55","현장에서 공무적 현장관리가 아닌 것은?","","자재관리","노무관리","위험 및 재해방지","공정표작성","4"
"건설안전산업기사","2008","2","건설시공학","56","다음은 현장용접시 발생하는 재해예방조치를 설명한 것이다. 이 중 화재예방조치와 직접적인 관련성이 가장 작은 것은?","","용접기의 완전한 접지(earth)를 한다.","용접부분 부근의 가연물이나 인화물을 치운다.","착의, 장갑, 구두 등을 건조상태로 한다.","불꽃이 비산하는 장소에 주의한다.","3"
"건설안전산업기사","2008","2","건설시공학","57","철근콘크리트 구조물의 내구성 저하 요인이 아닌 것은?","","백화(百花)","염해","중성화","동해","1"
"건설안전산업기사","2008","2","건설시공학","58","다음 용어에 대한 정의로 틀린 것은?","","$함수비 = \\frac{물의 무게}{토립자의 무게(건조중량)} \\times 100(\\%)$","$간극비 = \\frac{간극의 부피}{토립자의 부피}$","$포화도 = \\frac{물의 부피}{간극의 부피} \\times 100(\\%)$","$간극률 = \\frac{물의 부피}{전체의 부피} \\times 100(\\%)$","4"
"건설안전산업기사","2008","2","건설시공학","59","철골공사의 녹막이칠에 관한 기술 중 옳지 않은 것은?","","기계깎기 마무리한 면의 녹막이 칠은 그리이스(grease) 칠을 하는 것을 원칙으로 한다.","공장가공 후 현장으로 운반하기 전 녹막이칠을 1~2회 정도 한다.","콘크리트에 묻히는 부분에는 반드시 녹막이칠을 한다.","현장 용접부분은 용접부에서 100mm 이내에 녹막이 칠을 하지 않는다.","3"
"건설안전산업기사","2008","2","건설시공학","60","철골공사의 철골부재 용접에서 용접 결함이 아닌 것은?","","언더컷(under cut)","오버랩(overlap)","위핑(weeping)","블로우홀(blow hole)","3"
"건설안전산업기사","2008","2","건설재료학","61","타일의 제조공정에서 건식제법에 대한 설명으로 옳지 않은 것은?","","내장타일은 주로 건식제법으로 제조된다.","제조능률이 높다.","치수 정도(精度)가 좋다.","복잡한 형상의 것에 적당하다.","4"
"건설안전산업기사","2008","2","건설재료학","62","대리석의 성질과 용도에 관한 설명 중 옳은 것은?","","석질이 치밀하고 판석으로서 지붕 외벽 등에 붙이고 비석, 숫돌로 이용된다.","석질이 견고하고 조적재, 기초석재, 장식용으로 쓰인다.","내화도는 높으나 조잡하여 경량골재, 내화재 등에 사용한다.","석질이 치밀하고 열, 산에는 약하지만 미려하므로 장식용으로 사용된다.","4"
"건설안전산업기사","2008","2","건설재료학","63","석회암($CaCO_3$)을 900~1200℃ 정도로 가열 소성하여 얻어지는 것은?","","소석회","생석회","무수석고","마그네시아 석회","2"
"건설안전산업기사","2008","2","건설재료학","64","KS에 규정된 1종 포틀랜드 시멘트의 4주 압축강도는?","","10.8 MPa 이상","12.7 MPa 이상","19.6 MPa 이상","28.4 MPa 이상","4"
"건설안전산업기사","2008","2","건설재료학","65","정토제품의 원료와 그 역할이 올바르게 연결된 것은?","","규석, 모래 - 점성 조절","장석, 석회석 - 균열 방지","샤모트(chamotte) - 내화성 증대","식염, 붕사 - 용융성 조절","1"
"건설안전산업기사","2008","2","건설재료학","66","화성암의 일종으로 내구성 및 강도가 크고 외관이 수려하며, 절리의 거리가 비교적 커서 대재를 얻을 수 있으나, 함유광물의 열팽창계수가 달라 내화성이 약한 석재는?","","안산암","사암","화강암","응회암","3"
"건설안전산업기사","2008","2","건설재료학","67","강을 800~1000℃로 가열하여 그 온도에서 수십분 간 보존한 후 대기 중에서 서서히 냉각하는 열처리로 조직을 개선하고 결정을 미세화하기 위해 실시하는 것은?","","불림","풀림","담금질","뜨임질","1"
"건설안전산업기사","2008","2","건설재료학","68","다음의 각종 미장재료에 대한 설명 중 틀린 것은?","","회반죽 바름은 수경성 재료이며 소석회에 물과 풀을 넣고 여물을 섞어 바른다.","질석모르타르는 질석을 모르타르에 혼합한 것으로 내화피복용 바름재로 쓰인다.","돌로마이트 플라스터는 기경성 재료이며 건조수축이 크다.","석고 플라스터는 소석고를 주성분으로 한다.","1"
"건설안전산업기사","2008","2","건설재료학","69","다음 중 건축재료로 쓰이는 알루미늄에 대한 설명으로 옳은 것은?","","열 전기전도성이 우수하다.","가공성이 나빠서 복잡한 형상의 제작이 곤란하다.","내화성이 크다.","산, 알칼리 등에 강해서 콘크리트용으로 적합하다.","1"
"건설안전산업기사","2008","2","건설재료학","70","건축용 접착제에 기본적으로 요구되는 성능과 가장 관계가 먼 것은?","","경화시 체적수축 등의 변형을 일으키지 않을 것","취급이 용이하고 사용시 유동성이 없을 것","장기 하중에 의한 크리프가 없을 것","진동, 충격의 반복에 잘 견딜 것","2"
"건설안전산업기사","2008","2","건설재료학","71","다음 중 보통 콘크리트용 쇄석의 원석으로 가장 부적당한 것은?","","현무암","안산암","화강암","응회암","4"
"건설안전산업기사","2008","2","건설재료학","72","목재에 관한 설명 중 옳지 않은 것은?","","활엽수는 일반적으로 침엽수에 비해 단단한 것이 많아 경재(硬材)라 부른다.","인장강도는 응력방향이 섬유방향에 수직인 경우에 최대가 된다.","불에 타는 단점이 있으나 열전도도가 아주 낮아 여러가지 보온재료로 사용된다.","섬유포화점 이상의 함수상태에서는 함수율의 증감에도 불구하고 신축을 일으키지 않는다.","2"
"건설안전산업기사","2008","2","건설재료학","73","굳지 않은 콘크리트의 성질을 나타내는 용어로서 콘크리트 타설 작업의 난이도 정도 및 재료의 분리에 저항하는 정도를 나타내는 것은?","","워커빌리티 (workability)","컨시스턴시(consistency)","플라스티시티(plasticity)","펌퍼빌리티 (pumpability)","1"
"건설안전산업기사","2008","2","건설재료학","74","블로운 아스팔트의 성능을 개량하기 위해 동식물성 유지와 광물질 분말을 혼입하여 제작한 것은?","","아스팔트 프라이머","아스팔트 컴파운드","아스팔트 코팅","아스팔트 에멀젼","2"
"건설안전산업기사","2008","2","건설재료학","75","다음 중 프리팩트 콘크리트에서 주입용 모르타르에 쓰이는 모래의 조립를(FM값)로 가장 알맞은 것은?","","0.7~1.2","1.4~2.2","2.3~3.7","3.8~4.0","2"
"건설안전산업기사","2008","2","건설재료학","76","집성목재에 대한 설명 중 옳지 않은 것은?","","옹이, 균열 등의 각종 결점을 제거하거나 이를 적당히 분산시켜 되도록 균질한 조직의 인공목재를 제조 할 수 있다.","보, 기둥, 아치, 트러스 등의 구조재료로 사용할 수 있다.","직경이 작은 목재들을 접착하여 장대재(長大材)로 활용할 수 있으므로 자원을 절약할 수 있다.","소재를 약제처리 후 집성접착하므로 양산이 어려우며 건조균열 및 변형 등을 피할 수 없다.","4"
"건설안전산업기사","2008","2","건설재료학","77","목재의 건조목적이 아닌 것은?","","목재의 강도 증진","도료, 주입제 및 접착제의 효과 증대","균류 발생의 방지","수지낭(resin pocket)과 연륜의 제거","4"
"건설안전산업기사","2008","2","건설재료학","78","철강제품 중에서 내식성, 내마모성이 우수하고 강도가 높으며, 장식적으로도 광택이 미려한 Cr-Ni 합금의 비자성강(鋼)은?","","스테인리스강","탄소강","주철","주강","1"
