"Test Name","Year","Session","Subject","Number","Question","Question_image","Option 1","Option 2","Option 3","Option 4","Answer"
"건설안전산업기사","2013","1","산업안전관리론","1","다음 중 직무적성검사에 있어 갖추어야 할 요건으로 볼 수 없는 것은?","","규준","타당성","표준화","융통성","4"
"건설안전산업기사","2013","1","산업안전관리론","2","기억의 과정 중 과거의 학습경험을 통해서 학습된 행동이 현재와 미래에 지속되는 것을 무엇이라 하는가?","","기명(memorizing)","파지(retention)","재생(recall)","재인(recognition)","2"
"건설안전산업기사","2013","1","산업안전관리론","3","다음 중 교육훈련 평가의 4단계를 올바르게 나열한 것은?","","학습 → 반응 → 행동 → 결과","학습 → 행동 → 반응→ 결과","행동 → 반응 → 학습 → 결과","반응 → 학습 → 행동 → 결과","4"
"건설안전산업기사","2013","1","산업안전관리론","4","다음 중 산업안전보건법에 따라 안전·보건진단을 받아 안전보건개선계획을 수립·제출하도록 명할 수 있는 사업장에 해당하지 않는 것은?","","직업병에 걸린 사람이 연간 1명 발생한 사업장","산업재해율이 같은 업종 평균 산업재해율의 3배인 사업장","작업환경 불량, 화재폭발 또는 누출사고 등으로 사회적 물의를 일으킨 사업장","산업재해율이 같은 업종의 규모별 평균 산업재해율보다 높은 사업장 중 사업주가 안전·보건조치의무를 이행하지 아니하여 발생한 중대재해 발생 사업장","1"
"건설안전산업기사","2013","1","산업안전관리론","5","산업안전보건법상 사업내 안전·보건교육에 있어 관리감독자 정기안전·보건교육에 해당하는 것은? (단, 산업안전보건법 및 일반관리에 관한 사항은 제외한다.)","","정리정돈 및 청소에 관한 사항","작업 개시 전 점검에 관한 사항","작업공정의 유해·위험과 재해 예방대책에 관한사항","기계·기구의 위험성과 작업의 순서 및 동선에 관한 사항","3"
"건설안전산업기사","2013","1","산업안전관리론","6","다음 중 리더십의 유효성(有效性)을 증대시키는 1차적 요소와 관계가 가장 먼 것은?","","리더 자신","조직의 규모","상황적 변수","추종자 집단","2"
"건설안전산업기사","2013","1","산업안전관리론","7","의무안전인증 대상 보호구 중 차광보안경의 사용구분에 따른 종류가 아닌 것은?","","보정용","용접용","복합용","적외선용","1"
"건설안전산업기사","2013","1","산업안전관리론","8","다음 중 산업안전보건법상 용어의 정의가 잘못 설명된 것은?","","'사업주'란 근로자를 사용하여 사업을 하는 자를 말한다.","'근로자대표'란 근로자의 과반수로 조직된 노동조합이 없는 경우에는 사업주가 지정하는 자를 말한다.","'산업재해'란 근로자가 업무에 관계되는 건설물·설비·원재료 가스·증기 등에 의하거나 작업 또는 그 밖의 업무로 인하여 사망 또는 부상 하거나 질병에 걸리는 것을 말한다.","'안전·보건진단'이란 산업재해를 예방하기 위하여 잠재적 위험성을 발견하고 그 개선대책을 수립할 목적으로 고용노동부장관이 지정하는 자가 하는 조사·평가를 말한다.","2"
"건설안전산업기사","2013","1","산업안전관리론","9","다음 설명에 해당하는 위험 예지활동은?\n작업을 오조작 없이 안전하게 하기 위하여 작업공정의 요소에서 자신의 행동을 하고 대상을 가리킨 후 큰 소리로 확인하는 것","","지적확인","Tool Box Meeting","터치앤콜","삼각위험예지훈련","1"
"건설안전산업기사","2013","1","산업안전관리론","10","스트레스 주요 원인 중 마음속에서 일어나는 내적 자극요인으로 볼 수 없는 것은?","","자존심의 손상","업무상 죄책감","현실에서의 부적응","대인 관계상의 갈등","4"
"건설안전산업기사","2013","1","산업안전관리론","11","다음 중 재해의 기본원인을 4M으로 분류할 때 작업의 정보. 작업방법, 환경 등의 요인이 속하는 것은?","","Man","Machine","Media","Method","3"
"건설안전산업기사","2013","1","산업안전관리론","12","다음 중 재해를 분석하는 방법에 있어 재해건수가 비교적 적은 사업장의 적용에 적합하고, 특수재해나 중대재해의 분석에 사용하는 방법은?","","개별분석","통계분석","사전분석","크로스(Cross)분석","1"
"건설안전산업기사","2013","1","산업안전관리론","13","사업장 무재해 운동 추진 및 운영에 있어 무재해 목표설정의 기준이 되는 무재해 시간은 무재해 운동을 개시하거나 재개시한 날부터 실근무자수와 실근로시간을 곱하여 산정하는데 다음 중 실근로시간의 산정이 곤란한 사무직 근로자 등의 경우에는 1일 몇 시간 근무한 것으로 보는가?","","6시간","8시간","9시간","10시간","2"
"건설안전산업기사","2013","1","산업안전관리론","14","다음 중 인간이 자기의 실패나 약점을 그럴듯한 이유를 들어 남의 비난을 받지 않도록 하며 또한 자위도 하는 방어기제를 무엇이라 하는가?","","보상","투사","합리화","전이","3"
"건설안전산업기사","2013","1","산업안전관리론","15","다음 중 학습지도의 원리에 해당하지 않는 것은?","","자기활동의 원리","사회화의 원리","직관의 원리","분리의 원리","4"
"건설안전산업기사","2013","1","산업안전관리론","16","다음 중 안전점검 체크리스트 작성시 유의해야 할 사항과 관계가 가장 적은 것은?","","사업장에 적합한 독자적인 내용으로 작성한다.","점검 항목은 전문적이면서 간략하게 작성한다.","관계의 의견을 통하여 정기적으로 검토 보안 작성한다.","위험성이 높고, 긴급을 요하는 순으로 작성한다.","2"
"건설안전산업기사","2013","1","산업안전관리론","17","의식수준 5단계 중 의식수준의 저하로 인한 피로와 단조로움의 생리적 상태가 일어나는 단계는?","","Phase I","Phase II","Phase lll","Phase IV","1"
"건설안전산업기사","2013","1","산업안전관리론","18","산업안전보건법령상 안전·보건표지 중 안내표지의 종류에 해당하지 않는 것은?","","들것","세안장치","비상용기구","허가대상물질 작업장","4"
"건설안전산업기사","2013","1","산업안전관리론","19","매슬로우(Maslow)의 욕구 단계 이론 중 인간에게 영향을 줄 수 있는 불안, 공포, 재해 등 각종 위험으로부터 해방 되고자 하는 욕구에 해당되는 것은?","","사회적 욕구","존경의 욕구","안전의 욕구","자아실현의 욕구","3"
"건설안전산업기사","2013","1","산업안전관리론","20","상시근로자수가 75명인 사업장에서 1일 8시간씩 연간 320일을 작업하는 동안에 4건의 재해가 발생하였다면 이 사업장의 도수율은 약 얼마인가?","","17.68","19.67","20.83","22.8","3"
"건설안전산업기사","2013","1","인간공학 및 시스템안전공학","21","다음 중 정보의 전달방법으로 시각적 표시장치보다 청각적 표시방법을 이용하는 것이 적절한 경우는?","","정보의 내용이 복잡하고 긴 경우","정보가 시간적인 사상을 다룰 때","즉각적인 행동을 요구하지 않는 경우","정보가 공간적인 위치를 다루는 경우","2"
"건설안전산업기사","2013","1","인간공학 및 시스템안전공학","22","각각 10000 시간의 수명을 가진 A, B 두 요소가 병렬로 이루고 있을 때 이 시스템이 수명은 얼마인가? (단, 요소 A. B의 수명은 지수분포를 따른다.)","","5000 시간","1000 시간","15000 시간","20000 시간","3"
"건설안전산업기사","2013","1","인간공학 및 시스템안전공학","23","다음 중 위험처리 방법에 관한 설명으로 적절하지 않은 것은?","","위험처리 대책 수립시 비용문제는 제외된다.","재정적으로 처리하는 방법에는 보유와 전가 방법이 있다.","위험의 제어 방법에는 회피, 손실제어, 위험분리, 책임전가 등이 있다.","위험처리 방법에는 위험을 제어하는 방법과 재정적으로 처리하는 방법이 있다.","1"
"건설안전산업기사","2013","1","인간공학 및 시스템안전공학","24","다음 중 조종-반응 비율(C/R비)에 따른 이동시간과 조정시간의 관계로 옳은 것은?","O","image_2013_1_24_1","image_2013_1_24_2","image_2013_1_24_3","image_2013_1_24_4","1"
"건설안전산업기사","2013","1","인간공학 및 시스템안전공학","25","일반적으로 인체에 가해지는 온·습도 및 기류 등의 외적변수를 종합적으로 평가하는 데에는 '불쾌지수'라는 지표가 이용된다. 식이 다음과 같은 경우 건구온도와 습구온도의 단위로 옳은 것은?\n$\\text{불쾌지수} = 0.72 \\times (\\text{건구온도} + \\text{습구온도}) + 40.6$","","실효온도","화씨온도","절대온도","섭씨온도","4"
"건설안전산업기사","2013","1","인간공학 및 시스템안전공학","26","40phon 이 1sone 일 때 60phon 은 몇 sone 인가?","","2 sone","4 sone","6 sone","100 sone","2"
"건설안전산업기사","2013","1","인간공학 및 시스템안전공학","27","빨강, 노랑, 파랑, 화살표 등 모두 4종류의 신호등이 있다. 신호등은 한 번에 하나의 등만 켜지도록 되어 있다. 1시간 동안 측정한 결과 4가지 신호등이 모두 15분씩 켜져 있었다. 이 신호등의 총 정보량은 얼마인가?","","1 bit","2 bit","3 bit","4 bit","2"
"건설안전산업기사","2013","1","인간공학 및 시스템안전공학","28","다음 중 FTA를 이용하여 사고원인의 분석 등 시스템의 위험을 분석할 경우 기대 효과와 관계없는 것은?","","사고원인 분석의 정량화 가능","사고원인 규명의 귀납적 해석가능","안전점검을 위한 체크리스트 작성 가능","복잡하고 대형화된 시스템의 신뢰성분석 및 안전성 분석가능","2"
"건설안전산업기사","2013","1","인간공학 및 시스템안전공학","29","다음 중 인체계측에 있어 구조적 인체치수에 관한 설명으로 옳은 것은?","","움직이는 신체의 자세로부터 측정한다.","실제의 작업 중 움직임을 계측, 자료를 취합하여 통계적으로 분석한다.","정해진 동작에 있어 자세, 관절 등의 관계를 3차원 디지타이저(digitizer), 모아레(Moire)법 등의 복합적인 장비를 활용하여 측정한다.","고정된 자세에서 마틴(Martin)식 인체측정기로 측정한다.","4"
"건설안전산업기사","2013","1","인간공학 및 시스템안전공학","30","다음 중 정신적 작업 부하에 대한 생리적 측정치에 해당하는 것은?","","에너지대사량","최대산소소비능력","근전도","부정맥 지수","4"
"건설안전산업기사","2013","1","인간공학 및 시스템안전공학","31","다음 중 Fussell의 알고리즘을 이용하여 최소컷셋을 구하는 방법에 대한 설명으로 적절하지 않은 것은?","","OR 게이트 항상 컷셋의 수를 증가시킨다.","AND 게이트는 항상 컷셋의 크기를 증가시킨다.","중복되는 사건이 많은 경우 매우 간편하고 적용하기 적합하다.","불대수(Boolean algebra) 이론을 적용하여 시스템 고장을 유발시키는 모든 기본사상들의 조합을 구한다.","3"
"건설안전산업기사","2013","1","인간공학 및 시스템안전공학","32","다음 중 부품배치의 원칙에 해당하지 않는 것은?","","사용순서의 원칙","사용빈도의 원칙","중요성의 원칙","신뢰성의 원칙","4"
"건설안전산업기사","2013","1","인간공학 및 시스템안전공학","33","인간-기계 시스템의 구성요소에서 다음 중 일반적으로 신뢰도가 가장 낮은 요소는? (단. 관련 요건은 동일하다는 가정이다.)","","수공구","작업자","조종장치","표시장치","2"
"건설안전산업기사","2013","1","인간공학 및 시스템안전공학","34","다음 중 정량적 표시장치의 눈금 수열로 가장 인식하기 쉬운 것은?","","1. 2. 3","2, 4, 5","3, 6, 9","4, 8, 12","1"
"건설안전산업기사","2013","1","인간공학 및 시스템안전공학","35","의사결정에 있어 결정자가 각 대안에 대해 어떤 결과가 발생할 것인가를 알고 있으나, 주어진 상태에 대한 확률을 모를 경우에 행하는 의사결정을 무엇이라 하는가?","","대립 상태 하에서 의사결정","위험함 상황 하에서 의사결정","확실한 상황 하에서 의사결정","불확실 상황 하에서 의사결정","4"
"건설안전산업기사","2013","1","인간공학 및 시스템안전공학","36","시스템 설계 과정의 주요 단계 중 계면설계에 있어 계면설계를 위한 인간 요소 자료로 볼 수 없는 것은?","","상식과 경험","전문가의 판단","실험절차","정량적 자료집","3"
"건설안전산업기사","2013","1","인간공학 및 시스템안전공학","37","다음 중 조도에 관한 설명으로 틀린 것은?","","조도는 거리에 비례하고, 광도에 반비례한다.","어떤 물체나 표면에 도달하는 광의 밀도를 말한다.","1[lux] 란 1촉광의 점광원으로부터 1m 떨어진 곡면에 비추는 광의 밀도를 말한다.","1[fc] 란 1촉광의 점광원으로부터 1 foot 떨어진 곡면에 비추는 광의 밀도를 말한다.","1"
"건설안전산업기사","2013","1","인간공학 및 시스템안전공학","38","다음 중 예비위험분석(PHA)에서 위험의 정도를 분류하는 4가지 범주에 속하지 않는 것은?","","catastrophic","critical","control","marginal","3"
"건설안전산업기사","2013","1","인간공학 및 시스템안전공학","39","다음 중 사고나 위험, 오류 등의 정보를 근로자의 직접 면접. 조사 등을 사용하여 수집하고, 인간-기계 시스템 요소들의 관계 규명 및 중대 작업 필요조건 확인을 통한 시스템 개선을 수행하는 기법은?","","직무 위급도 분석","인간 실수율 예측기법","위급사건기법","인간 실수 자료 은행","3"
"건설안전산업기사","2013","1","인간공학 및 시스템안전공학","40","FT도에 사용되는 다음의 기호가 의미하는 내용으로 옳은 것은?","","생략사상으로서 간소화","생략사상으로서 인간의 실수","생략사상으로서 조직자의 간과","생략사상으로서 시스템의 고장","2"
"건설안전산업기사","2013","1","건설시공학","41","철골 용접접합에 대한 용어설명 중 옳지 않은 것은?","","모살용접 - 목두께의 방향이 모재의 면과 45° 또는 거의 45°의 각을 이루는 용접","슬래그(slag): 용접부에 잔류하는 산화물 등의 비금속 물질이 용접금속 속에 녹아 있는 것","블로홀(blow hole): 비드(bead)의 가장자리에서 모재가 깊이 먹어들어간 모양으로 된 것","오버랩(overlap): 용접금속이 모재에 융착되지 않고 단순히 겹쳐있는 용접","3"
"건설안전산업기사","2013","1","건설시공학","42","콘크리트 비파괴검사 중에서 강도를 추정하는 측정 방법과 거리가 먼 것은?","","슈미트 해머법","초음파 속도법","인발법","방사선 투과법","4"
"건설안전산업기사","2013","1","건설시공학","43","공공 혹은 공익 프로젝트에 있어서 자금을 조달하고, 설계, 엔지니어링 및 시공 전부를 도급받아 시설물을 완성 하고 그 시설을 일정기간 운영하여 투자금을 회수한 후 발주자에게 시설을 인도하는 공사계약방식은?","","CM계약방식","공동도급방식","파트너링방식","BOT방식","4"
"건설안전산업기사","2013","1","건설시공학","44","다음 용접방식 중 용접기구에 의한 분류가 아닌 것은?","","아크 수동용접","일렉트로 슬래그 용접","가스 압접","필렛 용접","4"
"건설안전산업기사","2013","1","건설시공학","45","철근콘크리트 보강 블록공사에 대한 설명 중 옳지 않은 것은?","","보강근이 들어간 부분은 블록 2단마다 콘크리트나 모르타르를 충분히 충전시켜 철근이 녹스는 것을 방지한다.","블록 쌓기 시 되도록 고저차가 없도록 수평이 되게 쌓아 올린다.","벽의 세로근은 원칙적으로 이음을 만들지 않고 기초와 테두리보에 정착시킨다.","블록의 빈속을 철근과 콘크리트로 보강하여 장막벽을 구성하는 것이다.","4"
"건설안전산업기사","2013","1","건설시공학","46","기초콘크리트에 앵커볼트를 묻을 구멍을 내 두었다가 콘크리트가 경화한 뒤 볼트에 그라우트 모르타르로 충전하면서 고정하는 공법으로, 소규모 앵커볼트 매입에 적당한 것은?","","고정매입공법","가동매입공법","전면바름공법","전면그라우트공법","2"
"건설안전산업기사","2013","1","건설시공학","47","철골조 용접 공작에서 용접봉의 피복재 역할로 옳지 않은 것은?","","함유 원소를 이온화하여 아크를 안정시킨다.","용착 금속에 합금 원소를 가한다.","용착 금속의 산화를 촉진하여 고열을 발생시킨다.","용융 금속의 탈산, 정련을 한다.","3"
"건설안전산업기사","2013","1","건설시공학","48","콘크리트 강도에 가장 큰 영향을 미치는 배합요소는?","","모래와 자갈의 비율","물과 시멘트의 비율","시멘트와 모래의 비율","시멘트와 자갈의 비율","2"
"건설안전산업기사","2013","1","건설시공학","49","낭비를 최소화하는 가장 효율적인 건설생산 시스템을 의미하는 것은?","","인공지능(Artificial Intelligence)","린 건설(Lean Construction)","건설관리(Construction Management)","품질관리(Quality Control)","2"
"건설안전산업기사","2013","1","건설시공학","50","흙을 이김에 따라 약해지는 정도를 표시한 것은?","","간극비","함수비","포화도","예민비","4"
"건설안전산업기사","2013","1","건설시공학","51","이형철근가공 시 갈고리(hook)를 설치하지 않아도 되는 곳은?","","지중보의 돌출부분의 철근","스터럽","굴뚝의 철근","기둥 및 보의 돌출부분의 철근","1"
"건설안전산업기사","2013","1","건설시공학","52","시공과정상 불가피하게 콘크리트를 이어치기할 때 발생하는 시공불량 이음부를 무엇이라고 하는가?","","컨스트럭션 조인트(construction joint)","콜드 조인트(cold joint)","컨트롤 조인트(control joint)","익스팬션 조인트(expansion joint)","2"
"건설안전산업기사","2013","1","건설시공학","53","콘크리트의 거푸집 측압 증가 요인이 아닌 것은?","","타설 속도가 빠를수록 증가한다.","슬럼프가 클수록 증가한다.","다짐이 적을수록 증가한다.","경화속도가 늦을수록 증가한다.","3"
"건설안전산업기사","2013","1","건설시공학","54","건축공사 공정의 공기단축 기법으로 사용되는 것은?","","MCX(Minimum Cost Expedition)","TQC(Total Quality Control)","TBM(Tool Box Meeting)","CIC(Computer Integrated Construction)","1"
"건설안전산업기사","2013","1","건설시공학","55","표토를 제거하고 건물의 기둥 위치에 3~3.5m 지름의 우물을 파 기초를 축조하고, 그 기초 상부에 철골기둥을 세우고 1층 바닥부터 콘크리트를 친 후 지하를 향해 공사해 나가는 흙파기 공법은?","","심초 공법","뉴매틱 웰 케이슨 공법","개방잠함 공법","톱다운 공법","1"
"건설안전산업기사","2013","1","건설시공학","56","토공사의 굴착기계 용도에 관한 설명으로 옳지 않은 것은?","","백호는 기체보다 낮은 곳을 굴착하는데 사용한다.","파워쇼벨은 기체보다 높은 곳을 굴착하는데 사용한다.","드래그라인은 기체보다 낮은 곳의 흙을 긁어모으는데 사용한다.","클램쉘은 기체보다 높은 곳의 흙과 자갈을 긁어내는 데 사용한다.","4"
"건설안전산업기사","2013","1","건설시공학","57","흙막이 공법 선정 시 검토해야할 사항 중 가장 거리가 먼 것은?","","주변 구조물의 지하 매설물 상태","대지주변의 유동인구검토","지하수의 배수 및 치수공법 검토","공사기간과 경제성 검토","2"
"건설안전산업기사","2013","1","건설시공학","58","QC의 7대 도구 중 결함부나 기타 시공불량 등 항목을 구분하여 크기순으로 나열한 것으로, 결함항목을 집중적으로 감소시키는데 효과적으로 사용되는 것은?","","파레토도","히스토그램","산포도","관리도","1"
"건설안전산업기사","2013","1","건설시공학","59","보일링(boiling)이나 부풀어오름을 방지하기 위한 대책으로 옳지 않은 것은?","","흙막이벽의 타입깊이를 늘린다.","흙막이 외부의 지반면을 진동 가압한다.","웰포인트로 지하수위를 낮춘다.","약액주입 등으로 굴착지면을 지수한다.","2"
"건설안전산업기사","2013","1","건설시공학","60","주문받은 건설업자가 대상계획의 기업, 금융, 토지조달, 설계, 시공 기타 모든 요소를 포괄하는 도급계약방식은?","","실비청산 보수가산도급","정액도급","공동도급","턴키(turn-key)도급","4"
"건설안전산업기사","2013","1","건설재료학","61","각종 단열재에 대한 설명 중 옳지 않은 것은?","","암면은 암석으로부터 인공적으로 만들어진 내열성이 높은 광물섬유를 이용하여 만드는 제품으로 단열성, 흡음성이 뛰어나다.","세라믹 파이버의 원료는 실리카와 알루미나이며, 알루미나의 함유량을 늘이면 내열성이 상승한다.","경질 우레탄폼은 방수성, 내투습성이 뛰어나기 때문에 방습층을 겸한 단열재로 사용된다.","펄라이트 판은 천연의 목질섬유를 원료로 하며, 단열성이 우수하여 주로 건축물이 외벽 단열재 바름에 사용된다.","4"
"건설안전산업기사","2013","1","건설재료학","62","보통 포틀랜드시멘트의 성질에 관한 설명 중 옳지 않은 것은?","","시멘트의 분말도가 수화속도에 큰 영향을 준다.","시멘트의 분말도가 높으면 응결, 경화 속도가 빠르다.","온도와 습도가 높으면 응결시간이 느리며 경화가 지연된다.","혼합용수가 많으면 응결, 경화가 느리다.","3"
"건설안전산업기사","2013","1","건설재료학","63","P.S.콘크리트 부재 제작 시 프리스트레스(prestress)를 도입시키기 위해 개발된 시멘트는?","","제트 시멘트","알루미나 시멘트","인산 시멘트","팽창 시멘트","4"
"건설안전산업기사","2013","1","건설재료학","64","합성수지 중 PVC라 불리우며 사용온도는 $-10 \sim 60^{\circ}C$이며 판재, 타일, 파이프, 도료 등으로 사용되는 것은?","","염화비닐 수지","폴리에틸렌 수지","아크릴 수지","페놀 수지","1"
"건설안전산업기사","2013","1","건설재료학","65","다음 미장재료 중 수경성에 해당되지 않는 것은?","","보드용 석고 플라스터","돌로마이트 플라스터","인조석 바름","시멘트 모르타르","2"
"건설안전산업기사","2013","1","건설재료학","66","다음 철물 중 창호용이 아닌 것은?","","안장쇠","크레센트","도어체인","플로어힌지","1"
"건설안전산업기사","2013","1","건설재료학","67","목재의 성질에 대한 설명 중 옳지 않은 것은?","","수분을 흡수하면 변형이 커진다.","열전도율이 큰 재료이다.","인화성이 강하다.","부패하기 쉽다.","2"
"건설안전산업기사","2013","1","건설재료학","68","콘크리트구조물의 크리프(Creep) 현상에 대한 설명 중 옳지 않은 것은?","","작용응력이 클수록 크리프는 크다.","물시멘트비가 클수록 크리프는 크다.","외부습도가 높을수록 크리프는 적다.","구조부재의 치수가 클수록 크리프는 크다.","4"
"건설안전산업기사","2013","1","건설재료학","69","목재 섬유포화점의 범위는 대략 얼마인가?","","약 5~10%","약 15~20%","약 25~30%","약 35~40%","3"
"건설안전산업기사","2013","1","건설재료학","70","굳지 않은 콘크리트의 성질에 관한 기술 중 옳은 것은?","","워커빌리티는 정량적인 수치로 표현하는 것이 용이하다.","컨시스턴시는 콘크리트의 유동속도와 무관하다.","플라스티시티는 굵은 골재의 최대치수, 잔골재율, 잔골재입도 등에 의한 마감성의 난이를 표시하는 성질이다.","같은 슬럼프를 나타내는 컨시스턴시의 것이라도 워커빌리티가 동일하다고는 할 수 없다.","4"
"건설안전산업기사","2013","1","건설재료학","71","다음 재료 중 무기재료에 속하는 재료는?","","알루미늄","목재","플라스틱","섬유판","1"
