"Test Name","Year","Session","Subject","Number","Question","Question_image","Option 1","Option 2","Option 3","Option 4","Answer"
"건설안전기사","2012","4","산업안전관리론","1","다음 중 산업안전보건법령상 안전인증심사에 관한 설명으로 옳은 것은?","","서면심사 : 기계·기구 및 방호장치 보호구가 안전인증 대상 기계·기구 등 인지를 확인하는 심사","개별 제품심사: 서면심사와 기술능력 및 생상체계 심사 결과가 안전인증기준에 적합할 경우에 안전인증대상 기계·기구 등의 형식별로 표본을 추출하여 하는 심사","예비심사: 안전인증대상 기계·기구 등의 종류별 또는 형식별로 설계도면 등 안전인증대상 기계·기구 등의 제품기술과 관련된 문서가 관련법에 따른 안전인증기준에 적합한지에 대한 심사","기술능력 및 생상체계 심사: 안전인증대상 기계·기구 등의 안전성능을 지속적으로 유지·보증하기 위하여 사업장에서 갖추어야 할 기술능력과 생산 체계가 안전인증기준에 적합한지에 대한 심사","4"
"건설안전기사","2012","4","산업안전관리론","2","다음 중 안전과 경영에서 나오는 용어인 리스크(risk)에 대하여 가장 옳게 설명한 것은?","","리스크는 위급을 나타내는 용어로서 잠재적인 위험의 표출을 의미한다.","리스크는 위험 발생의 급박한 상태가 어떤 조건이 갖춰졌을 때를 의미한다.","리스크는 위험상황이 재해 상황으로 변하는 과정상의 위험분석을 의미한다.","리스크는 재해 발생가능성과 재해 발생시 그 결과의 크기의 조합(combination)으로 위험의 크기나 정도를 의미한다.","4"
"건설안전기사","2012","4","산업안전관리론","3","듀퐁사에서 실시하여 실효를 거둔 기법으로 각 계층의 관리 감독자들이 숙련된 안전 관찰을 행할 수 있도록 훈련을 실시함으로써 사고의 발생을 미연에 방지하여 안전을 확보하는 안전관찰훈련기법은?","","THP 기법","STOP 기법","TBM 기법","TD-BU 기법","2"
"건설안전기사","2012","4","산업안전관리론","4","다음 중 재해의 손실비용 산정에 있어 간접손실비에 해당하는 것은?","","장의비","직업재활급여","상병(像病)보상연금","신규인력 채용부담금","4"
"건설안전기사","2012","4","산업안전관리론","5","다음 중 안전점검시 고려하여야 할 사항으로 적절하지 않은 것은?","","점검자 능력을 감안하여 구체적인 계획 수립 후 점검을 실시한다.","과거의 재해 발생장소는 대책이 수립되어 그 원인이 해소되었음으로 대상에서 제외한다.","점검사항, 점검방법 등에 대한 지속적인 교육을 통하여 정확한 점검이 이루어지도록 한다.","점검시 특이한 사항 등을 기록, 보존하여 향후 점검 및 이상 발생시 대비할 수 있도록 한다.","2"
"건설안전기사","2012","4","산업안전관리론","6","다음 중 산업안전보건법령상 안전·보건표시에 있어 금지표지의 색채기준으로 옳은 것은?","","바탕은 검정색, 기본모형은 빨간색, 관련부호 및 그림은 흰색","바탕은 흰색, 기본모형은 빨간색, 관련부호 및 그림은 검정색","바탕은 노란색, 기본모형은 검정색, 관련부호 및 그림은 빨간색","바탕은 흰색, 기본모형은 노란색, 관련부호 및 그림은 검정색","2"
"건설안전기사","2012","4","산업안전관리론","7","다음 중 산업안전보건위원회의 심의 또는 의결사항이 아닌 것은?","","산업재해 예방계획의 수립에 관한 사항","근로자의 건강진단 등 건강관리에 관한 사항","안전장치 및 보호구 구입시의 적격품 여부 확인에 관한 사항","중대재해의 원인조사 및 재발방지대책의 수립에 관한 사항","3"
"건설안전기사","2012","4","산업안전관리론","8","다음 중 재해발생의 주요 원인에 있어 불안전한 행동에 해당하지 않는 것은?","","불안전한 속도 조작","안전장치 기능 제거","보호구 미착용 후 작업","결함 있는 기계설비 및 장비","4"
"건설안전기사","2012","4","산업안전관리론","9","다음 중 산업안전보건법령상 지방고용노동관서의 장이 사업주에게 안전관리자나 보건관리자를 점수 이상으로 증원하게 하거나 교체하여 임명할 것을 명할 수 있는 경우가 아닌 것은?","","중대재해가 연간 4건 발생한 경우","해당 사업장의 연간재해율이 같은 업종의 평균재해율의 2.5배인 경우","관리자가 질병이나 그 밖의 사유로 4개월 동안 직무를 수행할 없게 된 경우","발암성물질을 취급하는 작업장 중 측정치가 노출 기준을 상회하여 작업환경측정을 연속 3회 명령받은 경우","4"
"건설안전기사","2012","4","산업안전관리론","10","다음 중 안전관리조직의 특성에 관한 설명으로 옳은 것은?","","라인형 조직은 중, 대규모 사업장에 적합하다.","스탭형 조직은 권한 다툼의 해소나 조정이 용이하여 시간과 노력이 감소된다.","라인형 조직은 안전에 대한 정보가 불충분하지만 안전지시나 조치에 대한 실시가 신속하다.","라인 스탭형 조직은 대규모 사업장에 적합하나 조직원 전원의 자율적 참여가 어려운 단점이 있다.","3"
"건설안전기사","2012","4","산업안전관리론","11","다음 중 무재해운동 추진에 있어 특정 목표배수를 달성하여 그 다음 배수 달성을 위한 새로운 목표를 재설정하는 경우의 무재해 목표 설정기준으로 적절하지 않은 것은?","","업종은 무재해 목표를 달성한 시점에서의 업종을 적용한다.","건설업의 규모는 재개시 시서점에 해당하는 총공사 금액의 4분의 3을 적용한다.","무재해 목표를 달성한 시점 이후부터 즉시 다음 배수를 기산하여 업종과 규모에 따라 새로운 무재해 목표시간을 재설정한다.","창업하거나 통합·분리한지 12개월 미만인 사업장은 창업일이나 통합·분리일부터 산정일까지의 매월 말일의 상시 근로자수를 합하여 해당 월수로 나눈값을 적용한다.","2"
"건설안전기사","2012","4","산업안전관리론","12","다음 중 산업재해 발생시 조치 순서에 있어 긴급처리의 내용으로 볼 수 없는 것은?","","관련 기계의 정지","장해위험요인 적출","현장 보존","재해자의 응급조치","2"
"건설안전기사","2012","4","산업안전관리론","13","다음 중 산업안전보건법상 사업주의 책무에 해당하는 것은?","","산업재해에 관한 조사 및 통계의 유지·관리","재해 다발 사업장에 대한 재해 예방 지원 및 지도","안전·보건을 위한 기술의 연구·개발 및 시설의 설치·운영","산업재해 예방을 위한 기준 준수 및 해당 사업장의 안전·보건에 관한 정보 제공","4"
"건설안전기사","2012","4","산업안전관리론","14","재해의 분석에 있어 사고유형, 기인물, 불안전한 상태, 불안전한 행동을 하나의 축으로 하고, 그것을 구성하고 있는 몇 개의 분류 항목을 크기가 큰 순서대로 나열하여 비교하기 쉽게 도시한 통계 양식의 도표는?","","특성요인도","크로스도","파레토도","직선도","3"
"건설안전기사","2012","4","산업안전관리론","15","다음 중 버드(Frank Bird)의 새로운 도미노 이론으로 올바르게 나열된 것은?","","제어의 부족→기본 원인→직접 원인→사고→상해","관리구조→작전적 에러→전술적 에러→사고→상해","유전과 환경→인간의 결함→불안전한 행동 및 상태→재해→상해","유전적 요인 및 사회적 환경→개인적 결함→불안전한 행동 및 상태→사고→상해","1"
"건설안전기사","2012","4","산업안전관리론","16","강도율이 1.98인 사업장에서 한 근로자가 평생 근무한다면 이 근로자는 재해로 인해 며칠의 근로손실 일수가 발생하겠는가? (단, 근로자의 평생근무시간은 100000시간이라 한다.)","","198일","216일","254일","300일","1"
"건설안전기사","2012","4","산업안전관리론","17","다음 중 건설기술관리법에 따라 안전관리계획을 수립하여야 하는 건설공사에 해당하지 않는 것은?","","원자력시설공사","지하 10m 이상을 굴착하는 건설공사","10층 이상인 건축물의 리모델링 또는 해체공사","시설물의 안전관리에 관한 특별법에 따른 1종시설물의 건설공사","1"
"건설안전기사","2012","4","산업안전관리론","18","다음 중 재해예방의 4원칙에 해당되지 않는 것은?","","손실 우연의 원칙","예방 가능의 원칙","사고 연쇄의 원칙","원인 계기의 원칙","3"
"건설안전기사","2012","4","산업안전관리론","19","다음 중 내전압용절연장갑의 성능기준에 있어 절연 장갑의 등급과 최대사용전압이 올바르게 연결된 것은? (단, 전압은 교류로 실효값을 의미한다.)","","00등급: 500V","0등급: 2500V","1등급: 10000V","2등급: 20000V","1"
"건설안전기사","2012","4","산업안전관리론","20","산업안전보건법에 따라 사업장의 안전·보건을 유지하기 위하여 작성하는 안전보건관리규정에 포함될 사항과 가장 거리가 먼 것은?","","안전·보건교육에 관한 사항","사고 조사 및 대채 수립에 관한 사항","산업재해손실비용 분석방법에 관한 사항","안전·보건 관리조직과 그 직무에 관한 사항","3"
"건설안전기사","2012","4","산업심리 및 교육","21","다음 중 토의식 교육지도에서 시간이 가장 많이 소요되는 단계는?","","도입","제시","적용","확인","3"
"건설안전기사","2012","4","산업심리 및 교육","22","다음 중 상황성 누발자의 재해유발 원인과 가장 거리가 먼 것은?","","기능 미숙 때문에","작업이 어렵기 때문에","기계 설비에 결함이 있기 때문에","환경상 주의력의 집중이 혼란되기 때문에","1"
"건설안전기사","2012","4","산업심리 및 교육","23","스트레스(stress)에 영향을 주는 요인 가운데 환경이나, 외부를 통해서 일어나는 자극 요인에 해당되는 것은?","","자존심의 손상","현실에의 부적응","도전의 좌절과 자만심의 상충","직장에서의 대인관계 갈등과 대립","4"
"건설안전기사","2012","4","산업심리 및 교육","24","다음 중 인간이 충족시키고자 추구하는 욕구에 있어 가장 강력한 욕구는?","","안전의 욕구","생리적 욕구","자아실현의 욕구","애정 및 귀속의 욕구","2"
"건설안전기사","2012","4","산업심리 및 교육","25","자아실현의 기회 부여로 근무의욕 고취와 재해사고의 예방에 기여하는 효과를 높이기 위해 적성배치가 필요하다. 다음중 이러한 적성배치시 기본적으로 고려할 사항으로 틀린 것은?","","객관적인 감정요소 배제","인사관리의 기준에 원칙을 준수","직무평가를 통하여 자격수준 결정","적성검사를 실시하여 개인의 능력파악","1"
"건설안전기사","2012","4","산업심리 및 교육","26","다음 중 O.J.T(On the Job Training)와 관계가 가장 먼것은?","","효과가 곧 업무에 나타난다.","직장의 실정에 맞는 실체적 훈련이다.","다수의 근로자에게 조직적 훈련이 가능하다.","교육을 통한 훈련 효과에 의해 상호 신뢰 이해도가 높아진다.","3"
"건설안전기사","2012","4","산업심리 및 교육","27","다음 중 의식수준이 정상적 상태이지만 생리적 상태가 안전을 취하거나 휴식할 대에 해당하는 것은?","","phase I","phase II","phase III","phase IV","2"
"건설안전기사","2012","4","산업심리 및 교육","28","다음 중 피로의 증상과 가장 거리가 먼 것은?","","식욕의 증대","흥미의 상실","불쾌감의 증가","작업능률의 감퇴","1"
"건설안전기사","2012","4","산업심리 및 교육","29","다음 중 운동의 시지각이 아닌 것은?","","자동 운동(自動運動)","항상 운동(恒常運動)","유도 운동(誘導 運動)","가현 운동(價現運動)","2"
"건설안전기사","2012","4","산업심리 및 교육","30","다음 중 안전교육의 목표로 가장 적절한 것은?","","작업동작의 숙련화","인간의 동작특성 학습","설비에 대한 지식 획득","작업에 의한 안전행동의 습관화","4"
"건설안전기사","2012","4","산업심리 및 교육","31","교육심리학의 연구방법 중 의식적으로 의견을 발표하도록 하여 인간의 내면에서 일어나고 있는 심리적 상태를 사물과 연관시켜 인간의 성격을 알아보는 방법을 무엇이라 하는가?","","면접법","집단토의법","투사법","질문지법","3"
"건설안전기사","2012","4","산업심리 및 교육","32","다음 중 시청각적 교육방법의 특징과 가장 거리가 먼 것은?","","교재의 구조화를 기할 수 있다.","대규모 수업체제의 구성이 어렵다.","학습의 다양성과 능률화를 기할 수 있다.","학습자에게 공통경험을 형성시켜 줄 수 있다.","2"
"건설안전기사","2012","4","산업심리 및 교육","33","리더십의 권한 역할 중 부하를 처벌할 수 있는 권한'은 어떠한 권한에 해당하는가?","","위임된 권한","합법적 권한","강압적 권한","보상적 권한","3"
"건설안전기사","2012","4","산업심리 및 교육","34","다음 중 산업안전보건법령상 사업내 안전·보건교육 중 건설업 일용근로자에 대한 건설업 기초안전·보건 교육의 교육시간으로 옳은 것은?","","1시간","2시간","3시간","4시간","4"
"건설안전기사","2012","4","산업심리 및 교육","35","다음 설명에 해당하는 주의의 특성은?\n\n공간적으로 보면 시선의 주시점만 인지하는 기능으로한 지점에 주의를 집중하면 다른 곳의 주의는 약해진다.","","선택성","방향성","변동성","일점집중","2"
"건설안전기사","2012","4","산업심리 및 교육","36","다음 중 소시오메트리(sociometry)에 대하여 가장 옳게 설명한 것은?","","구성원 상호간의 선호도를 기초로 집단 내부의 동태적 상호관계를 분석하는 기법이다.","구성원들이 서로에 매력적으로 끌리어 목표를 효율적으로 달성하는 정도를 도식화하는 것이다.","리더십을 인간 중심과 과업 중심으로 나누어 이를 계량화하고, 리더의 행동경향을 표현, 분류하는 기법이다.","리더의 유형을 분류하는데 있어 리더들이 자기가 싫어하는 동료에 대한 평가를 점수로 환산하여 비교, 분석하는 기법이다.","1"
"건설안전기사","2012","4","산업심리 및 교육","37","직무에 적합한 근로자를 위한 심리검사는 합리적 타당성을 갖추어야 한다. 다음 중 이러한 합리적 타당성을 얻는 방법으로만 나열된 것은?","","구인 타당도, 내용 타당도","예언적 타당도, 공인 타당도","구인 타당도, 공인 타당도","예언적 타당도, 안면 타당도","1"
"건설안전기사","2012","4","산업심리 및 교육","38","다음 중 Tiffin의 동기유발요인에 있어 공식적 자극에 해당되지 않는 것은?","","특권박탈","승진","작업계획의 선택","칭찬","4"
"건설안전기사","2012","4","산업심리 및 교육","39","다음 중 안전교육 계획수립 및 추진에 있어 진행순서를 가장 올바르게 나열한 것은?","","교육 대상 결정 → 교육의 필요점 발견 → 교육 준비→ 교육 실시 → 교육의 성과를 평가","교육의 필요점 발견 → 교육 대상 결정 → 교육 준비 → 교육 실시 → 교육의 성과를 평가","교육 대상 결정 → 교육 준비 → 교육의 필요점 발견 → 교육 실시 → 교육의 성과를 평가","교육의 필요점 발견 → 교육 실시 → 교육 대상 결정 → 교육 준비 → 교육의 성과를 평가","4"
"건설안전기사","2012","4","산업심리 및 교육","40","다음 중 산업안전보건법령상 사업내 안전·보건교육에 있어 특별안전·보건교육 대상 작업에 해당하지 않는 것은?","","굴착면의 높이가 5m 되는 암석의 굴착작업","흙막이 지보공의 보강 또는 동바리를 설치하거나 해체하는 작업","휴대용 목재가공기계를 3대 보유한 사업장에서 해당 기계로 하는 작업","5m인 구축물을 대상으로 콘크리트 파쇄기를 사용하여 하는 파쇄작업","3"
"건설안전기사","2012","4","인간공학 및 시스템안전공학","41","다음 [보기]의 각 단계를 결함수분석법(FTA)에 의한 재해사례의 연구 순서대로 올바르게 나열한 것은?\n① 정상사상의 선정\n② FT도 작성 및 분석\n③ 개선 계획의 작성\n④ 각 사상의 재해원인 규명","","①→②→③→④","①→④→③→②","①→③→②→④","①→④→②→③","4"
"건설안전기사","2012","4","인간공학 및 시스템안전공학","42","인간이 청각으로 느끼는 소리의 크기를 측정하는 두 가지 척도는 sone과 phon 이다. 50phon은 몇 sone에 해당하는가?","","0.5","1","2","2.5","3"
"건설안전기사","2012","4","인간공학 및 시스템안전공학","43","작업만족도(job satisfaction)는 작업설계(job design)를 함에 있어 철학적으로 고려해야 할 사항이다. 다음 중 작업만족도를 얻기 위한 수단으로 볼 수 없는 것은?","","작업확대(job enlargement)","작업윤택화(job enrichment)","작업감소(job reduce)","작업순환(job rotation)","3"
"건설안전기사","2012","4","인간공학 및 시스템안전공학","44","다음 중 보전에 관한 설명으로 옳은 것은?","","피로고장은 작업자의 조작실수제거로 예방할 수 없다.","초기고장은 Burn-In 기간을 통해서도 예방이 불가능하다.","설계한계를 변경하더라도 우발고장은 예방할 수 없다.","고장율이 일정한 패턴을 유지하면 예방보전이 효과적이다.","1"
"건설안전기사","2012","4","인간공학 및 시스템안전공학","45","다음 중 위험분석기법에 관한 설명으로 틀린 것은?","","결함수분석(FTA)은 잠재위험을 체계적으로 파악하고 분석하며, 연역적 사고방식을 사용한다.","결함위험분석(FHA)은 기능적 위험을 분석하고 파악하며, 연역적 방식을 사용한다.","예비위험분석(PHA)은 초기 위험분석을 위해 사용되며, 설계상의 안전에 대해 결론을 내릴 때 예비 서식으로 사용한다.","운용위험분석(OHA)은 시스템이 저장, 이동, 실행됨에 따라 발생하는 작동시스템의 기능이나 과업, 활동으로부터 발생되는 위험분석에 사용한다.","2"
"건설안전기사","2012","4","인간공학 및 시스템안전공학","46","다음 FT도에서 최소 컷셋을 올바르게 구한 것은?","O","{X1, X2}","{X1, X2, X3}","{X1, X3}","{X2, X3}","1"
"건설안전기사","2012","4","인간공학 및 시스템안전공학","47","부품 배치의 원칙 중 부품의 일반적 위치 내에서의 구체적인 배치를 결정하기 위한 기준이 되는 것은?","","중요성의 원칙과 사용빈도의 원칙","사용빈도의 원칙과 사용 순서의 원칙","사용빈도의 원칙과 기능별 배치의 원칙","기능별 배치의 원칙과 사용 순서의 원칙","4"
"건설안전기사","2012","4","인간공학 및 시스템안전공학","48","청각적 표시장치와 시각적 표지장치 중 시각적 표시장치를 사용하는 것이 더 유리한 경우는?","","정보가 간단할 때","직무상 수신자가 자주 움직일 때","정보가 일정시간 경과 후 재창조될 때","정보전달이 즉각적인 행동을 요구할 때","3"
"건설안전기사","2012","4","인간공학 및 시스템안전공학","49","다음 중 영상표시단말기(VDT) 취급 근로자를 위한 조명과 채광에 대한 설명으로 옳은 것은?","","화면을 바라보는 시간이 많은 작업일수록 화면 밝기와 작업대 주변 밝기의 차를 줄이도록 한다.","작업장 주변 환경의 조도를 환면의 바탕 색상이 흰색계통일 때에는 300Lux 이하로 유지하도록 한다.","작업장 주변 환경의 조도를 화면의 바탕 색상이 검정색 계통일 때에는 500Lux 이상을 유지하도록 한다.","작업실 내의 창 벽면 등은 반사되는 재질로 하여야 하며, 조명은 화면과 명암의 대조가 심하지 않도록 하여야 한다.","1"
"건설안전기사","2012","4","인간공학 및 시스템안전공학","50","다음 중 작업관련 근골격계 질환 관련 유해요인조사에 대한 설명으로 옳은 것은?","","근로자 5인 미만의 사업장은 근골격계부담작업 유해요인 조사를 실시하지 않아도 된다.","유해요인조사는 근골격계 질환자가 발생할 경우에 3년마다 정기적으로 실시해야 한다.","유해요인 조사는 사업장내 근골격계부담작업 중 50%를 샘플링으로 선정하여 조사한다.","근골격계부담작업 유해요인조사에는 유해요인기본 조사와 근골격계질환증상조사가 포함된다.","4"
"건설안전기사","2012","4","인간공학 및 시스템안전공학","51","FT도에 사용되는다음 [기호]의 명칭으로 옳은 것은?","O","억제게이트","조합AND게이트","부정게이트","배타적OR게이트","2"
"건설안전기사","2012","4","인간공학 및 시스템안전공학","52","다음 중 산업안전보건법령상 유해위험방지계획서의 제출처로 옳은 것은?","","지방고용노동관서","대한산업안전협회","안전관리대행기관","한국산업안전보건공단","4"
"건설안전기사","2012","4","인간공학 및 시스템안전공학","53","근로자가 작업 중에 소모하는 에너지의 량을 측정하는 방법 중 가장 먼저 측정하는 것은?","","작업 중에 소비한 칼로리로 측정한다.","작업 중에 소비한 산소소모량으로 측정한다.","작업 중에 소비한 에너지대사율로 측정한다.","기초에너지를 작업시간으로 곱하여 측정한다.","2"
"건설안전기사","2012","4","인간공학 및 시스템안전공학","54","다음 중 구조적 인체치수의 측정에 대한 설명으로 가장 적절한 것은?","","신장계와 줄자를 이용하여 인체측정을 하는 것이다.","전체 치수는 각 부위별 측정치수를 합하여 산정한다.","표준자세에서 움직이는 피측정자를 인체측정기를 측정한 것이다.","표준자세에서 움직이지 않는 피측정자를 인체측정기로 측정한 것이다.","4"
"건설안전기사","2012","4","인간공학 및 시스템안전공학","55","다음 중 인간-기계 통합체계의 인간 또는 기계에 의하여 수행되는 기본 기능이 아닌 것은?","","사용 분석기능","정보 보관기능","의사 결정기능","입력 및 출력기능","1"
"건설안전기사","2012","4","인간공학 및 시스템안전공학","56","각각 $1.2 \times 10^4$ 시간의 수명을 가진 요소 4개가 병렬계를 이룰 때 이 계의 수명은 얼마인가?","","$3.0 \times 10^3$ 시간","$1.2 \times 10^4$ 시간","$2.5 \times 10^4$ 시간","$4.8 \times 10^4$ 시간","3"
"건설안전기사","2012","4","인간공학 및 시스템안전공학","57","염산을 취급하는 A 업체에서는 신설 설비에 관한 안전성 평가를 실시해야 한다. 다음 중 정성적 평가 단계에 있어 설계와 관련된 주요 진단 항목에 해당하는 것은?","","공장 내의 배치","제조공정의 개요","재평가 방법 및 계획","안전·보건교육 훈련계획","1"
"건설안전기사","2012","4","인간공학 및 시스템안전공학","58","다음 중 1m 또는 그보다 먼 물체에만 잘 볼 수 있는 원시안경은 몇 D인가? (단, 명시거리는 25cm로 한다.)","","1D","2D","3D","4D","3"
"건설안전기사","2012","4","인간공학 및 시스템안전공학","59","다음 중 시스템 수명주기 단계에 있어서 예비설계와 생산기술을 확인하는 단계는?","","구상단계","정의단계","개발단계","생산단계","2"
"건설안전기사","2012","4","인간공학 및 시스템안전공학","60","다음 중 사고 인과관계 이론에 있어 특정상황에서는 사람들이 다소간에 사고를 일으키는 경향이 있고 이 성향은 영구적인 것이 아니라 시간에 따라 달라진다는 이론은?","","Accident-time theory","Accident-liability theory","Accident-proneness theory","Accident knowledge theory","2"
"건설안전기사","2012","4","건설시공학","61","다음 중 철근의 정착 위치로 옳지 않은 것은?","","기둥의 주근은 기초에 정착한다.","작은 보의 주근은 기둥에 정착한다.","지중보의 주근은 기초에 정착한다.","벽체의 주근은 기둥 또는 큰보에 정착한다.","2"
"건설안전기사","2012","4","건설시공학","62","두께 110mm의 일반구조용 압연강재 SS400의 항복강도(f) 기준값은?","","205 MPa 이상","215 MPa 이상","235 MPa 이상","245 MPa 이상","1"
