"Test Name","Year","Session","Subject","Number","Question","Question_image","Option 1","Option 2","Option 3","Option 4","Answer"
"건설안전산업기사","2019","1","건설재료학","80","화성암의 일종으로 내구성 및 강도가 크고 외관이 수려하며, 절리의 거리가 비교적 커서 대재를 얻을 수 있으나. 함유광물의 열팽창계수가 달라 내화성이 약한 석재는?","","안산암","사암","화강암","응회암","3"
"건설안전산업기사","2019","1","건설안전기술","81","산업안전보건관리비 중 안전시설비 등의 항목에서 사용가능한 내역은?","","외부인 출입금지, 공사장 경계표시를 위한 가설울타리","비계·통로·계단에 추가 설치하는 추락방지용 안전난간","절토부 및 성토부 등의 토사유실 방지를 위한 설비","공사 목적물의 품질 확보 또는 건설장비 자체의 운행 감시, 공사 진척상황 확인, 방범 등의 목적을 가진 CCTV 등 감시용 장비","2"
"건설안전산업기사","2019","1","건설안전기술","82","콘크리트 타설용 거푸집에 작용하는 외력 중 연직방향 하중이 아닌 것은?","","고정하중","충격하중","작업하중","풍하중","4"
"건설안전산업기사","2019","1","건설안전기술","83","유해위험방지계획서를 제출해야 하는 공사의 기준으로 옮지 않은 것은?","","최대 지간길이 30m 이상인 교량 건설 등 공사","깊이 10m 이상인 굴착공사","터널 건설 등의 공사","다목적댐, 발전용댐 및 저수용량 2천만톤 이상의 용수전용 댐, 지방상수도 전용 댐 건설 등의 공사","1"
"건설안전산업기사","2019","1","건설안전기술","84","철골공사에서 용접작업을 실시함에 있어 전격예방을 위한 안전조치 중 옳지 않은 것은?","","전격방지를 위해 자동전격방지기를 설치한다.","우천, 강설시에는 야외작업을 중단한다.","개로 전압이 낮은 교류 용접기는 사용하지 않는다.","절연 홀더(Holder)를 사용한다.","3"
"건설안전산업기사","2019","1","건설안전기술","85","흙막이 가시설의 버팀대(Strut)의 변형을 측정하는 계측기에 해당하는 것은?","","Water level meter","Strain gauge","Piezometer","Load cell","2"
"건설안전산업기사","2019","1","건설안전기술","86","흙막이지보공을 설치하였을 때 정기적으로 점검하고 이상을 발견하면 즉시 보수하여야 하는 사항으로 거리가 먼 것은?","","부재의 손상 변형, 부식, 변위 및 탈락의 유무와 상태","부재의 접속부, 부착부 및 교차부의 상태","침하의 정도","발판의 지지 상태","4"
"건설안전산업기사","2019","1","건설안전기술","87","유한사면에서 사면기울기가 비교적 완만한 점성토에서 주로 발생되는 사면파괴의 형태는?","","저부파괴","사면선단파괴","사면내파괴","국부전단파괴","1"
"건설안전산업기사","2019","1","건설안전기술","88","말비계를 조립하여 사용하는 경우의 준수사항으로 옳지 않은 것은?","","지주부재의 하단에는 미끄럼 방지장치를 할 것","지주부재와 수평면과의 기울기는 85° 이하로 할 것","말비계의 높이가 2m를 초과할 경우에는 작업발판의 폭을 40cm 이상으로 할 것","지주부재와 지주부재 사이를 고정시키는 보조부재를 설치할 것","2"
"건설안전산업기사","2019","1","건설안전기술","89","사다리식 통로 등을 설치하는 경우 준수해야 할 기준으로 옳지 않은 것은?","","접이식 사다리 기둥은 사용 시 접혀지거나 펼쳐지지 않도록 철물 등을 사용하여 견고하게 조치할 것","발판과 벽과의 사이는 25cm 이상의 간격을 유지할 것","폭은 30cm 이상으로 할 것","사다리식 통로의 길이가 10m 이상인 경우에는 5m 이내마다 계단참을 설치할 것","2"
"건설안전산업기사","2019","1","건설안전기술","90","지반조사의 방법 중 지반을 강관으로 천공하고 토사를 채취 후 여러 가지 시험을 시행하여 지반의 토질 분포, 흙의 층상과 구성 등을 알 수 있는 것은?","","보링","표준관입시험","베인테스트","평판재하시험","1"
"건설안전산업기사","2019","1","건설안전기술","91","추락방지망의 달기로프르 지지점에 부착할 때 지지점의 간격이 1.5m인 경우 지지덤의 강도는 최소 얼마 이상이어야 하는가?","","200kg","300kg","400kg","500kg","2"
"건설안전산업기사","2019","1","건설안전기술","92","철골작업을 중지하여야 하는 제한 기준에 해당되지 않는 것은?","","풍속이 초당 10m 이상인 경우","강우량이 시간당 1mm 이상인 경우","강설량이 시간당 1cm 이상인 경우","소음이 65dB 이상인 경우","4"
"건설안전산업기사","2019","1","건설안전기술","93","화물을 적재하는 경우에 준수하여야 하는 사항으로 옳지 않은 것은?","","침하 우려가 없는 튼튼한 기반 위에 적재할 것","건물의 칸막이나 벽 등이 화물의 압력에 견딜 만큼의 강도를 지니지 아니한 경우에는 칸막이나 벽에 기대어 적재하지 않도록 할 것","불안정할 정도로 높이 쌓아 올리지 말 것","편하중이 발생하도록 쌓아 적재 효율을 높일 것","4"
"건설안전산업기사","2019","1","건설안전기술","94","강관틀비계의 높이가 20m를 초과하는 경우 주틀간의 간격은 최대 얼마 이하로 사용해야 하는가?","","1.0m","1.5m","1.8m","2.0m","3"
"건설안전산업기사","2019","1","건설안전기술","95","타워크레인의 운전작업을 중지하여야 하는 순간풍속기준으로 옳은 것은?","","초당 10m 초과","초당 12m 초과","초당 15m 초과","초당 20m 초과","3"
"건설안전산업기사","2019","1","건설안전기술","96","추락방지용 방망을 구성하는 그물코의 모양과 크기로 옳은 것은?","","원형 또는 사각으로서 그 크기는 10cm 이하이어야 한다.","원형 또는 사각으로서 그 크기는 20cm이하이어야 한다.","사각 또는 마름모로서 그 크기는 10cm이하이어야 한다.","사각 또는 마름모로서 그 크기는 20cm 이하이어야 한다.","3"
"건설안전산업기사","2019","1","건설안전기술","97","핸드 브레이커 취급 시 안전에 관한 유의사항으로 옳지 않은 것은?","","기본적으로 현장 정리가 잘되어 있어야 한다.","작업 자세는 항상 하향 45° 방향으로 유지하여야 한다.","작업 전 기계에 대한 점검을 철저히 한다.","호스의 교차 및 꼬임여부를 점검하여야 한다.","2"
"건설안전산업기사","2019","1","건설안전기술","98","중량물의 취급작업 시 근로자의 위험을 방지하기 위하여 사전에 작성하여야 하는 작업계획서 내용에 해당되지 않는 것은?","","추락위험을 예방할 수 있는 안전대책","낙하위험을 예방할 수 있는 안전대책","전도위험을 예방할 수 있는 안전대책","침수위험을 예방할 수 있는 안전대책","4"
"건설안전산업기사","2019","1","건설안전기술","99","가설통로를 설치하는 경우 준수해야 할 기준으로 옳지 않은 것은?","","경사는 45°이하로 할 것","경사가 15°를 초과하는 경우에는 미끄러지지 아니하는 구조로 할 것","추락할 위험이 있는 장소에는 안전난간을 설치할 것","수직갱에 가설된 통로의 길이가 15m 이상인 경우에는 10m 이내마다 계단참을 설치할 것","1"
"건설안전산업기사","2019","1","건설안전기술","100","굴착이 곤란한 경우 발파가 어려운 암석의 파쇄굴착 또는 암석제거에 적합한 장비는?","","리퍼","스크레이퍼","롤러","드래그라인","1"