"Test Name","Year","Session","Subject","Number","Question","Question_image","Option 1","Option 2","Option 3","Option 4","Answer"
"건설안전기사","2014","4","건설시공학","73","철골공사의 기초상부 고름질 방법에 해당되지 않는 것은?","","전면바름 마무리법","나중 채워넣기 중심바름법","나중 매입공법","나중 채워넣기법","3"
"건설안전기사","2014","4","건설시공학","74","원심력 고강도 프리스트레스트 콘크리트말뚝의 이음방법 중 가장 강성이 우수하고 안전하여 많이 사용하는 이음 방법은?","","충전식이음","볼트식이음","용접식이음","강관말뚝이음","3"
"건설안전기사","2014","4","건설시공학","75","아파트, 지하철공사, 고속도로공사 등 대규모공사에서 지역별로 공사를 구분하여 발주하는 도급방식은?","","전문공종별 분할도급","공구별 분할도급","공정별 분할도급","직종별, 공정별 분할도급","2"
"건설안전기사","2014","4","건설시공학","76","지층의 변화 심도(深度)를 측정하는데 가장 적합한 지반조사 방법은?","","전기 저항식 지하탐사(electric resistivity prospecting)","베인테스트(vane test)","표준관입시험(penetration test)","딘월 샘플링(thin wall sampling)","1"
"건설안전기사","2014","4","건설시공학","77","석공사의 건식석재공사에 대한 설명 중 틀린 것은?","","석재의 건식 붙임에 사용되는 모든 구조재 또는 긴결 철물은 녹막이 처리를 한다.","석재의 색상, 석질, 가공형상, 마감 정도, 물리적 성질 등이 동일한 것으로 한다.","건식 석재 붙임에 사용되는 앵커볼트, 너트, 와셔 등은 주철제를 사용한다.","화강석 특유의 무늬를 제외한 눈에 띄는 반점 등을 제거한다.","3"
"건설안전기사","2014","4","건설시공학","78","콘크리트 타설 후 진동다짐에 대한 설명으로 틀린 것은?","","진동기는 하층 콘크리트에 10cm 정도 삽입하여 상하층 콘크리트를 일체화 시킨다.","진동기는 가능한 연직방향으로 찔러 넣는다.","진동기를 빼낼 때는 서서히 뽑아 구멍이 남지 않도록 한다.","된비빔 콘크리트의 경우 구조체의 철근에 진동을 주어 진동효과를 좋게 한다.","4"
"건설안전기사","2014","4","건설시공학","79","보통콘크리트의 슬럼프시험 결과 중 균등한 슬럼프를 나타내는 가장 좋은 상태는?","O","image_2014_4_79_1","image_2014_4_79_2","image_2014_4_79_3","image_2014_4_79_4","4"
"건설안전기사","2014","4","건설시공학","80","일정한 폭의 구덩이를 연속으로 파며, 좁고 깊은 도랑 파기에 가장 적당한 토공장비는?","","트렌처(Trencher)","로더(Loader)","백호우(Backhoe)","파워쇼벨(Power Shovel)","1"
"건설안전기사","2014","4","건설재료학","81","철근콘크리트의 골재로서 불가피하게 해사를 사용할 경우 중점을 두어 반드시 취해야 할 조치는?","","충분히 물에 씻어 사용한다.","잔골재의 혼합비를 높게 한다.","구조내력상 중요한 부분에 보강근을 넣는다.","충분히 건조시킨 후 사용한다.","1"
"건설안전기사","2014","4","건설재료학","82","콘크리트 워커빌리티(workability)에 관한 설명 중 틀린것은?","","과도하게 비빔시간이 길면 시멘트의 수화를 촉진하여 워커빌리티가 나빠진다.","단위수량을 너무 증가시키면 재료분리가 생기기 쉽기 때문에 워커빌리티가 좋아진다고 볼 수 없다.","AE제를 혼입하면 워커빌리티가 좋게 된다.","깬자갈이나 깬모래를 사용할 경우, 잔골재를 작게 하고 단위수량을 감소시키면 워커빌리티가 좋아 진다.","4"
"건설안전기사","2014","4","건설재료학","83","목재의 방부제 중 독성이 적고 자극적인 냄새가 나며, 처리재는 갈색으로 가격이 저렴하여 많이 사용되는 것은?","","크레오소트유(Creosote Oil)","페놀류·무기플루오르화물계(PF)","크롬 구리·비소화합물(CCA)","펜타클로르페놀(PCP)","1"
"건설안전기사","2014","4","건설재료학","84","다음 석재 중 변성암에 속하지 않는 석재는?","","트래버틴","대리석","펄라이트","사문석","3"
"건설안전기사","2014","4","건설재료학","85","바니시에 대한 설명으로 틀린 것은?","","바니시는 합성수지, 아스팔트, 안료 등에 건성유나 용제를 첨가한 것이다.","휘발성 바니시에는 락(lock), 래커(lacquer) 등이 있다.","휘발성 바니시는 건조가 빠르나 도막이 얇고 부착력이 약하다.","유성 바니시는 불투명도료로 내후성이 커서 외장용으로 사용된다.","4"
"건설안전기사","2014","4","건설재료학","86","다음 중 열경화성수지에 속하지 않는 것은?","","에폭시수지","페놀수지","아크릴수지","요소수지","3"
"건설안전기사","2014","4","건설재료학","87","내구성 및 강도가 크고 외관이 수려하나 함유광물의 열팽창 계수가 달라 내화성이 약한 석재로 외장, 내장, 구조재, 도로포장재, 콘크리트 골재 등에 사용되는 것은?","","응회암","화강암","화산암","대리석","2"
"건설안전기사","2014","4","건설재료학","88","건축재료의 역학적 성질에 속하지 않는 항목은?","","탄성","비중","강성","소성","2"
"건설안전기사","2014","4","건설재료학","89","콘크리트용 골재에 대한 설명으로 틀린 것은?","","입형과 입도가 좋은 골재는 실적율이 작고 동일 슬럼프를 얻기 위한 단위수량이 크다.","골재의 입도를 수치적으로 나타내는 지표로서는 조립률이 이용된다.","실적률이 큰 골재를 사용하면 시멘트 페이스트랑이 적게 든다.","콘크리트용 골재의 입형은 편평, 세장하지 않은 것이 좋다.","1"
"건설안전기사","2014","4","건설재료학","90","금속부식에 대한 대책으로 틀린 것은?","","가능한 한 이종 금속은 이를 인접, 접속시켜 사용하지 않을 것","균질한 것을 선택하고 사용할 때 큰 변형을 주지 않도록 할것","큰 변형을 준 것은 가능한 한 풀림하여 사용할 것","표면을 거칠게 하고 가능한 한 습윤상태로 유지할 것","4"
"건설안전기사","2014","4","건설재료학","91","미장바탕의 일반적인 성능조건과 가장 관계가 먼 것은?","","미장층보다는 강도가 클 것","미장층과 유효한 접착강도를 얻을 수 있을 것","미장층보다 강성이 작을 것","미장층의 경화, 건조에 지장을 주지 않을 것","3"
"건설안전기사","2014","4","건설재료학","92","건축재료의 화학조성에 의한 분류 중, 무기재료에 포함되지 않는 것은?","","콘크리트","철강","목재","석재","3"
"건설안전기사","2014","4","건설재료학","93","에폭시수지 접착제에 대한 설명으로 틀린 것은?","","금속, 석재, 도자기의 접착에 사용이 가능하다.","급경성이며 내화학성이 크다.","접착력이 크고 내수성이 우수하다.","내알칼리성이 적어 콘크리트에는 사용이 어렵다.","4"
"건설안전기사","2014","4","건설재료학","94","점토소성제품 중 흡수성이 극히 작고 경도와 강도가 가장 크며, 소성온도는 1250~1430℃로써 고급타일이나 위생도기를 만드는데 사용되는 것은?","","토기","석기","도기","자기","4"
"건설안전기사","2014","4","건설재료학","95","돌로마이트에 화강석 부스러기, 색모래, 안료 등을 섞어 정벌 바름하고 충분히 굳지 않은 때에 표면에 거친솔, 얼레빗 같은 것으로 긁어 거친 면으로 마무리한 것은?","","리신바름","라프코트","섬유벽바름","회반죽바름","1"
"건설안전기사","2014","4","건설재료학","96","입자가 잘거나 치밀하며 색은 검은색·암회색이고 석질이 견고하여 토대석 석축으로 쓰이는 석재는?","","안산암","현무암","점판암","사문암","2"
"건설안전기사","2014","4","건설재료학","97","목재의 수분 습기의 변화에 따른 팽창수축을 감소시키는 방법으로 틀린 것은?","","사용하기 전에 충분히 건조시켜 균일한 함수율이 된 것을 사용할 것","가능한 곧은결 목재를 사용할 것","가능한 저온 처리된 목재를 사용할 것","파라핀 크레오소트 등을 침투시켜 사용할 것","3"
"건설안전기사","2014","4","건설재료학","98","목재의 성질 및 용도에 대한 설명으로 틀린 것은?","","함수율 변화에 따른 신축변형이 크다.","침엽수가 활엽수보다 재질이 강하다.","구조용 재료로 침엽수가 주로 쓰인다.","화재나 충해에 취약하다.","2"
"건설안전기사","2014","4","건설재료학","99","아스팔트계 방수재료에 대한 설명 중 틀린 것은?","","아스팔트 프라이머는 블로운 아스팔트를 용제에 녹인 것으로 액상을 하고 있다.","아스팔트 펠트는 유기천연섬유 또는 석면섬유를 결합한 원지에 연질의 블로운 아스팔트를 침투시킨 것이다.","아스팔트 루핑은 아스팔트 펠트의 양면에 블로운 아스팔트를 가열 용융시켜 피복한 것이다.","아스팔트 컴파운드는 볼로운 아스팔트의 성능을 개량하기 위해 동식물성 유지와 광물질 분말을 혼입한 것이다.","2"
"건설안전기사","2014","4","건설재료학","100","알루미늄에 관한 설명으로 틀린 것은?","","알루미늄은 내식성이 크므로 직접 콘크리트 중에 매입해도 지장이 없다.","알루미늄의 비중은 철의 약 1/3 이다.","알루미늄의 응력-변형곡선은 강재와 같은 명확한 항복점이 없다.","알루미늄과 강판을 접촉하여 사용하면 알루미늄판이 부식된다.","1"
"건설안전기사","2014","4","건설안전기술","101","철골구조의 앵커볼트매립과 관련된 사항 중 옳지 않은 것은?","","기둥중심은 기준선 및 인접기둥의 중심에서 3mm 이상 벗어나지 않을 것","앵커 볼트는 매립 후에 수정하지 않도록 설치할 것","베이스플레이트의 하단은 기준 높이 및 인접기둥의 높이에서 3mm 이상 벗어나지 않을 것","앵커 볼트는 기둥중심에서 2mm 이상 벗어나지 않을 것","1"
"건설안전기사","2014","4","건설안전기술","102","터널붕괴를 방지하기 위한 지보공 점검사항과 가장 거리가 먼 것은?","","부재의 긴압의 정도","부재의 손상·변형부식 변위 탈락의 유무 및 상태","기둥침하의 유무 및 상태","경보장치의 작동상태","4"
"건설안전기사","2014","4","건설안전기술","103","다음은 항만하역작업 시 통행설비의 설치에 관한 내용이다. ()안에 알맞은 숫자는?\n\n사업주는 갑판의 윗면에서 선창 밑바닥까지의 깊이가 ()를 초과하는 선창의 내부에서 화물취급작업을 하는 경우에 그 작업에 종사하는 근로자가 안전하게 통행할 수 있는 설비를 설치하여야 한다.","","1.0m","1.2m","1.3m","1.5m","4"
"건설안전기사","2014","4","건설안전기술","104","연약지반의 이상현상 중 하나인 히빙(heaving) 현상에 대한 안전대책이 아닌 것은?","","흙막이벽의 관입깊이를 깊게 한다.","굴착 저면에 토사 등으로 하중을 가한다.","흙막이 배면의 표토를 제거하여 토압을 경감한다.","주변 수위를 높인다.","4"
"건설안전기사","2014","4","건설안전기술","105","52m 높이로 강관비계를 세우려면 지상에서 몇 미터까지 2개의 강관으로 묶어 세워야 하는가?","","11m","16m","21m","26m","3"
"건설안전기사","2014","4","건설안전기술","106","콘크리트 타설작업과 관련하여 준수하여야 할 사항으로 가장 거리가 먼 것은?","","당일의 작업을 시작하기 전에 해당 작업에 관한 거푸집 동바리 등의 변형변위 및 지반의 침하 유무 등을 점검하고 이상이 있는 경우 보수할 것","콘크리트를 타설하는 경우에는 편심이 발생하지 않도록 골고루 분산하여 타설할 것","진동기의 사용은 많이 할수록 균일한 콘크리트를 얻을 수 있으므로 가급적 많이 사용할 것","설계도서상의 콘크리트 양생기준을 준수하여 거푸집동바리를 해체할 것","3"
"건설안전기사","2014","4","건설안전기술","107","부두안벽 등 하역작업을 하는 장소에서는 부두 또는 안벽의 선을 따라 통로를 설치하는 경우에는 폭을 최소 얼마 이상으로 해야 하는가?","","70cm","80cm","90cm","100cm","3"
"건설안전기사","2014","4","건설안전기술","108","터널 지보공을 조립하거나 변경하는 경우에 조치하여야 하는 사항으로 옳지 않은 것은?","","목재의 터널 지보공은 조립시 각 부재에 작용하는 긴압 정도를 체크하여 그 정도가 최대한 차이나도록 한다.","강(鋼)아치 지보공의 조립은 연결볼트 및 띠장 등을 사용하여 주재 상호간을 튼튼하게 연결할 것","기둥에는 침하를 방지하기 위하여 받침목을 사용하는 등의 조치를 할 것","주재(主材)를 구성하는 1세트의 부재는 동일 평면 내에 배치할 것","1"
"건설안전기사","2014","4","건설안전기술","109","신품의 추락방지망 중 그물코의 크기 10cm인 매듭방망의 인장강도 기준으로 옳은 것은?","","110kgf 이상","200kgf 이상","360kgf 이상","400kgf 이상","2"
"건설안전기사","2014","4","건설안전기술","110","콘크리트 타설을 위한 거푸집동바리의 구조검토시 가장 선행되어야 할 작업은?","","각 부재에 생기는 응력에 대하여 안전한 단면을 산정한다.","하중·외력에 의하여 각 부재에 생기는 응력을 구한다.","가설물에 작용하는 하중 및 외력의 종류, 크기를 산정한다.","사용할 거푸집동바리의 설치간격을 결정한다.","3"
"건설안전기사","2014","4","건설안전기술","111","클램쉘(Clam shell)의 용도로 옳지 않은 것은?","","잠함안의 굴착에 사용된다.","수면아래의 자갈, 모래를 굴착하고 준설선에 많이 사용된다.","건축구조물의 기초 등 정해진 범위의 깊은 굴착에 적합하다.","단단한 지반의 작업도 가능하며 작업속도가 빠르고 특히 암반굴착에 적합하다.","4"
"건설안전기사","2014","4","건설안전기술","112","표준관입시험에 대한 내용으로 옳지 않은 것은?","","N치(N-value)는 지반을 30cm 굴진하는데 필요한 타격 횟수를 의미한다.","50/3의 표기에서 50은 굴진수치, 3은 타격횟수를 의미한다.","63.5kg 무게의 추를 76cm 높이에서 자유낙하하여 타격하는 시험이다.","사질지반에 적용하며, 점토지반에서는 편차가 커서 신뢰성이 떨어진다.","2"
"건설안전기사","2014","4","건설안전기술","113","지반조사 보고서 내용에 해당되지 않는 항목은?","","지반공학적 조건","표준관입시험치, 콘관입저항치 결과분석","시공예정인 흙막이 공법","건설할 구조물 등에 대한 지반특성","3"
"건설안전기사","2014","4","건설안전기술","114","흙막이 가시설 공사시 사용되는 각 계측기 설치목적으로 옳지 않은 것은?","","지표침하계 - 지표면 침하량 측정","수위계 - 지반 내 지하수위의 변화 측정","하중계 - 상부 적재하중 변화 측정","지중경사계 - 지중의 수평 변위량 측정","3"
"건설안전기사","2014","4","건설안전기술","115","산업안전보건기준에 관한 규칙에 따른 철골공사 작업시 작업을 중지해야 할 경우는?","","강우량 1.5mm/hr","풍속 8m/sec","강설량 5mm/hr","지진 진도 1.0","1"
"건설안전기사","2014","4","건설안전기술","116","폭풍시 옥외에 설치되어 있는 주행크레인에 대하여 이탈방지를 위한 조치가 필요한 풍속 기준은?","","순간풍속이 20m/sec 초과할 때","순간풍속이 25m/sec 초과할 때","순간풍속이 30m/sec 초과할 때","순간풍속이 35m/sec 초과할 때","3"
"건설안전기사","2014","4","건설안전기술","117","철골조립작업에서 안전한 작업발판과 안전난간을 설치하기가 곤란한 경우 작업원에 대한 안전대책으로 가장 알맞은 것은?","","안전대 및 구명로프 사용","안전모 및 안전화 사용","출입금지 조치","작업중지 조치","1"
"건설안전기사","2014","4","건설안전기술","118","철근콘크리트 구조물의 해체를 위한 장비가 아닌 것은?","","램머(Rammer)","압쇄기","철제 해머","핸드 브레이커(Hand Breaker)","1"
"건설안전기사","2014","4","건설안전기술","119","낙하물방지망 또는 방호선반을 설치하는 경우에 수평면과의 각도 기준으로 옳은 것은?","","$10^{\\circ}$ 이상 $20^{\\circ}$ 이하","$20^{\\circ}$ 이상 30° 이하","$25^{\\circ}$ 이상 $35^{\\circ}$ 이하","$35^{\\circ}$ 이상 45° 이하","2"
"건설안전기사","2014","4","건설안전기술","120","강풍시 타워크레인의 작업제한과 관련된 사항으로 타워크레인의 운전 작업을 중지해야 하는 순간풍속기준으로 옳은 것은?(관련규정 개정전 문제로 기존 정답은 2번입니다. 여기서는 2번을 누르면 정답 처리 됩니다 자세한 내용은 해설을 참고 하세요.)","","순간풍속이 매초 당 10 미터 초과","순간풍속이 매초 당 20 미터 초과","순간풍속이 매초 당 30 미터 초과","순간풍속이 매초 당 40 미터 초과","2"