"Test Name","Year","Session","Subject","Number","Question","Question_image","Option 1","Option 2","Option 3","Option 4","Answer"
"건설안전산업기사","2006","4","건설재료학","79","목재의 일반적인 성질에 대한 설명 중 옳지 않은 것은?","","석재나 금속에 비하여 가공하기가 쉽다.","건조한 것은 타기 쉽고 건조가 불충분한 것은 썩기 쉽다.","열전도율이 커서 보온재료로 사용이 곤란하다.","아름다운 색채와 무늬로 장식효과가 우수하다.","3"
"건설안전산업기사","2006","4","건설재료학","80","회반죽에 대한 설명 중 틀린 것은?","","경화건조에 의한 수축율이 크기 때문에 여물로서 균열을 분산, 경감시킨다.","해초풀을 넣는 것은 경화속도를 높이기 위한 것이다.","회반죽 바름은 일반적으로 연약하고 비내수성이다.","공기중의 탄산가스와 표면부터 서서히 반응하여 경화한다.","2"
"건설안전산업기사","2006","4","건설안전기술","81","철골작업을 중지 시켜야 하는 기준이 되는 강우량은 1시간 당몇 mm 이상인가?","","1mm","2mm","3mm","4mm","1"
"건설안전산업기사","2006","4","건설안전기술","82","비탈면붕괴를 방지하기 위한 방법으로 틀린 것은?","","배토공","배수공","압성토공","절토 높이의 증가","4"
"건설안전산업기사","2006","4","건설안전기술","83","다음 중 리프트의 조립·해체작업을 지휘하는 자가 취해야 할 조치라고 볼 수 없는 것은?","","작업방법과 근로자의 배치 결정","리프트의 상하 운행 작동","기구 및 공구의 기능 점검","작업 중 보호구 착용 감시","2"
"건설안전산업기사","2006","4","건설안전기술","84","일반적으로 저수지나 댐의 사면이 가장 위험한 때는?","","사면의 수위가 서서히 하강할 때","사면이 완전 건조 상태일 때","사면의 수위가 급격히 하강할 때","사면이 완전 포화 상태일 때","3"
"건설안전산업기사","2006","4","건설안전기술","85","항타기 항발기 권상용 와이어로프의 사용금지 기준으로 틀린 것은?","","이음매가 있는 것","심하게 변형 또는 부식된 것","지름의 감소가 공칭지름의 5%를 초과하는 것","와이어로프의 한 꼬임에서 소선의 수가 10% 이상 절단된것","3"
"건설안전산업기사","2006","4","건설안전기술","86","'현장의 고압선 충전전로에서 근접하여 비계작업을 하려고 한다. 해당 작업에 종사하는 근로자의 신체 등이 충전 전로에 접촉하거나 해당 충전전로에 대하여 머리 위로의 거리가 (①)cm 이내 이거나 신체 또는 발 아래로의 거리가 (②)cm 이내로 접근함으로 인하여 감전의 우려가 있는 때에는 해당 충전전로에 절연용 방호구를 설치하여야 한다.' () 안에 적합한 것은?","","①30, ②60","①60, ②30","①60, ②90","①90, ②60","1"
"건설안전산업기사","2006","4","건설안전기술","87","산업안전보건관리비(안전관리비)의 항목으로 사용할 수 있는 것은?","","비계 해체시 하부통제를 위한 신호자의 인건비","외부인 출입금지, 공사장 경계표시를 위한 가설울타리 설치비","가설 전기설비, 분전반, 전신주 이설비","교통 통제를 위한 교통정리, 신호수의 인건비","1"
"건설안전산업기사","2006","4","건설안전기술","88","다음 중 구조물 해체작업용 기계·기구의 종류가 아닌 것은?","","포크 리프트(Fork lift)","압쇄기","대형 브레이커","쐐기 타입기 (Rock jack)","1"
"건설안전산업기사","2006","4","건설안전기술","89","비계(달비계, 달대비계 및 말비계 제외)의 높이가 2미터 이상인 작업장소에 적합한 작업발판의 폭은 얼마 이상이어야 하는가?","","10cm","20cm","30cm","40cm","4"
"건설안전산업기사","2006","4","건설안전기술","90","연질의 점토지반 굴착시 흙막이 바깥에 있는 흙의 중량과 지표 위의 적재하중 등에 의해 저면 흙이 붕괴 되고 흙막이 바깥에 있는 흙이 안으로 밀려 불룩하게 되는 현상은?","","히빙","보일링","파이핑","베인","1"
"건설안전산업기사","2006","4","건설안전기술","91","다음 중 유해·위험방지 계획서 제출 대상 공사는?","","지상높이가 25m인 건축물","최대지간길이가 45m인 교량건설공사","제방 높이가 50m인 다목적댐 건설공사","깊이가 8m인 굴착공사","3"
"건설안전산업기사","2006","4","건설안전기술","92","건설공사 현장에서 가설통로 설치기준으로 맞는 것은?","","높이 3m인 가설통로의 경사가 15°이내일 때 손잡이를 설치하여야 한다.","수직갱에 가설된 통로의 길이가 10m를 초과하면 8m 이내에 계단참을 설치하여야 한다.","경사각이 15° 미만이면 일반적으로 미끄럼 방지 장치를 하지 않아도 된다.","높이가 7m 이상인 비계다리에는 6m 이내 마다 계단참을 설치하여야 한다.","3"
"건설안전산업기사","2006","4","건설안전기술","93","안전난간의 설치 기준에 대한 설명으로 옳지 않은 것은?","","안전난간은 상부난간대, 중간난간대, 발끝막이판, 난간 기둥으로 구성된다.","상부난간대는 바닥면 등으로부터 90~120cm 이하에 설치하고, 중간난간대는 그 중간에 설치한다.","발끝막이판은 바닥면 등으로부터 10cm의 높이를 유지한다.","안전난간은 임의이 점에서 임의의 방향으로 움직이는 80kg 이상의 하중에 견딜 수 있는 튼튼한 구조로 한다.","4"
"건설안전산업기사","2006","4","건설안전기술","94","다음 중 터널식 굴착방법과 거리가 먼 것은?","","Τ.Β.Μ","NATM","쉴드","어스앵커(Earth Anchor)","4"
"건설안전산업기사","2006","4","건설안전기술","95","강관 비계기둥 간의 최대 허용 적재 하중으로 맞는 것은?","","500kg","400kg","300kg","200kg","2"
"건설안전산업기사","2006","4","건설안전기술","96","비계를 조립, 해체하거나 또는 변경한 후 그 비계에서 작업할 때 해당 작업 시작 전에 점검하여야 하는 사항으로 옳지 않은 것은?","","최대 적재하중으로 재하시험을 한다.","발판 재료의 손상 여부 및 부착 또는 걸림 상태를 점검한다.","연결재료 및 연결철물의 손상 또는 부식 상태를 점검한다.","해당 비계의 연결부 또는 접속부의 풀림 상태를 확인한다.","1"
"건설안전산업기사","2006","4","건설안전기술","97","철근 콘크리트 공사에서 거푸집동바리의 해체시기를 결정하는 요인으로 가장 거리가 먼 것은?","","시방서 상의 거푸집 존치기간의 경과","콘크리트 강도시험 결과","일정한 양생 기간의 경과","후속공정의 착수시기","4"
"건설안전산업기사","2006","4","건설안전기술","98","콘크리트 타설 시 거푸집의 측압에 영향을 미치는 인자에 대한 설명으로 맞는 것은?","","슬럼프가 작을수록 측압이 크다.","단위 폭당 단면적이 클수록 측압이 크다.","타설속도가 느릴수록 측압이 크다.","콘크리트의 단위중량(밀도)이 작을수록 측압이 크다.","2"
"건설안전산업기사","2006","4","건설안전기술","99","발파공사 암질 변화 구간 및 이상암질 출현시 암질 판별 방법이 아닌 것은?","","R.Q.D","R.M.R 분류","탄성파 속도","하중계(Load Cell)","4"
"건설안전산업기사","2006","4","건설안전기술","100","추락시 로프의 지지점에서 최하단까지의 거리 h를 구하면 얼마인가? (단, 로프 길이 150cm, 로프 신율 30%, 근로자 신장 170cm)","","2.8m","3.0m","3.2m","3.4m","1"