"Test Name","Year","Session","Subject","Number","Question","Question_image","Option 1","Option 2","Option 3","Option 4","Answer"
"건설안전산업기사","2004","4","건설재료학","79","블론아스팔트의 성능을 개량하기 위해 동식물성 유지와 광물질 분말을 혼입하여 제작한 것은?","","아스팔트 프라이머","아스팔트 컴파운드","아스팔트 코팅","아스팔트 에멀젼","2"
"건설안전산업기사","2004","4","건설재료학","80","AE콘크리트의 절대용적배합을 나타낸 것이다. 이 콘크리트의 물시멘트비는? (단 시멘트의 비중은 3.15 이다.)\n단위수량 $\equiv F(kg/m^3)$: 180\n절대용적 $1(e/m^3)$: 시멘트 95, 모래 305, 자갈 380","","50%","55%","60%","65%","3"
"건설안전산업기사","2004","4","건설안전기술","81","비탈면붕괴를 방지하기 위한 방법으로 틀린 것은?","","배토공","배수공","압성토공","절토 높이의 증가","4"
"건설안전산업기사","2004","4","건설안전기술","82","다음 중 공사현장에서 철골을 세우기 위한 건설기계로서 적당하지 않은 것은?","","크레인","데릭","이동식 크레인","항발기","4"
"건설안전산업기사","2004","4","건설안전기술","83","양중기를 사용하는 작업에서 운전자가 보기 쉬운 곳에 부착하여야 하는 사항이 아닌 것은?","","작업위치","정격하중","운전속도","경고표시","1"
"건설안전산업기사","2004","4","건설안전기술","84","15층 아파트 신축공사 현장에서 강관으로 외부비계를 설치할 때 비계기둥의 최고 높이가 45m라면 규정에 따라 비계기둥을 2본으로 보강하여야 하는 높이는 지상으로부터 얼마까지인가?","","14m","20m","25m","31m","1"
"건설안전산업기사","2004","4","건설안전기술","85","노천굴착 작업을 위한 작업 장소 등의 조사시 조사하여야 할 사항이 아닌 것은?","","주변의 도로 분포 상태","형상, 지질 및 지층의 상태","매설물 등의 유무 또는 상태","지반의 지하수위 상태","1"
"건설안전산업기사","2004","4","건설안전기술","86","와이어로프나 철선 등을 이용하여 상부지점에서 작업용 발판을 매다는 형식의 비계로서 건물 외벽도장이나 청소 등의 작업에서 사용되는 비계는?","","브라켓비계","달비계","이동식 비계","말비계","2"
"건설안전산업기사","2004","4","건설안전기술","87","콘크리트의 종류 중 수중공사에 주로 이용되며 거푸집을 조립하고 골재를 미리 충진한 후 특수한 모르타르를 그 사이에 주입하여 형성하는 콘크리트는?","","프리팩트콘크리트","한중콘크리트","경량콘크리트","섬유보강콘크리트","1"
"건설안전산업기사","2004","4","건설안전기술","88","다음 중 크레인에 부착하는 방호장치가 아닌 것은?","","과부하방지장치","비상정지장치","권과방지장치","자동전력방지장치","4"
"건설안전산업기사","2004","4","건설안전기술","89","연약한 지반 위에 성토를 하거나 직접기초를 건설하고자 할 때 지중 점토층의 압밀을 촉진시키기 위한 탈수공법의 종류가 아닌 것은?","","샌드 드레인 공법","웰 포인트 공법","약액 주입 공법","페이퍼 드레인 공법","3"
"건설안전산업기사","2004","4","건설안전기술","90","근로자의 안전한 통행을 위하여 통로에 설치하여야 하는 조명시설의 안전기준에서 지정한 조도는?","","30 Lux 이상","75 Lux 이상","150 Lux 이상","300 Lux 이상","2"
"건설안전산업기사","2004","4","건설안전기술","91","강관비계의 기둥간의 적재하중은 얼마이내로 제한하여야 하는가?","","200kg","400kg","600kg","800kg","2"
"건설안전산업기사","2004","4","건설안전기술","92","발파 작업시 안전 수칙에 위배되는 사항은?","","발파공의 충진재료로 모래를 사용하였다.","화약과 뇌관은 분리하여 저장하였다.","화약 장전에 구멍을 막는 작업에 철근을 사용하였다.","발파 작업 후 불발 뇌관의 유무를 확인하였다.","3"
"건설안전산업기사","2004","4","건설안전기술","93","프리캐스트 부재의 현장야적에 대한 설명으로 옳지 않은 것은?","","오물로 인한 부재의 변질을 방지한다.","벽 부재는 수평으로 포개 쌓아 놓는다.","부재의 제조번호, 기호 등을 식별하기 쉽게 야적한다.","받침대를 설치하여 휠, 균열 등이 생기지 않게 한다.","2"
"건설안전산업기사","2004","4","건설안전기술","94","거푸집 동바리를 고정하거나 조립 또는 해체 작업을 할때 안전담당자가 준수하여야 할 유해·위험방지업무 기준이 아닌 것은?","","안전한 작업방법을 결정하고 작업을 지휘하는 일","재료, 기구의 결함유무를 점검하고 불량품을 제거하는 일","작업 중 안전대 및 안전모 등 보호구 착용상황을 감시하는 일","주변 작업자간의 연락조정을 행하는 일","4"
"건설안전산업기사","2004","4","건설안전기술","95","낙하물방지망 또는 방호선반의 설치시 준수하여야 할 기준으로 옳은 것은?","","설치높이는 10m이내마다 설치한다.","내민길이는 벽면으로부터 1m 이상으로 한다.","수평면과의 각도는 10도 내지 20도를 유지한다.","500kg 이상의 하중에 견딜 수 있어야 한다.","1"
"건설안전산업기사","2004","4","건설안전기술","96","다음 공사 중 건설업 유해·위험방지계획서 제출 대상이 아닌 것은?","","지상높이 35m인 공작물 건설 공사","최대 지간길이가 60m인 교량건설 공사","터널건설 공사","깊이 5m인 굴착공사","4"
"건설안전산업기사","2004","4","건설안전기술","97","건설공사 현장에서 주로 사용하는 이동식 사다리를 조립할 때에 준수하여야 할 사항이 아닌 것은?","","높이가 10m를 초과하는 경우 10m이내에 띠장방향으로 버팀기둥을 설치한다.","폭은 30cm 이상으로 한다.","다리부분에 미끄럼방지장치 등으로 미끄러지거나 넘어지는 것을 방지하기 위한 조치를 한다.","발판의 간격은 동일하게 한다.","1"
"건설안전산업기사","2004","4","건설안전기술","98","현장 토질시험으로 +자형 날개를 회전시켜 점토질 지반의 점착력을 판별하는 시험 방법은?","","탐사관시험","표준관입시험","베인 테스트","슈미트해머법","3"
"건설안전산업기사","2004","4","건설안전기술","99","철골공사 작업 중 작업을 중지해야 하는 기후조건의 기준으로 알맞은 것은?","","풍속: 10m/sec이상, 강우량: 1mm/h이상","풍속: 5m/sec이상, 강우량: 1mm/h이상","풍속: 5m/sec이상, 강우량: 2mm/h이상","풍속: 10m/sec이상, 강우량: 0.5mm/h이상","1"
"건설안전산업기사","2004","4","건설안전기술","100","'작업장이나 기계·설비의 바닥 작업발판 및 통로 등의 끝이나 개구부로부터 근로자가 추락하거나 넘어질 위험이 있는 장소에는 (①), 울, 손잡이 또는 충분한 강도를 가진(②) 등을 설치하는 등 필요한 조치를 하여야 한다.' 빈칸에 가장 알맞은 것으로 짝지어진 것은? (순서대로 1, 2)","","폭목, 덮개","안전난간, 덮개","표준안전난간, 발끝막이판","방호선반, 폭목","2"