"Test Name","Year","Session","Subject","Number","Question","Question_image","Option 1","Option 2","Option 3","Option 4","Answer"
"건설안전기사","2005","1","건설시공학","80","콘크리트에는 균열이 반드시 생긴다는 기본 생각을 토대로 해서, 균열이 생길만한 구조물의 부재에 미리 결함부위를 만들어 두는 것을 무엇이라 하는가?","","신축줄눈","팽창줄눈","시공줄눈","조절줄눈","4"
"건설안전기사","2005","1","건설재료학","81","석재에 관한 기술 중 옳지 않은 것은?","","석재의 강도는 보통 압축강도를 말하며 구조용으로 사용할 경우 압축력을 받는 부분에 사용해야 한다.","일반적으로 규산분을 많이 함유한 석재는 내산성이 크고 석회분을 포함한 것은 내산성이 적다.","일반적으로 화강암, 안산암 등의 화성암 종류가 내마모성이 작고 수성암 종류는 내마모성이 큰 편이다.","석재는 비중의 대소로 강도나 내구성의 정도를 추정할 수 있다.","3"
"건설안전기사","2005","1","건설재료학","82","아래 그림은 일반 구조용 강재의 응력-변형도 그림이다. 이것에 관한 설명으로 옳지 않은 것은?","O","a는 비례한도이다.","b는 탄성한도이다.","c는 하항복점이다.","d는 최대강도이다.","2"
"건설안전기사","2005","1","건설재료학","83","다음 석고판의 성질에 대한 설명 중 옳지 않은 것은?","","화재시 화염과 열의 확산을 지연시킨다.","연소나 석회화 하기 전까지 100℃이상의 열을 전달하지 않는다.","부식이 안되고 충해가 없다.","흡수성이 없어 흡수로 인한 강도의 저하가 없다.","4"
"건설안전기사","2005","1","건설재료학","84","콘크리트의 크리프에 대한 설명으로 옳지 않은 것은?","","재하 초기에 증가가 현저하고, 장기화될수록 증가율은 작게 되고 보통 3~4년에 정지한다.","재하재령이 빠를수록 크리프는 적다.","물시멘트비가 클수록 크리프는 크다.","크리프는 응력집중을 감소시키고 균열발생의 위험성을 줄이는 효과가 있다.","2"
"건설안전기사","2005","1","건설재료학","85","대리석의 쇄석, 백색시멘트, 안료, 물을 혼합하여 매끈한 면에 타설후 가공 연마하여 대리석과 같은 광택을 내도록한 제품은?","","테라조","의석(모조석)","수지계 인조석","감람석","1"
"건설안전기사","2005","1","건설재료학","86","점토 소성벽돌의 품질 등급에서 1종의 압축강도(N/mm²)는 최소 얼마 이상인가? (KS규정)(1kgf ≒ 9.80N)","","5.89","10.78","15.69","20.59","4"
"건설안전기사","2005","1","건설재료학","87","도료에 관한 설명 중 틀린 것은?","","유성페인트 - 건조시간이 길고 내알칼리성이 떨어진다.","수성페인트 - 광택이 좋고 내마모성이 크다.","수지성페인트 - 내산, 내알칼리성이 우수하다.","알루미늄페인트 - 분리가 적고 솔질이 용이하다.","2"
"건설안전기사","2005","1","건설재료학","88","굳지 않은 콘크리트의 성질 중 굵은 골재의 분리는 모르타르 부분에서 굵은 골재가 분리되어 불균일하게 존재하는 상태를 말하는데, 이러한 굵은 골재의 분리에 영향을 주는 인자와 거리가 먼 것은?","","단위수량","골재의 종류","골재의 강도","골재의 입형","3"
"건설안전기사","2005","1","건설재료학","89","목재의 건조에 대한 설명 중 옳지 않은 것은?","","전기절연성의 증가는 목재를 건조시키는 목적에 포함된다.","침수건조는 생목을 수중에 수침시켜 수액을 용실(溶失)시킨 후 대기건조시키는 방법이다.","열기건조는 건조실에 목재를 쌓고 온도, 습도, 풍속 등을 인위적으로 조절하면서 건조하는 방법이다.","활엽수가 침엽수보다 건조가 빠르다.","4"
"건설안전기사","2005","1","건설재료학","90","일반적으로 설계에 있어서 콘크리트의 열팽창계수로 옳은 것은?","","$1\times10^{-4}/^{\circ}C$","$1\times10^{-5}/^{\circ}C$","$1\times10^{-6}/^{\circ}C$","$1\times10^{-7}/^{\circ}C$","2"
"건설안전기사","2005","1","건설재료학","91","레디믹스드 콘크리트(ready mixed concrete)의 규격을 나타내는 (25-210-18)의 수치가 뜻하는 것은?","","잔골재 최대치수 - 압축강도 - 슬럼프값","굵은골재 최대치수 - 압축강도 - 슬럼프값","슬럼프값 - 압축강도 - 잔골재 최대치수","굵은골재 최대치수 - 인장강도 - 슬럼프값","2"
"건설안전기사","2005","1","건설재료학","92","바닥재에 관한 설명 중 옳지 않은 것은?","","하중조건에 대응하는 강도 및 강성을 가져야 한다.","바닥이 전혀 미끄럽지 않을 정도로 표면 마찰저항이 높아야 한다.","자연석과 인조석은 일반적으로 차갑고 단단하므로 거주성능이 나쁘다.","아스팔트계 시트는 내유성, 내산성이 우수하나 내알칼리성이 나쁘다.","2"
"건설안전기사","2005","1","건설재료학","93","솔, 로울러 등으로 용이하게 도포할 수 있도록 아스팔트를 휘발성 용제에 용해한 비교적 저점도의 액체로써 방수시공의 첫째 공정에 쓰는 바탕처리재는?","","아스팔트 프라이머","아스팔트 펠트","블로운 아스팔트","아스팔트 루핑","1"
"건설안전기사","2005","1","건설재료학","94","다음 중 흡수율이 가장 작은 타일은?","","석기질","자기질","도기질","토기질","2"
"건설안전기사","2005","1","건설재료학","95","플라스틱 재료에 관한 설명 중 옳지 않은 것은?","","실리콘수지는 내열성, 내한성이 우수한 수지로 콘크리트의 발수성 방수도료에 적당하다.","불포화 폴리에스테르수지는 유리섬유로 보강하여 사용되는 경우가 많다.","아크릴수지는 투명도가 높아 유기유리로 불린다.","멜라민수지는 내수, 내약품성은 우수하나 표면경도가 낮다.","4"
"건설안전기사","2005","1","건설재료학","96","자갈 시료의 표면수를 포함한 중량이 2,100g이고 표면건조 내부포화상태의 중량이 2.090g이며 절대건조상태의 중량이 2,070g이라면 흡수율과 표면수율은 약 몇% 인가?","","흡수율 0.48%, 표면수율 0.97%","흡수율 0.48%, 표면수율 1.45%","흡수율 0.97%, 표면수율 0.48%","흡수율 0.97%, 표면수율 1.45%","3"
"건설안전기사","2005","1","건설재료학","97","콘크리트용 골재의 조건으로서 부적합한 것은?","","강도는 콘크리트 중의 경화시멘트 페이스트의 강도 이상일것","표면이 깨끗하고 매끄러운 것","입형은 가능한 한 편평, 세장하지 않을 것","입도는 조립에서 세립까지 연속적으로 균등히 혼합되어 있을 것","2"
"건설안전기사","2005","1","건설재료학","98","동(銅)에 대한 설명 중 옳지 않은 것은?","","연성이고 가공성이 풍부하여 판재, 선, 봉 등으로 만들기가 용이하다.","열 및 전기전도율이 매우 크다.","맑은 물에서는 부식되나 염수(鹽水)에서는 부식되지 않는다.","콘크리트 등에 접하는 곳이나 가스가 발생되는 곳에서는 부식의 속도가 빠르므로 주의하여야 한다.","3"
"건설안전기사","2005","1","건설재료학","99","다음 목재의 강도 중 가장 큰 것은?","","응력방향이 섬유방향에 평행한 경우의 압축강도","응력방향이 섬유방향에 평행한 경우의 인장강도","응력방향이 섬유방향에 평행한 경우의 전단강도","응력방향이 섬유에 직각방향인 경우의 압축강도","2"
"건설안전기사","2005","1","건설재료학","100","건축구조물에 사용되는 일반구조용 압연강재의 시험 중 중요시 되지 않는 시험 항목은?","","인장강도 시험","굴곡(홈) 시험","압축강도 시험","연신율 시험","3"
"건설안전기사","2005","1","건설안전기술","101","다음 중 발파공의 충전재료로 부적당한 것은?","","점토","모래","비발화성 물질","인화성 물질","4"
"건설안전기사","2005","1","건설안전기술","102","강관비계의 종류 중 단관비계를 설치할 때 조립간격으로 옳은 것은? (단, 수직방향, 수평방향의 순서임)","","4m, 4m","5m, 5m","5.5m, 7.5m","6m, 8m","2"
"건설안전기사","2005","1","건설안전기술","103","다음 중 지반의 굴착시 풍화암의 기울기 기준으로 적절한 것은?","","1:1","1:0.5","1:0.8","1:0.3","3"
"건설안전기사","2005","1","건설안전기술","104","토석붕괴 방지방법에 대한 설명으로 틀린 것은?","","말뚝(강관. H형강, 철근콘크리트)을 박아 지반을 강화 시킨다.","활동의 가능성이 있는 토석은 제거한다.","지표수가 침투되지 않도록 배수시키고 지하수위 저하를 위해 수평보링을 하여 배수시킨다.","활동에 의한 붕괴를 방지하기 위해 비탈면, 법면의 상단을 다진다.","4"
"건설안전기사","2005","1","건설안전기술","105","달비계 작업발판의 최대적재하중을 정함에 있어서 안전계수로 옳은 것은?","","달기 와이어로프(Wire rope): 5 이상","달기강선 : 5 이상","달기 체인(Chain): 3 이상","달기 훅(Hook): 5 이상","4"
"건설안전기사","2005","1","건설안전기술","106","콘크리트 타설시 내부진동기를 이용한 진동다지기를 할 때 사용상의 주의사항으로 잘못된 것은?","","여러층으로 나누어 진동다지기를 할 때는 진동기를 하층의 콘크리트 속으로 찔러 넣어서는 안된다.","진동기는 수직방향으로 넣고 간격은 약 50cm 이하로 한다.","진동기를 넣고 나서 뺄때까지 시간은 보통 5~15초가 적당하다.","진동기를 가지고 거푸집속의 콘크리트를 옆 방향으로 이동시켜서는 안된다.","1"
"건설안전기사","2005","1","건설안전기술","107","롤러의 표면에 돌기를 만들어 부착한 것으로 돌기가 전압층에 매입항에 의해 풍화암을 파쇄하여 흙 속의 간극수압을 소산하게 하고, 다짐의 유효 깊이가 큰 롤러는 무엇인가?","","머캐덤롤러","탠덤롤러","탬핑롤러","타이어롤러","3"
"건설안전기사","2005","1","건설안전기술","108","강선의 안전계수가 40이고 $2000kg/cm^2$의 인장강도를 갖는 경우에 최대허용응력은?","","$500kg/cm^2$","$1000kg/cm^2$","$1500kg/cm^2$","$2000kg/cm^2$","1"
"건설안전기사","2005","1","건설안전기술","109","콘크리트 타설시의 유의사항 중 옳지 않은 것은?","","콘크리트 타설 도중 표면에 떠올라 고인 블리딩수가 있을 경우에는 콘크리트 표면에 홈을 만들어 흐르게 하는 등 적당한 조치를 취해야 한다.","비비기로부터 타설시까지 시간은 외기온도 25℃ 이상에서는 1.5시간을 넘어서는 안된다.","타설시 콘크리트의 재료분리는 가능한 적게 일어나도록 해야 한다.","타설한 콘크리트를 거푸집 안에서 횡방향으로 이동시켜서는 안된다.","1"
"건설안전기사","2005","1","건설안전기술","110","철골공사 작업시 산업안전보건법상 작업을 중지해야 할 악천후는?","","풍속 8m/sec","강우량 1.5mm/hr","강설량 5mm/hr","지진 진도 1.0","2"
"건설안전기사","2005","1","건설안전기술","111","철제거푸집의 장점이 아닌 것은?","","강성이 크다.","수밀성이 좋다.","정밀도가 높다.","가볍다.","4"
"건설안전기사","2005","1","건설안전기술","112","다음 중 터널 굴착 작업시 시공계획에 포함되어야 할 사항으로 거리가 먼 것은?","","굴착의 방법","터널 지보공 및 복공의 시공 방법과 용수의 처리 방법","환기 또는 조명시설을 하는 때에는 그 방법","계기의 이상 유무 점검","4"
"건설안전기사","2005","1","건설안전기술","113","특수지반 개량공법 중 하나인 지하연속벽 공법(Slurry Wall)의 특징이 아닌 것은?","","소음과 진동이 다른 항타, 인발 등을 동반하는 공법에 비해 낮다.","시공 조인트의 처리를 잘하면 높은 차수성을 기대할 수 있다.","지반 조건에 좌우되지 않는다.","차수성이 우수하나 임의의 치수와 형상을 선택할 수 없다.","4"
"건설안전기사","2005","1","건설안전기술","114","흙의 안식각을 가장 잘 설명한 것은?","","자연 경사각","비탈면 각","시공 경사각","계획 경사각","1"
"건설안전기사","2005","1","건설안전기술","115","흙의 연경도에서 소성상태와 액성상태 사이의 한계를 무엇이라 하는가?","","에터버그(Atterberg)한계","액성한계","소성한계","수축한계","2"
"건설안전기사","2005","1","건설안전기술","116","다음 중 강말뚝의 특징으로 틀린 것은?","","허용응력이 크다.","내부식성이 크다.","말뚝길이에 비교적 제한을 받지 않는다.","굳은 지층에도 관입시킬 수 있다.","2"
"건설안전기사","2005","1","건설안전기술","117","다음 중 건설용 양중기에 해당하지 않는 것은?","","곤도라","리프트","최대하중이 0.25톤 미만인 승강기","크레인","3"
"건설안전기사","2005","1","건설안전기술","118","높이 2m 이상인 작업장에 설치하는 작업발판의 구조 및 설비에 관한 기준으로 옳지 않은 것은?","","발판의 폭이 40cm이상이 되도록 한다.","발판재료 간의 틈은 3cm이하로 한다.","작업발판을 작업에 따라 이동할 때에는 불시의 이동에 따른 위험방지 조치를 한다.","작업발판재료는 전위나 탈락이 없도록 2이상의 지지물에 연결하거나 고정시킨다.","4"
"건설안전기사","2005","1","건설안전기술","119","본 터널(main tunnel)을 시공하기 전에 터널에서 약간 떨어진 곳에 지질조사, 환기, 배수, 운반 등의 상태를 알아보기 위하여 설치하는 터널은?","","파이럿(pilot) 터널","프리패브(prefab) 터널","사이드(side) 터널","쉴드(shield) 터널","1"
"건설안전기사","2005","1","건설안전기술","120","산업안전보건법상 자체검사 대상 기계·기구가 아닌 것은?","","프레스 및 전단기","크레인(호이스트 포함)","곤도라","지게차","4"