"Test Name","Year","Session","Subject","Number","Question","Question_image","Option 1","Option 2","Option 3","Option 4","Answer"
"건설안전기사","2021","4","산업안전관리론","1","하인리히의 도미노 이론에서 재해의 직접원인에 해당하는 것은?","","사회적 환경","유전적 요소","개인적인 결함","불안전한 행동 및 불안전한 상태","4"
"건설안전기사","2021","4","산업안전관리론","2","안전관리조직의 형태 중 직계식 조직의 특징이 아닌 것은?","","소규모 사업장에 적합하다.","안전에 관한 명령지시가 빠르다.","안전에 대한 정보가 불충분하다.","별도의 안전관리 전담요원이 직접 통제한다.","4"
"건설안전기사","2021","4","산업안전관리론","3","건설기술진흥법령상 안전점검의 시기·방법에 관한 사항으로 ( )에 알맞은 내용은?\n정기안전점검 결과 건설공사의 물리적·기능적 결함 등이 발견되어 보수·보강 등의 조치를 위하여 필요한 경우에는 ( )을 할 것","","긴급점검","정기점검","특별점검","정밀안전점검","4"
"건설안전기사","2021","4","산업안전관리론","4","산업안전보건법령상 타워크레인 지지에 관한 사항으로 ( )에 알맞은 내용은?\n타워크레인을 와이어로프로 지지하는 경우, 설치 각도는 수평면에서 (ㄱ)도 이내로 하되, 지지점은 (ㄴ)개소 이상으로 하고, 같은 각도로 설치하여야 한다.","","ㄱ:45, ㄴ:3","ㄱ:45, ㄴ:4","ㄱ:60, ㄴ:3","ㄱ:60, ㄴ:4","4"
"건설안전기사","2021","4","산업안전관리론","5","사고예방대책의 기본원리 5단계 중 3단계의 분석평가에 관한 내용으로 옳은 것은?","","현장 조사","교육 및 훈련의 개선","기술의 개선 및 인사조정","사고 및 안전활동 기록 검토","1"
"건설안전기사","2021","4","산업안전관리론","6","산업안전보건법령상 노사협의체에 관한 사항으로 틀린 것은?","","노사협의체 정기회의는 1개월마다 노사협의체의 위원장이 소집한다.","공사금액이 20억원 이상인 공사의 관계수급인의 각 대표자는 사용자 위원에 해당된다.","도급 또는 하도급 사업을 포함한 전체 사업의 근로자대표는 근로자 위원에 해당된다.","노사협의체의 근로자위원과 사용자위원은 합의하여 노사협의체에 공사금액이 20억원 미만인 공사의 관계수급인 및 관계수급인 근로자대표를 위원으로 위촉할 수 있다.","1"
"건설안전기사","2021","4","산업안전관리론","7","버드(Bird)의 도미노 이론에서 재해발생과정 중 직접원인은 몇 단계인가?","","1 단계","2단계","3 단계","4단계","3"
"건설안전기사","2021","4","산업안전관리론","8","산업안전보건법령상 상시근로자 20명 이상 50명 미만인 사업장중 안전보건관리담당자를 선임하여야 할 업종이 아닌 것은?","","임업","제조업","건설업","하수, 폐수 및 분뇨 처리업","3"
"건설안전기사","2021","4","산업안전관리론","9","산업안전보건법령상 안전보건표지의 용도 및 색도기준이 바르게 연결된 것은?","","지시표지 : 5N 9.5","금지표지 : 2.5G 4/10","경고표지 : 5Y 8.5/12","안내표지 : 7.5R 4/14","3"
"건설안전기사","2021","4","산업안전관리론","10","A 사업장에서 중상이 10명 발생하였다면 버드(Bird)의 재해구성비율에 의한 경상해자는 몇 명인가?","","50명","100명","145명","300명","2"
"건설안전기사","2021","4","산업안전관리론","11","산업재해 발생 시 조치 순서에 있어 긴급처리의 내용으로 볼 수 없는 것은?","","현장 보존","잠재위험요인 적출","관련 기계의 정지","재해자의 응급조치","2"
"건설안전기사","2021","4","산업안전관리론","12","산업안전보건법령상 안전보건진단을 받아 안전보건개선계획을 수립하여야 하는 대상을 모두 고른 것은?\nㄱ. 산업재해율이 같은 업종 평균 산업 재해율의 2배 이상인 사업장\nㄴ. 사업주가 필요한 안전조치 또는 보건 조치를 이행하지 아니하여 중대재해가 발생한 사업장\nㄷ. 상시근로자 1천명 이상 사업장에서 직업성 질병자가 연간 2명 이상 발생한 사업장","","ㄱ, ㄴ","ㄱ, ㄷ","ㄴ, ㄷ","ㄱ, ㄴ, ㄷ","1"
"건설안전기사","2021","4","산업안전관리론","13","산업안전보건법령상 중대재해에 해당하지 않는 것은?","","사망자 1명이 발생한 재해","12명의 부상자가 동시에 발생한 재해","2명의 직업성 질병자가 동시에 발생한 재해","5개월의 요양이 필요한 부상자가 동시에 3명 발생한 재해","3"
"건설안전기사","2021","4","산업안전관리론","14","T.B.M 활동의 5단계 추진법의 진행순서로 옳은 것은?","","도입→확인→위험예지훈련→작업지시→정비점검","도입→작업지시→위험예지훈련→정비점검→확인","도입→정비점검→작업지시→위험예지훈련→확인","도입→위험예지훈련→작업지시→정비점검→확인","2"
"건설안전기사","2021","4","산업안전관리론","15","보호구 안전인증 고시상 저음부터 고음까지 차음하는 방음용 귀마개의 기호는?","","EM","EP-1","EP-2","EP-3","2"
"건설안전기사","2021","4","산업안전관리론","16","산업재해보상보험법령상 명시된 보험급여의 종류가 아닌 것은?","","장례비","요양급여","휴업급여","생산손실급여","4"
"건설안전기사","2021","4","산업안전관리론","17","맥그리거의 X,Y이론 중 X이론의 관리처방에 해당하는 것은?","","조직구조의 평면화","분권화와 권한의 위임","자체평가제도의 활성화","권위주의적 리더십의 확립","4"
"건설안전기사","2021","4","산업안전관리론","18","산업안전보건법령상 안전보건관리책임자의 업무에 해당하지 않는 것은? (단, 그 밖의 고용노동부령으로 정하는 사항은 제외한다.)","","근로자의 적정배치에 관한 사항","작업환경의 점검 및 개선에 관한 사항","안전보건관리규정의 작성 및 변경에 관한 사항","안전장치 및 보호구 구입 시 적격품 여부 확인에 관한 사항","1"
"건설안전기사","2021","4","산업안전관리론","19","산업안전보건법령상 명시된 안전검사대상 유해하거나 위험한 기계·기구·설비에 해당하지 않는 것은?","","리프트","곤돌라","산업용 원심기","밀폐형 롤러기","4"
"건설안전기사","2021","4","산업안전관리론","20","재해사례연구의 진행단계로 옳은 것은?\nㄱ. 대책수립\nㄴ. 사실의 확인\nㄷ. 문제점의 발견\nㄹ. 재해상황의 파악\nㅁ. 근본적 문제점의 결정","","ㄹ→ㄴ→ㄷ→ㅁ→ㄱ","ㄹ→ㄷ→ㄴ→ㅁ→ㄱ","ㄹ→ㄷ→ㅁ→ㄴ→ㄱ","ㄹ→ㅁ→ㄷ→ㄴ→ㄱ","3"
"건설안전기사","2021","4","산업심리 및 교육","21","인간 착오의 메커니즘으로 틀린 것은?","","위치의 착오","패턴의 착오","느낌의 착오","형(形)의 착오","3"
"건설안전기사","2021","4","산업심리 및 교육","22","산업안전보건법령상 명시된 건설용 리프트·곤돌라를 이용한 작업의 특별교육 내용으로 틀린 것은? (단, 그 밖에 안전·보건관리에 필요한 사항은 제외한다.)","","신호방법 및 공동작업에 관한 사항","화물의 취급 및 작업 방법에 관한 사항","방호 장치의 기능 및 사용에 관한 사항","기계·기구에 특성 및 동작원리에 관한 사항","2"
"건설안전기사","2021","4","산업심리 및 교육","23","테일러(Taylor)의 과학적 관리와 거리가 가장 먼 것은?","","시간 동작 연구를 적용하였다.","생산의 효율성을 상당히 향상시켰다.","인간중심의 관점으로 일을 재설계한다.","인센티브를 도입함으로써 작업자들을 동기화시킬 수 있다.","3"
"건설안전기사","2021","4","산업심리 및 교육","24","프로그램 학습법(programmed self-instruction method)의 단점은?","","보충학습이 어렵다.","수강생의 시간적 활용이 어렵다.","수강생의 사회성이 결여되기 쉽다.","수강생의 개인적인 차이를 조절할 수 없다.","3"
"건설안전기사","2021","4","산업심리 및 교육","25","작업의 어려움, 기계설비의 결함 및 환경에 대한 주의력의 집중혼란, 심신의 근심 등으로 인하여 재해를 많이 일으키는 사람을 지칭하는 것은?","","미숙성 누발자","상황성 누발자","습관성 누발자","소질성 누발자","2"
"건설안전기사","2021","4","산업심리 및 교육","26","안전사고가 발생하는 요인 중 심리적인 요인에 해당하는 것은?","","감정의 불안정","극도의 피로감","신경계통의 이상","육체적 능력의 초과","1"
"건설안전기사","2021","4","산업심리 및 교육","27","허츠버그(Herzberg)의 2 요인 이론 중 동기요인(motivator)에 해당하지 않는 것은?","","성취","작업 조건","인정","작업 자체","2"
"건설안전기사","2021","4","산업심리 및 교육","28","작업의 강도를 객관적으로 측정하기 위한 지표로 옳은 것은?","","강도율","작업시간","작업속도","에너지 대사율(RMR)","4"
"건설안전기사","2021","4","산업심리 및 교육","29","지도자가 부하의 능력에 따라 차별적으로 성과급을 지급하고자 하는 리더십의 권한은?","","전문성 권한","보상적 권한","합법적 권한","위임된 권한","2"
"건설안전기사","2021","4","산업심리 및 교육","30","인간의 욕구에 대한 적응기제(Adjustment Mechanism)를 공격적 기제, 방어적 기제, 도피적 기제로 구분할 때 다음 중 도피적 기제에 해당하는 것은?","","보상","고립","승화","합리화","2"
"건설안전기사","2021","4","산업심리 및 교육","31","알더퍼(Alderfer)의 ERG 이론에서 인간의 기본적인 3가지 욕구가 아닌 것은?","","관계욕구","성장욕구","생리욕구","존재욕구","3"
"건설안전기사","2021","4","산업심리 및 교육","32","주의력의 특성과 그에 대한 설명으로 옳은 것은?","","지속성: 인간의 주의력은 2시간 이상 지속된다.","변동성: 인간은 주의 집중은 내향과 외향의 변동이 반복된다.","방향성: 인간이 주의력을 집중하는 방향은 상하 좌우에 따라 영향을 받는다.","선택성: 인간의 주의력은 한계가 있어 여러 작업에 대해 선택적으로 배분된다.","4"
"건설안전기사","2021","4","산업심리 및 교육","33","파악하고자 하는 연구과제에 대해 언어를 매개로 구조화된 질의응답을 통하여 교육하는 기법은?","","면접(interview)","카운슬링(counseling)","CCS(Civil Communication Section)","ATT(American Telephone & Telegram Co.)","1"
"건설안전기사","2021","4","산업심리 및 교육","34","안전교육방법 중 새로운 자료나 교재를 제시하고, 거기에서의 문제점을 피교육자로하여금 제기하게 하거나, 의견을 여러 가지 방법으로 발표하게 하고, 다시 깊게 파고들어서 토의 하는 방법은?","","포럼(Forum)","심포지엄(Symposium)","버즈세션(Buzz Session)","패널 디스커션(Panel Discussion)","1"
"건설안전기사","2021","4","산업심리 및 교육","35","산업안전보건법령상 근로자 안전보건교육의 교육과정 중 건설 일용근로자의 건설업 기초 안전·보건교육 교육시간 기준으로 옳은 것은?","","1시간 이상","2시간 이상","3시간 이상","4시간 이상","4"
"건설안전기사","2021","4","산업심리 및 교육","36","안전교육의 방법을 지식교육, 기능교육 및 태도교육 순서로 구분하여 맞게 나열한 것은?","","시청각 교육→현장실습 교육→안전작업 동작지도","시청각 교육→안전작업 동작지도→현장실습 교육","현장실습 교육→안전작업 동작지도→시청각 교육","안전작업 동작지도→시청각 교육→현장실습 교육","1"
"건설안전기사","2021","4","산업심리 및 교육","37","O.J.T(On the Job Training)의 장점이 아닌 것은?","","직장의 실정에 맞게 실제적 훈련이 가능하다.","교육을 통한 훈련효과에 의해 상호 신뢰이해도가 높아진다.","대상자의 개인별 능력에 따라 훈련의 진도를 조정하기가 쉽다.","교육훈련 대상자가 교육훈련에만 몰두할 수 있어 학습효과가 높다.","4"
"건설안전기사","2021","4","산업심리 및 교육","38","학습목적의 3요소가 아닌 것은?","","목표(goal)","주제(subject)","학습정도(level of learning)","학습방법(method of learning)","4"
"건설안전기사","2021","4","산업심리 및 교육","39","학습된 행동이 지속되는 것을 의미하는 용어는?","","회상(recall)","파지(retention)","재인(recognition)","기명(memorizing)","2"
"건설안전기사","2021","4","산업심리 및 교육","40","작업자들에게 적성검사를 실시하는 가장 큰 목적은?","","작업자의 협조를 얻기 위함","작업자의 인간관계 개선을 위함","작업자의 생산능률을 높이기 위함","작업자의 업무량을 최대로 할당하기 위함","3"
"건설안전기사","2021","4","인간공학 및 시스템안전공학","41","인간공학적 수공구 설계원칙이 아닌 것은?","","손목을 곧게 유지할 것","반복적인 손가락 동작을 피할 것","손잡이 접촉 면적을 작게 설계할 것","조직(tissue)에 가해지는 압력을 피할 것","3"
"건설안전기사","2021","4","인간공학 및 시스템안전공학","42","NIOSH 지침에서 최대허용한계(MPL)는 활동한계(AL)의 몇 배인가?","","1배","3배","5배","9배","2"
"건설안전기사","2021","4","인간공학 및 시스템안전공학","43","FMEA의 특징에 대한 설명으로 틀린 것은?","","서브시스템 분석 시 FTA보다 효과적이다.","양식이 비교적 간단하고 적은 노력으로 특별한 훈련 없이 해석이 가능하다.","시스템 해석기법은 정성적·귀납적 분석법 등에 사용된다.","각 요소간 영향 해석이 어려워 2가지 이상 동시 고장은 해석이 곤란하다.","1"
"건설안전기사","2021","4","인간공학 및 시스템안전공학","44","인간공학에 대한 설명으로 틀린 것은?","","제품의 설계 시 사용자를 고려한다.","환경과 사람이 격리된 존재가 아님을 인식한다.","인간공학의 목표는 기능적 효과, 효율 및 인간 가치를 향상시키는 것이다.","인간의 능력 및 한계에는 개인차가 없다고 인지한다.","4"
"건설안전기사","2021","4","인간공학 및 시스템안전공학","45","인간-기계시스템에서의 여러 가지 인간에러와 그것으로 인해 생길 수 있는 위험성의 예측과 개선을 위한 기법은?","","PHA","FHA","OHA","THERP","4"
"건설안전기사","2021","4","인간공학 및 시스템안전공학","46","개선의 ECRS의 원칙에 해당하지 않는 것은?","","제거(Eliminate)","결합(Combine)","재조정(Rearrange)","안전(Safety)","4"
"건설안전기사","2021","4","인간공학 및 시스템안전공학","47","표시장치로부터 정보를 얻어 조종장치를 통해 기계를 통제하는 시스템은?","","수동 시스템","무인 시스템","반자동 시스템","자동 시스템","3"
"건설안전기사","2021","4","인간공학 및 시스템안전공학","48","Q10 효과에 직접적인 영향을 미치는 인자는?","","고온 스트레스","한랭한 작업장","중량물의 취급","분진의 다량발생","1"
"건설안전기사","2021","4","인간공학 및 시스템안전공학","49","결함수분석(FTA)에 의한 재해사례의 연구 순서로 옳은 것은?\n㉠ FT(Fault Tree)도 작성\n㉡ 개선안 실시계획\n㉢ 톱 사상의 선정\n㉣ 사상마다 재해원인 및 요인 규명\n㉤ 개선계획 작성","","㉡→㉢→㉠→㉣→㉤","㉢→㉣→㉠→㉤→㉡","㉡→㉣→㉢→㉠→㉤","㉢→㉠→㉣→㉤→㉡","2"
"건설안전기사","2021","4","인간공학 및 시스템안전공학","50","물체의 표면에 도달하는 빛의 밀도를 뜻하는 용어는?","","광도","광량","대비","조도","4"
"건설안전기사","2021","4","인간공학 및 시스템안전공학","51","시각적 표시장치와 청각적 표시장치 중 시각적 표시장치를 선택해야 하는 경우는?","","메시지가 긴 경우","메시지가 후에 재창조되지 않는 경우","직무상 수신자가 자주 움직이는 경우","메시지가 시간적 사상(event)을 다룬 경우","1"
"건설안전기사","2021","4","인간공학 및 시스템안전공학","52","조작과 반응과의 관계, 사용자의 의도와 실제 반응과의 관계, 조종장치와 작동결과에 관한 관계 등 사람들이 기대하는 바와 일치하는 관계가 뜻하는 것은?","","중복성","조직화","양립성","표준화","3"
"건설안전기사","2021","4","인간공학 및 시스템안전공학","53","FT도에 사용되는 다음 기호의 명칭은?","O","억제게이트","조합AND게이트","부정게이트","베타적 OR게이트","2"
"건설안전기사","2021","4","인간공학 및 시스템안전공학","54","일정한 고장률을 가진 어떤 기계의 고장률이 시간당 0.008일 때 5시간 이내에 고장을 일으킬 확률은?","","$1+e^{0.04}$","$1-e^{-0.004}$","$1-e^{0.04}$","$1-e^{-0.04}$","4"
"건설안전기사","2021","4","인간공학 및 시스템안전공학","55","HAZOP기법에서 사용하는 가이드워드와 그 의미가 틀린 것은?","","Other than: 기타 환경적인 요인","No/Not: 디자인 의도의 완전한 부정","Reverse: 디자인 의도의 논리적 반대","More/Less: 정량적인 증가 또는 감소","1"
"건설안전기사","2021","4","인간공학 및 시스템안전공학","56","음압수준이 60dB일 때 1000Hz에서 순음의 phon의 값은?","","50phon","60phon","90phon","100phon","2"
"건설안전기사","2021","4","인간공학 및 시스템안전공학","57","인간의 오류모형에서 상황해석을 잘못하거나 목표를 잘못 이해하고 착각하여 행하는 경우를 뜻하는 용어는?","","실수(Slip)","착오(Mistake)","건망증(Lapse)","위반(Violation)","2"
"건설안전기사","2021","4","인간공학 및 시스템안전공학","58","프레스기어의 안전장치 수명은 지수분포를 따르며 평균 수명이 1000시간일 때, A와 B에 알맞은 값은 약 얼마인가?\nA: 새로 구입한 안전장치가 향후 500시간 동안 고장 없이 작동할 확률\nB: 이미 1000 시간을 사용한 안전장치가 향후 500시간 이상 견딜 확률","","A: 0.606, B: 0.606","A: 0.808, B: 0.606","A: 0.606, B: 0.808","A: 0.808, B: 0.808","1"
"건설안전기사","2021","4","인간공학 및 시스템안전공학","59","FT도에서 신뢰도는? (단 A발생확률은 0.01, B발생확률은 0.02이다.)","","96.02%","97.02%","98.02%","99.02%","2"
"건설안전기사","2021","4","인간공학 및 시스템안전공학","60","위험성평가 시 위험의 크기를 결정하는 방법이 아닌 것은?","","덧셈법","곱셈법","뺄셈법","행렬법","3"
"건설안전기사","2021","4","건설시공학","61","기존에 구축된 건축물 가까이에서 건축공사를 실시할 경우 기존 건축물의 지반과 기초를 보강하는 공법은?","","리버스 서큘레이션 공법","언더피닝 공법","슬러리 월 공법","탑다운 공법","2"
"건설안전기사","2021","4","건설시공학","62","다음은 기성말뚝 세우기에 관한 표준시방서 규정이다. ( )안에 순서대로 들어갈 내용으로 옳게 짝지어진 것은? (단, 보기항의 D는 말뚝의 바깥지름 임)","","1/50, D/4","1/100, D/3","1/150, D/4","1/150, D/3","1"
"건설안전기사","2021","4","건설시공학","63","철골공사에서 발생하는 용접 결함이 아닌 것은?","","피트(Pit)","블로우 홀(Blow hole)","오버랩(Over lap)","가우징(Gouging)","4"
"건설안전기사","2021","4","건설시공학","64","원심력 고강도 프리스트레스트 콘크리트말뚝의 이음방법 중 가장 강성이 우수하고 안전하여 많이 사용하는 이음방법은?","","충전식이음","볼트식이음","용접식이음","강관말뚝이음","3"
"건설안전기사","2021","4","건설시공학","65","철근이음의 종류 중 나사를 가지는 슬리브 또는 커플러, 에폭시나 모르타르 또는 용융 금속 등을 충전한 슬리브, 클립이나 편체 등의 보조장치 등을 이용한 것을 무엇이라 하는가?","","겹침이음","가스압접 이음","기계적 이음","용접이음","3"
"건설안전기사","2021","4","건설시공학","66","R.C.D(리버스 서큘레이션 드릴)공법의 특징으로 옳지 않은 것은?","","드릴파이프 직경보다 큰 호박돌이 있는 경우 굴착이 불가하다.","깊은 심도까지 굴착이 가능하다.","시공속도가 빠른 장점이 있다.","수상(해상)작업이 불가하다.","4"
"건설안전기사","2021","4","건설시공학","67","보강블록공사 시 벽의 철근 배치에 관한 설명으로 옳지 않은 것은?","","가로근을 배근 상세도에 따라 가공하되, 그 단부는 180º의 갈구리로 구부려 배근한다.","블록의 공동에 보강근을 배치하고 콘크리트를 다져 넣기 때문에 세로줄눈은 막힌줄눈으로 하는 것이 좋다.","세로근은 기초 및 테두리보에서 위층의 테두리보까지 잇지 않고 배근하여 그 정착길이는 철근 직경의 40배 이상으로 한다.","벽의 세로근은 구부리지 않고 항상 진동 없이 설치한다.","2"
"건설안전기사","2021","4","건설시공학","68","철근공사 시 철근의 조립과 관련된 설명으로 옳지 않은 것은?","","철근이 바른 위치를 확보할 수 있도록 결속선으로 결속하여야 한다.","철근을 조립한 다음 장기간 경과한 경우에는 콘크리트의 타설 전에 다시 조립검사를 하고 청소하여야 한다.","경미한 황갈색의 녹이 발생한 철근은 콘크리트와의 부착이 매우 불량하므로 사용이 불가하다.","철근의 피복두께를 정확하게 확보하기 위해 적절한 간격으로 고임재 및 간격재를 배치하여야 한다.","3"
"건설안전기사","2021","4","건설시공학","69","공사계약방식에서 공사실시 방식에 의한 계약제도가 아닌 것은?","","일식도급","분할도급","실비정산보수가산도급","공동도급","3"
"건설안전기사","2021","4","건설시공학","70","알루미늄 거푸집에 관한 설명으로 옳지 않은 것은?","","경량으로 설치시간이 단축된다.","이음매(Joint) 감소로 견출작업이 감소된다.","주요 시공 부위는 내부벽체, 슬래브, 계단실 벽체이며, 슬래브 필러 시스템이 있어서 해체가 간편하다.","녹이 슬지 않는 장점이 있으나 전용횟수가 매우 적다.","4"
"건설안전기사","2021","4","건설시공학","71","철거작업 시 지중장애물 사전조사항목으로 가장 거리가 먼 것은?","","주변 공사장에 설치된 모든 계측기 확인","기존 건축물의 설계도, 시공기록 확인","가스, 수도, 전기 등 공공매설물 확인","시험굴착, 탐사 확인","1"
"건설안전기사","2021","4","건설시공학","72","벽돌쌓기 시 사전준비에 관한 설명으로 옳지 않은 것은?","","줄기초, 연결보 및 바닥 콘크리트의 쌓기면은 작업 전에 청소하고, 우묵한 곳은 모르타르로 수평지게 고른다.","벽돌에 부착된 흙이나 먼지는 깨끗이 제거한다.","모르타르는 지정한 배합으로 하되 시멘트와 모래는 건비빔으로 하고, 사용할 때에는 쌓기에 지장이 없는 유동성이 확보되도록 물을 가하고 충분히 반죽하여 사용한다.","콘크리트 벽돌은 쌓기 직전에 충분한 물축이기를 한다.","4"
"건설안전기사","2021","4","건설시공학","73","콘크리트는 신속하게 운반하여 즉시 타설하고, 충분히 다져야 하는데 비비기로부터 타설이 끝날 때까지의 시간은 원칙적으로 얼마를 넘어서면 안 되는가? (단, 외기온도가 25°C 이상일 경우)","","1.5시간","2시간","2.5시간","3시간","1"
"건설안전기사","2021","4","건설시공학","74","피어기초공사에 관한 설명으로 옳지 않은 것은?","","중량구조물을 설치하는데 있어서 지반이 연약하거나 말뚝으로도 수직지지력이 부족하여 그 시공이 불가능한 경우와 기초지반의 교란을 최소화해야 할 경우에 채용한다.","굴착된 흙을 직접 탐사할 수 있고 지지층의 상태를 확인할 수 있다.","진동과 소음이 발생하는 공법이긴 하나 여타 기초형식에 비하여 공기 및 비용이 적게 소요된다.","피어기초를 채용한 국내의 초고층 건축물에는 63빌딩이 있다.","3"
