"Test Name","Year","Session","Subject","Number","Question","Question_image","Option 1","Option 2","Option 3","Option 4","Answer"
"건설안전산업기사","2008","1","건설재료학","77","철강의 부식에 관한 설명 중 틀린 것은?","","토양 속에서의 강재부식은 전기전도도가 낮을수록, pH값이 높을수록 빠르다.","철강의 표면은 대기중의 습기나 탄산가스와 반응하여 수산화제이철, 수산화제일철 및 탄산철 등으로 구성되는 녹을 발생시킨다.","물 특히 바닷물 속에서 부식되기 쉬우며, 물과 공기에 번갈아 접촉시키면 더욱 부식되기 쉽다.","철근콘크리트 중의 철근 부식은 콘크리트의 성질에 영향을 받는다.","1"
"건설안전산업기사","2008","1","건설재료학","78","다음 중 염화비닐수지의 용도로 가장 적절치 않은 것은?","","파이프","타일","도료","유리 대용품","4"
"건설안전산업기사","2008","1","건설재료학","79","건축재료로서 사용되는 합성수지의 일반적 특성으로 옳은 것은?","","흡수성이 적고 거의 투수성이 없다.","내열성, 내화성이 크다.","강성이 크고 탄성계수가 강재보다 크다.","마모가 크고 탄력성이 작다.","1"
"건설안전산업기사","2008","1","건설재료학","80","다음 점토 제품에 관한 설명 중 옳은 것은?","","흡수성의 크기는 도기>석기>자기>토기의 순이다.","소성온도가 높을수록 흡수율이 낮다.","토기는 주로 모자이크 타일로 사용된다.","외장용 타일에 사용되는 것은 토기이다.","2"
"건설안전산업기사","2008","1","건설안전기술","81","기초의 안전상 부동침하를 방지하는 대책이 아닌 것은?","","구조물의 전체 하중이 기초에 균등하게 분포되도록 한다.","기초 상호간의 지중보로 연결한다.","한 구조물의 기초는 2종류 이상의 복합적인 기초형식으로 한다.","기초 지반 아래의 토질이 연약할 경우는 연약지반처리 공법으로 보강한다.","3"
"건설안전산업기사","2008","1","건설안전기술","82","화물을 차량계 하역운반 기계·기구에 싣고 내리는 작업시 작업 지휘자를 지정하여야 하는 것은 단위화물 중량이 얼마 이상일 때를 기준으로 하는가?","","100kg","200kg","300kg","400kg","1"
"건설안전산업기사","2008","1","건설안전기술","83","기준에 적합한 작업발판의 설치가 필요한 비계의 최소 높이는?","","1m","2m","3m","4m","2"
"건설안전산업기사","2008","1","건설안전기술","84","콘크리트 타설시 안전에 유의해야 할 사항으로 적절하지 않는 것은?","","타설 순서는 계획에 의하여 실시한다.","타설 속도는 하계 $1.0m/h$, 동계 $1.5m/h$를 표준으로한다.","콘크리트를 치는 도중에는 거푸집, 동바리 등의 이상유무를 확인하여야 한다.","타설시 공동이 발생되지 않도록 밀실하게 부어 넣는다.","2"
"건설안전산업기사","2008","1","건설안전기술","85","건물 외부에 설치하는 안전방망의 수평면과의 설치 각도로 옳은 것은?","","$20^{\\circ}\\sim30^{\\circ}$","$40^{\\circ}\\sim50^{\\circ}$","$60^{\\circ}\\sim70^{\\circ}$","$80^{\\circ}$ 이상","1"
"건설안전산업기사","2008","1","건설안전기술","86","암반 굴착공사에서 굴착높이가 5m 굴착기초면의 폭이 5m인 경우 양단면 굴착을 할 때 상부단면의 폭은? (단, 굴착기울기는 1:0.5로 한다.)","","5m","15m","10m","20m","2"
"건설안전산업기사","2008","1","건설안전기술","87","안전대의 등급을 4개로 분류할 때 작업장 작업발판을 설치하기 곤란할 때 착용하는 1개걸이 전용 안전대의 등급은?","","1종","2종","3종","4종","2"
"건설안전산업기사","2008","1","건설안전기술","88","현장에서 강관을 사용하여 비계를 구성하는 때에 비계기둥간의 적재하중은 얼마를 초과해서는 안되는가?","","200kg","300kg","400kg","500kg","3"
"건설안전산업기사","2008","1","건설안전기술","89","교류아크 용접기에 부착해야 할 방호장치는?","","권과방지장치","과부하방지장치","자동전격방지장치","양수조작식방호장치","3"
"건설안전산업기사","2008","1","건설안전기술","90","부득이한 경우를 제외한 일반적인 경우에 공사용 가설 도로의 최고 허용 경사도는 얼마인가?","","5%","10%","20%","30%","2"
"건설안전산업기사","2008","1","건설안전기술","91","크레인을 사용하여 양중작업을 하는 때에 안전한 작업을 위해 준수하여야 할 내용으로 틀린 것은?","","인양할 하물을 바닥에서 끌어당기거나 밀어 정위치 작업을 할 것","가스통 등 운반 도중에 떨어져 폭발 가능성이 있는 위험물 용기는 보관함에 담아 매달아 운반할 것","인양 중인 하물이 작업자의 머리 위로 통과하게 하지 아니할 것","인양할 하물이 보이지 아니하는 경우에는 어떠한 동작도 하지 아니할 것","1"
"건설안전산업기사","2008","1","건설안전기술","92","지반의 굴착작업에 있어 지반의 붕괴 또는 매설물 등의 손괴 등에 의하여 근로자에게 위험이 미칠 우려가 있을 때미리 작업장소 및 주변에 대하여 조사하여 굴착시기와 작업순서를 정하여야 한다. 이때의 조사사항과 거리가 먼 것은?","","형상, 지질 및 지층의 상태","균열, 함수, 용수의 유무 및 동결의 유무 또는 상태","매설물 등의 유무 또는 상태","흙막이 지보공 상태","4"
"건설안전산업기사","2008","1","건설안전기술","93","크레인의 조립 또는 해체작업시 취해야 할 조치로서 적당하지 않은 것은?","","작업순서를 정하고 그 순서에 의해 작업을 한다.","악천후 시에는 작업을 중지시킨다.","충분한 공간을 확보하고 장애물이 없도록 한다.","작업구역에는 자격증을 보유한 자만 출입시킨다.","4"
"건설안전산업기사","2008","1","건설안전기술","94","사질토 지반 굴착시 모래의 보일링 현상에 의한 흙막이공의 붕괴를 예방하기 위한 대책으로 틀린 것은?","","흙막이벽의 근입장 증가","주변의 지하수위 저하","투수거리를 길게 하기 위한 지수벽 설치","굴착 주변의 상재 하중 증가","4"
"건설안전산업기사","2008","1","건설안전기술","95","가설통로의 구조로서 적당하지 않은 것은?","","일반적으로 경사는 30도 이하로 할 것","높이가 2m 미만인 경우 튼튼한 손잡이를 설치할때경사는 30도를 초과할 수 있다.","경사가 15도를 초과하는 때에는 미끄러지지 아니하는 구조로 할 것","높이 10m 이상인 비계다리에는 8m 이내마다 계단참을 설치할 것","4"
"건설안전산업기사","2008","1","건설안전기술","96","2m 이상의 비계(달비계, 달대비계 및 말비계 제외)에서 작업할 때 작업발판의 구조에 대한 기준으로 옳은 것은?","","작업발판의 폭(외줄비계 제외): 30cm 이상, 발판 재료간의 틈: 3cm 이하","작업발판의 폭(외줄비계 제외): 40cm 이상, 발판 재료간의 틈: 3cm 이하","작업발판의 폭(외출비계 제외): 30cm 이상, 발판 재료간의 름: 5cm 이하","작업발판의 폭(외줄비계 제외): 40cm 이상, 발판 재료간의 틈: 5cm 이하","2"
"건설안전산업기사","2008","1","건설안전기술","97","거푸집 동바리 설치 기준을 잘못 설명한 것은?","","파이프서포트는 3본 이상 이어서 사용하지 않는다.","강관을 지주로 사용할 때에 수평연결재를 2m 이내마다. 2개 방향으로 설치한다.","조립강주를 지주로 사용할 때는 높이 5m 이내마다 수평연결재를 2방향으로 설치한다.","강관틀을 지주로 사용할 때는 강관틀과 강관들의 사이에 교차가새를 설치한다.","3"
"건설안전산업기사","2008","1","건설안전기술","98","고소작업을 할 때 재료나 공구 등의 낙하로 인한 피해를 방지하기 위해 설치하는 설비에 해당하지 않는 것은?","","낙하물 방지망","수직보호망","안전난간","방호선반","3"
"건설안전산업기사","2008","1","건설안전기술","99","건설공사에서 발코니 단부, 엘리베이터 입구, 재료 반입 구 등과 같이 벽면 혹은 바닥에 추락의 위험이 우려되는 장소를 가리키는 용어는?","","비계","개구부","가설구조물","연결통로","2"
"건설안전산업기사","2008","1","건설안전기술","100","유해·위험방지계획서의 제출시 첨부서류의 항목이 아닌 것은?","","공사개요","안전보건관리계획","작업환경 조성계획","보호장비 폐기계획","4"