"Test Name","Year","Session","Subject","Number","Question","Question_image","Option 1","Option 2","Option 3","Option 4","Answer"
"건설안전산업기사","2018","2","건설재료학","80","모래의 함수율과 용적변화에서 이넌데이트(inundate) 현상이란 어떤 상태를 말하는가?","","함수율 0~8%에서 모래의 용적이 증가하는 현상","함수율 8%의 습윤상태에서 모래의 용적이 감소하는 현상","함수율 8%에서 모래의 용적이 최고가 되는 현상","절건상태와 습윤상태에서 모래의 용적이 동일한 현상","4"
"건설안전산업기사","2018","2","건설안전기술","81","달비계에 사용이 불가한 와이어로프의 기준으로 옳지 않은 것은?","","이음매가 없는 것","지름의 감소가 공칭지름의 7%를 초과하는 것","심하게 변형되거나 부식된 것","와이어로프의 한 꼬임에서 끊어진 소선(素線)의 수가 10% 이상인 것","1"
"건설안전산업기사","2018","2","건설안전기술","82","다음은 산업안전보건기준에 관한 규칙 중 가설통로의 구조에 관한 사항이다. ( )안에 들어갈 내용으로 옳은 것은?\n수직갱에 가설된 통로의 길이가 15m 이상인 경우에는 10m 이내마다 ( )을/를 설치할 것","","손잡이","계단참","클램프","버팀대","2"
"건설안전산업기사","2018","2","건설안전기술","83","다음 중 구조물의 해체작업을 위한 기계·기구가 아닌 것은?","","쇄석기","데릭","압쇄기","철제 해머","2"
"건설안전산업기사","2018","2","건설안전기술","84","강풍 시 타워크레인의 설치·수리·점검 또는 해체 작업을 중지하여야 하는 순간풍속 기준으로 옳은 것은?","","순간풍속이 초당 10m를 초과하는 경우","순간풍속이 초당 15m를 초과하는 경우","순간풍속이 초당 20m를 초과하는 경우","순간풍속이 초당 30m를 초과하는 경우","1"
"건설안전산업기사","2018","2","건설안전기술","85","근로자의 추락 위험이 있는 장소에서 발생하는 추락재해의 원인으로 볼 수 없는 것은?","","안전대를 부착하지 않았다.","덮개를 설치하지 않았다.","투하설비를 설치하지 않았다.","안전난간을 설치하지 않았다.","3"
"건설안전산업기사","2018","2","건설안전기술","86","기상상태의 악화로 비계에서의 작업을 중지시킨 후 그 비계에서 작업을 다시 시작하기 전에 점검해야 할 사항에 해당하지 않는 것은?","","기둥의 침하 변형·변위 또는 흔들림 상태","손잡이의 탈락 여부","격벽의 설치여부","발판재료의 손상 여부 및 부착 또는 걸림 상태","3"
"건설안전산업기사","2018","2","건설안전기술","87","사다리식 통로 등을 설치하는 경우 발판과 벽과의 사이는 최소 얼마 이상의 간격을 유지하여야 하는가?","","5cm","10cm","15cm","20cm","3"
"건설안전산업기사","2018","2","건설안전기술","88","드럼에 다수의 돌기를 붙여 놓은 기계로 점토층의 내부를 다지는 데 적합한 것은?","","탠덤 롤러","타이어 롤러","진동 롤러","탬핑 롤러","4"
"건설안전산업기사","2018","2","건설안전기술","89","산업안전보건법령에 따른 중량물을 취급하는 작업을 하는 경우의 작업계획서 내용에 포함되지 않는 사항은?","","추락위험을 예방할 수 있는 안전대책","낙하위험을 예방할 수 있는 안전대책","전도위험을 예방할 수 있는 안전대책","위험물 누출위험을 예방할 수 있는 안전대책","4"
"건설안전산업기사","2018","2","건설안전기술","90","산업안전보건관리비 계상을 위한 대상액이 56억원인 교량공사의 산업안전보건관리비는 얼마인가? (단, 일반건설공사(갑)에 해당)","","104,160 천원","110.320 천원","144,800 천원","150,400 천원","2"
"건설안전산업기사","2018","2","건설안전기술","91","콘크리트 구조물에 적용하는 해체작업 공법의 종류가 아닌 것은?","","연삭 공법","발파 공법","오픈컷 공법","유압 공법","3"
"건설안전산업기사","2018","2","건설안전기술","92","콘크리트 타설작업 시 거푸집에 작용하는 연직하중이 아닌 것은?","","콘크리트의 측압","거푸집의 중량","굳지 않은 콘크리트의 중량","작업원의 작업하중","1"
"건설안전산업기사","2018","2","건설안전기술","93","거푸집 공사에 관한 설명으로 옳지 않은 것은?","","거푸집 조립 시 거푸집이 이동하지 않도록 비계 또는 기타 공작물과 직접 연결한다.","거푸집 치수를 정확하게 하여 시멘트 모르타르가 새지 않도록 한다.","거푸집 해체가 쉽게 가능하도록 박리제 사용 등의 조치를 한다.","측압에 대한 안전성을 고려한다.","1"
"건설안전산업기사","2018","2","건설안전기술","94","개착식 굴착공사에서 버팀보공법을 적용하여 굴착할 때 지반붕괴를 방지하기 위하여 사용하는 계측장치로 거리가 먼 것은?","","지하수위계","경사계","변형률계","록볼트응력계","4"
"건설안전산업기사","2018","2","건설안전기술","95","다음 중 유해·위험방지 계획서 제출 대상 공사에 해당하는 것은?","","지상높이가 25m인 건축물 건설공사","최대 지간길이가 45m인 교량공사","깊이가 8m인 굴착공사","제방 높이가 50m인 다목적댐 건설공사","4"
"건설안전산업기사","2018","2","건설안전기술","96","차량계 하역운반기계등을 사용하는 작업을 할 때, 그 기계가 넘어지거나 굴러떨어짐으로써 근로자에게 위험을 미칠 우려가 있는 경우에 이를 방지하기 위한 조치사항과 거리가 먼 것은?","","유도자 배치","지반의 부동침하방지","상단부분의 안정을 위하여 버팀줄 설치","갓길 붕괴방지","3"
"건설안전산업기사","2018","2","건설안전기술","97","추락재해 방지용 방망의 신품에 대한 인장강도는 얼마인가? (단, 그물코의 크기가 10cm 이며, 매듭 없는 방망)","","220kg","240kg","260kg","280kg","2"
"건설안전산업기사","2018","2","건설안전기술","98","발파작업에 종사하는 근로자가 준수하여야 할 사항으로 옳지 않은 것은?","","장전구는 마찰·충격 정전기 등에 의한 폭발의 위험이 없는 안전한 것을 사용할 것","발파공의 충진재료는 점토 모래 등 발화성 또는 인화성의 위험이 없는 재료를 사용할 것","얼어붙은 다이나마이트는 화기에 접근시키거나 그 밖의 고열물에 직접 접촉시켜 단시간 안에 융해시킬 수 있도록할 것","전기뇌관에 의한 발파의 경우 점화하기 전에 화약류를 장전한 장소로부터 30m 이상 떨어진 안전한 장소에서 전선에 대하여 저항측정 및 도통시험을 할 것","3"
"건설안전산업기사","2018","2","건설안전기술","99","다음은 산업안전보건법령에 따른 근로자의 추락위험 방지를 위한 추락방호망의 설치기준이다. ( )안에 들어갈 내용으로 옳은 것은?\n추락방호망은 수평으로 설치하고, 망의 처짐은 짧은 변 길이의 ( ) 이상이 되도록 할 것","","10%","12%","15%","18%","2"
"건설안전산업기사","2018","2","건설안전기술","100","거푸집동바리등을 조립하는 경우의 준수사항으로 옳지 않은 것은?","","동바리로 사용하는 파이프 서포트는 최소 3개 이상 이어서 사용하도록 할 것","동바리의 상하 고정 및 미끄러짐 방지 조치를 하고, 하중의 지지상태를 유지할 것","동바리의 이음은 맞댄이음이나 장부이음으로 하고 같은 품질의 재료를 사용할 것","강재와 강재의 접속부 및 교차부는 볼트클램프 등 전용철물을 사용하여 단단히 연결할 것","1"
