"Test Name","Year","Session","Subject","Number","Question","Question_image","Option 1","Option 2","Option 3","Option 4","Answer"
"건설안전기사","2014","4","산업안전관리론","1","다음 중 시설물의 안전관리에 관한 특별법상 용어의 설명으로 옳은 것은?(관련 규정 개정전 문제로 여기서는 기존 정답인 3번을 누르면 정답 처리됩니다. 자세한 내용은 해설을 참고하세요.)","","'시설물'이란 건설공사를 통하여 만들어진 구조물과 그 부대시설로서 1종시설물, 2종시설물 및 3종시설물로 구분되어진다.","'3종시설물'이란 1종과 2종시설물 외의 시설물로서 대통령령으로 정하는 시설물을 말한다.","'안전점검'이란 경험과 기술을 갖춘 자가 육안이나 점검기구 등으로 검사하여 시설물에 내재(內在)되어 있는 위험요인을 조사하는 행위를 말한다.","'관리주체'란 관계 법령에 따라 해당 시설물의 관리자로 규정된 자나 해당 시설물의 소유자로 민간관리주체(民間管理主體)와 비민간관리주체(非民間管理主體)로 구분한다.","3"
"건설안전기사","2014","4","산업안전관리론","2","다음 중 위험예지훈련에서 활용하는 기법으로 가장 적합한 것은?","","심포지엄(symposium)","예비사고분석(PHA)","O.J.T(On the Job Training)","브레인스토밍(brainstorming)","4"
"건설안전기사","2014","4","산업안전관리론","3","산업안전보건법령에 따라 안전보건관리규정을 작성하여야 할 사업의 사업주는 안전보건관리규정을 작성하여야 할 사유가 발생한 날부터 며칠 이내에 작성하여야 하는가?","","7일","14일","30일","60일","3"
"건설안전기사","2014","4","산업안전관리론","4","다음 중 무재해운동의 기본이념의 3원칙과 가장 거리가 먼 것은?","","무(zero)의 원칙","관리의 원칙","참가의 원칙","선취의 원칙","2"
"건설안전기사","2014","4","산업안전관리론","5","다음 중 사업재해의 기본원인으로 볼 수 있는 4M에 해당하는 것으로만 나열한 것은?","","Man. Management. Machine. Media","Man, Management, Machine, Material","Man, Machine, Maker, Management","Man. Machine, Maker, Media","1"
"건설안전기사","2014","4","산업안전관리론","6","A사업장의 연간 도수율이 4일 때 연천인율은 얼마인가?(단. 근로자 1인당 연간근로시간은 2400시간으로 한다.)","","1.7","9.6","15","20","2"
"건설안전기사","2014","4","산업안전관리론","7","재해손실비의 평가방식 중 시몬즈(simonds) 방식에서 비보험 코스트의 산정 항목에 해당하지 않는 것은?","","사망사고건수","무상해사고건수","통원상해건수","응급조치건수","1"
"건설안전기사","2014","4","산업안전관리론","8","다음 중 산업안전보건법에 따라 구성, 운영되는 산업안전 보건위원회의 심의·의결사항이 아닌 것은?","","안전보건관리규정의 작성 및 변경에 관한 사항","작업환경측정 등 작업환경의 점검 및 개선에 관한 사항","사업장 경영체계 구성 및 운영에 관한 사항","산업재해 예방계획의 수립에 관한 사항","3"
"건설안전기사","2014","4","산업안전관리론","9","다음 중 일반적인 보호구의 관리 방법으로 가장 적절하지 않은 것은?","","정기적으로 점검하고 관리한다.","청결하고 습기가 없는 곳에 보관한다.","세척한 후에는 햇볕에 완전히 건조시켜 보관한다.","항상 깨끗이 보관하고 사용 후 건조시켜 보관한다.","3"
"건설안전기사","2014","4","산업안전관리론","10","산업안전보건법령상 고소작업대를 사용하여 작업을 하는 때의 작업시작 전 점검사항에 해당하지 않는 것은?","","작업면의 기울기 또는 요철 유무","아웃트리거 또는 바퀴의 이상 유무","충전장치를 포함한 홀더 등의 결합상태의 이상 유무","비상정지장치 및 비상하강 방지장치 기능의 이상 유무","3"
"건설안전기사","2014","4","산업안전관리론","11","다음 설명에 해당하는 재해의 통계적 원인분석 방법은?\n\n2개 이상의 문제 관계를 분석하는데 사용하는 것으로 데이터를 집계하고, 표로 표시하며 요인별 결과내역을 교차한 그림을 작성, 분석하는 방법","","파레토도","특성요인도","관리도","클로즈 분석","4"
"건설안전기사","2014","4","산업안전관리론","12","다음 중 산업안전보건법령상 사업주는 고용노동부장관이 정하는 바에 따라 해당 공사를 위하여 계상된 산업안전보건관리비의 사용명세는 공사종료 후 얼마동안 보존하여야 하는가?","","6개월","1년","2년","3년","2"
"건설안전기사","2014","4","산업안전관리론","13","다음 중 재해의 원인에 있어 기술적 원인에 해당되지 않는 것은?","","경험 및 훈련의 미숙","구조, 재료의 부적합","점검, 정비, 보존 불량","건물, 기계장치 설계 불량","1"
"건설안전기사","2014","4","산업안전관리론","14","다음 중 산업안전보건법령상 안전인증기관이 하는 안전인증 심사의 종류에 해당되는 않는 것은?","","서면심사","예비심사","제품심사","완성심사","4"
"건설안전기사","2014","4","산업안전관리론","15","다음 중 하인리히가 제시한 재해발생의 연쇄성 이론의 도미노 이론에서 3단계에 해당하는 요소로서 사고나 재해예방에 가장 핵심이 되는 요소는?","","사고","개인적 결함","사회적 환경 및 유전적 요소","불안전한 행동 및 불안전한 상태","4"
"건설안전기사","2014","4","산업안전관리론","16","다음 중 산업안전보건법령상 안전관리자를 2인 이상 선임하여야 하는 사업에 해당하지 않는 것은?","","공사금액이 1000억원인 건설업","상시 근로자가 500명인 통신업","상시 근로자가 1500명인 운수업","상시 근로자가 600명인 식료품 제조업","2"
"건설안전기사","2014","4","산업안전관리론","17","다음 중 재해조사시 유의사항으로 가장 적절한 것은?","","재발방지 목적보다 책임 소재 파악을 우선으로 하는 기본적인 태도를 갖는다.","사람, 기계설비 재해요인 중 물적 재해요인을 먼저 도출한다.","2차 재해예방과 위험성에 대한 보호구를 착용한다.","조사자의 전문성을 고려하여 단독으로 조사하며, 사고정황을 추정한다.","3"
"건설안전기사","2014","4","산업안전관리론","18","다음 중 재해방지를 위한 안전관리 조직의 목적과 가장 거리가 먼 것은?","","위험요소의 제거","기업의 재무제표 안정화","재해방지 기술의 수준 향상","재해 예방율의 향상 및 단위당 예방비용의 절감","2"
"건설안전기사","2014","4","산업안전관리론","19","산업안전보건법령상 화학물질 취급장소에서의 유해·위험경고 이외의 위험경고, 주의표지 또는 기계방호물에 사용되는 안전·보건표지 색채의 색도기준은?","","5Y 8.5/12","2.5PB 4/10","2.5G 4/10","N9.5","1"
"건설안전기사","2014","4","산업안전관리론","20","다음 중 재해예방의 5단계에서 제5단계의 시정책 적용에 관한 3E에 해당하지 않는 것은?","","Education","Engineering","Enforcement","Eliminate","4"
"건설안전기사","2014","4","산업심리 및 교육","21","다음 설명에 해당하는 안전교육방법은?\n\nATP라고도 하며, 당초 일부 회사의 매니지먼트(top management)에 대하여만 행하여졌으나 그 후 널리 보급 되었으며, 정책의 수립, 조작, 통제 및 운영 등의 교육내용을 다룬다.","","TWI(Training Within Industry)","MTP(Management Training Program)","CCS(Civil Communication Section)","ATT(American Telephone & Telegram Co.)","3"
"건설안전기사","2014","4","산업심리 및 교육","22","다음 중 돌발사태의 발생으로 인하여 주의의 일점 집중 현상이 일어나는 경우 인간의 의식수준으로 옳은 것은?","","Phase I","Phase II","Phase Ill","Phase IV","4"
"건설안전기사","2014","4","산업심리 및 교육","23","다음 중 집단간 갈등의 해소방안으로 적절하지 못한 것은?","","공동의 문제 설정","상위 목표의 설정","집단간 접촉 기회의 증대","사회적 범주화 편향의 최대화","4"
"건설안전기사","2014","4","산업심리 및 교육","24","산업안전보건법령상 사업장의 안전보건관리책임자 및 안전관리자에 대한 신규 및 보수교육시간으로 옳은 것은?","","안전관리자의 신규교육: 30시간 이상","안전관리자의 보수교육: 16시간 이상","안전관리책임자의 신규교육 : 6시간 이상","안전관리책임자의 보수교육 : 4시간 이상","3"
"건설안전기사","2014","4","산업심리 및 교육","25","다음 중 집단역학(Group Dynamics)에서 의미하는 집단의 기능과 관계가 가장 먼 것은?","","응집력 발생","집단의 목표 설정","권한의 위임","행동의 규범 존재","3"
"건설안전기사","2014","4","산업심리 및 교육","26","다음 설명에 해당하는 적응기제는?\n\n자신의 결함과 무능에 의하여 생긴 열등감이나 긴장을 해소시키기 위하여 장점과 같은 것으로 그 결함을 보충하려는 행동","","보상","합리화","승화","치환","1"
"건설안전기사","2014","4","산업심리 및 교육","27","미국 국립산업안전보건연구원(NIOSH)이 제시한 직무스트레스 모형에서 직무스트레스 요인을 작업요인, 조직요인, 환경요인으로 구분할 때 다음 중 조직요인에 해당하는 것은?","","작업 속도","관리 유형","교대 근무","조명 및 소음","2"
"건설안전기사","2014","4","산업심리 및 교육","28","교육방법 중 토의법이 효과적으로 활용되는 경우가 아닌 것은?","","피교육생들의 태도를 변화시키고자 할때","인원이 토의를 할 수 있는 적정 수준일 때","피교육생들 간에 학습능력의 차이가 클 때","피교육생들이 토의 주제를 어느 정도 인지하고 있을 때","3"
"건설안전기사","2014","4","산업심리 및 교육","29","교육지도의 5단계가 다음과 같을 때 올바르게 나열한 것은?\n| ① | 가설의 | 설정 |\n|---|---|---|\n| ② | 결론 | |\n| ③ | 원리의 | 제시 |\n| ④ | 관련된 개념의 | 분석 |\n| ⑤ | 자료의 | 평가 |","","(3)→(4)→(1)→(5)→(2)","(1)→(3)→(4)→(5)→(2)","(3)→(1)→(5)→(4)→(2)","(1)→(3)→(5)→(4)→(2)","1"
"건설안전기사","2014","4","산업심리 및 교육","30","다음 중 심리검사의 구비 요건이 아닌 것은?","","표준화","신뢰성","규격화","타당성","3"
"건설안전기사","2014","4","산업심리 및 교육","31","매슬로우(Maslow)의 욕구 5단계 중 인간의 가장 기초적인 욕구는?","","생리적 욕구","애정 및 사회적 욕구","자아실현의 욕구","안전에 대한 욕구","1"
"건설안전기사","2014","4","산업심리 및 교육","32","다음 중 인간의 적성을 발견하는 방법으로 가장 적당하지 않은 것은?","","작업 분석","계발적 경험","자기 이해","적성 검사","1"
"건설안전기사","2014","4","산업심리 및 교육","33","다음 중 교육훈련 평가 4단계에서 각 단계의 내용으로 틀린 것은?","","제1단계: 반응단계","제2단계: 작업단계","제3단계: 행동단계","제4단계: 결과단계","2"
"건설안전기사","2014","4","산업심리 및 교육","34","다음 중 관계지향적 리더가 나타내는 대표적인 행동 특징으로 볼 수 없는 것은?","","우호적이며 가까이 하기 쉽다.","집단구성원들의 활동을 조정한다.","집단구성원들을 동등하게 대한다.","어떤 결정에 대해 자세히 설명해준다.","2"
"건설안전기사","2014","4","산업심리 및 교육","35","인간본성을 파악하여 동기유발로 인한 산업재해를 방지하기 위한 맥그리거의 XY이론에서 다음 중 Y이론의 가정으로 틀린 것은?","","현대 산업사회와 같은 여건 하에서 일반 사람의 지적 잠재력은 무한히 활용한다.","대부분 사람들은 조건만 적당하면 책임뿐만 아니라 그것을 추구할 능력이 있다.","목적에 투신하는 것은 성취와 관련된 보상과 함수 관계에 있다.","근로에 육체적, 정신적 노력을 쏟는 것은 놀이나 휴식 만큼 자연스럽다.","1"
"건설안전기사","2014","4","산업심리 및 교육","36","다음 중 학습지도 방법의 분류에 있어 Project Method의 4단계를 올바르게 나열한 것은?","","목적 → 평가 → 계획 → 수행","목적 → 계획 → 수행 → 평가","계획→ 목적 → 평가 → 수행","계획 → 목적 → 수행 → 평가","2"
"건설안전기사","2014","4","산업심리 및 교육","37","다음 중 교육목적에 관한 설명으로 적절하지 않은 것은?","","교육목적은 교육이념에 근거한다.","교육목적은 개념상 이념이나 목표보다 광범위하고 포괄적이다.","교육목적의 기능으로는 방향의 지시, 교육 활동의 통제 등이 있다.","교육목적은 교육목표의 하위개념으로 학습경험을 통한 피교육자들의 행동변화를 지칭하는 것이다.","4"
"건설안전기사","2014","4","산업심리 및 교육","38","부주의에 의한 사고방지대책 중 정신적 대책과 가장 거리가 먼 것은?","","적성 배치","스트레스 해소 대책","주의력 집중훈련","표준작업의 습관화","4"
"건설안전기사","2014","4","산업심리 및 교육","39","다음 중 운동의 시지각(착각현상)이 아닌 것은?","","자동운동(自動運動)","항상운동(恒常運動)","유도운동(誘導運動)","가현운동(假現運動)","2"
"건설안전기사","2014","4","산업심리 및 교육","40","다음 중 안전사고와 관련하여 소질적 사고 요인과 가장 관계가 먼 것은?","","지능","작업자세","성격","시각기능","2"
"건설안전기사","2014","4","인간공학 및 시스템안전공학","41","다음 중 고열에 의한 건강장해 예방 대책으로 작업조건 및 환경개선 두 가지 모두 관계되는 요소는?","","착의상태","휴식처에서의 온열조건","열에 노출되는 횟수 및 노출시간","온열환경에서 작업할 때의 체열교환","1"
"건설안전기사","2014","4","인간공학 및 시스템안전공학","42","다음 중 결함수분석법(FTA)의 특징으로 볼 수 없는 것은?","","Top Down 형식","특정사상에 대한 해석","정성적 해석의 불가능","논리기호를 사용한 해석","3"
"건설안전기사","2014","4","인간공학 및 시스템안전공학","43","다음 중 신호 및 경보등을 설계할 때 초당 3~10회의 점멸 속도로 얼마의 지속시간이 가장 적합한가?","","0.01초 이상","0.02초 이상","0.03초 이상","0.05초 이상","4"
"건설안전기사","2014","4","인간공학 및 시스템안전공학","44","다음 중 스트레스의 주요 척도에서 생리적 긴장의 화학적 척도에 해당하는 것은?","","혈압","호흡수","심전도","혈액 정보","4"
"건설안전기사","2014","4","인간공학 및 시스템안전공학","45","[그림]과 같이 신뢰도 95%인 펌프 A가 각각 신뢰도 90%인 밸브 B와 밸브 C의 병렬밸브계와 직렬계를 이룬 시스템의 실패 확률은 약 얼마인가?","O","0.0091","0.0595","0.9405","0.9811","2"
"건설안전기사","2014","4","인간공학 및 시스템안전공학","46","조종장치를 촉각적으로 식별하기 위하여 사용되는 촉각적 코드화의 방법으로 가장 적합하지 않는 것은?","","크기를 이용한 코드화","조정장치의 형상 코드화","표면 촉감을 이용한 코드화","피부 자극을 활용한 코드화","4"
"건설안전기사","2014","4","인간공학 및 시스템안전공학","47","자동차 운전대를 시계 방향으로 돌리면 자동차 오른쪽으로 회전하도록 설계한 것은 어떠한 양립성을 구현한 것인가?","","개념 양립성","운동 양립성","공간 양립성","양식 양립성","2"
"건설안전기사","2014","4","인간공학 및 시스템안전공학","48","손목을 반복적이고 지속적으로 사용하면 손목관증후군(CTS)에 걸릴 수 있는데, 이 증후군은 어떤 신경에 가장 큰 손상이 일어나는 것인가?","","감각 신경(sensor nerve)","정중 신경(median nerve)","중추 신경(central nerve)","자율 신경(autonomic nerve)","2"
"건설안전기사","2014","4","인간공학 및 시스템안전공학","49","다음 중 착석식 작업대의 높이 설계를 할 경우 고려해야 할 사항과 가장 관계가 먼 것은?","","의자의 높이","작업의 성질","대퇴 여유","작업대의 형태","4"
"건설안전기사","2014","4","인간공학 및 시스템안전공학","50","인간-기계 시스템의 설계 과정을 [보기]와 같이 분류할 때 다음 중 기능을 할당하는 단계는?\n1단계: 시스템의 목표와 성능명세 결정\n2단계: 시스템의 정의\n3단계: 기본 설계\n4단계: 인터페이스 설계\n5단계: 보조물 설계 혹은 편의수단 설계\n6단계: 평가","","기본 설계","인터페이스 설계","시스템의 목표와 성능명세 결정","보조물 설계 혹은 편의 수단 설계","1"
"건설안전기사","2014","4","인간공학 및 시스템안전공학","51","다음 중 인간공학의 정의로 가장 적합한 것은?","","인간의 과오가 시스템에 미치는 영향을 최대화하기 위한 연구분야","인간, 기계, 물자, 환경으로 구성된 복잡한 체계의 효율을 최대로 활용하기 위하여 인간의 한계 능력을 최대화하는 학문분야","인간, 기계, 물자, 환경으로 구성된 복잡한 체계의 효율을 최대로 활용하기 위하여 인간의 생리적, 심리적 조건을 시스템에 맞추는 학문분야","인간 특성과 한계 능력을 공학적으로 분석, 평가하여 이를 복잡한 체계의 설계에 응용함으로 효율을 최대로 활용할 수 있도록 하는 학문분야","4"
"건설안전기사","2014","4","인간공학 및 시스템안전공학","52","다음의 위험분석 기법 중 시스템 수명주기 관점에서 적용 시점이 가장 빠른 것은?","","PHA","FHA","OHA","SHA","1"
"건설안전기사","2014","4","인간공학 및 시스템안전공학","53","결함수분석(FTA) 결과 다음과 같은 패스셋을 구하였다. X4가 중복사상인 경우 다음 중 최소 패스셋(minimal pathsets)으로 옳은 것은?\n{X2, X3, X4}\n{X1, X3, X4}\n{X3, X4}","","${X_3,X_4}$","${X_1,X_3,X_4}$","${X_2,X_3,X_4}$","${X_2,X_3,X_4}$ 와 ${X_3,X_4}$","1"
"건설안전기사","2014","4","인간공학 및 시스템안전공학","54","다음 중 불(Bool) 대수의 정리를 나타낸 관계식으로 틀린 것은?","","$A \\cdot A=A$","$A+A'=0$","$A+AB=A$","$A+A=A$","2"
"건설안전기사","2014","4","인간공학 및 시스템안전공학","55","다음 중 산업안전보건법령에 따라 유해하거나 위험한 장소에서 사용하는 기계·기구 및 설비를 설치·이전하는 경우 유해·위험방지계획서를 작성, 제출하여야 하는 대상이 아닌 것은?","","화학설비","건조설비","전기용접장치","금속 용해로","3"
"건설안전기사","2014","4","인간공학 및 시스템안전공학","56","인간에러 원인 중 작업특성 및 환경조건의 상태악화로 인한 원인과 가장 거리가 먼 것은?","","낮은 자율성","혼동되는 신호의 탐색 및 검출","매뉴얼과 체크리스트 등의 부족","판단과 행동에 복잡한 조건이 관련된 작업","3"
"건설안전기사","2014","4","인간공학 및 시스템안전공학","57","어떤 사람이 자동차를 생산하는 공장에서 95dB(A)의 소음 수준에서 하루 8시간 작업하며 매 시간 조용한 휴게실에서 20분씩 휴식을 취한다고 가정하였을 때 8시간 시간가중평균(TWA)은 약 얼마인가? (단, 소음은 누적소음노출량측정기로 측정하였으며. OSHA에서 정한 95dB(A)의 허용시간은 4시간이다.)","","91dB(A)","91.5dB(A)","92dB(A)","92.5dB(A)","3"
"건설안전기사","2014","4","인간공학 및 시스템안전공학","58","Chapanis는 위험분석을 확률과 영향 두 가지 요소를 고려하여 확률수준과 그에 따른 위험발생율을 객관화 하였는데 '가끔 발생하는(occasional)' 발생빈도의 확률로 옳은 것은?","","$>10^{-2}/day$","$>10^{-3}/day$","$>10^{-4}/day$","$>10^{-5}/day$","3"
"건설안전기사","2014","4","인간공학 및 시스템안전공학","59","다음 설명에 해당하는 설비보전방식의 유형은?\n\n설비보전 정보와 신기술을 기초로 신뢰성, 조작성, 보전성, 안전성, 경제성 등이 우수한 설비의 선정, 조달 또는 설계를 통하여 궁극적으로 설비의 설계, 제작 단계에서 보전활동이 불필요한 체제를 목표로 한 설비보전 방법을 말한다.","","개량 보전","사후 보전","일상 보전","보전 예방","4"
"건설안전기사","2014","4","인간공학 및 시스템안전공학","60","다음 중 VE(Value Engineering) 활동으로 각 분석항목에 대한 안전성과의 관계를 잘못 연결한 것은?","","재료 - 불량률","검사포장 - 육체피로","설비 - 사고재해 건수","운반 Layout - 작업피로","1"
"건설안전기사","2014","4","건설시공학","61","철근공사에 사용하고 있는 철근의 이음방법이 아닌 것은?","","기계식이음","갈고리이음","겹침이음","용접이음","2"
"건설안전기사","2014","4","건설시공학","62","건축공사를 수행하기 위하여 필요한 서류 중 시방서에 기재하지 않아도 되는 사항은?","","사용재료의 품질시험방법","건물의 인도시기","각 부위별 시공방법","각 부위별 사용 재료의 품질","2"
"건설안전기사","2014","4","건설시공학","63","전사적 품질관리 즉 T.Q.C(Total Quality Control) 도구에 대한 설명으로 옳은 것은?","","파레토도 - 결과에 원인이 어떻게 관계되고 있는가를 알아보기 위하여 작성하는 것이다.","산점도 : 불량, 결점, 고장 등의 발생 건수를 분류 항목 별로 나누어 크기 순서대로 나열해 놓은 것이다.","체크시트 - 계수치의 데이터가 분류항목의 어디에 집중되어 있는가를 알아보기 쉽게 나타낸 것이다.","특성 요인도 - 서로 대응되는 두 개의 짝으로 된 데이터를 그래프용지에 점으로 나타낸 것이다.","3"
"건설안전기사","2014","4","건설시공학","64","거푸집공사에서 사용되는 격리재(separator)에 대한 설명으로 옳은 것은?","","철근과 거푸집의 간격을 유지한다.","철근과 철근의 간격을 유지한다.","골재와 거푸집과의 간격을 유지한다.","거푸집 상호간의 간격을 유지한다.","4"
"건설안전기사","2014","4","건설시공학","65","경량 콘크리트의 범주에 들지 않는 것은?","","신더콘크리트","톱밥콘크리트","AE콘크리트","경량기포콘크리트","3"
"건설안전기사","2014","4","건설시공학","66","지반조사 시 시추주상도 보고서에서 확인사항과 거리가 먼 것은?","","지층의 확인","Slime의 두께","지하수위 확인","N값의 확인","2"
"건설안전기사","2014","4","건설시공학","67","바닥전용 거푸집으로서 테이블 폼이라고도 부르며 거푸집판, 장선, 멍에, 서포트 등을 일체로 제작하여 수평, 수직방향으로 이동하는 시스템 거푸집은?","","슬라이딩 폼","클라이밍 폼","플라잉 폼","트래블링 폼","3"
"건설안전기사","2014","4","건설시공학","68","파워셔블의 1시간당 추정 굴착 작업량은 약 얼마인가?(단, 버킷용량 $0.6m^3$, 굴삭토의 용적변화 계수 1.28. 작업효율 0.83, 굴사계수 0.8, 싸이클 타임 30sec)","","$41.2m^3$","$45.2m^3$","$59.2m^3$","$61.2m^3$","4"
"건설안전기사","2014","4","건설시공학","69","기초공사 중 언더피닝(Under pinning)공법에 해당하지 않는 것은?","","2중 널말뚝 공법","전기침투 공법","강제말뚝 공법","약액주입법","2"
"건설안전기사","2014","4","건설시공학","70","토공사와 관련하여 신뢰성이 높은 현장시험에 해당되지 않는 것은?","","흙의 투수시험","베인테스트","표준관입시험","평판재하시험","1"
"건설안전기사","2014","4","건설시공학","71","벽돌공사에서 치장줄눈용 모르타르 용적배합비(잔골재/결합재)비율로 가장 적정한 것은?","","$0.5 \\sim 1.5$","$1.5 \\sim 2.5$","$2.5 \\sim 3.5$","$3.5 \\sim 4.5$","1"
"건설안전기사","2014","4","건설시공학","72","지반개량 공법 중 동다짐(Dynamic Compaction) 공법의 장·단점으로 틀린 것은?","","시공 시 지반진동에 의한 공해문제가 발생하기도 한다.","지반 내에 암괴 등의 장애물이 있으면 적용이 불가능하다.","특별한 약품이나 자재를 필요로 하지 않는다.","깊은 심도의 지반개량에 대해서는 초대형 장비가 필요하다.","2"
