"Test Name","Year","Session","Subject","Number","Question","Question_image","Option 1","Option 2","Option 3","Option 4","Answer"
"건설안전산업기사","2008","2","건설재료학","79","합성수지와 그 용도의 조합으로 부적당한 것은?","","멜라민수지 - 테이블용","아크릴수지 - 도어(door)용","폴리에스테르수지 - 타일용","폴리스티렌수지 - 단열용","3"
"건설안전산업기사","2008","2","건설재료학","80","플라이애쉬를 혼입한 콘크리트의 특성에 관한 설명 중 올바른 것은?","","동일한 워커빌리티를 가진 보통콘크리트보다 많은 단위수량을 필요로 한다.","동일한 보통콘크리트보다 중성화 속도가 느리다.","플라이애쉬를 사용한 콘크리트는 화학저항성이 증대 된다.","초기강도는 증가되지만 장기강도에는 큰 영향을 미치지 않는다.","3"
"건설안전산업기사","2008","2","건설안전기술","81","압밀에 대한 설명으로 옳지 않은 것은?","","압밀이란 흙의 간극 속에서 물이 배수됨으로써 오랜 시간에 걸쳐 압축되는 현상을 말한다.","압밀시험의 목적은 지반의 침하 속도와 침하량을 추정해서 설계 시공의 자료를 얻는데 있다.","일반적으로 정토는 투수계수가 작아 압밀이 장시간에 걸쳐 일어나나, 간극비가 작아 침하량은 작다.","압밀이 완료되면 과잉간극수압(Ue)은 0이 된다.","3"
"건설안전산업기사","2008","2","건설안전기술","82","다음 중 터널굴착 작업시 시공계획의 내용이 아닌 것은?","","터널굴착방법","터널지보공 및 복공의 시공방법과 용수처리방법","자동경보장치의 설치방법","환기 또는 조명시설을 하는 때에는 그 방법","3"
"건설안전산업기사","2008","2","건설안전기술","83","건설현장에서 거푸집 동바리를 조립할 때 준수 사항으로 틀린 것은?","","동바리의 이음은 맞댄이음 또는 장부이음으로 할 것","깔목의 사용, 콘크리트 타설, 말뚝박기 등 동바리의 침하방지 조치를 할 것","동바리로 사용하는 강관(파이프서포트는 제외)은 높이 3미터 이내마다 수평연결재를 3개 방향으로 설치할 것","강재와 강재와의 접속부 및 교차부는 볼트, 클램프 등 전용철물을 사용하여 연결할 것","3"
"건설안전산업기사","2008","2","건설안전기술","84","차량계 건설기계를 사용하여 작업을 하는 때에 건설기계의 전도 또는 전락에 의한 근로자의 위험을 방지하기 위하여 사업주가 취하여야 할 조치사항으로 적당하지 않은 것은?","","도로폭의 유지","지반의 부동침하방지","울, 손잡이 설치","갓길의 붕괴방지","3"
"건설안전산업기사","2008","2","건설안전기술","85","산업안전기준에 관한 규칙에 따른 근로자의 안전한 행동을 위하여 통로에 설치하여야 하는 조명시설의 조도는?","","30럭스 이상","75럭스 이상","150럭스 이상","300럭스 이상","2"
"건설안전산업기사","2008","2","건설안전기술","86","개착식 굴착공사의 흙막이공법 중 버팀보공법을 적용하여 굴착할 때 지반붕괴를 방지하기 위하여 사용하는 계측장치로 거리가 먼 것은?","","지하수위계","경사계","록볼트응력계","변형률계","3"
"건설안전산업기사","2008","2","건설안전기술","87","표준안전작업지침에 의하면 인력굴착 작업시 굴착면이 계단식 굴착을 할 때 소단의 폭은 수평거리 얼마정도로 하여야 하는가?","","1m","1.5m","2m","2.5m","3"
"건설안전산업기사","2008","2","건설안전기술","88","항타기 또는 항발기를 조립할 때 점검하여야 하는 사항과 거리가 먼 것은?","","권상기의 설치상태의 이상 유무","본체 연결부의 풀림 또는 손상의 유무","이동 제동장치 기능의 이상 유무","권상장치의 브레이크 및 쐐기장치 기능의 이상 유무","3"
"건설안전산업기사","2008","2","건설안전기술","89","거푸집동바리의 조립 또는 해체작업시 준수사항으로 틀린 것은?","","보, 슬래브 등의 거푸집동바리 등을 해체할 때에는 낙하, 충격에 의한 돌발 재해를 방지하기 위하여 버팀목을 설치하는 등의 조치를 할 것","공구 등을 올리거나 내릴 때에는 달줄, 달포대 등을 사용할 것","비·눈 그 밖의 기상상태의 불안정으로 날씨가 몹시 나쁠 때 작업을 중지시킬 것","크레인 등 양중기로 철근을 운반할 경우에는 중앙의 1개소 이상을 묶어 수평으로 운반할 것","4"
"건설안전산업기사","2008","2","건설안전기술","90","자재 등의 물체 투하에 투하설비를 설치하거나 감시인을 배치하는 등의 조치를 취하여야 하는 최소 높이는 얼마 이상 부터인가?","","2m","3m","4m","5m","2"
"건설안전산업기사","2008","2","건설안전기술","91","가설 통로 중 경사로의 설치 기준으로 틀린 것은?","","경사로의 폭은 최소 90cm 이상이어야 한다.","발판 폭은 40cm 이상이어야 한다.","비탈면의 경사각은 30° 이내이어야 한다.","경사로의 지지 기둥은 5m 이내로 설치한다.","4"
"건설안전산업기사","2008","2","건설안전기술","92","통나무 비계는 지상높이 4층 이하 또는 몇 m 이하인 건축물·공작물 등의 건조·해체 및 조립 등 작업에서만 사용하여야 하는가?","","5m","12m","15m","20m","2"
"건설안전산업기사","2008","2","건설안전기술","93","달비계에 설치되는 작업발판의 폭에 대한 기준으로 옳은 것은?","","20cm 이상","40cm 이상","60cm 이상","80cm 이상","2"
"건설안전산업기사","2008","2","건설안전기술","94","그림과 같이 무게 500kg의 화물을 인양하려고 한다. 이때 와이어로프의 1가닥에 작용되는 장력(T)는 약 얼마인가?","O","500kg","357kg","289kg","144kg","3"
"건설안전산업기사","2008","2","건설안전기술","95","채석작업시 붕괴 또는 낙하에 의해 근로자에게 위험의 우려가 있을 때 설치해야 하는 것은?","","건널다리","천막덮개","손잡이","방호망","4"
"건설안전산업기사","2008","2","건설안전기술","96","히빙(heaving) 현상이 잘 발생하는 토질 지반은?","","연약한 점토 지반","연약한 사질토 지반","견고한 점토 지반","견고한 사질토 지반","1"
"건설안전산업기사","2008","2","건설안전기술","97","와이어로프나 철선 등을 이용하여 상부지점에서 작업용 발판을 매다는 형식의 비계로서 건물 외벽도장이나 청소 등의 작업에서 사용되는 비계는?","","브라켓 비계","달비계","이동식 비계","말비계","2"
"건설안전산업기사","2008","2","건설안전기술","98","지면을 절삭하여 평활하게 다듬는 장비로서 노면의 성형과 정지작업에 가장 적당한 장비는?","","모터 그레이더","백호","트랜처","크램쉘","1"
"건설안전산업기사","2008","2","건설안전기술","99","콘크리트 거푸집을 설계할 때 고려해야 하는 연직하중으로 거리가 먼 것은?","","작업하중","콘크리트 자중","충격하중","풍하중","4"
"건설안전산업기사","2008","2","건설안전기술","100","높이 2m 이상인 작업발판의 끝이나 개구부 등에서 추락을 방지하기 위한 설비로 가장 거리가 먼 것은?","","안전난간","덮개","방호선반","울타리","3"