"Test Name","Year","Session","Subject","Number","Question","Question_image","Option 1","Option 2","Option 3","Option 4","Answer"
"건설안전기사","2005","1","산업안전관리론","1","안전교육의 목적에 해당되지 않는 것은?","","환경의 안전화","행동의 안전화","설비와 물자의 안전화","생산지연의 안전화","4"
"건설안전기사","2005","1","산업안전관리론","2","안전수칙에 포함되는 사항이 아닌 것은?","","표준작업시간","각종설비의 동작순서 강조","작업대 또는 기계주위의 청결 및 정리정돈 철저","작업자의 복장, 두발 및 장구 등에 대한 규제","1"
"건설안전기사","2005","1","산업안전관리론","3","경험연수가 10년 내외의 경험자에게 중상재해가 많은 이유로서 거리가 먼 것은?","","위험의 정도가 높은 업무를 담당 하므로","작업에 자신의 과잉으로 안전수단을 생략하고 있기 때문에","고령이 되어 위험에 대비하는 능력이 감퇴되었는데도 그에 대한 자각이 없기 때문","작업에 대한 집중도나 열의가 떨어지기 때문","4"
"건설안전기사","2005","1","산업안전관리론","4","연간도수율이 5건 일 때 근로자 1000명당 발생하는 사상자 수인 연천인율은?","","9명","12명","15명","20명","2"
"건설안전기사","2005","1","산업안전관리론","5","높이 또는 깊이 2미터 이상의 추락할 위험이 있는 장소에서의 작업시에 착용하여야 하는 보호구는?","","보안면","안전대","방열복","방한화","2"
"건설안전기사","2005","1","산업안전관리론","6","인간에게는 재해를 일으키기 쉬운 성격을 가진 사람과 그렇지 않는 사람도 있다. 이것은 어디까지나 개인의 성격차인 것이지만 무모, 격한 기질, 신경질, 흥분성, 안전작업에 대한 소홀이나 무시 등은 성격적으로 재해 발생에 아주 밀접한 관계를 가진다는 것은?","","사회적, 환경적인 결함","제도적인 법제상의 결함","불안전 행동상의 결함","개인적인 성격상의 결함","4"
"건설안전기사","2005","1","산업안전관리론","7","안전관리조직의 주요 형태중 100인 미만의 소규모 기업이나 사업체에 적용되는 조직형태는?","","Staff형 조직","Line형 조직","Line-Staff형 조직","Network형 조직","2"
"건설안전기사","2005","1","산업안전관리론","8","금속재료가 일정온도에서 일정응력에 의해 시간의 경과와 더불어서 변형하는 현상을 측정하는 것은?","","인장검사","굽힘검사","크리프시험","충격시험","3"
"건설안전기사","2005","1","산업안전관리론","9","다음 재해 원인 중 인적원인(불안전행위)으로 맞는 것은?","","연락 불충분","방호설비의 결함","전기절연 불량","자물쇠 불비","1"
"건설안전기사","2005","1","산업안전관리론","10","작업 위험분석 방법이 아닌 것은?","","질문지법","시찰법","면접법","시범법","4"
"건설안전기사","2005","1","산업안전관리론","11","다음 중 산업재해 예방의 4대 기본원칙이 아닌 것은?","","손실우연의 원칙","분석방법 선정의 원칙","예방가능의 원칙","원인연계의 원칙","2"
"건설안전기사","2005","1","산업안전관리론","12","사업장의 조직원과 재해조사자를 잘못 연결된 것은?","","안전관리자 - 산업안전보건위원회 위원","보건관리자 - 작업자","현장관리감독자 - 노동조합간부","안전보건관리책임자 - 안전관리전문가","2"
"건설안전기사","2005","1","산업안전관리론","13","문제해결 4단계에서 원 포인트(one point) 지적 확인을 하는 단계는?","","1,2단계","1,3단계","2,4단계","3,4단계","3"
"건설안전기사","2005","1","산업안전관리론","14","재해 사례의 주된 목적에 관한 설명이다. 틀린 것은?","","재해요인을 체계적으로 규명하여 이에 대한 대책을 세운다.","재해요인을 조사하여 책임 소재를 명확히 하기 위해서 한다.","재해 방지의 원칙을 습득해서 이것을 일상 안전 보건활동에 실천한다.","참가자의 안전보건활동에 관한 견해나 생각을 깊게하고, 태도를 바꾸게 한다.","2"
"건설안전기사","2005","1","산업안전관리론","15","재해분석시에 재해발생건수 등의 추이를 파악하고 관리선을 설정하여 목표관리를 수행하는 통계적 분석방법은?","","관리도","파렛트도","특성요인도","클로스 분석도","1"
"건설안전기사","2005","1","산업안전관리론","16","다음 그림은 무엇을 의미하는 안전보건표지인가?","O","고온경고","위험장소경고","유해물질경고","매달린물체경고","2"
"건설안전기사","2005","1","산업안전관리론","17","산업재해가 발생하였을 때 통계 중 사람의 신체 부위 중에서 어느 부위가 가장 많이 상해를 입을까?","","다리, 발","척추, 옆구리","팔, 손","가슴","3"
"건설안전기사","2005","1","산업안전관리론","18","1년간 평균 상시 500명의 근로자를 두고 있는 사업장에서 1년간 25건의 재해가 발생하였다. 연천인율은 얼마인가?","","30","40","50","60","3"
"건설안전기사","2005","1","산업안전관리론","19","재해의 간접 원인 중 기초원인에 속하는 것은?","","기술적 원인","교육적 원인","정신적 원인","관리적 원인","4"
"건설안전기사","2005","1","산업안전관리론","20","방진마스크의 선정기준이 아닌 것은?","","흡기, 배기 저항이 커야 한다.","유효공간이 적어야 한다.","중량이 가벼워야 한다.","안면 밀착성이 좋아야 한다.","1"
"건설안전기사","2005","1","산업심리 및 교육","21","다음 작업표준 작성시의 유의사항이 아닌 것은?","","작업표준은 관리 감독자가 관리하고 꾸준히 개선하며 전원이 관심을 가지고 운영한다.","작업표준은 그 사업장의 독자적인 것으로 개개의 작업에 적용되는 내용일 것","재해가 발생할 가능성이 높은 작업부터 먼저 착수 한다.","작업표준은 포괄적이어야 하며 생산성과 품질은 고려할 필요가 없다.","4"
"건설안전기사","2005","1","산업심리 및 교육","22","단조로운 업무가 장시간 지속될 때 작업자의 감각기능 및 판단능력이 둔화 또는 마비되는 현상은?","","착각현상","망각현상","피로현상","감각차단현상","4"
"건설안전기사","2005","1","산업심리 및 교육","23","리더십을 리더가 부하들에게 미치는 영향력으로 간주하고, 그 영향력의 근원에 따라서 권력을 구분했는데, 준거권력(reference power)을 가장 잘 설명한 것은?","","부하들로부터 호감과 존경을 받는 리더 개인의 매력으로부터 나온다.","부하에게 승진, 보너스, 임금인상 등을 베풀 수 있는 힘에서 나온다.","지식이나 기술에 바탕을 두고 영향을 미침으로써 얻는 권력이다.","견책, 나쁜 인사고과로 부하에게 영향을 미침으로써 얻는 권력이다.","1"
"건설안전기사","2005","1","산업심리 및 교육","24","교육훈련 평가의 목적과 관계가 가장 먼 것은?","","문제해결을 위하여","작업자의 적정배치를 위하여","지도 방법을 개선하기 위하여","학습지도를 효과적으로 하기 위하여","1"
"건설안전기사","2005","1","산업심리 및 교육","25","교육지도의 효율성을 높이는 원리인 훈련전이(transfer of training)에 관한 것으로 잘못 설명된 것은?","","훈련생은 훈련과정에 대해서 사전정보가 없을수록 왜곡된 반응을 보이지 않을 것이다.","훈련 상황이 가급적 실제상황과 유사할수록 전이효과는 높아진다.","실제 직무수행에서 훈련된 행동이 나타날 때 보상이 따르면 전이효과는 더 높아진다.","훈련전이란 훈련기간에 학습된 내용이 실무상황으로 옮겨져서 사용되는 정도이다.","1"
"건설안전기사","2005","1","산업심리 및 교육","26","무의식 동작의 특성에 대한 설명이 올바른 것은?","","무의식 동작은 최장거리를 거쳐 나타낸다.","감각기의 기능이 정상적으로 작동되는 동작이다.","인간의 일상동작에서 작업에 익숙해지면 무의식 동작은 감소한다.","무의식 동작에는 외계의 능력에 대응하는 능력이 어느 정도는 있다.","4"
"건설안전기사","2005","1","산업심리 및 교육","27","어떤 작업을 하는데 있어서 소모하는 열량이 1시간에 390kcal이다. 작업시 시간당 휴식시간은? (단, 작업시 평균에너지가 5kcal/분, 휴식시 에너지가 1.5kcal/분)","","8분","12분","18분","21분","3"
"건설안전기사","2005","1","산업심리 및 교육","28","리더의 기능 중 이용 가능한 정보나 기술에 관한 정보원으로서의 역할을 수행하는 리더의 유형에 해당하는 것은?","","집단대표로서의 리더","집행자로서의 리더","전문가로서의 리더","개개인의 책임대행자로서의 리더","3"
"건설안전기사","2005","1","산업심리 및 교육","29","맥그리거(McGregor)의 X.Y이론에 따라 관리를 하고자 할 때 X이론에 가까운 작업자에게는 어떤 동기부여를 해야 좋은가?","","직무확장","자아실현","보수의 인상","작업환경 개선","3"
"건설안전기사","2005","1","산업심리 및 교육","30","학습평가의 기본적인 기준으로 합당치 못한 것은?","","타당도","실용도","주관도","신뢰도","3"
"건설안전기사","2005","1","산업심리 및 교육","31","다음 중 인간의 착오요인 중에서 '조작과정에서의 착오요인'에 속하는 것은?","","능력부족","기술부족","감각차단 현상","정보의 부족","2"
"건설안전기사","2005","1","산업심리 및 교육","32","부주의 현상 중, 심신이 피로하거나 단조로운 작업을 반복할 경우 나타나는 의식 수준의 저하 현상은 의식수준의 어느 단계에서 발생하는가?","","Phase I 이하","Phase II","Phase III","Phase IV","1"
"건설안전기사","2005","1","산업심리 및 교육","33","다음은 Project method의 장점을 서술한 것이다. 이에 해당되지 않는 것은?","","동기부여가 충분하다.","현실적인 학습방법이다.","작업에 대하여 창조력이 생긴다.","시간과 에너지가 많이 소비된다.","4"
"건설안전기사","2005","1","산업심리 및 교육","34","욕구저지(欲求咀止)를 일으키게 하는 장해에 대한 반응으로 분류할 수 없는 것은?","","장해 우위형","자아 방위형","욕구 고집형","반동 형성형","4"
"건설안전기사","2005","1","산업심리 및 교육","35","교육법의 4단계 중 학과와 실습에 따른 4단계를 연결한 것이다. 틀린 단계는?","","도입 - 학습준비","제시 - 작업설명","적용 - 실습","확인 - 실습","4"
"건설안전기사","2005","1","산업심리 및 교육","36","안전교육 훈련은 인간의 결함제거의 방법이다. 다음 중 행동반응의 순서로 맞는 것은?","","자극- 욕구 - 판단 - 행동","욕구 - 자극 - 판단 - 행동","판단 - 자극 - 욕구 - 행동","행동 - 욕구 - 자극 - 판단","1"
"건설안전기사","2005","1","산업심리 및 교육","37","다음 중 레빈(Lewin)의 행동방정식인 B = f(P·E)에서 E가 의미하는 것은?","","Education","Environment","Engineering","Energy","2"
"건설안전기사","2005","1","산업심리 및 교육","38","심리검사의 특징 중 측정하고자 하는 것을 실제로 잘 측정하는가 여부를 판별하는 것을 무엇이라 하는가?","","표준화","객관성","신뢰성","타당성","4"
"건설안전기사","2005","1","산업심리 및 교육","39","매슬로우의 5단계 욕구성장과정을 관리감독자의 능력과 연결시켰다. 연관성이 가장 먼 것은?","","포괄적 능력 - 존경의 욕구","인간적 능력 - 생리적 욕구","기술적 능력 - 안전의 욕구","종합적 능력 - 자기실현의 욕구","2"
"건설안전기사","2005","1","산업심리 및 교육","40","조직에서 새로운 제도나 프로그램을 도입하였을 때 처음에는 호기심 때문에 긍정적인 효과가 발생하나 시간이 지나면서 신기함이 감소하여 원래의 상태로 돌아간다는 현상은?","","밀러 효과","단기 효과","기대 효과","호오손 효과","4"
"건설안전기사","2005","1","인간공학 및 시스템안전공학","41","인간 기계시스템에서 수동제어 시스템에 속하지 않는 것은?","","연속적 추적제어","프로그램제어","계층구조적 제어","시켄셜제어","3"
"건설안전기사","2005","1","인간공학 및 시스템안전공학","42","인간의 신뢰도가 0.6, 기계의 신뢰도가 0.90이고 인간과 기계가 직렬체제로 작업할 때의 신뢰도는 얼마인가?","","0.43","0.54","0.65","0.76","2"
"건설안전기사","2005","1","인간공학 및 시스템안전공학","43","반사율이 80%, 글자의 밝기가 $400cd/m^2$인 VDT화면에 314lux의 조명이 있다면 대비는? [단 대비의 정의는 (배경광-목표광)/배경광을 사용한다.]","","-0.6","-1.59","-5.0","-6.0","3"
"건설안전기사","2005","1","인간공학 및 시스템안전공학","44","'작업설계시의 딜레마(dilemma)' 란?","","안전투자와 기업이윤간의 딜레마","작업능률과 작업만족도간의 딜레마","작업확대와 작업윤택화간의 딜레마","생산목표와 생산수단간의 딜레마","2"
"건설안전기사","2005","1","인간공학 및 시스템안전공학","45","단순반복 작업으로 인하여 발생되는 건강장애 즉 $CTD_S$ 의 발생요인이 아닌 것은?","","작업적 과도한 힘의 요구","부적합한 작업자세","긴 작업주기","저온환경","3"
"건설안전기사","2005","1","인간공학 및 시스템안전공학","46","작업장의 색채를 설명한 것이으로 틀린 것은?","","지붕은 주위의 환경과 조화를 이루도록 한다.","벽면은 주위 명도의 2배 이상으로 한다.","창틀에는 흰빛으로 악센트를 준다.","바닥의 추천반사율은 40-60%가 좋다.","4"
"건설안전기사","2005","1","인간공학 및 시스템안전공학","47","공장설비의 안전화를 위하여 레이아웃에 대한 검토를 요하는 사항과 거리가 먼 것은?","","작업의 흐름에 따라 기계설비를 배치시켜 필요없는 운반작업을 극력 배제","안전한 통로를 설정하고 작업장소와 통로는 명확히 구분","재료, 제품, 공구들을 놓아둘 곳을 충분히 확보할 것","필요한 안전장치를 설치할 것","4"
"건설안전기사","2005","1","인간공학 및 시스템안전공학","48","작업장의 색은 매우 중요하다. 색을 선택할 때 기본 조건이 아닌 것은?","","자극이 강한색은 피한다.","밝은 색은 상부에 어두운 색은 하부에 둔다.","차분하고 밝은색을 선택한다.","순백색을 선택한다.","4"
"건설안전기사","2005","1","인간공학 및 시스템안전공학","49","신호검출이론의 적용대상이 아닌 것은?","","성역화","품질검사","의학처방","법정에서의 판정","1"
"건설안전기사","2005","1","인간공학 및 시스템안전공학","50","다음은 초기고장과 마모고장의 고장형태와 그 예방대책에 관한 내용이다. 연결이 잘못된 것은?","","초기고장 - 감소형","마모고장 - 증가형","초기고장 - 디버깅","마모고장 - 스크리닝","4"
"건설안전기사","2005","1","인간공학 및 시스템안전공학","51","예비위험 분석에서 달성하기 위하여 노력하여야 하는 4가지 주요 사항이 아닌 것은?","","시스템에 관한 주요 사고를 식별하고 개략적인 말로 표시할 것","사고를 초래하는 요인을 식별할 것","사고발생 확률을 계산할 것","식별된 위험을 4가지 범주로 분류할 것","3"
"건설안전기사","2005","1","인간공학 및 시스템안전공학","52","다음 중 시스템안전 위험분석 (SSHA)을 수행하기 위한 최초의 작업으로서 구상단계나 설계 및 발주의 극히 초기에 실시되는 것은?","","예비위험분석(PHA)","결함위험분석(FHA)","시스템안전성위험분석(SSHA)","결함수분석(FTA)","1"
"건설안전기사","2005","1","인간공학 및 시스템안전공학","53","F.T.A(Fault Tree Analysis)란 무엇인가?","","재해발생을 귀납적, 정성적으로 해석, 예측할 수 있다.","재해발생을 연역적, 정성적으로 해석, 예측할 수 있다.","재해발생을 연역적, 정량적으로 해석, 예측할 수 있다.","재해발생을 귀납적, 정량적으로 해석, 예측할 수 있다.","3"
"건설안전기사","2005","1","인간공학 및 시스템안전공학","54","우리가 흔히 사용하는 시각적 표시장치와 청각적 표시장치 중 청각적 표시장치를 사용하는 것이 더 좋은 경우는?","","전언이 공간적인 위치를 다룬 경우","수신자의 청각계통이 과부하 상태일 때","직무상 수신자가 한 곳에 머무르는 경우","수신장소가 너무 밝거나 암조응이 요구될 때","4"
"건설안전기사","2005","1","인간공학 및 시스템안전공학","55","다음 시스템 A의 확률은?","O","0.64","0.82","0.92","0.97","4"
"건설안전기사","2005","1","인간공학 및 시스템안전공학","56","위험 및 운전성 검토(HAZOP)의 성패를 좌우하는 중요 요인과 거리가 먼 것은?","","팀의 무재해 운동 추진 실태","검토에 사용된 도면이나 자료들의 정확성","팀의 기술능력과 통찰력","발견된 위험의 심각성을 평가할 때 그 팀의 균형감각을 유지할 수 있는 능력","1"
"건설안전기사","2005","1","인간공학 및 시스템안전공학","57","다음 중 진동에 의한 영향이 가장 적은 작업은?","","추적작업","시각적 인식작업","형태 식별작업","수동 제어작업","3"
"건설안전기사","2005","1","인간공학 및 시스템안전공학","58","감각적으로 물리현상을 왜곡하는 지각현상에 해당되는 것은?","","주의산만","착각","피로","부주의","2"
"건설안전기사","2005","1","인간공학 및 시스템안전공학","59","디버깅(debugging)이란?","","초기 고장기간의 고장원인 도출과정","우발 고장기간의 고장원인 도출과정","마모 고장기간의 고장원인 도출과정","고장원인 도출과는 상관이 없다.","1"
"건설안전기사","2005","1","인간공학 및 시스템안전공학","60","인간 실수의 형태를 크게 작위(Commission) 실수와 부작위(Omission) 실수로 나눌수 있다. 다음 중 작위 (Commission) 실수를 바르게 설명한 것은?","","생략한 형태의 실수","다른 것으로 착각하여 실행한 실수","수행해야 할 작업을 수행하지 않는 실수","불안전한 행동에 의한 실수","2"
"건설안전기사","2005","1","건설시공학","61","건설공사의 클레임 유형에 해당하지 않는 것은?","","작업범위 관련 클레임","작업인원 축소에 관한 클레임","현장조건 변경에 따른 클레임","공사지연에 의한 클레임","2"
"건설안전기사","2005","1","건설시공학","62","조적조 벽에 생기는 백화현상을 방지하기 위한 대책으로 부적합한 것은?","","줄눈 모르타르에 방수제를 넣는다.","흡수율이 작고 고온소성 벽돌을 사용한다.","벽돌면에 실리콘을 뿜칠한다.","줄눈 모르타르에 석회를 사용한다.","4"
"건설안전기사","2005","1","건설시공학","63","다음 중 연약지반의 지반개량공법이 아닌 것은?","","샌드드레인공법","탑다운공법","웰포인트공법","그라우팅공법","2"
"건설안전기사","2005","1","건설시공학","64","돌쌓기 방법의 한가지로 돌과 돌사이에 모르타르를 다져넣고, 뒤 고임에도 콘크리트를 채워넣는 돌쌓기는?","","건쌓기","찰쌓기","골쌓기","귀갑형쌓기","2"
"건설안전기사","2005","1","건설시공학","65","시멘트의 응결에 관한 다음 설명 중 틀린 것은?","","분말도가 고우면 응결이 빨라진다.","석고량이 많으면 응결이 늦어진다.","물·시멘트비가 크면 응결이 늦어진다.","온도가 낮으면 응결이 빨라진다.","4"
"건설안전기사","2005","1","건설시공학","66","콘크리트 압축강도를 조사하기 위해 슈미트해머를 이용하여 반발경도를 측정한 후 강도를 계산할 때 실시하는 보정 방안과 관계없는 것은?","","타격 각도에 대한 보정","콘크리트 재령에 따른 보정","압축응력에 따른 보정","반발경도에 따른 보정","4"
"건설안전기사","2005","1","건설시공학","67","벽돌조공사의 시공에 대한 주의사항으로 옳지 않은 것은?","","벽돌은 흡수성이 크므로 가능한 한 건조상태로 사용한다.","1일 쌓기 높이는 1.5m 이내로 하고, 보통 1.2m 정도로 한다.","치장줄눈은 되도록 짧은 시일에 하는 것이 좋다.","하루 일이 끝날 때에 켜에 차가 나면 층단 들여쌓기로 하여 다음 날의 일과 연결이 쉽게 한다.","1"
"건설안전기사","2005","1","건설시공학","68","모래의 전단력의 차이에 의해 모래의 불교란 시료를 채취하기 곤란한 경우 현지의 지반에서 직접 밀도를 측정하는 시험방법은?","","표준관입시험","베인테스트","지내력시험","전단시험","1"
"건설안전기사","2005","1","건설시공학","69","웰 포인트(Well-Point)공법의 특징이 아닌 것은?","","점토지반 보다는 사질지반에 유효한 공법이다.","지반내의 기압이 대기압 보다 높아져서 토층은 대기압에 의해 다져진다.","지하수위를 낮게하는 공법이다.","지하수위의 저하에 따라서 부력이 감소되어 지반을 다지게 된다.","2"
"건설안전기사","2005","1","건설시공학","70","연질의 점토지반에서는 굴착에 의한 흙막이벽 바깥에 있는 흙의 중량과 지표위의 적재하중의 중량에 못 견디어 저면 흙이 붕괴되고 흙막이벽 바깥에 있는 흙이 저면 지표안으로 밀려 불룩하게 되는 현상은?","","Heaving 파괴","Boiling 파괴","Shearing 파괴","Piping 파괴","1"
"건설안전기사","2005","1","건설시공학","71","철골재의 용접결함이 아닌 것은?","","위핑(weeping)","슬래그(slag) 감싸들기","오버랩(overlap)","공기구멍(blow hole)","1"
"건설안전기사","2005","1","건설시공학","72","공동도급의 장점으로 옳지 않은 것은?","","정밀시공이 가능하다.","공사수급의 경쟁완화수단이 된다.","일식도급공사의 경우보다 경비가 줄어든다.","기술, 자본 및 위험 등의 부담을 분산시킬 수 있다.","3"
"건설안전기사","2005","1","건설시공학","73","다음 중 토공사의 장비로 거리가 먼 것은?","","로더(loader)","파워쇼벨(power shovel)","가이데릭(guy derrick)","클램쉘(clamshell)","3"
"건설안전기사","2005","1","건설시공학","74","철골세우기에서 앵커 보울트(anchor bolt)묻기의 설명 중 옳지 않은 것은?","","고정매입법은 기초 콘크리트 시공시 앵커보울트를 정확한 위치에 고정시켜 콘크리트를 치기 때문에 시공이 간단하다.","가동매입법은 앵커보울트를 완전히 매입하지 않고 상부에 함석판을 끼우고 콘크리트를 시공한다.","나중매입법은 기초 콘크리트에 앵커보울트를 묻을 구멍을 내두었다가 나중에 고정한다.","나중매입법은 경미한 구조에 이용된다.","1"
"건설안전기사","2005","1","건설시공학","75","네트워크 공정표의 설명 중 틀린 것은?","","공사단축 가능요소의 발견이 용이하다.","작업상호간의 관련성은 알기 쉽다.","작성자 이외의 사람도 이해하기 쉽다.","공사의 진척관리를 정확히 알 수 없다.","4"
"건설안전기사","2005","1","건설시공학","76","콘크리트 타설시 일반적인 주의사항으로 옳지 않은 것은?","","운반거리가 가까운 곳으로부터 타설을 시작한다.","자유낙하 높이를 작게 한다.","콘크리트를 수직으로 낙하한다.","거푸집, 철근에 콘크리트를 충돌시키지 않는다.","1"
"건설안전기사","2005","1","건설시공학","77","철골공작 용어에서 스패터(spatter)란?","","철골용접 중 튀어나오는 슬래그 및 금속입자","전단절단에서 생기는 뒤꺽임 현상","수동 가스절단에서 절단선이 곧지 못하여 생기는 잘록한 자국의 거치렁이","철골용접에서 용접부의 상부를 덮는 용접 불순물","1"
"건설안전기사","2005","1","건설시공학","78","거푸집에 대한 콘크리트의 측압에 대한 기술 중 옳은 것은?","","묽은 콘크리트 일수록 측압이 작다.","온도가 낮을수록 측압은 작다.","콘크리트의 붓기속도가 빠를수록 측압이 크다.","거푸집의 강성이 클수록 측압이 작다.","3"
"건설안전기사","2005","1","건설시공학","79","큰 토압, 수압에 견디며 일반적으로 널리 쓰이는 강재 널말뚝은?","","라르젠","유니버설 조인트","테레스 로기스","랜섬","1"
