"Test Name","Year","Session","Subject","Number","Question","Question_image","Option 1","Option 2","Option 3","Option 4","Answer"
"건설안전산업기사","2005","1_추가시험","건설재료학","79","굳지 않은 콘크리트의 성질 중 플라스티시티(plasticity)에 대한 설명으로 옳은 것은?","","수량에 의해 변화하는 유동성의 정도","거푸집 등의 형상에 순응하여 채우기 쉽고 분리가 일어나지 않는 성질","마감성의 난이를 표시하는 성질","콘크리트의 작업성 난이 정도","2"
"건설안전산업기사","2005","1_추가시험","건설재료학","80","대리석의 성질과 용도에 관한 다음 기술 중 옳은 것은?","","석질이 치밀하고 판석으로서 지붕 외벽 등에 붙이고 비석, 숫돌로 이용된다.","석질이 견고하고 조적재, 기초석재, 장식용으로 쓰인다.","내화도는 높으나 조잡하여 경량골재, 내화재 등에 사용한다.","석질이 치밀하고 열, 산에는 약하지만 미려하므로 장식용으로 최고급 재료이다.","4"
"건설안전산업기사","2005","1_추가시험","건설안전기술","81","다음()에 알맞은 수는?\n철골공사와 관련하여 근로자가 수직방향으로 이동하는 철골부재에는 답단 간격미 ()센티미터 이내인 고정된 승강로를 설치하여야 하며, 수평방향 철골과 수직방향 철골이 연결되는 부분에는 연결작업을 위하여 작업발판 등을 설치하여야 한다.","","10","20","30","40","3"
"건설안전산업기사","2005","1_추가시험","건설안전기술","82","다음 중 유해·위험 방지계획서 제출 대상 공사는?","","지상높이가 21m인 건축물 건설공사","최대지간 길이가 40m인 교량 건설공사","제방높이가 10m인 댐 건설공사","깊이가 12m인 굴착공사","4"
"건설안전산업기사","2005","1_추가시험","건설안전기술","83","다음은 이동식비계 조립시 준수하여야 할 사항으로()에 알맞은 것으로 짝지어진 것은?\n이동식비계의 바퀴에는 뜻밖의 갑작스러운 미동을 방지 하기 위하며 (①)(②) 등으로 바퀴를 고정시키고 비계의 일부를 견고한 시설물에 잡아매는 등의 조치를 할 것","","① 브레이크, ② 쐐기","① 콘크리트 타설, ② 교차가새","① 교차가새, ② 안전난간","① 안전난간, ② 쐐기","1"
"건설안전산업기사","2005","1_추가시험","건설안전기술","84","다음 중 지반의 굴착 전 사전조사 사항에 해당되는 것은?","","흙막이 지보공의 설치 유무","소화설비의 유무","지반의 지하수위 상태","유도자의 배치 유무","3"
"건설안전산업기사","2005","1_추가시험","건설안전기술","85","다음 설명에 적합한 용어는?\n(①): 부두 위의 화물에 훅을 걸어 선내에 적재하기 까지의 작업을 말한다.\n(②): 선내의 화물을 부두 위에 내려놓고 혹을 풀기 까지의 작업을 말한다.","","① 양하, ② 적하","① 적하, ② 양하","① 상차, ② 하차","① 하차, ② 상차","2"
"건설안전산업기사","2005","1_추가시험","건설안전기술","86","다음 중 달비계 각 구성부분의 안전계수로 틀린 것은? (단, 곤돌라의 달비계는 제외함)","","달기와이어로프 및 달기강선의 안전계수→ 10 이상","달기체인 및 달기후크의 안전계수 5 이상","달기강대와 달비계 하부 및 상부지점의 강재 안전계수→ 2.5 이상","달기강대와 달비계 하부 및 상부지점의 목재 안전계수→3 이상","4"
"건설안전산업기사","2005","1_추가시험","건설안전기술","87","일반건설공사(갑)에서 재료비가 30억, 직접노무비가 50억일 때 예정가격상의 안전관리비는? (단. 일반건설공사(갑)의 안전관리비 계상기준 $=1.97\%)$","","56.400.000원","94.000.000원","157,600,000원","159,400,000원","3"
"건설안전산업기사","2005","1_추가시험","건설안전기술","88","다음 중 인력운반 작업 시 안전수칙으로 옳은 것은?","","길이가 긴 물건은 뒷쪽을 높게 하여 운반한다.","등을 편 상태에서 물건을 들어올린다.","물건은 가능한 몸에서 멀리 떼어서 들어올린다.","무거운 물건일수록 보조기구는 피하는 것이 좋다.","2"
"건설안전산업기사","2005","1_추가시험","건설안전기술","89","토사붕괴의 외적원인이 아닌 것은?","","토석의 강도 저하","절토 및 성토 높이의 증가","사면법면외의 경사 및 기울기 증가","지표수 및 지하수의 침투에 의한 토사 중량 증가","1"
"건설안전산업기사","2005","1_추가시험","건설안전기술","90","건설장비 크레인의 헤지(Hedge) 장치란?","","중량초과시 부저(Buzzer)가 울리는 장치이다.","와이어로프의 후크이탈 방지장치이다.","일정거리 이상을 권상하지 못하도록 제한시키는 장치이다.","크레인 자체에 이상이 있을 때 운전자에게 알려주는 신호 장치이다.","2"
"건설안전산업기사","2005","1_추가시험","건설안전기술","91","가설구조물 부재의 강성이 부족하여 가늘고 긴 부재가 압축력에 의하여 파괴되는 현상은?","","좌굴","탄성변형","한계변형","변형","1"
"건설안전산업기사","2005","1_추가시험","건설안전기술","92","비계로부터의 추락 원인과 관계가 먼 것은?","","작업발판의 폭이 좁았다.","덮개가 없었다.","비계 위로 올라 갔다.","난간이 없었다.","2"
"건설안전산업기사","2005","1_추가시험","건설안전기술","93","거푸집 작업 시 안전담당자의 직무와 거리가 먼 것은?","","전반적인 작업공정과 공기를 결정하고 지시하는 일","안전한 작업방법을 결정하고 작업을 지휘하는 일","재료, 기구의 유무를 점검하고 불량품을 제거하는 일","작업 중 안전대 및 안전모 등 보호구 착용상태를 감시하는 일","1"
"건설안전산업기사","2005","1_추가시험","건설안전기술","94","건설현장에서 사용되는 건설장비는 자격을 가진 자가 정기적으로 자체검사를 실시해야 한다. 다음 중 틀린 것은?","","크레인, 이동식크레인, 데릭은 6개월에 1회 이상","승강기는 3개월에 1회 이상","리프트는 3개월에 1회 이상","곤돌라는 6개월에 1회 이상","2"
"건설안전산업기사","2005","1_추가시험","건설안전기술","95","다음 중 토사붕괴재해의 예방대책으로 옳지 않은 것은?","","사다리 설치","안전한 굴착 경사 유지","흙막이 지보공 설치","순찰강화 및 안전점검 실시","1"
"건설안전산업기사","2005","1_추가시험","건설안전기술","96","사업주는 계단 및 계단참을 설치할 때에는 매 $m^2$ 당몇 kg 이상의 하중에 견딜 수 있는 강도를 가진 구조로 설치하여야 하는가?","","200kg","300kg","400kg","500kg","4"
"건설안전산업기사","2005","1_추가시험","건설안전기술","97","추락사고를 예방하기 위한 방지대책으로 옳지 않은 것은?","","안전담당자를 지정하여 지도·감독","안전대 착용 및 추락방지망 설치","작업대나 비계에 작업발판과 난간대 설치","높이 1미터 이상인 장소에서의 작업 금지","4"
"건설안전산업기사","2005","1_추가시험","건설안전기술","98","다음 중 동상방지 대책으로 틀린 것은?","","동결되지 않는 흙으로 치환하는 방법","흙속의 단열재료를 매입하는 방법","지표의 흙을 화학약품으로 처리하는 방법","세립토층을 설치하여 모관수의 상승을 촉진시키는 방법","4"
"건설안전산업기사","2005","1_추가시험","건설안전기술","99","콘크리트 배합 시 품질에 직접 영향을 주지 않는 요소는?","","철근의 품질","골재의 입도","물-시멘트비","시멘트 강도","1"
"건설안전산업기사","2005","1_추가시험","건설안전기술","100","불도저(bulldozer)의 종류로 블레이드면이 진행방향의 중심선에 대하여 $20\sim30^{\circ}$ 경사져 흙을 측면으로 보낼 수 있는 것은?","","크롤러 도저","앵글 도저","레이크 도저","스트레이트 도저","2"