"Test Name","Year","Session","Subject","Number","Question","Question_image","Option 1","Option 2","Option 3","Option 4","Answer"
"건설안전기사","2009","1","건설시공학","75","철골용접 부위의 비파괴검사에 대한 설명 중 옳지 않은 것은?","","방사선검사는 필름의 밀착성이 좋지 않은 건축물 에서는 검출이 어렵다.","침투탐상검사는 액체의 모세관현상을 이용한다.","초음파탐상검사는 인간이 들을 수 있는 20KHz 이하의 주파수를 갖는 음파를 이용한다.","외관검사는 용접을 한 용접공이나 용접관리 기술자가 한다.","3"
"건설안전기사","2009","1","건설시공학","76","콘크리트 타설시 거푸집에 작용하는 측압에 대한 설명으로 옳지 않은 것은?","","기온이 낮을수록 측압은 작아진다.","거푸집의 강성이 클수록 측압은 크다.","진동기를 사용하여 다질수록 측압은 커진다.","조강시멘트 등을 활용하면 측압은 작아진다.","1"
"건설안전기사","2009","1","건설시공학","77","건설사업이 대규모화, 고도화, 다양화, 전문화 되어감에 따라 단순 기술에 의한 시공만이 아닌 고부가가치를 추구하기 위하여 업무영역 확대를 의미하는 것은?","","CM","EC","BOT","SOC","2"
"건설안전기사","2009","1","건설시공학","78","웰 포인트 공법(well point method)에 관한 설명 중 옳지 않은 것은?","","지하수위를 낮추는 공법이다.","1~3m의 간격으로 파이프를 지중에 박는다.","인접지 침하의 우려에 따른 주의가 필요하다.","사질지반보다 점토질 지반에서 효과가 좋다.","4"
"건설안전기사","2009","1","건설시공학","79","다음 중 콘크리트 이어붓기에 있어 계획상 의도되지 않은 것은?","","cold joint","control joint","construction joint","sliding joint","1"
"건설안전기사","2009","1","건설시공학","80","흙의 종류에서 알의 크기가 모래보다 작고 육안으로 헤아릴 수 없으나 구형에 가깝고 끈기가 없는 것은?","","부식토","진흙","실트","고로슬래그","2"
"건설안전기사","2009","1","건설재료학","81","다음 중 강당, 집회장 등의 음향조절용으로 쓰이거나 일반 건물의 벽 수장재로 사용하여 음향효과를 거둘 수 있는 목재 가공품은?","","파키트 블록","코펜하겐 리브","플로링 보드","파키트 패널","2"
"건설안전기사","2009","1","건설재료학","82","다음 중 석재와 그 용도를 짝지은 것으로 옳지 않은 것은?","","화강암 - 외장재","응회암-구조용석재","점판암-천연슬레이트","안산암-장식재","2"
"건설안전기사","2009","1","건설재료학","83","회반죽 바름을 한 벽체는 공기 중의 무엇과 반응하여 경화하는가?","","탄산가스","산소","질소","수소","1"
"건설안전기사","2009","1","건설재료학","84","다음 중 아스팔트의 물리적 성질에 있어 아스팔트의 견고성 정도를 평가한 것은?","","신도","침입도","내후성","인화점","2"
"건설안전기사","2009","1","건설재료학","85","다음의 합성수지 중 열경화성수지는?","","염화비닐수지","폴리에틸렌수지","폴리에스테르수지","폴리스티렌수지","3"
"건설안전기사","2009","1","건설재료학","86","석재의 일반적 성질에 관한 설명으로 옳지 않은 것은?","","석재의 강도는 비중에 비례한다.","석재의 공극률이 크면 동결융해 반복으로 동해하기쉽다.","석재의 함수율이 높을수록 강도가 저하된다.","석재의 강도 중에서 가장 큰 것은 인장강도이며, 압축 및 전단강도는 인장강도에 비하여 매우 작다.","4"
"건전설안전기사","2009","1","건설재료학","87","콘크리트 배합시 시멘트 1m³, 물 2000L 인 경우 물 시멘트비는?(단, 시멘트의 비중은 3.15이다)","","약 15.7%","약 20.5%","약 50.4%","약 63.5%","4"
"건설안전기사","2009","1","건설재료학","88","다음 미장재료의 경화과정별 분류로 옳지 않은 것은?","","돌로마이트 플라스터: 기경성","시멘트모르타르 : 수경성","석고플라스터 : 수경성","인조석바름 : 기경성","4"
"건설안전기사","2009","1","건설재료학","89","다음 중 골재의 함수상태에 관한 설명으로 옳지 않은 것은?","","함수량이란 습윤상태의 골재의 내외에 함유하는 전체수량을 말한다.","흡수량이란 표면건조 내부포수상태의 골재중에 포함하는 수량을 말한다.","유효흡수량이란 절건상태와 기건상태의 골재내에 함유된 수량과의 차를 말한다.","표면수량이란 함수량과 흡수량의 차를 말한다.","3"
"건설안전기사","2009","1","건설재료학","90","재료의 성질을 나타낸 용어에 대한 설명으로 옳지 않은 것은?","","강성 : 외력을 받았을 때 변형에 저항하는 성질","연성 : 재료를 두들길 때 얇게 펴지는 현상","취성: 작은 변형에도 파괴되는 성질","소성 : 힘을 제거해도 본래 상태로 돌아가지 않고 영구변형이 남는 성질","2"
"건설안전기사","2009","1","건설재료학","91","다음 중 콘크리트용 골재에 대한 설명으로 옳지 않은 것은?","","골재의 입형은 가능한 한 편평, 세장하지 않아야 한다.","청정하며 가능한 염화물을 많이 포함할수록 우수한 골재이다.","골재는 콘크리트의 워커빌리티에 영향을 미친다.","물리화학적으로 안전성이 있어야 한다.","2"
"건설안전기사","2009","1","건설재료학","92","다음 중 목재에 관한 설명으로 옳지 않은 것은?","","추재의 세포막은 춘재의 세포막보다 두껍고 조직이 치밀하다.","변재는 심재보다 수축이 크다.","변재는 수심의 주위에 둘러져 있는 생활기능이 줄어든 세포의 집합이다.","침엽수의 수지구는 수지의 분비, 이동, 저장의 역할을 한다.","3"
"건설안전기사","2009","1","건설재료학","93","다음 중 강을 제조할 때 사용하는 제강법의 종류가 아닌 것은?","","평로 제강법","전기로 제강법","반사로 제강법","전로 제강법","3"
"건설안전기사","2009","1","건설재료학","94","다음 중 합금에 대한 설명으로 옳지 않은 것은?","","구조용 특수강은 탄소강에 니켈, 망간 등을 첨가 하여 강인성을 높인 것이다.","황동은 구리와 주석으로 된 합금이며 산, 알칼리에 침식되지 않는다.","스테인리스강은 크롬 및 니켈 등을 함유하며 탄소강이 적고 내식성이 우수하다.","강의 합금인 내후성 강은 부식되는 정도가 보통강의 1/3~1/10정도이다.","2"
"건설안전기사","2009","1","건설재료학","95","굳지 않은 콘크리트의 성질 중 굵은 골재의 분리에 영향을 주는 인자와 거리가 먼 것은?","","단위수량","골재의 종류","골재의 강도","골재의 입형","3"
"건설안전기사","2009","1","건설재료학","96","유용성 수지를 건조성 기름에 가열용해하여 이것을 휘발성 용제로 희석한 것으로 광택이 있고 강인하며 내구 내수성이 큰 도장재료는?","","유성페인트","유성바니시","에나멜페인트","스테인","2"
"건설안전기사","2009","1","건설재료학","97","재하 하중이 120kN에서 파괴된 지름 100mm, 길이 200mm인 콘크리트시험체의 인장강도는?","","약 2.0MPa","약 2.4MPa","약 3.0MPa","약 3.8MPa","4"
"건설안전기사","2009","1","건설재료학","98","다음 중 내화벽돌의 원료 광물로서 가장 적절한 것은?","","형석","방해석","활석","납석","4"
"건설안전기사","2009","1","건설재료학","99","강화플라스틱(FRP)의 재료로서 전기절연성, 내열성, 내약품성이 뛰어나며 레진콘크리트용 수지, 도료, 접착제 등에 사용되는 수지는?","","알키드수지","실리콘수지","불포화 폴리에스테르수지","요소수지","3"
"건설안전기사","2009","1","건설재료학","100","양질의 도토 또는 장석분을 원료로 하여, 흡수율이 1%이하로 거의 없으며 소성온도가 약1230~1460℃인 점토제품은?","","토기","석기","자기","도기","3"
"건설안전기사","2009","1","건설안전기술","101","통나무비계를 사용할 때 벽연결은 수직방향에서 몇 미터 이하로 하여야 하는가?","","3m 이하","4.5m 이하","5.5m 이하","7.5m 이하","3"
"건설안전기사","2009","1","건설안전기술","102","크레인을 사용하는 경우 작업시작 전에 점검하여야 하는 사항에 해당하지 않는 것은?","","권과방지장치, 브레이크, 클러치 및 운전장치의 기능","주행로의 상측 및 트롤리가 횡행하는 레일의 상태","와이어로프가 통하는 곳의 상태","붐의 경사각도","4"
"건설안전기사","2009","1","건설안전기술","103","안전대의 종류는 사용구분에 따라 벨트식과 안전그네식으로 구분되는데 이 중 안전그네식에만 적용하는 것으로 나열한 것은?","","1개걸이용, U자걸이용","1개걸이용, 추락방지대","U자걸이용, 안전블록","추락방지대, 안전블록","4"
"건설안전기사","2009","1","건설안전기술","104","타워크레인의 설치·조립·해체작업을 하는 때에 작성하는 작업계획서에 포함시켜야 할 사항이 아닌 것은?","","타워크레인의 종류 및 형식","중량물의 운반 경로","작업인원의 구성 및 작업근로자의 역할범위","작업도구 장비·가설설비 및 방호설비","2"
"건설안전기사","2009","1","건설안전기술","105","굴착공사에 있어서 비탈면붕괴를 방지하기 위하여 행하는 대책이 아닌 것은?","","지표수의 침투를 막기 위해 표면배수공사를 한다","지하수위를 내리기 위해 수평배수공을 설치한다.","비탈면하단을 성토한다.","비탈면 상부에 토사를 적재한다.","4"
"건설안전기사","2009","1","건설안전기술","106","일반적인 콘크리트의 압축강도는 표준양생을 실시한 재령 몇일을 기준으로 하는가?","","7일","21일","28일","30일","3"
"건설안전기사","2009","1","건설안전기술","107","건설공사 중 물체의 낙하 또는 비래에 의하여 재해가 발생할 위험이 있을 때 이에 대한 방지대책으로 가장 거리가 먼 것은?","","낙하물방지망 또는 방호선반을 설치한다.","출입금지구역을 설정하여 출입통제를 한다.","안전난간을 설치한다.","보호구를 착용하고 작업하도록 한다.","3"
"건설안전기사","2009","1","건설안전기술","108","건설현장에서 사용하는 임시조명기구에 대한 안전대책으로 옳지 않은 것은?","","모든 조명기구에는 외부의 충격으로부터 보호될 수 있도록 보호망을 씌워야 한다.","이동식 조명기구의 배선은 유연성이 좋은 코드선을 사용해야 한다.","이동식 조명기구의 손잡이는 견고한 금속재료로 제작해야 한다.","이동식 조명기구를 일정한 장소에 고정시킬 경우에는 견고한 받침대를 사용해야 한다.","3"
"건설안전기사","2009","1","건설안전기술","109","롤러의 표면에 돌기를 만들어 부착한 것으로 풍화암을 파쇄하고 흙 속의 간극수압을 제거하는 작업에 적합한 장비는?","","Tandem roller","Macadam roller","Tamping roller","Tire roller","3"
"건설안전기사","2009","1","건설안전기술","110","그림과 같이 두 곳에 줄을 달아 중량물을 들어올릴 때, 힘 p의 크기에 관한 설명으로 옳은 것은?","O","매단 줄의 각도($\alpha$)가 0°일 때 최소가 된다.","매단 줄의 각도($\alpha$)가 60°일 때 최소가 된다.","매단 줄의 각도($\alpha$)가 120°일 때 최소가 된다.","매단 줄의 각도($\alpha$)와 상관없이 모두 같다.","4"
"건설안전기사","2009","1","건설안전기술","111","하역운반기계에 화물을 적재하거나 내리는 작업을 할 때 작업지휘자를 지정해야 하는 경우는 단위화물의 무게가 몇 kg 이상일 때인가?","","100kg","150kg","200kg","250kg","1"
"건설안전기사","2009","1","건설안전기술","112","흙막이 지보공을 설치하였을 때 정기적으로 점검하여 이상 발견시 즉시 보수하여야 할 사항이 아닌 것은?","","굴착 깊이의 정도","버팀대의 긴압의 정도","부재의 접속부, 부착부 및 교차부의 상태","부재의 손상, 변형, 부식, 변위 및 탈락의 유무와 상태","1"
"건설안전기사","2009","1","건설안전기술","113","10cm 그물코인 방망을 설치한 경우에 망 밑부분에 충돌위험이 있는 바닥면 또는 기계설비와의 수직거리는 얼마 이상이어야 하는가? (단, L(1개의 방망일 때 단변방향길이) = 12m, A(장변방향 방망의 지지간격) = 6m)","","10.2m","12.2m","14.2m","16.2m","1"
"건설안전기사","2009","1","건설안전기술","114","다음 중 가설통로의 설치기준으로 옳지 않은 것은?","","경사는 30° 이하로 한다.","경사가 10°를 초과하는 경우에는 미끄러지지 않는 구조로 한다.","추락위험이 있는 장소에는 안전난간을 설치한다.","건설공사에서 사용되는 높이 8m 이상인 비계다리에는 7m 이내마다 계단참을 설치한다.","2"
"건설안전기사","2009","1","건설안전기술","115","굴착공사에서 경사면의 안전성을 확인하기 위한 검토 사항에 해당되지 않는 것은?","","지질조사","토질시험","풍화의 정도","경보장치 작동상태","4"
"건설안전기사","2009","1","건설안전기술","116","인체가 감전되었을 때 그 위험도에 영향을 미치는 요소에 대한 설명으로 옳지 않은 것은?","","인체의 통전전류가 클수록 위험성은 커진다.","같은 크기의 전류에서는 감전시간이 길 경우에 위험성은 커진다.","같은 전류의 크기라도 상용주파수의 교류전원이 더 위험하다.","상용주파수의 교류전원보다 직류전원이 더 위험 하다.","4"
"건설안전기사","2009","1","건설안전기술","117","철골공사시 사전안전성 확보를 위해 공작도에 반영하여야 할 사항이 아닌 것은?","","주변 고압전주","외부비계받이","기둥승강용 트랩","방망 설치용 부재","1"
"건설안전기사","2009","1","건설안전기술","118","가설계단 및 계단참을 설치하는 때에는 m²당 몇kg 이상의 하중에 견딜 수 있는 강도를 가진 구조로 설치 하여야하는가?","","200kg","300kg","400kg","500kg","4"
"건설안전기사","2009","1","건설안전기술","119","크레인 또는 데릭에서 붐각도 및 작업반경별로 작용시킬 수 있는 최대하중에서 후크(Hook), 와이어로프 등 달기구의 중량을 공제한 하중은?","","작업하중","정격하중","이동하중","적재하중","2"
"건설안전기사","2009","1","건설안전기술","120","다음 중 지게차의 작업시작전 점검사항이 아닌 것은?","","권과방지장치, 브레이크, 클러치 및 운전장치 기능의 이상유무","하역장치 및 유압장치 기능의 이상유무","제동장치 및 조종장치 기능의 이상유무","전조등, 후미등, 방향지시기 및 경보장치 기능의 이상유무","1"