"Test Name","Year","Session","Subject","Number","Question","Question_image","Option 1","Option 2","Option 3","Option 4","Answer"
"건설안전산업기사","2003","4","건설안전기술","88","다음은 작업으로 인하여 물체가 낙하 또는 비래할 위험이 있는 경우 위험방지를 위해 취해야할 조치사항으로 가장 거리가 먼 것은?","","낙하물 방지망 또는 방호선반의 설치","출입금지구역의 설정","보호구의 착용","감시인 배치","4"
"건설안전산업기사","2003","4","건설안전기술","89","표준관입시험(SPT)에서의 N값은 외경 5.1cm, 내경 3.5cm, 길이 81cm의 스플릿스푼샘플러를 63.5kgf 햄머로 흐트러지지 않은 지반의 몇 cm 관입에 요하는 타격 회수인가?","","60cm","30cm","75cm","15cm","2"
"건설안전산업기사","2003","4","건설안전기술","90","히빙의 안전대책으로 틀린 것은?","","주변수위를 저하","근입심도 확보","적정한 굴착방법으로 대체","굴착주변 상재하중을 제거","1"
"건설안전산업기사","2003","4","건설안전기술","91","발파작업시 안전담당자의 직무가 아닌 것은?","","대피장소 및 경로를 지시한다.","근로자가 대피한 것을 확인한다.","자신이 직접 점화한다.","발파 후 불발장약을 점검한다.","3"
"건설안전산업기사","2003","4","건설안전기술","92","P.C(Precast Concrete) 조립시 안전대책으로 옳지 않은 것은?","","신호수를 지정한다.","인양 P.C부재 아래에 근로자 출입을 금지한다.","크레인에 P.C부재를 달아 올린 채 주행한다.","운전자는 P.C부재를 달아 올린 채 운전대 이탈을 금지한다.","3"
"건설안전산업기사","2003","4","건설안전기술","93","비계의 설치 기준을 설명한 것이다. 틀린 것은?","","강관 비계기둥 간격 띠장방향: 1.5~1.8m, 장선방향 : 1.5m 이하","통나무 비계의 기둥 간격 2.5m 이하","통나무 비계의 첫 번째 띠장 - 지상으로부터 3.0m이하","강관 비계의 첫 번째 띠장 지상으로부터 2.5m 이하","4"
"건설안전산업기사","2003","4","건설안전기술","94","거푸집 동바리 구조검토시 고려해야 할 연직하중이 아닌 것은?","","콘크리트 중량","작업자 중량","기계 차량 등이 적재되는 경우 그 하중","풍하중","4"
"건설안전산업기사","2003","4","건설안전기술","95","비계의 수평재(띠장)의 최대 모멘트가 $5,000kgf·cm$, 띠장의 단면 계수가 $5cm^3$ 일 때 응력은 얼마인가?","","$500kgf/cm^2$","$1,000kgf/cm^2$","$2,000kgf/cm^2$","$2,500kgf/cm^2$","2"
"건설안전산업기사","2003","4","건설안전기술","96","다음 중 트러스(Truss frame)구조를 가장 잘 설명한 것은?","","각 절점이 강하게 접합되어 있는 구조이며 역학적으로 횡재, 압축재, 인장재가 결합되어 있는 형식","골조의 각 절점이 모두 핀으로 접합되어 있으며 일반적으로 각 부재가 삼각형을 구성하는 골조","상부에서 오는 수직 압력이 아치의 축선에 따라 좌우로 나누어져 밑으로 직압력만 전달되는 구조로 부재의 하부에 인장력이 생기지 않는 구조","한쪽만 고정시키고 다른 끝은 돌출시켜 그 위에 하중을 지지하도록 한 구조","2"
"건설안전산업기사","2003","4","건설안전기술","97","추락의 위험이 있을 때 설치하는 방망의 정기시험에 대한 설명으로 알맞은 것은?","","사용개시 후 1년 이내에 처음 실시하고 1년에 1회 실시한다.","사용개시 후 6개월 이내에 처음 실시하고 1년에 1회 실시한다.","사용개시 후 1년 이내에 처음 실시하고 6개월에 1회 실시한다.","사용개시 후 6개월 이내에 처음 실시하고 6개월에 1회 실시한다.","3"
"건설안전산업기사","2003","4","건설안전기술","98","콘크리트 타설시 안전에 유의해야 할 사항으로 적절하지 않는 것은?","","타설구획 순서는 계획대로 실시한다.","타설 속도는 하계 1.0m/시, 동계 1.5m/시를 표준으로 한다.","높은 곳으로부터 콘크리트를 세게 거푸집내에 넣지 않는다.","타설시 공동이 발생되지 않도록 밀실하게 부어 넣는다.","2"
"건설안전산업기사","2003","4","건설안전기술","99","다음은 지게차의 장점을 열거한 것이다. 이에 해당되지 않는 것은?","","하역을 위한 마스트(mast)가 주행시야를 넓게 한다.","하역, 운반 작업시 작업자는 운전자 1명으로도 가능하다.","하역, 운반시의 안전성이 다른 운송기계에 비해 우수하다.","50m 이내의 운반거리에서는 하역량을 극대화 시킬 수 있다.","1"
"건설안전산업기사","2003","4","건설안전기술","100","굴착기계로 채석작업시 작업장에 후진하여 접근하거나 전락할 우려가 있을 때 사고를 방지하기 위하여 배치하여야 하는 사람은?","","작업지휘자","안전담당자","감시인","유도자","4"