"Test Name","Year","Session","Subject","Number","Question","Question_image","Option 1","Option 2","Option 3","Option 4","Answer"
"건설안전산업기사","2014","2","건설재료학","76","콘크리트의 워커빌리티에 영향을 줄 수 있는 요소에 대한 설명 중 틀린 것은?","","단위수량이 증가하면 워커빌리티는 좋아지지만 재료의 분리가 발생하기 쉽다.","일반적으로 부(富)배합의 경우는 빈(貧) 배합의 경우보다 워커빌리티가 좋다.","골재로 강자갈을 사용한 경우가 깬자갈이나 깬모래를 사용한 경우보다 워커빌리티가 나쁘다.","비빔시간이 과도하게 길면 콘크리트의 워커빌리티는 나빠진다.","3"
"건설안전산업기사","2014","2","건설재료학","77","1,000℃ 이상의 고온에서도 견디는 단열재료로 최근 철골의 내화피복재로 많이 사용되는 것은?","","규산칼슘판","펄라이트판","세라믹섬유","경질우레탄폼","3"
"건설안전산업기사","2014","2","건설재료학","78","점토 벽돌의 규격에 해당되는 기본치수로 옳은 것은? (단. 단위는 mm)","","190×90×57","190×90×60","210×90×57","210×90×60","1"
"건설안전산업기사","2014","2","건설재료학","79","KS F 3211(건설용 도막방수제)에서 주요 원료에 따른 방수재의 종류에 해당하지 않는 것은?","","우레탄 고무계 방수재","아크릴 고무계 방수재","에폭시 고무계 방수재","고무 아스팔트계 방수재","3"
"건설안전산업기사","2014","2","건설재료학","80","강의 물리적 성질 중 탄소함유량이 증가함에 따라 나타나는 현상으로 틀린 것은?","","비중이 낮아진다.","열전율이 커진다.","팽창계수가 낮아진다.","비열과 전기저항이 커진다.","2"
"건설안전산업기사","2014","2","건설안전기술","81","건설현장에서 근로자가 안전하게 통행할 수 있도록 통로에 설치하는 조명의 조도 기준은?","","65 lux","75 lux","85 lux","95 lux","2"
"건설안전산업기사","2014","2","건설안전기술","82","작업으로 인하여 물체가 떨어지거나 날아올 위험이 있는 경우에 조치 및 준수하여야 할 내용으로 옳지 않은 것은?","","낙하물방지망, 수직보호망 또는 방호선반 등을 설치한다.","낙하물방지망의 내민 길이는 벽면으로부터 2m 이상으로 한다.","낙하물방지망의 수평면과 각도는 20° 이상 30° 이하를 유지한다.","낙하물방지망은 높이 15m 이내마다 설치한다.","4"
"건설안전산업기사","2014","2","건설안전기술","83","옹벽의 활동에 대한 저항력은 옹벽에 작용하는 수평력보다 최소 몇 배 이상 되어야 안전한가?","","0.5","1.0","1.5","2.0","3"
"건설안전산업기사","2014","2","건설안전기술","84","콘크리트를 타설할 때 안전상 유의하여야 할 사항으로 옳지 않은 것은?","","콘크리트를 치는 도중에는 거푸집, 지보공 등의 이상 유무를 확인한다.","진동기 사용시 지나친 진동은 거푸집 도괴의 원인이 될 수 있으므로 적절히 사용해야 한다.","최상부의 슬래브는 되도록 이어붓기를 하고 여러 번에 나누어 콘크리트를 타설한다.","타워에 연결되어 있는 슈트의 접속은 확실한지 확인한다.","3"
"건설안전산업기사","2014","2","건설안전기술","85","현장에서 말비계를 조립하여 사용할 때에는 다음 보기의 사항을 준수하여야 한다. ( )안에 적합한 것은?\n말비계의 높이가 2m를 초과할 경우에는 작업발판의 폭을 ( )cm 이상으로 할 것","","10","20","30","40","4"
"건설안전산업기사","2014","2","건설안전기술","86","비탈면 붕괴 방지를 위한 붕괴방지공법과 가장 거리가 먼 것은?","","배토공법","압성토공법","공작물의 설치","웰포인트 공법","4"
"건설안전산업기사","2014","2","건설안전기술","87","철근콘크리트 공사시 거푸집의 필요조건이 아닌 것은?","","콘크리트의 하중에 대해 뒤틀림이 없는 강도를 갖출 것","콘크리트 내 수분 등에 대한 물빠짐이 원할한 구조를 갖출 것","최소한의 재료로 여러 번 사용할 수 있는 전용성을 가질 것","거푸집은 조립·해체·운반이 용이하도록 할 것","2"
"건설안전산업기사","2014","2","건설안전기술","88","건설업 산업안전보건관리비의 사용항목이 아닌 것은?","","안전관리계획서 작성비용","안전관리자의 인건비","안전시설비","안전진단비","1"
"건설안전산업기사","2014","2","건설안전기술","89","트렌치 굴착시 흙막이 지보공을 설치하지 않는 경우 굴착 깊이는 몇 m 이하로 해야 하는가?","","1.5m","2m","3.5m","4m","1"
"건설안전산업기사","2014","2","건설안전기술","90","산업안전보건기준에 관한 규칙에 따른 계단 및 계단참을 설치하는 경우 매 $m^2$당 최소 얼마 이상의 하중에 견딜 수 있는 강도를 가진 구조로 설치하여야 하는가?","","500 kg","600 kg","700 kg","800 kg","1"
"건설안전산업기사","2014","2","건설안전기술","91","근로자의 추락 등의 위험을 방지하기 위하여 설치하는 안전난간의 구조 및 설치 기준으로 옳지 않은 것은?","","상부난간대는 바닥면 발판 또는 경사로의 표면으로부터 90cm 이상 지점에 설치할 것","발끝막이판은 바닥면 등으로부터 10cm 이상의 높이를 유지할 것","안전난간은 구조적으로 가장 취약한 지점에서 가장 취약한 방향으로 작용하는 80kg 이상의 하중에 견딜 수 있는 튼튼한 구조일 것","난간대는 지름 2.7cm 이상의 금속제 파이프나 그 이상의 강도가 있는 재료일 것","3"
"건설안전산업기사","2014","2","건설안전기술","92","사다리식 통로를 설치할 때 사다리의 상단은 걸쳐 놓은 지점으로부터 얼마 이상 올라가도록 하여야 하는가?","","45cm 이상","60cm 이상","75cm 이상","90cm 이상","2"
"건설안전산업기사","2014","2","건설안전기술","93","차량계 하역운반기계 등을 이송하기 위하여 지주 또는 견인에 의하여 화물자동차에 싣거나 내리는 작업을 할 때에 준수하여야 할 사항으로 옳지 않은 것은?","","발판을 사용하는 경우에는 충분한 길이폭 및 강도를 가진 것을 사용할 것","지정운전자의 성명 연락처 등을 보기 쉬운 곳에 표시하고 지정운전자 외에는 운전하지 않도록 할 것","가설대 등을 사용하는 경우에는 충분한 폭 및 강도와 적당한 경사를 확보할 것","싣거나 내리는 작업을 할 때는 편의를 위해 경사지고 견고한 지대에서 할 것","4"
"건설안전산업기사","2014","2","건설안전기술","94","작업조건에 알맞은 보호구의 연결이 옳지 않은 것은? (문제오류로 실제 시험에서는 모두 정답처리 되었습니다. 여기서는 1번을 누르면 정답 처리 됩니다.)","","안전대 : 높이 또는 깊이 2m 이상의 추락할 위험이 있는 장소에서의 작업","보안면 : 물체가 흩날릴 위험이 있는 작업","안전화: 물체의 낙하충격, 물체에의 끼임, 감전 또는 정전기의 대전(帶電)에 의한 위험이 있는 작업","방열복 : 고열에 의한 화상 등의 위험이 있는 작업","1"
"건설안전산업기사","2014","2","건설안전기술","95","콘크리트 타설 작업시 거푸집에 작용하는 연직하중이 아닌 것은?","","콘크리트의 측압","거푸집의 중량","굳지 않은 콘크리트의 중량","작업원의 작업하중","1"
"건설안전산업기사","2014","2","건설안전기술","96","점성토 지반의 개량공법으로 적합하지 않은 것은?","","바이브로 플로테이션 공법","프리로딩 공법","치환공법","페이퍼 드레인공법","1"
"건설안전산업기사","2014","2","건설안전기술","97","철골작업에서 작업을 중지해야 하는 규정에 해당되지 않는 경우는?","","풍속이 초당 10m 이상인 경우","강우량이 시간당 1mm 이상인 경우","강설량이 시간당 1cm 이상인 경우","겨울철 기온이 영하 4℃ 이상인 경우","4"
"건설안전산업기사","2014","2","건설안전기술","98","쇼벨계 굴착기에 부착하며, 유압을 이용하여 콘크리트의 파괴, 빌딩해체, 도로파괴 등에 쓰이는 것은?","","파일 드라이버","디젤해머","브레이커","오우거","3"
"건설안전산업기사","2014","2","건설안전기술","99","모래질 지반에서 포화된 가는 모래에 충격을 가하면 모래가 약간 수축하여 정(+)의 공극수압이 발생하며, 이로 인하여 유효응력이 감소하여 전단강도가 떨어져 순간침하가 발생하는 현상은?","","동상현상","연화현상","리칭현상","액상화현상","4"
"건설안전산업기사","2014","2","건설안전기술","100","유해·위험 방지계획서 제출시 첨부서류의 항목인 것은 어느 것인가?","","기계·설비의 배치도면","건축물 각 층의 평면도","작업환경 조성계획","공사 개요 및 안전보건관리계획","4"
