"Test Name","Year","Session","Subject","Number","Question","Question_image","Option 1","Option 2","Option 3","Option 4","Answer"
"건설안전기사","2020","1,2","산업안전관리론","1","다음은 산업안전보건법령상 공정안전보고서의 제출 시기에 관한 기준 내용이다. ( )안에 들어갈 내용을 올바르게 나열한 것은?\n사업주는 산업안전보건법 시행령에 따라 유해하거나 위험한 설비의 설치·이전 또는 주요 구조부분의 변경공사의 착공일 ( ) 전까지 공정안전보고서를 ( ) 작성하며 공단에 제출해야 한다.","","15일, 1부","15일, 2부","30일, 1부","30일, 2부","4"
"건설안전기사","2020","1,2","산업안전관리론","2","안전보건관리조직 중 스탭(Staff)형 조직에 관한 설명으로 옳지 않은 것은?","","안전정보수집이 신속하다.","안전과 생산을 별개로 취급하기 쉽다.","권한 다툼이나 조정이 용이하여 통제수속이 간단하다.","스탭 스스로 생산라인이 안전업무를 행하는 것은 아니다.","3"
"건설안전기사","2020","1,2","산업안전관리론","3","다음 중 시설물의 안전 및 유지관리에 관한 특별법상 시설물 정기안전점검의 실시 시기로 옳은 것은? (단, 시설물의 안전 등급이 A등급인 경우)","","반기에 1회 이상","1년에 1회 이상","2년에 1회 이상","3년에 1회 이상","1"
"건설안전기사","2020","1,2","산업안전관리론","4","정보서비스업의 경우, 상시근로자의 수가 최소 몇 명 이상일 때 안전보건관리규정을 작성하여야 하는가?","","50명 이상","100명 이상","200명 이상","300명 이상","4"
"건설안전기사","2020","1,2","산업안전관리론","5","100명의 근로자가 근무하는 A기업체에서 1주일에 48시간, 연간 50주를 근무하는데 1년에 50건의 재해로 총 2400일의 근로손실일수가 발생하였다. A기업체의 강도율은?","","10","24","100","240","1"
"건설안전기사","2020","1,2","산업안전관리론","6","아파트 신축 건설현장에 산업안전보건법령에 따른 안전·보건 표지를 설치하려고 한다. 용도에 따른 표지의 종류를 올바르게 연결한 것은?","","금연-지시표시","비상구-안내표시","고압전기-금지표시","안전모 착용-경고표시","2"
"건설안전기사","2020","1,2","산업안전관리론","7","기계설비의 안전에 있어서 중요 부분의 피로, 마모, 손상, 부식 등에 대한 장치의 변화 유무 등을 일정 기간마다 점검하는 안전점검의 종류는?","","수시점검","임시점검","정기점검","특별점검","3"
"건설안전기사","2020","1,2","산업안전관리론","8","하인리히 사고예방대책 5단계의 각 단계와 기본 원리가 잘못 연결된 것은?","","제1단계 - 안전조직","제2단계 - 사실의 발견","제3단계 - 점검 및 검사","제4단계 - 시정 방법의 선정","3"
"건설안전기사","2020","1,2","산업안전관리론","9","산업안전보건법령상 사업주의 의무에 해당하지 않는 것은?","","산업재해 예방을 위한 기준 준수","사업장의 안전 및 보건에 관한 정보를 근로자에게 제공","산업 안전 및 보건 관련 단체 등에 대한 지원 및 지도·감독","근로자의 신체적 피로와 정신적 스트레스 등을 줄일 수 있는 쾌적한 작업환경의 조성 및 근로조건 개선","3"
"건설안전기사","2020","1,2","산업안전관리론","10","시몬즈(Simonds)의 총재해 코스트 계산방식 중 비보험 코스트 항목에 해당하지 않는 것은?","","사망재해 건수","통원상해 건수","응급조치 건수","무상해 사고 건수","1"
"건설안전기사","2020","1,2","산업안전관리론","11","위험예지훈련의 4라운드 기법에서 문제점을 발견하고 중요 문제를 결정하는 단계는?","","현상파악","본질추구","목표설정","대책수립","2"
"건설안전기사","2020","1,2","산업안전관리론","12","재해조사의 주된 목적으로 옳은 것은?","","재해의 책임소재를 명확히 하기 위함이다.","동일 업종의 산업재해 통계를 조사하기 위함 이다.","동종 또는 유사재해의 재발을 방지하기 위함이다.","해당 사업장의 안전관리 계획을 수립하기 위함이다.","3"
"건설안전기사","2020","1,2","산업안전관리론","13","위험예지훈련의 기법으로 활용하는 브레인 스토밍(Brain Storming)에 관한 설명으로 옳지 않은 것은?","","발언은 누구나 자유분방하게 하도록 한다.","가능한 한 무엇이든 많이 발언하도록 한다.","타인의 아이디어를 수정하여 발언할 수 없다.","발표된 의견에 대하여는 서로 비판을 하지 않도록 한다.","3"
"건설안전기사","2020","1,2","산업안전관리론","14","버드(Frank Bird)의 도미노 이론에서 재해발생 과정에 있어 가장 먼저 수반되는 것은?","","관리의 부족","전술 및 전략적 에러","불안전한 행동 및 상태","사회적 환경과 유전적 요소","1"
"건설안전기사","2020","1,2","산업안전관리론","15","재해사례연구의 진행순서로 옳은 것은?","","재해 상황의 파악→사실의 확인→문제점 발견→근본적 문제점 결정→대책수립","사실의 확인→재해 상황의 파악→근본적 문제점 결정→문제점 발견→대책수립","문제점 발견→사실의 확인→재해 상황의 파악→근본적 문제점 결정→대책수립","재해 상황의 파악→문제점 발견→근본적 문제점 결정→대책수립→사실의 확인","1"
"건설안전기사","2020","1,2","산업안전관리론","16","사고예방대책의 기본원리 5단계 시정책의 적용 중 3E에 해당하지 않은 것은?","","교육(Education)","관리(Enforcement)","기술(Engineering)","환경(Enviroment)","4"
"건설안전기사","2020","1,2","산업안전관리론","17","다음 중 산업재해발견의 기본 원인 4M에 해당하지 않는 것은?","","Media","Material","Machine","Management","2"
"건설안전기사","2020","1,2","산업안전관리론","18","산업안전보건법령상 안전보건총괄책임자의 직무에 해당하지 않는 것은?","","도급 시 산업재해 예방조치","위험성평가의 실시에 관한 사항","해당 사업장 안전교육계획의 수립에 관한 보좌 및 지도·조언","산업안전보건관리비의 관계수급인 간의 사용에 관한 협의·조정 및 그 집행의 감독","3"
"건설안전기사","2020","1,2","산업안전관리론","19","보호구 안전인증제품에 표시할 사항으로 옳지 않은 것은?","","규격 또는 등급","형식 또는 모델명","제조번호 및 제조연월","성능기준 및 시험방법","4"
"건설안전기사","2020","1,2","산업안전관리론","20","산업안전보건법령상 자율안전확인대상 기계등에 해당하지 않는 것은?","","연삭기","곤돌라","컨베이어","산업용 로봇","2"
"건설안전기사","2020","1,2","산업심리 및 교육","21","집단간 갈등의 해소방안으로 틀린 것은?","","공동의 문제 설정","상위 목표의 설정","집단간 접촉 기회의 증대","사회적 범주화 편향의 최대화","4"
"건설안전기사","2020","1,2","산업심리 및 교육","22","의사소통의 심리구조를 4영역으로 나누어 설명한 조하리의 창(Johari's Windows)에서 '나는 모르지만 다른 사람은 알고 있는 영역'을 무엇이라 하는가?","","Blind area","Hidden area","Open area","Unknown area","1"
"건설안전기사","2020","1,2","산업심리 및 교육","23","Project method의 장점으로 볼 수 없는 것은?","","창조력이 생긴다.","동기부여가 충분하다.","현실적인 학습방법이다.","시간과 에너지가 적게 소비된다.","4"
"건설안전기사","2020","1,2","산업심리 및 교육","24","존 듀이(Jone Dewey)의 5단계 사고과정을 순서대로 나열한 것으로 맞는 것은?\n㉠ 행동에 의하여 가설을 검토한다.\n㉡ 가설(hypothesis)을 설정한다.\n㉢ 지식화(intellectualization)한다.\n㉣ 시사(suggestion)를 받는다.\n㉤ 추론(reasoning)한다.","","㉣→㉢→㉡→㉤→㉠","㉣→㉡→㉢→㉤→㉠","㉢→㉣→㉡→㉤→㉠","㉢→㉡→㉣→㉤→㉠","2"
"건설안전기사","2020","1,2","산업심리 및 교육","25","주의(attention)에 대한 설명으로 틀린 것은?","","주의력의 특성은 선택성, 변동성, 방향성을 표현된다.","한 자극에 주의를 집중하여도 다른 자극에 대한 주의력은 약해지지 않는다.","여러 종류의 자극을 지각할 때 소수의 특정한 것을 선택하여 집중하는 특성을 갖는다.","의식작용이 있는 일에 집중하거나 행동의 목적에 맞추어 의식수준이 집중되는 심리상태를 말한다.","2"
"건설안전기사","2020","1,2","산업심리 및 교육","26","안전교육 계획수립 및 추진에 있어 진행순서를 나열한 것으로 맞는 것은?","","교육의 필요정 발견→교육 대상 결정→교육 준비→교육 실시→교육의 성과를 평가","교육 대상 결정→교육의 필요점 발견→교육 준비→교육 실시→교육의 성과를 평가","교육의 필요점 발견→교육 준비→교육 대상 결정→교육 실시→교육의 성과를 평가","교육 대상 결정→교육 준비→교육의 필요점 발견→교육 실시→교육의 성과를 평가","1"
"건설안전기사","2020","1,2","산업심리 및 교육","27","인간의 동작 특성을 외적조건과 내적조건으로 구분할 때 내적조건에 해당하는 것은?","","경력","대상물의 크기","기온","대상물의 동적성질","1"
"건설안전기사","2020","1,2","산업심리 및 교육","28","산업안전보건법령상 사업내 안전보건교육 중 관리감독자의 지위에 있는 사람을 대상으로 실시하여야 할 정기교육의 교육시간으로 맞는 것은?","","연간 1시간 이상","매분기 3시간 이상","연간 16시간 이상","매분기 6시간 이상","3"
"건설안전기사","2020","1,2","산업심리 및 교육","29","교육방법에 있어 강의방식의 단점으로 볼 수 없는 것은?","","학습내용에 대한 집중이 어렵다.","학습자의 참여가 제한적일 수 있다.","인원대비 교육에 필요한 비용이 많이 든다","학습자 개개인의 이해도를 파악하기 어렵다.","3"
"건설안전기사","2020","1,2","산업심리 및 교육","30","리더십의 행동이론 중 관리 그리드(managerial grid)에서 인간에 대한 관심보다 업무에 대한 관심이 매우 높은 유형은?","","(1.1)형","(1,9)형","(5,5)형","(9.1)형","4"
"건설안전기사","2020","1,2","산업심리 및 교육","31","교육의 3요소로만 나열된 것은?","","강사, 교육생, 사회인사","강사, 교육생, 교육자료","교육자료, 지식인, 정보","교육생, 교육자료, 교육장소","2"
"건설안전기사","2020","1,2","산업심리 및 교육","32","판단과정 착오의 요인이 아닌 것은?","","자기 합리화","능력 부족","작업경험 부족","정보 부족","3"
"건설안전기사","2020","1,2","산업심리 및 교육","33","직업적성검사 중 시각적 판단 검사에 해당하지 않는 것은?","","조립검사","명칭판단검사","형태비교검사","공구판단검사","1"
"건설안전기사","2020","1,2","산업심리 및 교육","34","조직에 의한 스트레스 요인으로 역할 수행자에 대한 요구가 개인의 능력을 초과하거나 주어진 시간과 능력이 허용하는 것 이상을 달성하도록 요구받고 있다고 느끼는 상황을 무엇이라 하는가?","","역할 갈등","역할 과부하","업무수행 평가","역할 모호성","2"
"건설안전기사","2020","1,2","산업심리 및 교육","35","매슬로우(Abraham Maslow)의 욕구위계설에서 제시된 5단계의 인간의 욕구 중 허츠버그(Herzberg)가 주장한 2요인(인자)이론의 동기요인에 해당하지 않는 것은?","","성취 욕구","안전의 욕구","자아실현의 욕구","존경의 욕구","2"
"건설안전기사","2020","1,2","산업심리 및 교육","36","인간의 행동특성에 있어 태도에 관한 설명으로 맞는 것은?","","인간의 행동은 태도에 따라 달라진다.","태도가 결정되면 단시간 동안만 유지된다.","집단의 심적 태도교정보다 개인의 심적 태도교정이 용이하다","행동결정을 판단하고, 지시하는 외적 행동체계라고 할 수 있다.","1"
"건설안전기사","2020","1,2","산업심리 및 교육","37","손다이크(Thorndike)의 시행착오설에 의한 학습법칙과 관계가 가장 먼 것은?","","효과의 법칙","연습의 법칙","동일성의 법칙","준비성의 법칙","3"
"건설안전기사","2020","1,2","산업심리 및 교육","38","산업안전보건법령상 근로 정기안전 보건교육의 교육내용이 아닌 것은?","","산업안전 및 사고 예방에 관한 사항","건강증진 및 질병 예방에 관한 사항","산업보건 및 직업병 예방에 관한 사항","작업공정의 유해·위험과 재해 예방대책에 관한 사항","4"
"건설안전기사","2020","1,2","산업심리 및 교육","39","에너지소비량(RMR)의 산출방법으로 맞는 것은?","","$\frac{(\text{작업시의 소비에너지}-\text{기초대사량})}{\text{안정시의소비에너지}}$","$\frac{(\text{전체소비에너지}-\text{작업시의소비에너지})}{\text{기초대사량}}$","$\frac{(\text{작업시의 소비에너지}-\text{안정시의소비에너지})}{\text{기초대사량}}$","$\frac{(\text{작업시의 소비에너지}-\text{안정시의 소비에너지})}{\text{안정시의소비에너지}}$","3"
"건설안전기사","2020","1,2","산업심리 및 교육","40","레윈의 3단계 조직변화모델에 해당되지 않는 것은?","","해빙단계","체험단계","변화단계","재동결단계","2"
"건설안전기사","2020","1,2","인간공학 및 시스템안전공학","41","인체에서 뼈의 주요 기능이 아닌 것은?","","인체의 지주","장기의 보호","골수의 조혈","근육의 대사","4"
"건설안전기사","2020","1,2","인간공학 및 시스템안전공학","42","FT도에서 사용하는 기호 중 다음 그림과 같이 OR게이트이지만, 2개 또는 그 이상의 입력이 동시에 존재할 때 출력이 생기지 않은 경우 사용하는 것은?(문제 오류로 가답안 발표 시 2번으로 발표되었지만 최종정답 발표시 전항 정답 처리되었습니다. 여기서는 가답안인 2번을 누르면 정답 처리 됩니다.)","","부정 OR 게이트","배타적 OR 게이트","억제 게이트","조합 OR 게이트","2"
"건설안전기사","2020","1,2","인간공학 및 시스템안전공학","43","손이나 특정 신체부위에 발생하는 누적손상 장애(CTD)의 발생인자와 가장 거리가 먼 것은?","","무리한 힘","다습한 환경","장시간의 진동","반복도가 높은 작업","2"
"건설안전기사","2020","1,2","인간공학 및 시스템안전공학","44","FTA에 의한 재해사례 연구순서 중 2단계에 해당하는 것은?","","FT 도의 작성","톱 사상의 선정","개선계획의 작성","사상의 재해원인을 규명","2"
"건설안전기사","2020","1,2","인간공학 및 시스템안전공학","45","산업안전보건법령상 사업주가 유해위험방지계획서를 제출할 때에는 사업장 별로 관련서류를 첨부하여 해당 작업 시작 며칠 전까지 해당 기관에 제출하여야 하는가?","","7일","15일","30일","60일","2"
"건설안전기사","2020","1,2","인간공학 및 시스템안전공학","46","반사율이 85%, 글자의 밝기가 400$cd/m^2$인 VDT화면에 350lux의 조명이 있다면 대비는 약 얼마인가?","","-6.0","-5.0","-4.2","-2.8","3"
"건설안전기사","2020","1,2","인간공학 및 시스템안전공학","47","휴먼 에러(Human Error)의 요인을 심리적 요인과 물리적 요인으로 구분할 때, 심리적 요인에 해당하는 것은?","","일이 너무 복잡한 경우","일의 생산성이 너무 강조될 경우","동일 형상의 것이 나란히 있을 경우","서두르거나 절박한 상황에 놓여있을 경우","4"
"건설안전기사","2020","1,2","인간공학 및 시스템안전공학","48","각 부품의 신뢰도가 다음과 같을 때 시스템의 전체 신뢰도는 약 얼마인가?","O","0.8123","0.9453","0.9553","0.9953","2"
"건설안전기사","2020","1,2","인간공학 및 시스템안전공학","49","시스템 안전 MIL-STD-882B 분류기준의 위험성 평가 매트릭스에서 발생빈도에 속하지 않는 것은?","","거의 발생하지 않는(remote)","전혀 발생하지 않는(impoossible)","보통 발생하는(reasonably probable)","극히 발생하지 않을 것 같은(extremely improbable)","2"
"건설안전기사","2020","1,2","인간공학 및 시스템안전공학","50","적절한 온도의 작업환경에서 추운 환경으로 온도가 변할 때 우리의 신체가 수행하는 조절작용이 아닌 것은?","","발한(發汗)이 시작된다.","피부의 온도가 내려간다.","직장(直腸)온도가 약간 올라간다.","혈액의 많은 양이 몸의 중심부를 위주로 순환한다.","1"
"건설안전기사","2020","1,2","인간공학 및 시스템안전공학","51","의자 설계시 고려해야 할 일반적인 원리와 가장 거리가 먼 것은?","","자세고정을 줄인다.","조정이 용이해야 한다.","디스크가 받는 압력을 줄인다.","요추 부위의 후만곡선을 유지한다.","4"
"건설안전기사","2020","1,2","인간공학 및 시스템안전공학","52","인체 계측 자료의 응용 원칙이 아닌 것은?","","기존 동일 제품을 기준으로 한 설계","최대치수와 최소치수를 기준으로 한 설계","조절범위를 기준으로 한 설계","평균치를 기준으로 한 설계","1"
"건설안전기사","2020","1,2","인간공학 및 시스템안전공학","53","컷셋(cut set)과 패스셋(pass set)에 관한 설명으로 옳은 것은?","","동일한 시스템에서 패스셋의 개수와 컷셋의 개수는 같다.","패스셋은 동시에 발생했을 때 정상사상을 유발하는 사상들의 집합이다.","일반적으로 시스템에서 최소 컷셋의 개수가 늘어나면 위험 수준이 높아진다.","최소 컷셋은 어떤 고장이나 실수를 일으키지 않으면 재해는 일어나지 않는다고 하는 것이다.","3"
"건설안전기사","2020","1,2","인간공학 및 시스템안전공학","54","모든 시스템에서 안전분석에서 제일 첫 번째 단계의 분석으로 실행되고 있는 시스템을 포함한 모든 것의 상태를 인식하고 시스템의 개발단계에서 시스템 고유의 위험상태를 식별하여 예상되고 있는 재해의 위험수준을 결정하는 것을 목적으로 하는 위험분석 기법은?","","결함 위험 분석(FHA: Fault Hazard Analysis)","시스템 위험 분석(SHA: System Hazard Analysis)","예비 위험 분석(PHA: Preliminary Hazard Analysis)","운용 위험 분석(OHA: Operating Hazard Analysis)","3"
"건설안전기사","2020","1,2","인간공학 및 시스템안전공학","55","다음 FT도에서 시스템에 고장이 발생할 확률이 약 얼마인가? (단. X₁과 X₂의 발생확률은 각각 0.05, 0.03이다.)","O","0.0015","0.0785","0.9215","0.9985","2"
"건설안전기사","2020","1,2","인간공학 및 시스템안전공학","56","조종장치를 촉각적으로 식별하기 위하여 사용되는 촉각적 코드화의 방법으로 옳지 않은 것은?","","색감을 활용한 코드화","크기를 이용한 코드화","조종장치의 형상 코드화","표면 촉감을 이용한 코드화","1"
"건설안전기사","2020","1,2","인간공학 및 시스템안전공학","57","인간-기계 시스템을 설계할 때에는 특정기능을 기계에 할당하거나 인간에게 할당하게 된다. 이러한 기능할당과 관련된 사항으로 옳지 않은 것은? (단. 인공지능과 관련된 사항은 제외한다.)","","인간은 원칙을 적용하여 다양한 문제를 해결하는 능력이 기계에 비해 우월하다.","일반적으로 기계는 장시간 일관성이 있는 작업을 수행하는 능력이 인간에 비해 우월하다.","인간은 소음, 이상온도 등의 환경에서 작업을 수행하는 능력이 기계에 비해 우월하다.","일반적으로 인간은 주위가 이상하거나 예기치 못한 사건을 감지하여 대처하는 능력이 기계에 비해 우월하다.","3"
"건설안전기사","2020","1,2","인간공학 및 시스템안전공학","58","화학설비에 대한 안전성 평가 중 정량적 평가항목에 해당되지 않는 것은?","","공정","취급물질","압력","화학설비용량","1"
"건설안전기사","2020","1,2","인간공학 및 시스템안전공학","59","시각 장치와 비교하여 청각 장치 사용이 유리한 경우는?","","메시지가 길때","메시지가 복잡할 때","정보 전달 장소가 너무 소란할 때","메시지에 대한 즉각적인 반응이 필요할 때","4"
"건설안전기사","2020","1,2","인간공학 및 시스템안전공학","60","인간공학 연구조사에 사용되는 기준의 구비조건과 가장 거리가 먼 것은?","","다양성","적절성","무오염성","기준 척도의 신뢰성","1"
"건설안전기사","2020","1,2","건설시공학","61","흙을 이김에 의해서 약해지는 강도를 나타내는 흙의 성질은?","","간극비","함수비","예민비","항복비","3"
"건설안전기사","2020","1,2","건설시공학","62","콘크리트 타설 중 응결이 어느 정도 진행된 콘크리트에 새로운 콘크리트를 이어치면 시공불량이음부가 발생하여 경화 후 누수의 원인 및 철근의 녹 발생 등 내구성에 손상을 일으키는 것은?","","Expansion joint","Construction joint","Cold joint","Sliding joint","3"
"건설안전기사","2020","1,2","건설시공학","63","표준관입시험의 N치에서 추정이 곤란한 사항은?","","사질토의 상대밀도와 내부 마찰각","선단지지층이 사질토지반일 때 말뚝 지지력","점성토의 전단강도","점성토 지반의 투수 계수와 예민비","4"
"건설안전기사","2020","1,2","건설시공학","64","공동도급(Joint Venture Contract)의 장점이 아닌 것은?","","융자력의 증대","위험의 분산","이윤의 증대","시공의 확실성","3"
"건설안전기사","2020","1,2","건설시공학","65","철골 내화피복공법의 종류에 따른 사용재료의 연결이 옳지 않은 것은?","","타설공법-경량콘크리트","뿜칠공법-압면 흡임판","조적공법-경량콘크리트 블록","성형판붙임공법-ALC판","2"
"건설안전기사","2020","1,2","건설시공학","66","기초공사시 활용되는 현장타설 콘크리트 말뚝공법에 해당되지 않는 것은?","","어스드릴(earth drill) 공법","베노토 말뚝(benoto pile) 공법","리버스서큘레이션(reverse circulation pile) 공법","프리보링(preboring) 공법","4"
"건설안전기사","2020","1,2","건설시공학","67","벽돌벽 두께 1.0B. 벽높이 2.5m, 길이 8m인 벽면에 소요되는 점토벽돌의 매수는 얼마인가? (단. 규격은 190×90×57mm, 할증은 3%로 하며, 소수점 이하 결과는 올림하여 정수매로 표기)","","2980매","3070매","3278매","3542매","2"
"건설안전기사","2020","1,2","건설시공학","68","금속제 천장틀 공사 시 반자틀의 적정한 간격으로 옳은 것은? (단 공사시방서가 없는 경우)","","450 mm 정도","600 mm 정도","900 mm 정도","1200 mm 정도","3"
"건설안전기사","2020","1,2","건설시공학","69","철근이음에 관한 설명으로 옳지 않은 것은?","","철근의 이음부는 구조내력상 취약점이 되는 곳이다.","이음위치는 되도록 응력이 큰 곳을 피하도록 한다.","이음이 한 곳에 집중되지 않도록 엇갈리게 교대로 분산시켜야 한다.","응력 전달이 원활하도록 한 곳에서 철근수의 반 이상을 이어야 한다.","4"
"건설안전기사","2020","1,2","건설시공학","70","철골용접이음 후 용접부의 내부결함 검출을 위하여 실시하는 검사로써 빠르고 경제적이어서 현장에서 주로 사용하는 초음파를 이용한 비파괴 검사법은?","","MT(Magnetic particle Testing)","UT (Ultrasonic Testing)","RT(Radiogtaphy Testing)","PT(Liquid Penetrant Testing)","2"
"건설안전기사","2020","1,2","건설시공학","71","건설의 전 과정에 걸쳐 프로젝트를 보다 효율적이고 경제적으로 수행하기 위하여 각 부문의 전문가들로 구성된 통합관리기술을 발주자에세 서비스하는 것을 무엇이라고 하는가?","","Cost Management","Cost Manpower","Construction Manpower","Construction Management","4"
"건설안전기사","2020","1,2","건설시공학","72","네트워크공정표에서 후속작업의 가장 빠른 개시시간(EST)에 영향을 주지 않는 범위내에서 한 작업이 가질 수 있는 여유시간을 의미하는 것은?","","전체여유(TF)","자유여유(FF)","간섭여유(IF)","종속여유(DF)","2"
