"Test Name","Year","Session","Subject","Number","Question","Question_image","Option 1","Option 2","Option 3","Option 4","Answer"
"건설안전기사","2020","1,2","건설시공학","73","강구조물 제작 시 절단 및 개선(그루브)가공에 관한 일반사항으로 옳지 않은 것은?","","주요 부재의 강판 절단은 주된 응력의 방향과 압연방향을 직각으로 교차시켜 절단함을 원칙으로 하며, 절단작업 착수 전 재단도를 작성해야 하다.","강재의 절단은 강재의 형상, 치수를 고려하여 기계절단, 가스절단, 플라즈마 절단 등을 적용한다.","절단할 강재의 표면에 녹, 기름, 도료가 부착되어 있는 경우에는 제거 후 절단해야 한다.","용접선의 교차부분 또는 한 부재를 다른 부재에 접합시킬 때 불필요한 접촉을 피하기 위하여 모퉁이따기를 할 경우에는 10mm 이상 둥글게 해야 한다.","1"
"건설안전기사","2020","1,2","건설시공학","74","공사계약방식 중 직영공사방식에 관한 설명으로 옳은 것은?","","사회간접자본(SOC: Social Overhead Capital)의 민간투자 유치에 많이 이용되고 있다.","영리목적의 도급공사에 비해 저렴하고 재료선정이 자유로운 장점이 있으나, 고용기술자 등에 의한 시공관리능력이 부족하면 공사비 증대, 시공성의 결함 및 공기가 연장되기 쉬운 단점이 있다.","도급자가 자금을 조달하면 설계, 엔지니어링, 시공의 전부를 도급받아 시설물을 완성하고 그 시설을 일정기간 운영하는 것으로, 운영수입으로부터 투자자금을 회수한 후 발주자에게 그 시설을 인도하는 방식이다.","수입을 수반한 공공 혹은 공익 프로젝트(유료도로, 도시철도, 발전도 등)에 많이 이용되고 있다.","2"
"건설안전기사","2020","1,2","건설시공학","75","보강블록 공사 시벽 가로근의 시공에 관한 설명으로 옳지 않은 것은?","","가로근은 배근 상세도에 따라 가공하되 그 단부는 90º의 갈구리로 구부려 배근한다.","모서리에 가로근의 단부는 수평방향으로 구부려서 세로근의 바깥쪽으로 두르고, 정착길이는 공사시방서에 정한 바가 없는 한 40d 이상으로 한다.","창 및 출입구 등의 모서리 부분에 가로근의 단부를 수평방향으로 정착할 여유가 없을 때에는 갈구리로 하여 단부 세로근에 걸고 결속선으로 결속한다.","개구부 상하부의 가로근을 양측 벽부에 묻을 때의 정착길이는 40d 이상으로 한다.","1"
"건설안전기사","2020","1,2","건설시공학","76","철근배근 시 콘크리트의 피복두께를 유지해야 되는 가장 큰 이유는?","","콘크리트의 인장강도 증진을 위하여","콘크리트의 내구성, 내화성 확보를 위하여","구조물의 미관을 좋게 하기 위하여","콘크리트 타설을 쉽게 하기 위하여","2"
"건설안전기사","2020","1,2","건설시공학","77","흙막이 지지공법 중 수평버팀대 공법의 특징에 관한 설명으로 옳지 않은 것은?","","가설구조물이 적어 중장비작업이나 토량제거작업의 능률이 좋다.","토질에 대해 영향을 적게 받는다.","인근 대지로 공사범위로 넘어가지 않는다.","고저차가 크거나 상이한 구조인 경우 균형을 잡기 어렵다.","1"
"건설안전기사","2020","1,2","건설시공학","78","터널 폼에 관한 설명으로 옳지 않은 것은?","","거푸집의 전용횟수는 약 10회 정도로 매우 적다.","노무 절감, 공기단축이 가능하다.","벽체 및 슬래브거푸집을 일체로 제작한 거푸집이다.","이 품의 종류에는 트윈 쉘(twin shell)과 모노 쉘(mono shell)이 있다.","1"
"건설안전기사","2020","1,2","건설시공학","79","철근콘크리트 공사에서 거푸집의 간격을 일정하게 유지시키는데 사용되는 것은?","","클램프","쉐어 커넥터","세퍼레이터","인서트","3"
"건설안전기사","2020","1,2","건설시공학","80","지정에 관한 설명으로 옳지 않은 것은?","","잡석지정-기초 콘크리트 타설 시 흙의 혼입을 방지하기 위해 사용한다.","모래지정-지반이 단단하며 건물이 중량일 때 사용한다.","자갈지정-굳은 지반에 사용되는 지정이다.","밑창 콘크리트지정-잡석이나 자갈 위 기초부분의 먹매김을 위해 사용한다.","2"
"건설안전기사","2020","1,2","건설재료학","81","도료의 저장 중 또는 용기 내 방치 시 도료의 표면에 피막이 형성되는 현상의 발생 원인과 가장 관계가 먼 것은?","","피막방지제의 부족이나 건조제가 과잉일 경우","용기내의 공간이 커서 산소의 양이 많을 경우","부적당한 신너로 희석하였을 경우","사용잔량을 뚜껑을 열어둔 채 방치하였을 경우","3"
"건설안전기사","2020","1,2","건설재료학","82","다음 중 무기질 단열재에 해당하는 것은?","","발포폴리스티렌 보온재","셀롤로스 보온재","규산칼슘판","경질폴리우레탄폼","3"
"건설안전기사","2020","1,2","건설재료학","83","통풍이 잘 되지 않는 지하실의 미장재료로서 가장 적합하지 않은 것은?","","시멘트 모르타르","석고 플라스터","킨즈 시멘트","돌로마이트 플라스터","4"
"건설안전기사","2020","1,2","건설재료학","84","지붕공사에 사용되는 아스팔트 싱글제품 중 단위 중량이 $10.3kg/m^2$ 이상 12.5$kg/m^2$미만인 것은?","","경량 아스팔트 싱글","일반 아스팔트 싱글","중량 아스팔트 싱글","초중량 아스팔트 싱글","2"
"건설안전기사","2020","1,2","건설재료학","85","점토벽돌 1종의 압축강도는 최소 얼마 이상인가?","","17.85 MPa","19.53 MPa","20.59 MPa","24.50 MPa","4"
"건설안전기사","2020","1,2","건설재료학","86","골재의 함수상태에 따른 질량이 다음과 같을 경우 표면수율은?\n- 절대 건조 상태: 490g\n- 표면 건조 상태: 500g\n- 습윤 상태: 550g","","2%","3%","10%","15%","3"
"건설안전기사","2020","1,2","건설재료학","87","콘크리트의 건조수축에 관한 설명으로 옳지 않은 것은?","","시멘트의 제조성분에 따라 수축량이 다르다.","골재의 성질에 따라 수축량이 다르다.","시멘트량의 다소에 따라 수축량이 다르다.","된비빔일수록 수축량이 많다.","4"
"건설안전기사","2020","1,2","건설재료학","88","목재의 나뭇결 중 아래의 설명에 해당하는 것은?\n나이테에 직각방향으로 목재면에 나타나는 나뭇결로 일반적으로 외관이 아름답고 수축변형이 적으며 마모율도 낮다.","","무늬결","곧은결","널결","엇결","2"
"건설안전기사","2020","1,2","건설재료학","89","조이너(joiner)의 설치목적으로 옳은 것은?","","벽, 기둥 등의 모서리에 미장 바름의 보호","인조석깔기에서의 신축균열방지나 의장효과","천장에 보드를 붙인 후 그 이음새를 감추기 위한 목적","환기구멍이나 라디에이터의 덮개역할","3"
"건설안전기사","2020","1,2","건설재료학","90","각 석재별 주용도를 표기한 것으로 옳지 않은 것은?","","화강암: 외장재","석회암: 구조재","대리석: 내장재","점판암: 지붕재","2"
"건설안전기사","2020","1,2","건설재료학","91","암석의 구조를 나타내는 용어에 관한 설명으로 옳지 않은 것은?","","절리란 암석 특유의 천연적으로 갈라진 금을 말하며, 규칙적인 것과 불규칙적인 것이 있다.","총리란 퇴적암 및 변성암에 나타나는 퇴적할 당시의 지표면과 방향이 거의 평행한 절리를 말한다.","석리란 암석이 가장 쪼개지기 쉬운 면을 말하며, 절리보다 불분명하지만 방향이 대체로 일치되어 있다.","편리란 변성암에 생기는 절리로서 방향이 불규칙하고 얇은 판자모양으로 갈라지는 성질을 말한다.","3"
"건설안전기사","2020","1,2","건설재료학","92","강은 탄소 함유량의 증가에 따라 인장강도가 증가하지만 어느 이상이 되면 다시 감소한다 이때 인장강도가 가장 큰시점의 탄소 함유량은?","","약 0.9%","약 1.8%","약 2.7%","약 3.6%","1"
"건설안전기사","2020","1,2","건설재료학","93","아스팔트의 물리적 성질에 관한 설명으로 옳은 것은?","","감온성은 블로운 아스팔트가 스트레이트 아스팔트보다 크다.","연화점은 블로운 아스팔트가 스트레이트 아스팔트보다 낮다.","신장성은 스트레이트 아스팔트가 블로운 아스팔트보다 크다.","점착성은 블로운 아스팔트가 스트레이트 아스팔트보다 크다.","3"
"건설안전기사","2020","1,2","건설재료학","94","킨즈시멘트 제조 시 무수석고의 경화를 촉진시키기 위해 사용하는 혼화재료는?","","규산백토","플라이애쉬","화산회","백반","4"
"건설안전기사","2020","1,2","건설재료학","95","초기강도가 아주 크고 초기 수화발열이 커서 긴급공사나 동절기 공사에 가장 적합한 시멘트는?","","알루미나시멘트","보통포틀랜드시멘트","고로시멘트","실리카시멘트","1"
"건설안전기사","2020","1,2","건설재료학","96","일반적으로 단열재에 습기나 물기가 침투하면 어떤 현상이 발생하는가?","","열전도율이 높아져 단열성능이 좋아진다.","열전도율이 높아져 단열성능이 나빠진다.","열전도율이 낮아져 단열성능이 좋아진다.","열전도율이 낮아져 단열성능이 나빠진다.","2"
"건설안전기사","2020","1,2","건설재료학","97","도장재료 중 래커(lacquer)에 관한 설명으로 옳지 않은 것은?","","내구성은 크나 도막이 느리게 건조된다.","클리어래커는 투명래커로 도막은 얇으나 견고하고 광택이 우수하다.","클리어래커는 내후성이 좋지 않아 내부용으로 주로 쓰인다.","래커에나멀은 불투명 도료로서 클리어래커에 안료를 첨가한 것을 말한다.","1"
"건설안전기사","2020","1,2","건설재료학","98","도료의 건조제 중 상온에서 기름에 용해되지 않는 것은?","","붕산망간","이산화망간","초산염","코발트의 수지산","4"
"건설안전기사","2020","1,2","건설재료학","99","시멘트의 분말도에 관한 설명으로 옳지 않은 것은?","","분말도가 클수록 수화반응이 촉진된다.","분말도가 클수록 초기강도는 작으나 장기강도는 크다.","분말도가 클수록 시멘트 분말이 미세하다.","분말도가 너무 크면 풍화되기 쉽다.","2"
"건설안전기사","2020","1,2","건설재료학","100","목재의 방부 처리법 중 압력용기 속에 목재를 넣어 처리하는 방법으로 가장 신속하고 효과적인 방법은?","","가압주입법","생리적 주입법","표면탄화법","침지법","1"
"건설안전기사","2020","1,2","건설안전기술","101","지면보다 낮은 땅을 파는데 적합하고 수중굴착도 가능한 굴착기계는?","","백호우","파워쇼벨","가이데릭","파일드라이버","1"
"건설안전기사","2020","1,2","건설안전기술","102","굴착공사에서 비탈면 또는 비탈면 하단을 성토하여 붕괴를 방지하는 공법은?","","배수공","배토공","공작물에 의한 방지공","압성토공","4"
"건설안전기사","2020","1,2","건설안전기술","103","작업장에 계단 및 계단참을 설치하는 경우 매 제곱미터 당 최소 몇 킬로그램 이상의 하중에 견딜 수 있는 강도를 가진 구조로 설치하여야 하는가?","","300kg","400kg","500kg","600kg","3"
"건설안전기사","2020","1,2","건설안전기술","104","작업으로 인하여 물체가 떨어지거나 날아올 위험이 있는 경우 필요한 조치와 가장 거리가 먼 것은?","","투하설비 설치","낙하물 방지망 설치","수직보호망 설치","출입금지구역 설정","1"
"건설안전기사","2020","1,2","건설안전기술","105","크레인의 운전실 또는 운전대를 통하는 통로의 끝과 건설물 등의 벽체의 간격은 최대 얼마 이하로 하여야 하는가?","","0.2m","0.3m","0.4m","0.5m","2"
"건설안전기사","2020","1,2","건설안전기술","106","철골공사 시 안전작업방법 및 준수사항으로 옳지 않은 것은?","","강풍, 폭우 등과 같은 악천우시에는 작업을 중지하여야 하며 특히 강풍시에는 높은 곳에 있는 부재나 공구류가 낙하비래하지 않도록 조치하여야 한다.","철골부재 반입 시 시공순서가 빠른 부재는 상단부에 위치하도록 한다.","구명줄 설치 시 마닐라 로프 직경 10mm를 기준하여 설치하고 작업방법을 충분히 검토하여야 한다.","철골보의 두곳을 매어 인양시킬 때 와이어로프의 내각은 60°이하이어야 한다.","3"
"건설안전기사","2020","1,2","건설안전기술","107","강관비계의 수직방향 벽이음 조립간격(m)으로 옳은 것은? (단 틀비계이며 높이가 5m 이상일 경우)","","2m","4m","6m","9m","3"
"건설안전기사","2020","1,2","건설안전기술","108","공정율이 65%인 건설현장의 경우 공사 진척에 따른 산업안전보건관리비의 최소 사용기준으로 옳은 것은? (단, 공정율은 기성공정율을 기준으로 함)","","40% 이상","50% 이상","60% 이상","70% 이상","2"
"건설안전기사","2020","1,2","건설안전기술","109","달비계에 사용이 불가한 와이어로프의 기준으로 옳지 않은 것은?","","이음매가 있는 것","와이어로프의 한 꼬임에서 끊어진 소선의 수가 7% 이상인것","지름의 감소가 공칭지름의 7%를 초과하는 것","심하게 변형되거나 부식된 것","2"
"건설안전기사","2020","1,2","건설안전기술","110","구축물에 안전차단 등 안전성 평가를 실시하여 근로자에게 미칠 위험성을 미리 제거하여야 하는 경우가 아닌 것은?","","구축물 또는 이와 유사한 시설물의 인근에서 굴착·항타 작업 등으로 침하·균열 등이 발생하여 붕괴의 위험이 예상될 경우","구조물, 건축물, 그 밖의 시설물이 그 자체의 무게·적설·풍압 또는 그 밖에 부가되는 하중 등으로 붕괴 등의 위험이 있을 경우","화재 등으로 구축물 또는 이와 유사한 시설물의 내력(耐力)이 심하게 저하되었을 경우","구축물의 구조체가 안전측으로 과도하게 설계가 되었을 경우","4"
"건설안전기사","2020","1,2","건설안전기술","111","흙막이 지보공을 설치하였을 때 정기적으로 점검하여 이상 발견 시 즉시 보수하여야 할 사항이 아닌 것은?","","굴착 깊이의 정도","버팀대의 긴압의 정도","부재의 접속부·부착부 및 교차부의 상태","부재의 손상·변형·부식·변위 및 탈락의 유무와 상태","1"
"건설안전기사","2020","1,2","건설안전기술","112","달비계의 최대 적재하중을 정하는 경우 그 안전계수 기준으로 옳지 않은 것은?","","달기와이어로프 및 달기강선의 안전계수:10 이상","달기체인 및 달기 훅의 안전계수: 50이상","달기강대와 달비계의 하부 및 상부지점의 안전계수: 강재의 경우 3 이상","달기강대와 달비계의 하부 및 상부지점의 안전계수: 목재의 경우 5 이상","3"
"건설안전기사","2020","1,2","건설안전기술","113","다음은 안전대와 관련된 설명이다. 아래 내용에 해당되는 용어로 옳은 것은?\n로프 또는 레일 등과 같은 유연하거나 단단한 고정 줄로서 추락발생시 추락을 저지시키는 추락방지대를 지탱해 주는 줄모양의 부품","","안전블록","수직구명줄","죔줄","보조죔줄","2"
"건설안전기사","2020","1,2","건설안전기술","114","사업주가 유해위험방지 계획서 제출 후 건설공사 중 6개월 이내마다 안전보건공단의 확인을 받아야 할 내용이 아닌 것은?","","유해위험방지 계획서의 내용과 실제공사 내용이 부합하는지 여부","유해위험방지 계획서 변경 내용의 적정성","자율안전관리 업체 유해·위험방지 계획서 제출·심사 면제","추가적인 유해·위험요인의 존재 여부","3"
"건설안전기사","2020","1,2","건설안전기술","115","다음 중 방망사의 폐기 시 인장강도에 해당하는 것은? (단, 그물코의 크기는 10cm이며 매듭없는 방망의 경우임)","","50kg","100kg","150kg","200kg","3"
"건설안전기사","2020","1,2","건설안전기술","116","산업안전보건법령에 따른 지반의 종류별 굴착면의 기울기 기준으로 옳지 않은 것은?(2023년 11월 14일 변경된 규정 적용됨)","","모래 1: 1.8","연암 및 풍화암 1: 1.5","경암 1: 0.5","그 밖의 흙 1:1.2","2"
"건설안전기사","2020","1,2","건설안전기술","117","가설통로의 설치에 관한 기준으로 옳지 않은 것은?","","경사는 $30^{\circ}$ 이하로 한다.","건설공사에 사용하는 높이 8m 이상인 비계다리에는 7m 이내마다 계단참을 설치한다.","작업상 부득히한 경우에는 필요한 부분에 한하여 안전난간을 임시로 해체할 수 있다.","수직갱에 가설된 통로의 길이가 10m 이상인 경우에는 5m 이내마다 계단참을 설치한다.","4"
"건설안전기사","2020","1,2","건설안전기술","118","콘크리트 타설 시 거푸집 측압에 관한 설명으로 옳지 않은 것은?","","기온이 높을수록 측압은 크다.","타설속도가 클수록 측압은 크다.","슬럼프가 클수록 측압은 크다.","다짐이 과할수록 측압은 크다.","1"
"건설안전기사","2020","1,2","건설안전기술","119","해체공사 시 작업용 기계기구의 취급 안전기준에 관한 설명으로 옳지 않은 것은?","","철제햄머와 와이어로프의 결속은 경험이 많은 사람으로서 선임된 자에 한하여 실시하도록 하여야 한다.","팽창제 천공간격은 콘크리트 강도에 의하여 결정되나 70~120cm 정도를 유지하도록 한다.","쐐기타입으로 해체 시 천공구멍은 타입기 삽입부분의 직경과 거의 같아야 한다.","화염방사기로 해체작업 시 용기 내 압력은 온도에 의해 상승하기 때문에 항상 40℃이하로 보존해야 한다.","2"
"건설안전기사","2020","1,2","건설안전기술","120","굴착과 싣기를 동시에 할 수 있는 토공기계가 아닌 것은?","","Power shovel","Tractor shovel","Back hoe","Motor grader","4"
