"Test Name","Year","Session","Subject","Number","Question","Question_image","Option 1","Option 2","Option 3","Option 4","Answer"
"건설안전산업기사","2005","1_추가시험","산업안전관리론","1","안전동기를 유발시킬 수 있는 방법과 거리가 먼 것은?","","경쟁과 협동심을 유발시킨다.","안전목표를 명확히 설정한다.","상벌을 준다.","동기유발의 최소수준을 유지토록 한다.","4"
"건설안전산업기사","2005","1_추가시험","산업안전관리론","2","다음 중 산소가 결핍되어 있는 장소(8% 이하)에서도 사용할 수 있는 마스크는 어느 것인가?","","방독 마스크","방진 마스크","송기 마스크","방연 마스크","3"
"건설안전산업기사","2005","1_추가시험","산업안전관리론","3","위험 예지 훈련 문제해결 4단계 중 문제점 발견 및 중요 문제를 결정하는 단계는 다음 중 어느 것인가?","","대책수립 단계","현상파악 단계","본질추구 단계","행동목표설정 단계","3"
"건설안전산업기사","2005","1_추가시험","산업안전관리론","4","안전점검의 순서로 맞는 것은?","","실태파악 결함의 발견 대책 결정 - 대책 실시","실태파악 결함의 발견 대책 실시 대책 결정","결함의 발견 실태파악 대책 결정 대책 실시","결함의 발견 실태파악 대책 실시 대책 결정","1"
"건설안전산업기사","2005","1_추가시험","산업안전관리론","5","인간 자신이 가진 잠재능력을 최고도로 발휘하고자 하는 욕구와 관계있는 것은?","","자아실현의 욕구","존경의 욕구","사회적 욕구","안전의 욕구","1"
"건설안전산업기사","2005","1_추가시험","산업안전관리론","6","안전표지의 종류 중 지시표지에 포함되지 않는 것은?","","안전모 착용","안전화 착용","방호복 착용","방독마스크 착용","3"
"건설안전산업기사","2005","1_추가시험","산업안전관리론","7","다음의 부주의 발생현상 중 주의의 일점 집중현상과 관련성이 있는 것은?","","의식의 과잉","의식의 우회","의식수준의 저하","의식의 상승작용","1"
"건설안전산업기사","2005","1_추가시험","산업안전관리론","8","다음 중 보호구의 구비요건이 아닌 것은?","","방호성능이 충분할 것","착용이 복잡할 것","재료의 품질이 양호할 것","겉모양과 보기가 좋을 것","2"
"건설안전산업기사","2005","1_추가시험","산업안전관리론","9","안전관리자가 안전교육의 효과를 높이기 위해서 안전퀴즈 대회를 열어 정답자에게 상을 주었다면 이는 어떤 학습 원리를 학습자에게 적용한 것인가?","","Thorndike의 연습의 법칙","Thorndike의 준비성의 법칙","Pavlov의 강도의 원리","Skinner의 강화의 원리","4"
"건설안전산업기사","2005","1_추가시험","산업안전관리론","10","도수율이 1.0 이라면 연천인율은 얼마인가?","","1.0","2.4","3.4","4.4","2"
"건설안전산업기사","2005","1_추가시험","산업안전관리론","11","직접 작업을 하는 작업자 자신이 자기의 부주의 이외에 제반 오류의 원인을 생각함으로써 개선을 하도록 하는 과오 원인 제거로 옳은 것은?","","BS","TBM","ECR","STOP","3"
"건설안전산업기사","2005","1_추가시험","산업안전관리론","12","재해발생의 구조와 재해원인 중 불안전 상태에 해당되지 않는 것은?","","작업환경의 결함","보호조치의 결함","작업장소의 결함","보호구, 복장의 결함","4"
"건설안전산업기사","2005","1_추가시험","산업안전관리론","13","교육훈련 방법 중 사례연구법의 장점은?","","학습의 속도가 빠르다.","의사 결정의 중요성을 알린다.","준비가 간단하고 어디서나 가능하다.","현실적인 문제의 학습이 가능하며 관찰, 분석력이 향상된다.","4"
"건설안전산업기사","2005","1_추가시험","산업안전관리론","14","의식이 명석하고 사물을 적극적으로 받아들이려고 하는 상태인 의식의 레벨(Phase)은?","","Phase I","Phase II","Phase lll","Phase IV","3"
"건설안전산업기사","2005","1_추가시험","산업안전관리론","15","질병에 의한 피로의 방지 대책은?","","기계력을 사용한다.","작업의 가치를 부여한다.","보건상 유해한 작업상의 조건을 개선한다.","작업장에서의 부적절한 관계를 배제한다.","3"
"건설안전산업기사","2005","1_추가시험","산업안전관리론","16","'파지'에 대한 설명으로 가장 올바른 것은?","","사물의 인상을 마음속에 간직하는 것","획득된 행동이나 내용이 지속되는 것","사물의 보존된 인상을 다시 의식으로 떠오르는 것","과거의 경험이 어떤 형태로 미래의 행동에 영향을 주는 작용","2"
"건설안전산업기사","2005","1_추가시험","산업안전관리론","17","평균 근로자 수가 1,000명 이상의 대규모 사업장에 가장 효율적인 안전조직은?","","라인(line)형 안전조직","스태프(staff)형 안전조직","라인-스태프(line-staff) 혼합조직","생산부서장이 안전책임자 겸직조직","3"
"건설안전산업기사","2005","1_추가시험","산업안전관리론","18","학생들의 개인차가 최대한으로 조절되어야 할 경우에 적합한 교육방법은?","","Programmed self-instructional method","Discussion method","Demonstration method","Simulation method","1"
"건설안전산업기사","2005","1_추가시험","산업안전관리론","19","단조로운 업무가 장시간 지속될 때 작업자의 감각기능 및 판단능력이 둔화 또는 마비되는 형상을 무엇이라 하는가?","","감각차단현상","망각현상","피로현상","착각현상","1"
"건설안전산업기사","2005","1_추가시험","산업안전관리론","20","S공장에서 500명의 종업원이 1년간 작업하는 가운데 신체장해 1급 1명, 9급 3명, 12급 5명이 발생하였다. 강도율은? (단, 손실일수 1급:7500일, 9급: 1000일, 12급:200일)","","0.684","0.958","6.84","9.58","4"
"건설안전산업기사","2005","1_추가시험","인간공학 및 시스템안전공학","21","안전성의 관점에서 시스템을 분석 평가하는 접근방법과 거리가 먼 것은?","","'이런 일은 금지한다'의 상식과 사회기준에 따른 주관적인 방법","'어떤 일은 하면 안된다'라는 점검표를 사용하는 직관적인 방법","'어떤 일이 발생하였을 때 어떻게 처리하여야 안전한가'의 귀납적인 방법","'어떻게 하면 무슨 일이 발생할 것인가'의 연역적인 방법","1"
"건설안전산업기사","2005","1_추가시험","인간공학 및 시스템안전공학","22","위험성 평가에서 위험수위가 가장 높은 것은?","","catastrophic-remote","critical-probable","marginal-occasional","negligible-frequent","2"
"건설안전산업기사","2005","1_추가시험","인간공학 및 시스템안전공학","23","다음 중 인간의 중립적인 자세(Neutral Position)와 거리가 먼 것은?","","손목이 곧은(Straight) 상태","팔꿈치가 $45^{\circ}$","어깨가 이완된 상태","시각은 수평에서 약간 아래","2"
"건설안전산업기사","2005","1_추가시험","인간공학 및 시스템안전공학","24","인간-기계체계 설계시 인간공학적 해석방법이 아닌 것은?","","링크해석법","웨이트식 중요 빈도법","공간지수법","워크샘플링법","4"
"건설안전산업기사","2005","1_추가시험","인간공학 및 시스템안전공학","25","시스템에 있어서 인간의 과오를 정량적으로 평가하는 방법은?","","THERP","FMECA","ETA","FMEA","1"
"건설안전산업기사","2005","1_추가시험","인간공학 및 시스템안전공학","26","시스템 안전프로그램에 있어 제일 첫 번째 단계의 분석으로 시스템내의 위험요소가 어떤 상태에 있는가를 정성적으로 분석·평가하는 것을 무엇이라 하는가?","","결함수분석","예비위험분석","결함위험분석","고장형태와 영향분석","2"
"건설안전산업기사","2005","1_추가시험","인간공학 및 시스템안전공학","27","연속 조절 통제기기가 아닌 것은?","","토글(Toggle)스위치","노브(Knob)","페달(Pedal)","핸들(Handle)","1"
"건설안전산업기사","2005","1_추가시험","인간공학 및 시스템안전공학","28","균형 잡힌 동전 2개를 던져서 나타나는 앞면의 수를 자극정보라 하자. 이 자극의 불확실성은 얼마인가?","","0.5 bit","1.0 bit","1.5 bit","2.0 bit","3"
"건설안전산업기사","2005","1_추가시험","인간공학 및 시스템안전공학","29","다음 중 작업장에서 발생하는 소음에 대한 대책으로서 가장 적극적인 대책은?","","소음원의 격리","소음원의 제거","귀마개, 귀덮개 등 보호구의 착용","덮개 등 방호장치의 설치","2"
"건설안전산업기사","2005","1_추가시험","인간공학 및 시스템안전공학","30","다음 중 정보의 청각적 제시(聽覺的提示)가 적당한 경우는?","","작동자가 여러 곳으로 움직여야 할 때","정보가 복잡하고 길 때","정보가 공간적인 위치를 다룰 때","주위환경이 소란할 때","1"
"건설안전산업기사","2005","1_추가시험","인간공학 및 시스템안전공학","31","다음 중 직렬계(直列系)의 특성이 아닌 것은?","","요소(要素)중 어느 하나가 고장이면 계(系)는 고장이다.","요소의 수가 적을수록 신뢰도는 높아진다.","요소의 수가 많을수록 수명이 짧아진다.","계의 수명은 요소 중에서 수명이 가장 긴 것으로 정하여진다.","4"
"건설안전산업기사","2005","1_추가시험","인간공학 및 시스템안전공학","32","수치를 정확히 읽어야 할 경우에 적합한 시각적 표시 장치는?","","동침형","동목형","수평형","계수형","4"
"건설안전산업기사","2005","1_추가시험","인간공학 및 시스템안전공학","33","인간-기계 체계에서 인간과 기계가 만나는 면(面)을 무엇이라고 하는가?","","계면","포락면","의사결정면","인체설계면","1"
"건설안전산업기사","2005","1_추가시험","인간공학 및 시스템안전공학","34","인간공학 연구에서 실험실 연구와 현장 연구는 각각 장단점이 있다. 다음 설명 중 틀린 것은?","","사실성은 현장 연구가 유리하다.","변수의 관리는 실험실 연구가 유리하다.","피실험자의 안전은 현장연구가 유리하다.","현장연구가 불가능할 경우에는 모의실험이 유리하다.","3"
"건설안전산업기사","2005","1_추가시험","인간공학 및 시스템안전공학","35","음압수준이 10dB 증가하면 음압은 몇 배가 되는가?","","$\sqrt{10}$배","10배","5배","5배","1"
"건설안전산업기사","2005","1_추가시험","인간공학 및 시스템안전공학","36","정보 전달용 표시장치에서 청각적 표현이 좋은 경우가 아닌 것은?","","메시지가 단순하다.","메시지가 복잡하다.","메시지가 그 때의 사건을 다룬다.","시각장치가 지나치게 많다.","2"
"건설안전산업기사","2005","1_추가시험","인간공학 및 시스템안전공학","37","반경 7cm의 조종구를 $45^{\circ}$ 움직일 때 계기판의 표시가 3cm 이동 하였다. 이때의 C/R비는 얼마인가?","","1.99","1.83","1.45","1.00","2"
"건설안전산업기사","2005","1_추가시험","인간공학 및 시스템안전공학","38","인간관계가 작업 및 작업 공간 설계에 못지않게 생산성에 큰 영향을 끼친다는 것을 암시하는 것을 무엇이라 하는가?","","인간욕구 5단계","X Y 이론","인적자원개발효과","호손효과","4"
"건설안전산업기사","2005","1_추가시험","인간공학 및 시스템안전공학","39","결함수에서 입력현상이 발생하여 일정시간이 지속된 후 출력이 발생하는 기호는?","","전이 기호","위험지속 기호","시간단축 기호","작업변경 기호","2"
"건설안전산업기사","2005","1_추가시험","인간공학 및 시스템안전공학","40","시각 퍼포먼스는 일반적으로 진동수가 어느 범위에서 가장 나빠지는가?","","1~10Hz","10~25Hz","20~30Hz","50~70Hz","2"
"건설안전산업기사","2005","1_추가시험","건설시공학","41","건설공사의 품질관리의 목적과 가장 거리가 먼 것은?","","시공능률의 향상","설계의 합리화","작업의 표준화","비용의 최소화","4"
"건설안전산업기사","2005","1_추가시험","건설시공학","42","공업화 공법(PC공법)에 의한 콘크리트 공사의 특징과 관련이 없는 것은?","","프리패브 공법이기 때문에 현장에서의 공정이 단축된다.","천후기상의 영향을 덜 받는다.","현장에서의 노무가 감소된다.","품질의 균질성을 기대하기 어렵다.","4"
"건설안전산업기사","2005","1_추가시험","건설시공학","43","다음 중 철골작업에서 사용되는 철골세우기용 기계는 어느 것인가?","","진폴(gin pole)","크램셀(clam shell)","파워쇼벨(power shovel)","스크레이퍼(scraper)","1"
"건설안전산업기사","2005","1_추가시험","건설시공학","44","지형과 지반의 상태에 따라 지하수가 펌프 사용 없이 물이 솟아나는 자분샘물을 무엇이라 하는가?","","히빙","보일링","정압수","피압수","4"
"건설안전산업기사","2005","1_추가시험","건설시공학","45","철골구조에서 소성설계와 관계가 가장 먼 항목은 어느 것인가?","","형상계수","응력도의 탄성영역","하중계수","소성단면계수","2"
"건설안전산업기사","2005","1_추가시험","건설시공학","46","QC의 7대도구 중 불량품, 결점, 고장 등의 발생건수를 현상과 원인별로 분류하고 문제의 크기순서로 나열하여 그 크기를 막대그래프로 표기하며, 크기를 순차적으로 누적하여 절선그래프로 나타낸 QC의 도구는?","","파레토도","히스토그램","산포도","관리도","1"
"건설안전산업기사","2005","1_추가시험","건설시공학","47","프리팩트파일의 일종으로 어스오거로 굴착한 후에 철근을 넣고 모르타르 주입관을 삽입한 다음 자갈을 충전하고 모르타르를 주입하여 지지말뚝을 만드는 것은?","","PIP","CIP","MIP","RCD","2"
"건설안전산업기사","2005","1_추가시험","건설시공학","48","기초의 형식에 따른 분류에서 슬래브기초에 포함되지 않는 것은?","","독립기초","복합기초","줄기초","온통기초","4"
"건설안전산업기사","2005","1_추가시험","건설시공학","49","철골조 건축물의 공장 가공순서로 옳은 것은?","","원척도 금매김 본뜨기 구멍뚫기 절단 리벳치기 - 가조립 검사 운반","원척도 본뜨기 가조립 구멍뚫기 절단 금매김 - 리벳치기 검사 운반","원척도 - 본뜨기 금매김 절단 구멍뚫기 - 가조립 리벳치기 - 검사 운반","원척도 - 본뜨기 구멍뚫기 - 금매김 절단 가조립 - 리벳치기 검사 운반","3"
"건설안전산업기사","2005","1_추가시험","건설시공학","50","사질 지반에서 지하수를 강제로 뽑아내어 전체 지하수 위를 낮추어서 기초공사를 하는 공법은?","","웰 포인트(well point)공법","샌드 드레인(sand drain)공법","케이슨(caisson)공법","레이몬드 파일(raymond pile)공법","1"
"건설안전산업기사","2005","1_추가시험","건설시공학","51","용접상부에 따라 모재(母材)가 녹아서 용착 금속이 채워지지 않고 홈으로 남게 된 부분을 무엇이라고 하는가?","","공기구멍(Blow Hole)","언더 컷(Under Cut)","오버랩(Over Lap)","위핑(Weaping)","2"
"건설안전산업기사","2005","1_추가시험","건설시공학","52","건설공사에서 래머 (rammer)의 용도는?","","철근절단","철근굴곡","잡석다짐","토사적재","3"
"건설안전산업기사","2005","1_추가시험","건설시공학","53","제치장(제물치장) 콘크리트에 관한 설명 중 옳지 않은 것은?","","자갈은 될 수 있는 대로 잔 것이 좋고 최대지름 25mm 이하로 한다.","배합은 될 수 있는 대로 빈배합으로 한다.","벽기둥은 한 번에 꼭대기까지 부어 넣는다.","제치장 콘크리트용 거푸집에는 박리제를 충분히 사용한다.","2"
"건설안전산업기사","2005","1_추가시험","건설시공학","54","콘크리트의 표준 배합설계 순서로 옳은 것은?","","소요강도 결정 시멘트강도 결정 배합강도 결정→ 물시멘트비 결정→ 슬럼프값 결정 단위수량 결정→ 잔골재율 결정→ 굵은골재 최대치수 결정","배합강도 결정 소요강도 결정→ 시멘트강도 결정→ 슬럼프값 결정 물시멘트비 결정 단위수량 결정→ 굵은골재 최대치수 결정 잔골재율 결정","소요강도 결정 배합강도 결정 시멘트강도 결정→ 물시멘트비 결정→ 슬럼프값 결정→ 굵은골재 최대치수 결정→ 잔골재율 결정 단위수량 결정","시멘트강도 결정→ 소요강도 결정 배합강도 결정→ 슬럼프값 결정→ 물시멘트비 결정 잔골재율 결정→ 굵은골재 최대치수 결정 단위수량 결정","3"
"건설안전산업기사","2005","1_추가시험","건설시공학","55","붉은 콘크리트의 품질측정에 관한 시험이 아닌 것은?","","슬럼프 테스트","블리딩 시험","공기량 시험","블레인 공기투과 시험","4"
"건설안전산업기사","2005","1_추가시험","건설시공학","56","슬럼프테스트는 무엇을 측정하기 위한 실험인가?","","콘크리트 강도 측정","콘크리트 시공연도","골재의 입도율","시멘트 사용량","2"
"건설안전산업기사","2005","1_추가시험","건설시공학","57","일반적인 건축물의 철근 조립순서로 옳은 것은?","","기초철근 기둥철근→벽철근 보철근 슬래브철근 계단철근","기둥철근 기초철근 보철근→벽철근 계단철근 슬래브철근","기초철근 기둥철근 보철근 슬래브철근→벽철근→계단철근","기둥철근 기초철근 보철근 슬래브철근→계단철근→벽철근","1"
"건설안전산업기사","2005","1_추가시험","건설시공학","58","주로 연약한 점토질 지반에서 진흙의 점착력을 판별하는 토질시험은?","","표준관입시험","지내력도시험","보링","베인테스트","4"
"건설안전산업기사","2005","1_추가시험","건설시공학","59","거푸집내에 자갈을 먼저 채우고, 공극부에 유동성이 좋은 모르타르를 주입해서 일체의 콘크리트가 되도록 한 공법은?","","수일 콘크리트","진공 콘크리트","숏 콘크리트","프리팩트 콘크리트","4"
"건설안전산업기사","2005","1_추가시험","건설시공학","60","공정표 중 공사의 기성고를 표시하는데 대단히 편리하고 공사의 지연에 대하여 조속히 대처할 수 있는 것은?","","횡선식 공정표","PERT 공정표","CPM 공정표","사선 공정표","4"
"건설안전산업기사","2005","1_추가시험","건설재료학","61","다음 중 점토에 관한 설명으로 틀린 것은?","","비중은 일반적으로 2.5~2.6 정도이다.","정토의 가소성은 입자가 미세할수록 저하한다.","점토는 미세입자 외에 모래크기의 입자가 포함된다.","점토는 건조하면 수분의 방출로 수축한다.","2"
"건설안전산업기사","2005","1_추가시험","건설재료학","62","콘크리트의 방수성, 내약품성, 변형성능의 향상을 목적으로 다량의 고분자재료를 혼입한 시멘트는 어느 것인가?","","내황산염포틀랜드시멘트","저열포틀랜드시멘트","메이슨리시멘트","폴리머시멘트","4"
"건설안전산업기사","2005","1_추가시험","건설재료학","63","미장공사에서 바탕청소를 하는 주요 목적은?","","바름층의 경화 및 건조촉진","바탕층의 강도증진","바름층과의 접착력향상","바름층의 강도증진","3"
"건설안전산업기사","2005","1_추가시험","건설재료학","64","A.E콘크리트에 대한 설명으로 옳지 않은 것은?","","공기량이 많을수록 슬럼프는 증대한다.","염분 및 동결융해에 대한 저항성이 감소된다.","콘크리트의 재료분리, 블리딩이 감소된다.","콘크리트의 물시멘트비가 일정한 경우 공기량을 증가 시키면 압축강도는 저하된다.","2"
"건설안전산업기사","2005","1_추가시험","건설재료학","65","목구조용 접합철물 또는 보강철물에 대한 설명이 틀린 것은?","","볼트 - 한끝나사와 양끝나사인 것이 있으며, 재질면에서는 흑피볼트, 마볼트, 중마볼트 등이 있고, 형태상으로는 보통볼트, 주걱볼트, 특수볼트 등이 있다.","듀벨 - 목구조 부재의 접합에서 인장력 전달을 위해 두 부재의 연결부위에 끼워 넣는 촉을 의미한다.","꺾쇠 - 토대, 축부재, 지붕틀 부재 등의 접합용인 보통꺾쇠와 지붕보나 깔도리 등에서 부재의 직각부분에 쓰이는 엇꺾쇠 및 주걱꺾쇠 등이 있다.","띠쇠 인장부의 접합에 주로 사용되는 보강철물로서 볼트와 함께 사용한다.","2"
"건설안전산업기사","2005","1_추가시험","건설재료학","66","강의 열처리란 금속재료에 필요한 성질을 주기 위하여 가열 또는 냉각하는 조작을 말한다. 다음 중 강의 열처리 방법이 아닌 것은?","","늘림","불림","풀림","뜨임질","1"
"건설안전산업기사","2005","1_추가시험","건설재료학","67","목재의 비중이 0.4인 절건재의 공극률은?","","26.0%","36.0%","74.0%","64.0%","3"
"건설안전산업기사","2005","1_추가시험","건설재료학","68","각종 합성수지의 성질에 대한 설명으로 틀린 것은?","","아크릴수지는 투명도가 높고, 열팽창성이 낮아 채광판으로 쓰이나 내충격강도는 낮다.","폴리스틸렌 수지는 기계적 강도, 내수성이 좋다.","실리콘수지는 발수성이 높아 건축물, 전기 절연물 등의 방수에 쓰인다.","불소수지는 $-100^{\circ}C$의 저온에서도 성질의 변화가 거의 없다.","1"
"건설안전산업기사","2005","1_추가시험","건설재료학","69","목재의 건조목적이 아닌 것은?","","열전도성 개선","옹이 제거","방부제 주입용이","변색 및 부패방지","2"
"건설안전산업기사","2005","1_추가시험","건설재료학","70","유화제(乳化劑)를 써서 아스팔트를 미립자로 수중(水中)에 분산시킨 다갈색 액체로서 깬 자갈의 점결제(粘結劑) 등으로 쓰이는 아스팔트 제품은?","","아스팔트 프라이머(asphalt primer)","아스팔트 에멀젼(asphalt emulsion)","아스팔트 그라우트(asphalt grout)","아스팔트 콤파운드(asphalt compound)","2"
"건설안전산업기사","2005","1_추가시험","건설재료학","71","플라이애쉬를 혼입한 콘크리트의 특성에 관한 설명 중 올바른 것은?","","동일한 워커빌리티를 가진 보통콘크리트보다 많은 단위수량을 필요로 한다.","동일한 보통콘크리트보다 중성화 속도가 느리다.","플라이애쉬를 사용한 콘크리트는 화학저항성이 증대된다.","초기강도는 증가되지만 장기강도에는 큰 영향을 미치지 않는다.","3"
"건설안전산업기사","2005","1_추가시험","건설재료학","72","정토제품으로 소성온도가 가장 높은 것은?","","도기","토기","자기","석기","3"
"건설안전산업기사","2005","1_추가시험","건설재료학","73","미장 재료에 관한 설명 중 옳지 않은 것은?","","회반죽의 주성분은 수산화칼슘 [$Ca(OH)_2$]이다.","아스팔트 모르타르는 내산성이 크다.","굵은 모래를 사용하면 바름면의 균열을 적게 할 수 있다.","소석고 플라스터는 공기 중의 탄산가스를 흡수하여 경화한다.","4"
"건설안전산업기사","2005","1_추가시험","건설재료학","74","콘크리트용 골재로서 좋지 않은 것은?","","원형에 가까운 골재","굵은 골재의 최대치수가 25mm 이하의 것","화강석 등 단단한 잔골재나 굵은 골재","표면이 유리알 모양으로 매끈한 골재","4"
"건설안전산업기사","2005","1_추가시험","건설재료학","75","염화비닐수지의 용도로 가장 적절치 않은 것은?","","파이프","타일","도료","유리 대용품","4"
"건설안전산업기사","2005","1_추가시험","건설재료학","76","천연 슬레이트로 만들어 지붕, 벽 재료로 쓸 수 있는 암석의 종류는?","","안산암","현무암","사암","점판암","4"
"건설안전산업기사","2005","1_추가시험","건설재료학","77","연강의 인장시험에서 탄성에서 소성으로 변하는 경계는?","","비례한도","변형경화","항복점","파단점","3"
"건설안전산업기사","2005","1_추가시험","건설재료학","78","다음 파티클 보드(particle board)에 대한 설명 중 적당치 않은 것은?","","강도는 섬유의 방향에 따라 차이가 크다.","경질 파티클보드는 변형이 적다.","폐재, 부산물 등 저가치재를 이용하여 넓은 면적의 판상제품을 만들 수 있다.","경량 파티클보드는 흡음성, 열차단성이 경질 파티클보드보다 크다.","1"
