"Test Name","Year","Session","Subject","Number","Question","Question_image","Option 1","Option 2","Option 3","Option 4","Answer"
"건설안전산업기사","2020","3","건설재료학","76","미장재료에 관한 설명으로 옳지 않은 것은?","","회반죽벽은 습기가 많은 장소에서 시공이 곤란하다.","시멘트 모르타르는 물과 화학반응하여 경화되는 수경성 재료이다.","돌로마이트 플라스터는 마그네시아 석회에 모래, 여물을 섞어 반죽한 바름벽 재료를 말한다.","석고 플러스터는 공기 중의 탄산가스를 흡수하여 경화한다.","4"
"건설안전산업기사","2020","3","건설재료학","77","내약품성, 내마모성이 우수하여 화학공장의 방수층을 겸한 바닥 마무리재로 가장 적합한 것은?","","합성고분자 방수","무기질 침투방수","아스팔트 방수","에폭시 도막방수","4"
"건설안전산업기사","2020","3","건설재료학","78","일반적으로 철, 크롬, 망간 등의 산화물을 혼합하여 제조한 것으로 염색품의 색이 바래는 것을 방지하고 채광을 요구하는 진열장 등에 이용되는 유리는?","","자외선흡수유리","망입유리","복층유리","유리블록","1"
"건설안전산업기사","2020","3","건설재료학","79","회반죽 바름의 주원료가 아닌 것은?","","소석회","점토","모래","해초플","2"
"건설안전산업기사","2020","3","건설재료학","80","목재의 건조에 관한 설명으로 옳지 않은 것은?","","대기건조 시 통풍이 잘되게 세워 놓거나, 일정 간격으로 쌓아올려 건조시킨다.","마구리부분은 급격히 건조되면 갈라지기 쉬우므로 페인트 등으로 도장한다.","인공건조법으로 건조 시 기간은 통상 약 5~6주 정도이다.","고주파건조법은 고주파 에너지를 열에너지로 변화시켜 발열현상을 이용하여 건조한다.","3"
"건설안전산업기사","2020","3","건설안전기술","81","동바리로 사용하는 파이프 서포트에 관한 설치 기준으로 옳지 않은 것은?","","파이프 서포트를 3개 이상 이어서 사용하지 않도록 할 것","파이프 서포트를 이어서 사용하는 경우에는 4개 이상의 볼트 또는 전용철물을 사용하여 이을 것","높이가 3.5m를 초과하는 경우에는 높이 2m 이내마다 수평연결재를 2개 방향으로 만들고 수평연결재의 변위를 방지할 것","파이프 서포트 사이에 교차가새를 설치하여 수평력에 대하여 보강 조치할 것","4"
"건설안전산업기사","2020","3","건설안전기술","82","블레이드의 길이가 길고 낮으며 블레이드의 좌우를 전후 25~30° 각도로 회전시킬 수 있어 흙을 측면으로 보낼 수 있는 도저는?","","레이크 도저","스트레이트 도저","앵글도저","틸트도저","3"
"건설안전산업기사","2020","3","건설안전기술","83","리프트(Lift)의 방호장치에 해당하지 않는 것은?","","권과방지장치","비상정지장치","과부하방지장치","자동경보장치","4"
"건설안전산업기사","2020","3","건설안전기술","84","작업발판 및 통로의 끝이나 개구부로서 근로자가 추락할 위험이 있는 장소에서의 방호조치로 옳지 않은 것은?","","안전난간 설치","와이어로프 설치","울타리 설치","수직형 추락방망 설치","2"
"건설안전산업기사","2020","3","건설안전기술","85","건물외부에 낙하물 방지망을 설치할 경우 벽면으로부터 돌출되는 거리의 기준은?","","1m 이상","1.5m 이상","1.8m 이상","2m 이상","4"
"건설안전산업기사","2020","3","건설안전기술","86","다음은 비계를 조립하여 사용하는 경우 작업발판 설치에 관한 기준이다. ()에 들어갈 내용으로 옳은 것은?\n\n사업주는 비계(달비계, 달대비계 및 말비계는 제외한다)의 높이가 () 이상인 작업장소에 다음 각 호의 기준에 맞는 작업발판을 설치하여야 한다.\n1. 발판재료는 작업할 때의 하중을 견딜 수 있도록 견고한 것으로 할 것\n2. 작업발판의 폭은 40센티미터 이상으로 하고, 발판재료 간의 틈은 3센티미터 이하로 할 것","","1m","2m","3m","4m","2"
"건설안전산업기사","2020","3","건설안전기술","87","신축공사 현장에서 강관으로 외부비계를 설치할 때 비계기둥의 최고 높이가 45m라면 관련 법령에 따라 비계기둥을 2개의 강관으로 보강하여야 하는 높이는 지상으로부터 얼마까지인가?","","14m","20m","25m","31m","1"
"건설안전산업기사","2020","3","건설안전기술","88","암질 변화구간 및 이상 암질 출현 시 판별 방법과 가장 거리가 먼 것은?","","R.Q.D","R.M.R","지표침하량","탄성파 속도","3"
"건설안전산업기사","2020","3","건설안전기술","89","산업안전보건법령에 따른 크레인을 사용하여 작업을 하는 때 작업시작 전 점검사항에 해당되지 않는 것은?","","권과방지장치·브레이크·클러치 및 운전장치의 기능","주행로의 상측 및 트롤리(trolley)가 횡행하는 레일의 상태","원동기 및 풀리(pulley) 기능의 이상 유무","와이어로프가 통하고 있는 곳의 상태","3"
"건설안전산업기사","2020","3","건설안전기술","90","부두·안벽 등 하역작업을 하는 장소에서 부두 또는 안벽의 선을 따라 통로를 설치하는 경우 그 폭을 최소 얼마 이상으로 하여야 하는가?","","60cm","90cm","120cm","150cm","2"
"건설안전산업기사","2020","3","건설안전기술","91","다음과 같은 조건에서 추락 시 로프의 지지점에서 최하단까지의 거리 h를 구하면 얼마인가?\n- 로프 길이: 150cm\n- 로프 신율: 30%\n- 근로자 신장: 170cm","","2.8m","3.0m","3.2m","3.4m","1"
"건설안전산업기사","2020","3","건설안전기술","92","건설공사 유해위험방지계획서 제출 시 공통적으로 제출하여야 할 첨부서류가 아닌 것은?","","공사개요서","전체 공정표","산업안전보건관리비 사용계획서","가설도로계획서","4"
"건설안전산업기사","2020","3","건설안전기술","93","흙막이 지보공을 설치하였을 때 붕괴 등의 위험방지를 위하여 정기적으로 점검하고, 이상 발견 시 즉시 보수하여야 하는 사항이 아닌 것은?","","침하의 정도","버팀대의 긴압의 정도","지형·지질 및 지층상태","부재의 손상·변형·변위 및 탈락의 유무와 상태","3"
"건설안전산업기사","2020","3","건설안전기술","94","다음은 산업안전보건법령에 따른 승강설비의 설치에 관한 내용이다. ()에 들어갈 내용으로 옳은 것은?\n\n사업주는 높이 또는 깊이가 ()를 초과하는 장소에서 작업하는 경우 해당 작업에 종사하는 근로자가 안전하게 승강하기 위한 건설작업용 리프트 등의 설비를 설치하여야 한다. 다만, 승강설비를 설치하는 것이 작업의 성질상 곤란한 경우에는 그러하지 아니하다.","","2m","3m","4m","5m","1"
"건설안전산업기사","2020","3","건설안전기술","95","항타기 및 항발기를 조립하는 경우 점검하여야 할 사항이 아닌 것은?","","과부하장치 및 제동장치의 이상 유무","권상장치의 브레이크 및 쐐기장치 기능의 이상 유무","본체 연결부의 풀림 또는 손상의 유무","권상기의 설치상태의 이상 유무","1"
"건설안전산업기사","2020","3","건설안전기술","96","강관을 사용하여 비계를 구성하는 경우의 준수사항으로 옳지 않은 것은?","","비계기둥의 간격은 띠장 방향에서는 1.85m 이하로 할 것","비계기둥의 간격은 장선(長線) 방향에서는 1.0m 이하로 할 것","띠장 간격은 2.0m 이하로 할 것","비계기둥 간의 적재하중은 400kg을 초과하지 않도록 할 것","2"
"건설안전산업기사","2020","3","건설안전기술","97","철근콘크리트 현장타설공법과 비교한 PC(precast concrete) 공법의 장점으로 볼 수 없는 것은?","","기후의 영향을 받지 않아 동절기 시공이 가능하고, 공기를 단축할 수 있다.","현장작업이 감소되고, 생산성이 향상되어 인력절감이 가능하다.","공사비가 매우 저렴하다.","공장 제작이므로 콘크리트 양생 시 최적조건에 의한 양질의 제품생산이 가능하다.","3"
"건설안전산업기사","2020","3","건설안전기술","98","콘크리트를 타설할 때 거푸집에 작용하는 콘크리트 측압에 영향을 미치는 요인과 가장 거리가 먼 것은?","","콘크리트 타설 속도","콘크리트 타설 높이","콘크리트의 강도","기온","3"
"건설안전산업기사","2020","3","건설안전기술","99","히빙(heaving)현상이 가장 쉽게 발생하는 토질지반은?","","연약한 점토 지반","연약한 사질토 지반","견고한 점토 지반","견고한 사질토 지반","1"
"건설안전산업기사","2020","3","건설안전기술","100","안전관리비의 사용 항목에 해당하지 않는 것은?","","안전시설비","개인보호구 구입비","접대비","사업장의 안전·보건진단비","3"