"Test Name","Year","Session","Subject","Number","Question","Question_image","Option 1","Option 2","Option 3","Option 4","Answer"
"건설안전기사","2008","2","건설시공학","77","다음의 철골 세우기용 기계설비에서 수평이동이 가능하므로 건물의 층수가 적은 긴 평면에 유리하며 회전범위가 270°인 것은?","","가이데릭(Guy derrick)","스티프레그 데릭(stiff-leg derrick)","트럭 크레인(truck crane)","플레이트 스트레이닝 롤(plate straining roll)","2"
"건설안전기사","2008","2","건설시공학","78","현장타설 제자리 콘크리트 말뚝을 형성할 수 있는 리버스서큘레이션(Reverse Circulation Drill) 공법에 대한 설명으로 틀린 것은?","","점토, 실트층 등에 사용한다.","시공심도는 30~70m 정도이다.","시공직경은 0.5m 정도이다.","지하수위보다 2m 이상 물을 채워 정수압으로 공벽을 유지한다.","3"
"건설안전기사","2008","2","건설시공학","79","철골공사에서 용접불량과 관계없는 것은?","","엔드탭(end tab)","언더컷(under cut)","오버랩(over lap)","피트(pit)","1"
"건설안전기사","2008","2","건설시공학","80","굴착지반이 연약하여 구조물 위치 전체를 동시에 파내지 않고 측벽을 먼저 파내고 그 부분의 기초와 지하구조체를 축조한 다음 중앙부의 나머지 부분을 파내어 지하구조물을 완성하는 흙파기 공법은?","","트렌치 컷(Trench cut)공법","아일랜드 컷(Island cut)공법","흙막이 오픈 컷(Open cut)공법","비탈면 오픈 컷(Open cut)공법","1"
"건설안전기사","2008","2","건설재료학","81","철강의 부식 및 방식에 대한 설명으로 옳지 않은 것은?","","방식법 중 아연피복은 대기중에서 상당히 내구력이 있다.","철강의 표면은 대기중의 습기나 탄산가스와 반응하여 녹을 발생시킨다.","공기나 탄산가스가 적은 땅 속에서는 대기중 보다도 오히려 부식이 적다.","일반적으로 산에는 부식되지 않으나 알칼리에는 부식된다.","4"
"건설안전기사","2008","2","건설재료학","82","목재의 수축팽창에 관한 설명 중 옳지 않은 것은?","","변재는 심재보다 수축률 및 팽창률이 일반적으로 크다.","섬유포화점 이상의 함수상태에서는 함수율이 클수록 수축률 및 팽창률이 커진다.","수종에 따라 수축률 및 팽창률에 상당한 차이가 있다.","수축이 과도하거나 고르지 못하면 할렬, 비틀림 등이 생긴다.","2"
"건설안전기사","2008","2","건설재료학","83","다음 중 열경화성 합성수지는?","","페놀수지","염화비닐수지","아크릴수지","폴리에틸렌수지","1"
"건설안전기사","2008","2","건설재료학","84","다음 중 아스팔트에 있어서 침입도, 점도, 경도, 연신도 등에 가장 큰영향을 주는 것은?","","수분","온도","압력","비중","2"
"건설안전기사","2008","2","건설재료학","85","다음 중 강의 종류와 해당 용도의 연결이 옳지 않은 것은?","","연강: 스프링, 강선","극연강: 리벳, 철선","반경강: 레일","경강: 공구, 실린더재","1"
"건설안전기사","2008","2","건설재료학","86","다음 석고플라스터에 대한 설명 중 옳지 않은 것은?","","미장재료 중 점성이 가장 작다.","경화시간이 극히 짧다.","내화성이 높다.","경화·건조시 치수 안정성이 뛰어나다.","1"
"건설안전기사","2008","2","건설재료학","87","다음 중 회반죽에 여물을 넣는 가장 주된 이유는?","","균열을 방지하기 위하여","점성을 높이기 위하여","경화를 촉진하기 위하여","레이턴스를 제거하기 위하여","1"
"건설안전기사","2008","2","건설재료학","88","조강포틀랜드시멘트에 대한 설명으로 옳지 않은 것은?","","한중공사에 사용이 가능하다.","매스콘크리트용으로 주로 사용된다.","경화에 따른 수화열이 크다.","공사속도를 빨리 할 수 있다.","2"
"건설안전기사","2008","2","건설재료학","89","표준형 내화벽돌 중 보통형의 기본치수는?","","$190mm\times90mm\times57mm$","$230mm\times114mm\times65mm$","$210mm\times100mm\times60mm$","$230mm\times114mm\times85mm$","2"
"건설안전기사","2008","2","건설재료학","90","다음 중 보통 포틀랜드시멘트 제조시 석고를 혼합하는 이유로 가장 알맞은 것은?","","색깔을 조정하기 위하여","강도를 높이기 위하여","급속한 응결을 막기 위하여","분말도를 높이기 위하여","3"
"건설안전기사","2008","2","건설재료학","91","트래버틴(travertin)에 대한 설명으로 틀린 것은?","","석질이 불균일하고 다공질이다.","특수 외장용 장식재로서 주로 사용된다.","변성암으로 황갈색의 반문이 있다.","탄산석회를 포함한 물에서 침전, 생성된 것이다.","2"
"건설안전기사","2008","2","건설재료학","92","다음 중 콘크리트용 골재에 대한 설명으로 틀린 것은?(문제 오류로 1번 보기 내용이 정확하지 않습니다. 정확한 내용을 아시는분 께서는 오류신고를 통하여 내용 작성 부탁 드립니다. 정답은 2번입니다.)","","잔골재로서 사용할 모래의 절건밀도는 이상의 값을 표준으로 한다.","잔골재의 최대 염화물 이온 함유량은 질량백분율로 0.05%이다.","화학적으로 불안정한 골재는 사용할 수 없다.","잔골재로서 사용할 모래의 흡수율은 3.0% 이하의 값을 표준으로 한다.","2"
"건설안전기사","2008","2","건설재료학","93","다음의 합성수지 접착제 중 금속접착에 가장 알맞은 것은?","","요소수지 접착제","페놀수지 접착제","멜라민수지 접착제","에폭시수지 접착제","4"
"건설안전기사","2008","2","건설재료학","94","점토의 성질에 대한 설명으로 틀린 것은?","","양질의 점토는 건조상태에서 현저한 가소성을 나타내며 점토 입자가 미세할수록 가소성은 나빠진다.","점토의 주성분은 실리카와 알루미나이다.","인장강도는 점토의 조직에 관계하며 입자의 크기가 큰 영향을 준다.","점토제품의 색상은 철산화물 또는 석회물질에 의해 나타난다.","4"
"건설안전기사","2008","2","건설재료학","95","플라스틱 건설재료에 대한 설명 중 옳지 않은 것은?","","플라스틱은 인장강도가 압축강도보다 작다.","열에 의한 팽창 및 수축이 크며, 각종 변화가 다양하다.","직사일광에 의한 자외선폭로나 열적변화의 영향 등에 따라 강도저하, 노화 등이 발생된다.","하중과 신장이 후크의 법칙에 적용되지 않지만, 응력변화에 있어서 명확한 탄성한계 구별이 용이하다.","1"
"건설안전기사","2008","2","건설재료학","96","표건상태의 잔골재 500g을 건조시켜 기건상태에서 측정한 결과 460g, 절건상태에서 측정한 결과 450g이었다. 이 잔골재의 흡수율은?","","8%","8.8%","10%","11.1%","4"
"건설안전기사","2008","2","건설재료학","97","다음 중 목재의 열 및 전기에 대한 성질을 옳게 설명한 것은?","","목재는 조직 가운데 공간이 있기 때문에 열전도율이 크다.","목재의 함수율이 1% 증가하면 열전도율은 2% 감소한다.","목재의 전기저항은 비중과 상관없다.","목재의 전기전도율은 함수율이 클수록 증가한다.","4"
"건설안전기사","2008","2","건설재료학","98","콘크리트의 내구성에 관한 기술 중 옳지 않은 것은?","","염해는 철근과 무관하게 콘크리트 자체가 열화되는 것을 말한다.","알칼리 골재반응은 시멘트의 알칼리 성분과 골재를 구성하는 실리카광물이 반응하여 콘크리트를 팽창시키는 반응이다.","콘크리트중의 연행기포가 많을수록 동결융해저항성은 높아지나 강도가 떨어질 수 있다.","중성화현상은 경화콘크리트중의 알칼리성분이 탄산가스 등의 침입으로 중화되는 현상이다.","1"
"건설안전기사","2008","2","건설재료학","99","비중이 크고 연하면서 연성이 크며, 방사선실의 방사선 차폐용으로 사용되는 금속재료는?","","주석","납","철","크롬","2"
"건설안전기사","2008","2","건설재료학","100","석회암이 변성된 것으로 강도가 높고 색채와 결이 아름다우나, 풍화하기 쉬우므로 주로 내장재로 사용되는 것은?","","화강함","안산암","응회암","대리석","4"
"건설안전기사","2008","2","건설안전기술","101","항타기 및 항발기에 대한 설명으로 잘못된 것은?","","도괴방지를 위해 시설 또는 가설물 등에 설치하는 때에는 그 내력을 확인하고 내력이 부족한 때에는 그 내력을 보강하여야 한다.","와이어로프의 한 꼬임에서 끊어진 소선(필러선을 제외한다)의 수가 10% 이상인 것은 권상용 와이어로프로 사용을 금한다.","지름 감소가 호칭 지름의 7%를 초과하는 것은 권상용 와이어로프로 사용을 금한다.","권상용 와이어로프의 안전계수가 4.0이상 아니면 이를 사용하여서는 안된다.","4"
"건설안전기사","2008","2","건설안전기술","102","통나무비계의 비계 이음이 겹침이음할 경우 그 겹침 이음 길이는 최소 몇 m 이상으로 하여야 하는가?","","1m","1.5m","2m","2.5m","1"
"건설안전기사","2008","2","건설안전기술","103","아래 표의 ( )에 알맞은 숫자는?\n동바리로 사용하는 파이프서포트는 (①)본 이상을 이어서는 사용해서는 안되고 높이가 (②)m를 초과할 때에는 높이 (③)m 이내마다 수평연결재를 2개 방향으로 만들고 수평연결재의 변위를 방지한다.","","①:2, ②:3, ③:1","①:3, ②:3.5, ③:2","①:3, ②:3, ③:3","①:2, ②:3.5, ③:1","2"
"건설안전기사","2008","2","건설안전기술","104","다음 중 산업안전기준에 관한 규칙에서 정의하는 양중기가 아닌 것은?","","크레인","리프트","곤돌라","최대하중이 0.1ton인 승강기","4"
"건설안전기사","2008","2","건설안전기술","105","토사붕괴 예방을 위해 지반종류에 따른 굴착면의 기울기 기준을 설명한 것으로 잘못된 것은?","","보통흙(습지) - 1:1~1:1.5","풍화암 - 1:0.8","연암 - 1:0.5","경암 - 1:0.2","4"
"건설안전기사","2008","2","건설안전기술","106","화물취급작업시 관리감독자의 유해·위험방지업무와 가장 거리가 먼 것은?","","관계근로자 외의 자의 출입을 금지시키는 일","기구 및 공구를 점검하고 불량품을 제거하는 일","대피방법을 미리 교육하는 일","작업방법 및 순서를 결정하고 작업을 지휘하는 일","3"
"건설안전기사","2008","2","건설안전기술","107","건설업 산업안전보건관리비로 사용할 수 없는 것은?","","안전관리자의 인건비","교통통제를 위한 교통정리·신호수의 인건비","기성제품에 부착된 안정장치 고장시 교체 비용","근로자의 안전보건 촉진을 위한 교육, 세미나 등에 소요되는 비용","2"
"건설안전기사","2008","2","건설안전기술","108","철골작업을 중지하여야 하는 기준으로 옳은 것은?","","풍속이 초당 1미터 이상인 경우","강우량이 시간당 1센티미터 이상인 경우","강설량이 시간당 1센티미터 이상인 경우","10분간 평균풍속이 초당 5미터 이상인 경우","3"
"건설안전기사","2008","2","건설안전기술","109","유해위험방지계획서를 제출해야 할 대상 공사에 설명으로 잘못된 것은?","","지상 높이가 31m 이상인 건축물 또는 공작물의 건설, 기계조 또는 해체공사","최대지간 길이가 50m 이상인 교량건설 중의 공사","다목적댐·발전용댐 및 저수용량 2천만톤 이상의 용수전용댐 건설 등의 공사","깊이가 5m 이상인 굴착공사","4"
"건설안전기사","2008","2","건설안전기술","110","추락방지용 방망의 그물코가 10cm인 신제품 매듭방망사의 인장강도는 몇 킬로그램 이상이어야 하는가?","","80","110","150","200","4"
"건설안전기사","2008","2","건설안전기술","111","다음 중 연약지반 개량공법이 아닌 것은?","","폭파치환공법","샌드드레인공법","우물통공법","모래다짐말뚝공법","3"
"건설안전기사","2008","2","건설안전기술","112","다음의 토사붕괴 원인 중 외부의 힘이 작용하여 토사붕괴가 발생되는 외적요인이 아닌 것은?","","사면의 경사 증가","굴착사면의 높이 증가","빗물의 침투로 인하여 토사의 중량 증가","함수비 증가로 인한 점착력 증가","4"
"건설안전기사","2008","2","건설안전기술","113","기초, 보의 측면, 기둥, 벽의 거푸집널은 24시간 이상 양생한 후에 콘크리트의 압축강도가 일정한 값 이상에 도달하였을때 시험에 의하여 확인된 경우에 해체할 수 있는데, 이때 그 기준이 되는 콘크리트의 압축강도는?","","5MPa","7MPa","8MPa","10MPa","1"
"건설안전기사","2008","2","건설안전기술","114","추락재해를 방지하기 위하여 사용하는 방망의 지지점이 연속적인 구조물이고 지지점의 간격이 1.0m 일 때, 외력에 견딜 수 있어야 하는 강도는 최소 얼마 이상이어야 하는가?","","200kg","400kg","600kg","800kg","3"
"건설안전기사","2008","2","건설안전기술","115","표면에 다수의 돌기를 붙여 접지면적을 작게하여 접지압을 증가시킨 롤러로서 깊은 다짐이나 고함수비 지반의 다짐에 많이 이용되는 롤러는?","","머캐덤롤러","탠덤롤러","탬핑롤러","타이어롤러","3"
"건설안전기사","2008","2","건설안전기술","116","양중작업에 사용되는 와이어로프의 안전계수에 관한 사항 중 옳지 않은 것은?","","와이어로프의 안전계수는 그 절단하중의 값을 와이어로프에 걸리는 하중의 평균값으로 나눈 값이다.","근로자가 탑승하는 운반구를 지지하는 경우의 안전계수는 10 이상이어야 한다.","화물의 하중을 직접 지지하는 경우의 안전계수는 5 이상이어야 한다.","근로자가 탑승하는 운반구를 지지하거나 화물의 하중을 직접 지지하는 경우 외의 와이어로프 안전계수는 4 이상이어야 한다.","1"
"건설안전기사","2008","2","건설안전기술","117","흙막이 벽을 설치하여 기초 굴착 작업중 굴착부 바닥이 솟아 올랐다. 이에 대한 대책으로 옳은 것은?","","흙막이 벽의 근입길이를 깊게 한다.","굴착작업의 속도를 빨리 한다.","수평버팀을 추가하여 흙막이벽의 지지력을 강화시킨다.","흙막이 벽의 변위가 생기지 않도록 시공의 정도를 높인다.","1"
"건설안전기사","2008","2","건설안전기술","118","강관비계 조립시 준수사항으로 잘못된 것은?","","비계기둥에는 미끄러지거나 침하하는 것을 방지하기 위하여 밑받침철물을 사용하거나 깔판 깔목 등을 사용하여 밑둥잡이를 설치하는 등의 조치를 해야 한다.","비계기둥의 최고로부터 31m 되는 지점 일부분의 비계기둥은 2본의 강관으로 묶어 세워야 한다.","비계기둥간의 적재하중은 400kg을 초과하지 아니하도록 한다.","첫 번째 띠장은 지상으로부터 높이 2m 이하의 위치에 설치해야 한다.","3"
"건설안전기사","2008","2","건설안전기술","119","콘크리트 강도에 영향을 주는 요소로 거리가 먼 것은?","","콘크리트 재령 및 배합","양생 온도와 습도","타설 및 다지기","거푸집 모양 및 형상","4"
"건설안전기사","2008","2","건설안전기술","120","부두 등의 하역작업장에서 부두 또는 안벽의 선에 따라 통로를 설치할 때의 폭은?","","90cm 이상","75cm 이상","60cm 이상","45cm 이상","1"