"Test Name","Year","Session","Subject","Number","Question","Question_image","Option 1","Option 2","Option 3","Option 4","Answer"
"건설안전산업기사","2007","1","건설재료학","79","플라스틱 건설재료의 일반적 성질에 대한 설명 중 옳지 않은 것은?","","상호간 계면 접착이 잘되며, 금속, 콘크리트, 목재, 유리 등 다른 재료에도 잘 부착된다.","열에 의한 팽창 및 수축이 크며, 각종 변화가 다양 하다.","내수성 및 내투습성은 플리초산비닐 등 일부를 제외하고는 극히 양호하다.","투명성이 필요한 용도에는 사용할 수 없다.","4"
"건설안전산업기사","2007","1","건설재료학","80","KS에 규정된 콘크리트용 부순굵은골재와 부순잔골재의 품질 중 흡수율의 기준은?","","1% 이하","3% 이하","5% 이하","10% 이하","2"
"건설안전산업기사","2007","1","건설안전기술","81","안전보건관리책임자를 두어야 할 건설업(공사)의 규모와 고용노동부장관에게 이를 증명할 수 있는 서류 제출시기에 대한 기준으로 옳은 것은?","","총공사금액 2억원 이상, 선임한 날로부터 7일 이내","총공사금액 2억원 이상, 선임한 날로부터 14일 이내","총공사금액 20억원 이상, 선임한 날로부터 7일 이내","총공사금액 20억원 이상, 선임한 날로부터 14일 이내","4"
"건설안전산업기사","2007","1","건설안전기술","82","안전난간의 구조 및 설치요건에 대한 기준으로 틀린 것은?","","상부난간대는 경사로의 표면으로부터 90센티미터이상 120센티미터 이하에 설치한다.","발끝막이판은 바닥면으로부터 10센티미터 이상의 높이를 유지한다.","난간대는 지름 2센티미터 이상의 금속제파이프나 그 이상의 강도를 가진 재료로 한다.","안전난간은 임의의 점에서 임의의 방향으로 움직이는 100킬로그램의 이상의 하중을 견딜 수 있는 구조로한다.","3"
"건설안전산업기사","2007","1","건설안전기술","83","수직갱에 가설된 통로의 길이가 15m 이상인 때에는 매10m 마다 무엇을 설치해야 하는가?","","손잡이","계단참","클램프","미끄럼방지 조치","2"
"건설안전산업기사","2007","1","건설안전기술","84","다음 중 붕괴사고의 직접적인 방지대책과 가장 거리가 먼 것은?","","우수(雨水), 지하수 등의 사전배제","가스분출 검사","안전경사 유지","토사유출 방지","2"
"건설안전산업기사","2007","1","건설안전기술","85","다음 중 버팀대(Strut)의 변형을 측정하는 계측기는?","","경사계(Inclino meter)","수위계(water level meter)","침하계(Extension)","하중계(Load cell)","4"
"건설안전산업기사","2007","1","건설안전기술","86","다음의 승강장치 중 데릭의 종류에 속하지 않는 것은?","","가이 데릭","케이블 데릭","진폴 데릭","삼각 데릭","2"
"건설안전산업기사","2007","1","건설안전기술","87","쇼벨계 굴착기계에 속하지 않는 것은?","","파워쇼벨(power shovel)","크램셀(clamshell)","스크레이퍼(scraper)","드래그라인(dragline)","3"
"건설안전산업기사","2007","1","건설안전기술","88","거푸집동바리 조립도에 명시해야 할 사항과 가장 거리가 먼 것은?","","부재의 재질","단면규격","설치간격","작업 환경 조건","4"
"건설안전산업기사","2007","1","건설안전기술","89","사업주가 추락에 의하여 근로자에게 위험을 미칠 우려가 있을 때 비계를 조립하는 등의 방법에 의하여 작업발판을 설치하여 추락방지 조치를 해야 할 최소 높이는?","","2 m","3 m","4 m","5 m","1"
"건설안전산업기사","2007","1","건설안전기술","90","추락에 의한 위험방지 조치사항으로 거리가 먼 것은?","","투하설비 설치","작업발판 설치","추락방지망 설치","근로자에게 안전대 착용","1"
"건설안전산업기사","2007","1","건설안전기술","91","유해·위험 방지 계획서를 작성하는 자격 요건에 해당 되지 않는 것은?","","건설안전분야 산업안전지도사","건설안전기술사","건선안전산업기사 이상으로서 실무경력 7년인 자","건설안전기사로서 실무경력 4년인 자","4"
"건설안전산업기사","2007","1","건설안전기술","92","철골작업시 작업의 제한 기준으로 옳은 것은?","","풍속이 초당 10미터 이상인 경우","풍속이 초당 30미터 이상인 경우","강설량이 분당 1밀리미터 이상의 경우","강설량이 분당 1센티미터 이상의 경우","1"
"건설안전산업기사","2007","1","건설안전기술","93","건설업 산업안전보건관리비 사용내역에 해당 되지 않는 것은?","","안전관리자의 인건비","추락방지용 안전시설비","각종 개인보호구의 구입, 수리, 관리 등에 소요되는 비용","안전담당자 업무수당 외의 인건비","4"
"건설안전산업기사","2007","1","건설안전기술","94","단면이 20cm×20cm, 길이가 7m 인 기둥에 10ton의 압축력이 축방향으로 작용할 때 압축응력은?","","$20 ton/m^2$","$250 ton/m^2$","$200 ton/m^2$","$100 ton/m^2$","2"
"건설안전산업기사","2007","1","건설안전기술","95","강관 비계 조립시 높이가 최소 몇 m를 초과하는 경우에 주를간의 간격을 1.8m 이하로 하여야 하는가?","","15m","20m","25m","30m","2"
"건설안전산업기사","2007","1","건설안전기술","96","해체 작업용 화약류에 속하지 않는 것은?","","저폭속 파쇄약","저폭속 폭약","팽창제","다이나마이트","4"
"건설안전산업기사","2007","1","건설안전기술","97","거푸집동바리 등을 조립할 때 강재와 강재의 접속부 또는 교차부를 연결시키기 위한 전용철물은?","","가재","섀클","클램프","장선","3"
"건설안전산업기사","2007","1","건설안전기술","98","다음 터널 공법 중 전단면 기계 굴착에 의한 공법에 속하는 것은?","","ASSM(American Steel Supported Method)","NATM(New Austrian Tunneling Method)","TBM(Tunnel Boring Machine)","개착식 공법","3"
"건설안전산업기사","2007","1","건설안전기술","99","거푸집에 작용하는 하중 중에서 연직하중이 아닌 것은?","","거푸집의 자중","작업원의 작업하중","가설설비의 충격하중","콘크리트의 측압","4"
"건설안전산업기사","2007","1","건설안전기술","100","구조물 작업에서의 위험요인과 재해형태가 가장 관련이 적은 것은?","","자재적재 및 통로 미확보 - 전도","개구부 안전난간 미설치 - 추락","벽돌 등 중량물 취급 작업협착","함만 하역 작업 - 질식","4"