Test Name,Year,Session,Subject,Number,Question,Question_image,Option 1,Option 2,Option 3,Option 4,Answer
화재감식평가기사,2020,"1,2",화재조사보고 및 피해평가,68,화재현황조사서에 명시된 발화요인으로 맞는 것은?,,"불꽃, 불티",작동기기,"담뱃불, 라이터불",교통사고,4
화재감식평가기사,2020,"1,2",화재조사보고 및 피해평가,69,화재범위가 2이상의 관할구역에 걸친 화재에 대한 설명으로 맞는 것은?,,출동하여 진압한 소방서에서 1건의 화재로 한다.,관할 소방서장과 출동한 소방서장과 협의하여 정한다.,발화 소방대상물의 소재지를 관할하는 소방서에서 1건의 화재로 한다.,발화 소방대상물의 소재지를 관할하는 소방서와 출동한 소방서에서 각각 1건의 화재로 한다.,3
화재감식평가기사,2020,"1,2",화재조사보고 및 피해평가,70,화재 현장조사서에 첨부할 도면의 작성에 대한 설명으로 틀린 것은?,,"도면작성에 있어서는 방의 배치와 출입구, 개구부의 상황을 위주로 한다.",거리측정은 기둥의 중심에서 다른 기둥의 중심까지로 기준점을 통일한다.,"도면(평면도, 입체도)은 측정치를 기준으로 하여 축척에 맞춰서 작성한다.",화재조사관은 화재현장에 대한 이해도를 높이기 위해 화재의 유형과 규모에 관계없이 3차원 형식의 도면을 반드시 작성하여야 한다.,4
화재감식평가기사,2020,"1,2",화재조사보고 및 피해평가,71,화재조사서류 중 화재발생종합보고서의 보존기간으로 맞는 것은?,,5년,10년,영구,준영구,3
화재감식평가기사,2020,"1,2",화재조사보고 및 피해평가,72,화재피해액 산정에 있어 상당부분 교체 내지 수리가 필요한 경우의 손해율로 맞는 것은?,,20%,40%,60%,80%,3
화재감식평가기사,2020,"1,2",화재조사보고 및 피해평가,73,화재현장조사서 작성 시 유의사항 중 틀린 것은?,,관계자 진술은 주관적인 것이므로 기재하지 않는다.,필요한 경우 예상되는 사항 및 관련 조치사항 등도 기록할 수 있다.,"발화지점 및 화재원인 판정은 객관적인 증거자료(사진, 기타서류 등)를 첨부할 수 있다.","필요한 경우 감식·감정 결과통지서, 전기배선도, 연구자료, 재현실험 결과, 참고문헌 등 참고자료를 첨부할 수 있다.",1
화재감식평가기사,2020,"1,2",화재조사보고 및 피해평가,74,"지은지 10년된 아파트에서 화재가 발생하여 100m$^2$가 소실되었다. 화재피해액은 약 얼마인가? (단, 내용연수 50년, 신축단가 670천원/m$^2$, 손해율 40%이다.)",,21862천원,22512천원,26661천원,28891천원,2
화재감식평가기사,2020,"1,2",화재조사보고 및 피해평가,75,화재발생종합보고서에서 화재 발생 시 모든 경우에 작성되어야 할 조사서는?,,화재현황조사서,화재유형별조사서,방화·방화의심조사서,화재피해(인명·재산)조사서,1
화재감식평가기사,2020,"1,2",화재조사보고 및 피해평가,76,화재피해액 산정에 관한 설명으로 맞는 것은?,,"최종잔가율은 건물, 부대설비, 가재도구의 경우 20%, 기타의 경우 10%로 한다.",화재피해액을 산정하기 위한 피해면적은 화재피해를 입은 건물의 바닥면적을 말한다.,"화재로 인한 건물의 피해액은 화재피해 대상 건물과 동일한 구조, 용도, 질, 규모의 건물 재건축비에서 손해율을 곱한 금액이 된다.",간이평가방식에 의한 부대설비의 피해액 산정에 있어 전등 및 전열설비 등 기본적 전기설비만 설치되어 있어도 별도로 부대시설 피해액을 산정한다.,1
화재감식평가기사,2020,"1,2",화재조사보고 및 피해평가,77,화재조사 및 보고규정상 화재로 인한 재산피해의 범위가 아닌 것은?,,연기에 의한 그을음 피해,화재로 인한 영업손실의 피해,소화활동으로 발생한 수손피해,"열에 의한 탄화, 용융, 파손 피해",2
화재감식평가기사,2020,"1,2",화재조사보고 및 피해평가,78,화재피해액 산정 시 중고로 구입한 기계장치 및 집기비품으로서 그 제작년도를 알 수 없을 경우 그 상태에 따라 신품가액 대비 잔가율로 정할 수 있는 비율은?,,30% 내지 50%,30% 내지 60%,20% 내지 50%,20% 내지 60%,1
화재감식평가기사,2020,"1,2",화재조사보고 및 피해평가,79,화재현장 출동보고서의 기재항목이 아닌 것은?,,발화지점 판정,출동대원 및 응답자,현장도착시 발견사항,도착하여 처음 실행한 일의 지점 및 유형,1
화재감식평가기사,2020,"1,2",화재조사보고 및 피해평가,80,화재현장조사서 작성 시 화재원인 검토와 관련된 내용 중 필수 검토항목이 아닌 것은?,,방화 가능성,전기적 요인,인적 부주의,관련 조치사항,4
화재감식평가기사,2020,"1,2",화재조사관계법규,81,"소방기본법령에서 규정하고 있는 화재조사 전담부서의 장이 소속 소방공무원 가운데 소방청장이 실시하는 화재조사에 관한 시험에 합격한 자가 없는 경우, 화재조사를 실시하게 할 수 있는 소방공무원의 기준으로 옳은 것은?",,소방교육기관에서 10주 이상 화재조사에 관한 전문교육을 이수한 자,국립과학수사연구원에서 10주 이상 화재조사에 관한 전문교육을 이수한 자,외국의 화재조사 관련 기관에서 10주 이상 화재조사에 관한 전문교육을 이수한 자,'국가기술자격법'에 따른 건축·위험물·전기·안전관리(가스·소방·소방설비·전기안전·화재감식평가 종목에 한한다)분야 산업기사 이상의 자격을 취득한 자,4
화재감식평가기사,2020,"1,2",화재조사관계법규,82,화재조사 및 보고규정상 조사본부의 설치운영에 관한 사항 중 옳지 않은 것은?,,조사본부장은 화재조사 업무를 관장하는 과장으로 한다.,조사관은 소방본부 및 소방서의 화재조사업무를 담당한다.,조사본부장은 조사종료 후 7일 이내에 예외 없이 조사내용을 발표해야 한다.,본부장 또는 서장은 조사본부의 기능이 완료되었을 경우 이를 해체한다.,3
화재감식평가기사,2020,"1,2",화재조사관계법규,83,소방기본법령상 화재조사 전담부서의 장이 관장하는 업무가 아닌 것은?,,화재조사의 발전과 조사요원의 능력향상에 관한 사항,화재조사를 위한 장비의 관리운영에 관한 사항,화재조사의 총괄·조정,화재조사에 관한 시험의 응시자격 결정,4
화재감식평가기사,2020,"1,2",화재조사관계법규,84,화재로 인한 손해의 배상의무자가 법원에 손해배상액의 경감을 청구할 수 있는 경우로 옳은 것은?,,고의에 인한 화재인 경우,중대한 과실로 인한 실화인 경우,경미한 과실로 인한 실화인 경우,악의적인 방화로 인한 화재인 경우,3
화재감식평가기사,2020,"1,2",화재조사관계법규,85,화재조사 및 보고규정에서 6가지로 규정한 화재 유형이 아닌 것은?,,건축·구조물 화재,위험물·가스제조소 등 화재,공원화재,선박·항공기화재,3
화재감식평가기사,2020,"1,2",화재조사관계법규,86,"제조물 책임법에 따르면 손해배상의 청구권은 제조업자가 손해를 발생시킨 제조물을 공급한 날부터 몇 년 이내에 행사하여야 하는가? (단, 원칙적인 경우에 한한다.)",,3년,5년,10년,15년,3
화재감식평가기사,2020,"1,2",화재조사관계법규,87,화재로 인한 재해보상과 보험가입에 관한 법률의 설명으로 틀린 것은?,,보험금 청구권 중 손해배상책임을 담보하는 보험의 청구권은 압류할 수 없다.,'손해보험회사'란 손해배상법에 따른 화재보험업의 허가를 받은 자를 말한다.,대한민국에 주둔하는 외국군대가 소유하는 건물은 특수건물소유자의 손해배상책임에 적용되지 않는다.,손해보험회사는 대통령령으로 정하는 바에 따라 협회의 설립과 운영에 필요한 비용을 출연하여야 한다.,2
화재감식평가기사,2020,"1,2",화재조사관계법규,88,형법에서 규정하고 있는 진화방해죄에 대한 벌칙 기준 중 다음 ( )안에 알맞은 것은?\n\n화재배 있다시 진화용의 시설 또는 물건을 은닉 또는 손괴하거나 기타 방법으로 진화를방해한 자는 ( )년 이하의 징역에 처한다.,,10,7,5,1,1
화재감식평가기사,2020,"1,2",화재조사관계법규,89,제조물 책임법상 제조업자에 해당하는 자로 옳지 않은 것은?,,제조물의 제조·가공을 업으로 하는 자,제조물의 유통을 업으로 하는 자,제조물의 수입을 업으로 하는 자,제조물에 성명·상호·상표 등을 사용하여 자신을 제조업자로 오인하게 할 수 있는 표시를 한 자,2
화재감식평가기사,2020,"1,2",화재조사관계법규,90,미성년자가 타인에게 손해를 가한 경우에 그 행위의 책임을 변식할 지능이 없는 때에는 배상의 책임이 없다. 이 경우 민법상 미성년자임을 판단하는 연령과 그 산정방법으로 옳은 것은?,,"14세 미만, 출생일 산입","18세 미만, 출생일 불산입","19세 미만, 출생일 산입","20세 미만, 출생일 불산입",3
화재감식평가기사,2020,"1,2",화재조사관계법규,91,소방기본법령상 화재원인조사 중 발화원인 조사의 점위에 해당하지 않은 것은?,,화재가 발생한 과정,화재의 연소경로,화재가 발생한 지점,불이 붙기 시작한 물질,2
화재감식평가기사,2020,"1,2",화재조사관계법규,92,화재로 인한 재해보상과 보험가입에 관한 법률상 특약부화재보험을 가입하지 않은 특수건물 소유자의 벌칙으로 옳은 것은?,,200만원 이하의 벌금,300만원 이하의 벌금,400만원 이하의 벌금,500만원 이하의 벌금,4
화재감식평가기사,2020,"1,2",화재조사관계법규,93,실화책임에 관한 법률상 배상의무자가 법원에 손해배상액의 경감을 청구할 경우 법원이 손해배상액의 경감을 고려하는 사정이 아닌 것은?,,화재의 원인과 규모,피해의 대상과 정도,연소 및 피해 확대의 원인,화재피해자의 직업,4
화재감식평가기사,2020,"1,2",화재조사관계법규,94,"화재 현장에서의 증거물이 법정에 제출되는 경우, 증거로서의 가치를 상실하지 않도록 준수해야 하는 적법한 절차에 관한 사항으로 옳은 것은?",,관련 법규 및 지침에 규정된 일반적인 원칙과 절차를 준수한다.,화재조사에 필요한 증거 수집은 화재피해자의 피해를 최대화하도록 하여야 한다.,화재의 증거물을 획득할 때에는 어떠한 장비도 사용해서는 아니된다.,최정적으로 법정에 제출되는 화재증거물은 증거의 훼손 방지를 위하여 항상 사본을 제출한다.,1
화재감식평가기사,2020,"1,2",화재조사관계법규,95,화재보험법령상 손해보험회사가 운영하는 특약부화재보험에 가입 하여야 하는 특수건물의 기준으로 옳은 것은?,,노래연습장업으로 사용하는 부분의 바닥면적의 합계가 1000m$^2$이상인 건물,학원으로 사용하는 부분의 바닥면적의 합계가 1000m$^2$이상인 건물,병원급 의료기관으로 사용하는 건물로서 연면적의 합계가 2000m$^2$이상인 건물,관광숙박업으로 사용하는 건물로서 연면적의 합계가 3000m$^2$이상인 건물,4
화재감식평가기사,2020,"1,2",화재조사관계법규,96,"소방기본법상 화재, 재난·재해, 그 밖의 위급한 상황이 발생한 현장에 소방활동구역을 정하여 소방활동에 필요한 사람으로서 대통령령으로 정하는 사람 외에는 그 구역에 출입하는 것을 제한할 수 있는 자는?",,시·도지사,행정안전부장관,시장·군수,소방대장,4
화재감식평가기사,2020,"1,2",화재조사관계법규,97,승객이 있는 기차에 불을 놓은 경우에 해당되는 죄는 무엇인가?,,현주건조물등에의 방화,공용건조물등에의 방화,일반건조물등에의 방화,일반물건에의 방화,1
화재감식평가기사,2020,"1,2",화재조사관계법규,98,화재조사 및 보고규정상 건축·구조물화재의 소실정도의 분류 중 다음 ( )안에 알맞은 것은?\n\n반소 : 건물의 ( ㉠ )% 이상 ( ㉡ )%미만이 소실된 것,,"㉠ 20, ㉡ 50","㉠ 20, ㉡ 70","㉠ 30, ㉡ 50","㉠ 30, ㉡ 70",4
화재감식평가기사,2020,"1,2",화재조사관계법규,99,화재조사관이 화재원인 및 피해조사활동을 개시하는 시점으로 옳은 것은?,,화재사실을 인지하는 즉시,현장에 소방차량이 도착함과 동시,화재가 진압되고 즉시,관할 경찰서의 조사허가 즉시,1
화재감식평가기사,2020,"1,2",화재조사관계법규,100,소방서장 등은 불이 번지는 것을 막기 위하여 필요할 때에는 불이 번질 우려가 있는 소방대상물을 일시적으로 사용하거나 그 사용의 제한 또는 소방활동에 필요한 처분을 할 수 있다. 다음 중 이러한 처분을 방해한 자에 대한 벌칙으로 옳은 것은?,,3년이하 징역 또는 3천만원 이하의 벌금,5년이하 징역 또는 5천만원 이하의 벌금,1년이하 징역 또는 500만원 이하의 벌금,300만원 이하의 벌금,1
