Test Name,Year,Session,Subject,Number,Question,Question_image,Option 1,Option 2,Option 3,Option 4,Answer
소방시설관리사,2010,1,소방안전관리론,1,연소와 가장 관련이 있는 화학반응은?,,산화반응,환원반응,치환반응,중화반응,1
소방시설관리사,2010,1,소방안전관리론,2,가연성액체가 개방된 상태에서 증기를 계속 발생시키면서 연소가 지속될 수 있는 최저온도를 무이라고 하는가?,,인화점,연소점,발화점,기화점,2
소방시설관리사,2010,1,소방안전관리론,3,일반적으로 공기 중 산소농도를 몇 vol% 이하로 감소시키면 연소상태의 중지 및 질식소화가 가능하겠는가?,,15,21,25,31,1
소방시설관리사,2010,1,소방안전관리론,4,할로겐화합물 소화설비에 사용하는 소화약제가 아닌 것은?,,할론 2402,할론1211,할론1301,할론1311,4
소방시설관리사,2010,1,소방안전관리론,5,방화구획의 효과와 관계 없는 것은?,,화염의 제한,인명의 안전대피,화재하중의 감소,연기의 확산방지,3
소방시설관리사,2010,1,소방안전관리론,6,"출화 가옥의 기둥, 벽 등은 발화부를 향하여 도괴되는 경향이 있으므로 이곳을 출화부로 추정하는 것을 무엇이라 하는가?",,접염비교법,탄화심도비교법,도괴방향법,연소비교법,3
소방시설관리사,2010,1,소방안전관리론,7,화재실의 온도를 측정하는 데는 여러 종류의 온도계를 이용하여 측정하게 된다. 그렇다면 온도는 어느 계량 단위에 속하는가?,,기본단위,유도단위,보조단위,특수단위,1
소방시설관리사,2010,1,소방안전관리론,8,포소화설비의 화재 적응성이 가장 낮은 대상물은?,,건축물,가연성 고체류,가연성 가스,가연성 액체류,3
소방시설관리사,2010,1,소방안전관리론,9,우리나라에서의 화재급수와 그에 따른 화재분류가 틀린 것은?,,A급 - 일반화재,B급 - 유류화재,C급 - 가스화재,D급 - 금속화재,3
소방시설관리사,2010,1,소방안전관리론,10,불연재료가 아닌 것은?,,기와,석고보드,유리,콘크리트,2
소방시설관리사,2010,1,소방안전관리론,11,다음 중 주된 연소형태가 표면연소인 것은 어느 것인가?,,알코올,숯,목재,에테르,2
소방시설관리사,2010,1,소방안전관리론,12,화재시 발생되는 연소가스 중 적은 양으로는 인체에 거의 해가 없으나 많은 양을 흡입하면 질식을 일으키며 소화약제로도 사용되는 가스는?,,CO,CO$_2$,H$_2$O,H$_2$,2
소방시설관리사,2010,1,소방안전관리론,13,다음의 할로겐 화합물 중 오존 파괴지수가 가장 큰 것은?,,Halon 104,Halon 1211,Halon 2402,Halon 1301,4
소방시설관리사,2010,1,소방안전관리론,14,플래시 오버(flash over)를 옳게 설명한 것은?,,도시가스의 폭발적 연소를 말한다.,휘발유 등 가연성 액체가 넓게 흘러서 발화한 상태를 말한다.,옥내 화재가 서서히 진행하여 열 및 가연성 기체가 축적되었다가 일시에 연소하여 화염이 크게 발생하는 상태를 말한다.,화재층의 불이 상부층으로 올라가는 현상을 말한다.,3
소방시설관리사,2010,1,소방안전관리론,15,갑작스런 화재발생시 인간의 피난 특성으로 틀린 것은?,,본능적으로 평상시 사용하는 출입구를 사용한다.,최초로 행동을 개시한 사람을 따라서 움직인다.,공포감으로 인해서 빛을 피하여 어두운 곳으로몸을 숨긴다.,무의식중에 발화 장소의 반대쪽으로 이동한다.,3
소방시설관리사,2010,1,소방안전관리론,16,목재의 상태를 기준으로 했을 때 다음 중 연소 속도가 가장 느린 것은?,,거칠고 얇은 것,각이 있고 얇은 것,매끄럽고 둥근 것,수분이 적고 거친 것,3
소방시설관리사,2010,1,소방안전관리론,17,"페놀수지, 멜라민수지 등이 연소될 때 발생되며 눈, 코, 인후 및 폐에 매우 자극성이 큰 유독성 가스는?",,CO$_2$,SO$_2$,HBr,NH$_3$,4
소방시설관리사,2010,1,소방안전관리론,18,이산화탄소 소화약제의 저장 용기 충전비로서 적합하게 짝지어져 있는 것은?,,"저압식은 1.1이상, 고압식은 1.5 이상","저압식은 1.4이상, 고압식은 2.0 이상","저압식은 1.9이상, 고압식은 2.5 이상","저압식은 2.3이상, 고압식은 3.0 이상",1
소방시설관리사,2010,1,소방안전관리론,19,화재하중을 나타내는 단위는?,,kcal/kg,℃/m$^2$,kg/m$^2$,kg/kcal,3
소방시설관리사,2010,1,소방안전관리론,20,위험물 유별에 따른 그 성질의 연결이 틀린 것은?,,제1류 위험물-산화성 고체,제2류 위험물-가연성 고체,제4류 위험물-인화성 액체,제6류 위험물-자기반응성 물질,4
소방시설관리사,2010,1,소방안전관리론,21,다음 중 유류 화재 시 수성막 포 소화약제와 혼합사용 시 소화효과를 높일 수 있는 가장 효과적인 소화 약제는?,,분말 소화약제,화학포 소화약제,이산화탄소 소화약제,할로겐화합물 소화약제,1
소방시설관리사,2010,1,소방안전관리론,22,방화구조의 기준으로 맞는 것은?,,철망모르타르로서 그 바름 두께가 2cm 이상인 것,두께 2.5cm 이상의 암면보온판 위에 석면 시멘트판을 붙인 것,시멘트모르타르 위에 타일을 붙인 것으로서 그 두께의 합계가 1.5cm 이상인 것,두께 1.2cm 이상의 석고판위에 석면 시멘트판을 붙인 것,3
소방시설관리사,2010,1,소방안전관리론,23,소화에 필요한 산소농도를 알 수 있다면 CO$_2$소화약제 사용 시 최소 소화농도를 구하는 식은?,O,$\text{CO}_2[\%] = 21 \times (\frac{100 - \text{O}_2\%}{100})$,$\text{CO}_2[\%] = \frac{21 - \text{O}_2\%}{21} \times 100$,$\text{CO}_2[\%] = 21 \times (\frac{\text{O}_2\%}{100} - 1)$,$\text{CO}_2[\%] = (\frac{21 \times \text{O}_2\%}{100} - 1)$,2
소방시설관리사,2010,1,소방안전관리론,24,전기에 의한 발화를 방지하기 위한 예방대책으로 옳지 않은 것은?,,접지시설을 한다.,습도를 70% 이상으로 유지한다.,공기를 이온화한다.,부도체물질을 사용한다.,4
소방시설관리사,2010,1,소방안전관리론,25,"황린, 적린이 서로 동소체라는 것을 증명하는 데 가장 효과적인 것은?",,비중을 비교한다.,착화점을 비교한다.,유기용제에 대한 용해도를 비교한다.,연소생성물을 확인한다.,4
소방시설관리사,2010,1,소방수리학·약제화학 및 소방전기,26,지름이 5cm인 소방노즐에서 물제트가 40m/s의 속도로 건물벽에 수직으로 충돌하고 있다. 벽이 받는 힘은 몇 kgf인가?,,230,250,320,280,3
소방시설관리사,2010,1,소방수리학·약제화학 및 소방전기,27,"체적 2m$^3$, 온도 20℃의 기체 1kg을 정압하에서 체적을 5m$^3$로 팽창시켰다. 가한열량은 몇 KJ인가? (단, 기체의 정압비열은 2.06KJ/Kg∙K, 기체상수는 0.4881KJ/Kg∙K으로 한다.)",,954,905,889,863,2
소방시설관리사,2010,1,소방수리학·약제화학 및 소방전기,28,어떤 액체가 0.01m$^3$의 체적을 갖는 실린더 속에서 50kPa의 압력을 받고 있다. 이때 압력이 100kPa으로 증가되었을 때 액체의 체적이 0.0099m$^3$으로 축소되었다면 이액체의 체적탄성계수 K는 몇 kPa인가?,,500,"5,000","50,000","500,000",2
소방시설관리사,2010,1,소방수리학·약제화학 및 소방전기,29,"어느 유체가 배관 내의 층류로 흐르고 있다. 지름은100mm이며, 동점성계수가 1.3×10$^{-3}$cm$^2$/s인 유체로서 층류로 흐를 수 있는 최대유량은 약 얼마인가? (단, 임계레이놀즈수는 2,100이다.)",,21.44cm$^3$/s,214.4cm$^3$/s,21.44m$^3$/s,2.144m$^3$/s,1
소방시설관리사,2010,1,소방수리학·약제화학 및 소방전기,30,"관 마찰계수가 0.022인 지름 50mm 관에 물이흐르고 있다. 이 관에 부차적 손실계수가 각각 10, 1.8인 밸브와 티(tee)가 결합되어 있을 경우 관의 상당관 길이는 몇 m인가?",,24.3,24.9,25.4,26.8,4
소방시설관리사,2010,1,소방수리학·약제화학 및 소방전기,31,"원심식 송풍기에서 회전수를 변화시킬 때 동력변화를 구하는 식으로 맞는 것은? (단, 변화 전후의 회전수를 각각 N$_1$, N$_2$ 동력을 L$_1$, L$_2$로 표시한다.)",O,$\text{L}_2 = \text{L}_1 \times (\frac{\text{N}_1}{\text{N}_2})^3$,$\text{L}_2 = \text{L}_1 \times (\frac{\text{N}_1}{\text{N}_2})^2$,$\text{L}_2 = \text{L}_1 \times (\frac{\text{N}_2}{\text{N}_1})^3$,$\text{L}_2 = \text{L}_1 \times (\frac{\text{N}_2}{\text{N}_1})^2$,3
소방시설관리사,2010,1,소방수리학·약제화학 및 소방전기,32,"질량 M, 길이 L, 시간 T로 표시할 때 운동량의 차원은?",,[MLT],[ML$^{-1}$T],[MLT$^{-2}$],[MLT$^{-1}$],4
소방시설관리사,2010,1,소방수리학·약제화학 및 소방전기,33,웨버수(Weber number)의 물리적 의미는?,,관성력/압력,관성력/점성력,관성력/표면장력,관성력/탄성력,3
소방시설관리사,2010,1,소방수리학·약제화학 및 소방전기,34,"점성계수가 0.101N∙s/m$^2$, 비중이 0.85인 기름이 내경 300mm, 길이3km의 주철관 내부를 흐르며 유량은 0.0444m$^3$/s이다. 이 관을 흐르는 동안 수두손실은 약 몇 m인가? (단, 물의 밀도는 850KG/m$^3$이다.)",,7.1,8.1,7.7,8.9,2
소방시설관리사,2010,1,소방수리학·약제화학 및 소방전기,35,"펌프의 흡입양정이 4m이고 흡입관로의 손실수두가 2m일때 NPSH는 약 몇 m인가? (단, 수면 의 표준대기압(101.3kPa) 상태이고, 이 때의 포화 수증기압은 3300Pa이다.)",,10,2,6,4,4
소방시설관리사,2010,1,소방수리학·약제화학 및 소방전기,36,"표준대기압에서 진공압이 400mmHg일 때 절대압으로 약 몇 kPa인가? (단, 표준대기압은 101.3kPa, 수은의 비중은 13.6이다.)",,53,48,154,149,2
소방시설관리사,2010,1,소방수리학·약제화학 및 소방전기,37,"배관설비에서 상류 지점인 A지점의 배관을 조사 해 보니 지름 100mm, 압력 0.45MPa, 평균 유속 1m/s 이었다. 또 하류의 B지점을 조사해 보니 지름 50mm, 압력 0.4MPa 이었다면 두 지점 사이의 손실 수두는 몇 m인가?",,4.94,5.87,8.67,10.87,1
소방시설관리사,2010,1,소방수리학·약제화학 및 소방전기,38,"수압기에서 피스톤의 지름이 각각 10mm, 50mm 이고 큰 피스톤에 1,000N의 하중을 올려 놓으면 작은 피스톤에 얼마의 힘이 작용하게 되는가?",,40N,400N,"25,000N","245,000N",1
소방시설관리사,2010,1,소방수리학·약제화학 및 소방전기,39,"물이 파이프 속을 꽉 차서 흐를 때, 정전 등의 원인으로 유속이 급격히 변하면서 물에 심한 압력 변화가 생기고 큰 소음이 발생하는 현상을 무엇이라 하는가?",,수격 작용,서어징,캐비테이션,실속,1
소방시설관리사,2010,1,소방수리학·약제화학 및 소방전기,40,"호수 수면 아래에서 지름 d인 공기방울이 수면으로 올라오면서 지름이 1.5배로 팽창하였다. 공기방울의 최초 위치는 수면에서 몇 m되는 곳인가? (단, 이 호수의 대기압은 750mmHg, 수은의 비중은 13.6 공기방울 내부의 공기는 Boyle의 법칙을 따른다고 한다.)",,34.4,24.2,12.0,43.3,2
소방시설관리사,2010,1,소방수리학·약제화학 및 소방전기,41,일정전압의 직류전원에 저항을 접속하고 전류를 흘릴때 이 전류값을 20[%]증가시키기 위해서는 저항값을 몇 배로 하여야 하는가?,,1.25배,1.20배,0.83배,0.80배,3
소방시설관리사,2010,1,소방수리학·약제화학 및 소방전기,42,그림과 같은 회로에서 전압계 ⓥ의 지시값은?,O,40[V],50[V],80[V],100[V],4
소방시설관리사,2010,1,소방수리학·약제화학 및 소방전기,43,그림과 같은 회로망에서 전류를 산출하는 식은?,O,I$_1$+I$_2$-I$_3$+I$_4$=0,I$_1$-I$_2$-I$_3$+I$_4$=0,I$_1$+I$_2$+I$_3$+I$_4$=0,I$_1$-I$_2$-I$_3$-I$_4$=0,1
소방시설관리사,2010,1,소방수리학·약제화학 및 소방전기,44,i=I$_m$siωt인 정현파에 있어서 순시값과 실효 값이 같아지는 위상은 몇 도인가?,,30°,45°,50°,60°,2
소방시설관리사,2010,1,소방수리학·약제화학 및 소방전기,45,"다음 그림과 같은 회로에서 R=16Ω, L=180mH, ω=100rad/s일 때 합성임피던스는?",O,약 3[Ω],약 5[Ω],약 24[Ω],약 34[Ω],3
소방시설관리사,2010,1,소방수리학·약제화학 및 소방전기,46,200V 전원에 접속하면 1kW의 전력을 소비하는 저항을 100V 전원에 접속하였을 때 소비전력은?,,250[W],500[W],750[W],900[W],1
소방시설관리사,2010,1,소방수리학·약제화학 및 소방전기,47,"자체 인덕턴스가 각각 160mH, 250mH인 두 코일이 있다. 두 코일 사이의 상호 인덕턴스가 150mH이라면 결합계수는?",,0.5,0.75,0.66,1.0,2
소방시설관리사,2010,1,소방수리학·약제화학 및 소방전기,48,피드백 제어에서 반드시 필요한 장치는?,,구동장치,출력장치,입력과 출력을 비교하는 장치,안정도를 좋게 하는 장치,3
소방시설관리사,2010,1,소방수리학·약제화학 및 소방전기,49,"변압기의 1차 권수가 10회, 2차 권수가 300회인 경우 2차 단자에서 1,500V의 전압을 얻고자 하는 경우 1차 단자에서 인가하여야 할 전압은?",,50[V],100[V],220[V],380[V],1
소방시설관리사,2010,1,소방수리학·약제화학 및 소방전기,50,"그림과 같이 저항 3개가 병렬로 연결된 회로에 흐르는 가지전류 I$_1$, I$_2$, I$_3$는 몇 [A]인가?",O,"I$_1$=2, I$_2$=4/3. I$_3$=2/3","I$_1$=2/3, I$_2$=1/3, I$_3$=2","I$_1$=3, I$_2$=2, I$_3$=1","I$_1$=1, I$_2$=2, I$_3$=3",1
소방시설관리사,2010,1,소방관련법령,51,특정소방대상물에서 방화관리업무를 대행할 수 있는 사람은?,,소방시설관리업을 등록한 자,소방공사 감리업을 등록한 자,소방시설 설계업을 등록한 자,소방시설 공사업을 등록한 자,1
소방시설관리사,2010,1,소방관련법령,52,"시도지사는 등록신청을 받은 소방시설업의 업종별 자본금, 기술인력 및 장비가 소방시설업의 업종별 등록 기준에 적합하다고 인정되는 경우에는 등록신청을 받은 날부터 몇 일 이내에 소방 시설업 등록증 및 소방 시설업 등록수첩을 교부하여야하는가?",,3,5,10,15,4
소방시설관리사,2010,1,소방관련법령,53,소방기술자의 소방시설 공사현자의 배치기준으로 옳은 것은?,,기계분야의 소방설비기사는 기계분야 소방시설의 부대시설에 대한 공사에 배치할 수 없다.,비상콘센트설비 및 비상방송설비의 공사는 전기분야의 소방설비기사가 담당한다.,전기분야의 소방설비기사는 기계분야 소방시설에 부설되는 자동화재탐지설비의 공사에 배치하여서는 아니 된다.,무선통신보조설비의 공사는 기계분야의 소방설비기사도 배치할 수 있다.,2
소방시설관리사,2010,1,소방관련법령,54,정당한 사유 없이 며칠 이상 소방사별 공사를 계속하지 아니한 때에는 도급계약을 해지 할 수 있는가?,,10일,20일,30일,60일,3
소방시설관리사,2010,1,소방관련법령,55,소방시설관리업의 장비기준에서 소방시설별 장비가 잘못 연결된 것은?,,소화기구 - 저울,옥내소화전설비 - 절연저항계,자동화재탐지설비 - 열감지기시험기,제연설비 - 연기감지기시험기,4
소방시설관리사,2010,1,소방관련법령,56,원활한 소방 활동을 위한 소방용수시설 및 지리조사의 실시횟수 기준으로 옳은 것은?,,월 1회 이상,3개월에 1회 이상,6개월에 1회 이상,연 1회 이상,1
소방시설관리사,2010,1,소방관련법령,57,소방시설관리사가 다른 사람에게 자격증을 빌려주었을 때 제 1차 행정처분기준은?,,자격정지 3월,자격정지 6월,자격정지 2년,자격취소,4
소방시설관리사,2010,1,소방관련법령,58,소방시설관리사 시험의 시험위원에 될 수 없는 사람은?,,소방관련학 석사학위를 가진 자,소방관련학과 조교수이상으로 2년이상 재직한 자,소방시설관리사,소방기술사,1
소방시설관리사,2010,1,소방관련법령,59,특수가연물에 해당하는 것은?,,사류,알코올류,황산,동식물 유류,1
소방시설관리사,2010,1,소방관련법령,60,방염대상물품에 해당되지 않는 것은?,,무대막,전시용 합판,병원에서 사용하는 침구류,카페트,3
소방시설관리사,2010,1,소방관련법령,61,"정당한 사유없이 관계공무원의 소방특별조사를 거부, 방해 또는 기피한 자의 벌칙은?",,200만원 이하의 벌금,200만원 이하의 과태료,200만원 이하의 과태료,300만원 이하의 벌금,4
소방시설관리사,2010,1,소방관련법령,62,"특정소방대상물의 소방시설은 정기적으로 점검을 받아야 하며, 그 결과를 누구에게 보고하여야 하는가?",,시도지사,소방방재청장,한국소방안전협회장,소방본부장 또는 소방서장,4
소방시설관리사,2010,1,소방관련법령,63,위험물을 취급하는 건축물의 조명설비의 적합기준이 아닌 것은?,,연소의 우려가 없는 장소에 설치할 것,가연성 가스 등이 체류할 우려가 있는 장소의 조명등은 방폭 등으로 할 것,전선은 내화내열전선으로 할 것,점멸스위치는 출입문 바깥부분에 설치할 것,1
소방시설관리사,2010,1,소방관련법령,64,지정수량 10배 미만의 위험물제조소의 보유공지 너비는?,,3m 이상,5m 이상,7m 이상,9m 이상,1
소방시설관리사,2010,1,소방관련법령,65,예방규정을 정하여야 할 제조소 등으로 틀린 것은?,,지정수량10배 이상의 제조소,지정수량200배 이상의 옥외 탱크 저장소,지정수량 150배 이상의 옥외저장소,지정수량 10배 이상의 일반취급소,3
소방시설관리사,2010,1,소방관련법령,66,특정소방대상물의 분류 중 숙박시설에 해당되는 것은?,,수녀원,독서실,휴양콘도미니엄,고시원,4
소방시설관리사,2010,1,소방관련법령,67,지하가 중 터널로서 길이가 2000m인 곳에 설치해야 할 소화활동설비가 아닌 것은?,,비산콘센트설비,제연설비,무선통신보조설비,연결살수설비,2
소방시설관리사,2010,1,소방관련법령,68,소방용수시설 소화기구 및 설비 등의 설치명령을 위반한 자에 대한 과태료 처분 기준으로 틀린것은?,,1차 위반시 : 30만원,2차 위반시 : 100만원,3차 위반시 : 150만원,4차 위반시 : 200만원,1
소방시설관리사,2010,1,소방관련법령,69,소방시설관리사 자격의 결격사유가 아닌 것은?,,금치산 선고를 받은 자,한정치산 선고를 받은 자,파산선고를 받은자로 복권된 자,형의 집행유예를 받고 그 기간중에 있는 자,3
소방시설관리사,2010,1,소방관련법령,70,다음 시설 중 하자 보수의 보증 기간이 틀린 것은?,,유도등,유도표지,비상조명등,스프링클러 설비,4
소방시설관리사,2010,1,소방관련법령,71,"소방기본법에 의해서 소방방재청정, 소방본부장 또는 소방서장은 구조대를 편성, 운영하여야 하는 바, 특수구조대에 속하지 않는 것은?",,화학구조대,항공구조대,수난구조대,고속국도구조대,2
소방시설관리사,2010,1,소방관련법령,72,방화관리자 또는 공동방화관리자를 선임할 때 방화관리자 선임신고서에 첨부할 서류에 해당하지 않는 것은?,,소방시설관리사 자격수첩,자체소방대장임을 증명하는 서류,소방안전관리학과를 졸업한 경우 졸업증명서,방화관리자를 겸임할 수 있는 안전관리자로 선임된 사실을 증명할 수 있는 서류,3
소방시설관리사,2010,1,소방관련법령,73,전문 소방시설설계업을 등록하고자 할 때 주된 기술인력에 대한 기준에 맞는 것은?,,기계분야 또는 전기분야 소방설비기사 자격자 1인 이상,기계분야 소방설비기사 자격자 1인 이상과 전기분야 소방설비산업기사 자격자 1인 이상,기계분야와 전기분야를 겸하여 취득한 경우에는 겸하여 취득한 소방설비기사 자격자 1 인 이상,소방기술사 1인 이상,4
소방시설관리사,2010,1,소방관련법령,74,스프링클러설비를 설치하여야 하는 특정소방대상물로서 틀린 것은?,,복합건축물 또는 교육연구시설 내에 있는 학생수용을 위한 기숙사로서 연면적 5000m$^2$이상 인 경우에는 전 층,층수가 11층 이상인 특정소방대상물의 경우에는 전 층,정신보건시설 및 숙박시설이 있는 수련시설로서 연면적 500m$^2$ 이상인 경우에는 전 층,지하가로서 연면적 1000m$^2$ 이상인 것,3
소방시설관리사,2010,1,소방관련법령,75,다음 중 소방신호가 아닌 것은?,,경계신호,피난신호,발화신호,해제신호,2
소방시설관리사,2010,1,위험물의 성상 및 시설기준,76,제3류 위험물인 칼륨의 특성으로 맞지 않는 것은?,,물보다 비중이 크다.,은백색의 광택이 있는 무른 경금속이다.,연소 시 보라색 불꽃을 내면서 연소한다.,융점이 63.5℃이고 비점은 762℃이다.,1
소방시설관리사,2010,1,위험물의 성상 및 시설기준,77,제2류 위험물(인화성 고체는 제외)의 주의사항 및 게시판의 표시내용으로 맞는 것은?,,적색 바탕에 백색 문자의 '화기주의',청색 바탕에 백색 문자의 '물기엄금',적색 바탕에 백색 문자의 '화기엄금',청색 바탕에 백색 문자의 '물기주의',1
소방시설관리사,2010,1,위험물의 성상 및 시설기준,78,황린의 위험성에 대한 설명으로 맞지 않는 것 은?,,발화점은 34℃로 낮아 매우 위험하다.,증기는 유독하며 피부에 접촉되면 화상을 입는다.,상온에 방치하면 증기를 발생시키고 산화하여 발열한다.,백색 또는 담황색의 고체로 물에 잘 녹는다.,4
소방시설관리사,2010,1,위험물의 성상 및 시설기준,79,물에 잘 녹지 않고 물보다 가벼우며 인화점이 가장 낮은 위험물은?,,아세톤,디에틸에테르,이황화탄소,산화프로필렌,2
소방시설관리사,2010,1,위험물의 성상 및 시설기준,80,칼륨(K)의 보호액으로 적당한 것은?,,등유,에탄올,아세트산,톨루엔,1
소방시설관리사,2010,1,위험물의 성상 및 시설기준,81,황린이 자연발화하기 쉬운 이유는 어느 것인가?,,비등점이 낮고 증기의 비중이 작기 때문,녹는점이 낮고 상온에서 엑체로 되어 있기 때문,산소와 결합력이 강하고 착화온도가 낮기 때문,인화점이 낮고 가연성 물질이기 때문,3
소방시설관리사,2010,1,위험물의 성상 및 시설기준,82,옥내저장소의 바닥을 물이 스며들지 못하는 구조로 해야 할 위험물이 아닌 것은?,,제2류 위험물,제3류 위험물,제6류 위험물,알칼리금속의 과산화물,3
소방시설관리사,2010,1,위험물의 성상 및 시설기준,83,대량의 제4류 위험물 화재에 있어서 물로 소화하는 것은 적절하지 못한데 그 이유는 무엇인가?,,가연성 가스를 발생한다.,연소면을 확대시킨다.,인화점이 강하다.,물이 열분해한다.,2
소방시설관리사,2010,1,위험물의 성상 및 시설기준,84,"에테르A, 아세톤B, 피리딘C, 톨루엔D라고 할 때 다음 중 인화점이 낮은 것부터 순서대로 되어 있는 것은?",,A - B - D - C,A - C - B - D,B - C - D - A,D - C - B - A,1
소방시설관리사,2010,1,위험물의 성상 및 시설기준,85,톨루엔(C$_6$H$_5$CH$_3$)의 일반적 성질에 대하여 다음 중 틀린 것은?,,증기밀도는 공기보다 가볍다.,인화점이 낮고 물에는 녹지 않는다.,휘발성이 있는 무색 투명한 액체이다.,증기는 독성이 있지만 벤젠에 비해 약한 편이다.,1
소방시설관리사,2010,1,위험물의 성상 및 시설기준,86,자체에서 산소를 함유하고 있어 공기 중의 산소를 필요로 하지 않고 자기 연소하는 것은 어느 것인가?,,카바이드,생석회,초산에스테르류,질산에스테르류,4
소방시설관리사,2010,1,위험물의 성상 및 시설기준,87,니트로셀룰로오스의 저장 및 취급상 틀린 것은?,,열을 멀리하고 찬 곳에 저장한다.,햇빛이 잘 들어오는 곳에 저장한다.,알코올로 습면하고 안정제를 가하여 저장한다.,"타격, 마찰을 하지 않는 곳에 저장한다.",2
소방시설관리사,2010,1,위험물의 성상 및 시설기준,88,과산화수소의 성질에 관한 설명이다. 옳지 않은 것은?,,"순수한 것은 점성이 있는 무색 액체이며, 다량이면 청색빛깔을 띤다.","순도가 높은 것은 불순물, 구리, 은, 백금 등의 미립자에 의하여 폭발적으로 분해한다.","에테르에 녹지 않으며, 벤젠에는 녹는다.",강력한 산화제이나 환원제로서 작용하는 경우도 있다.,3
소방시설관리사,2010,1,위험물의 성상 및 시설기준,89,지정수량의 몇 배 이상의 위험물을 취급하는 제조소에는 화재예방을 위한 예방규정을 정하여야 하는가?,,10,20,30,40,1
