"Test Name","Year","Session","Subject","Number","Question","Question_image","Option 1","Option 2","Option 3","Option 4","Answer"
"소방설비기사(기계분야)","2014","2","소방원론","1","가연성 액체에서 발생하는 증기와 공기의 혼합기체에 불꽃을 대었을 때 연소가 일어나는 최저 온도를 무엇이라고 하는가?","","발화점","인화점","연소점","착화점","2"
"소방설비기사(기계분야)","2014","2","소방원론","2","제3종 분말소화약제의 열분해 시 생성되는 물질과 관계없는 것은?","","NH$_3$","HPO$_3$","H$_2$O","CO$_2$","4"
"소방설비기사(기계분야)","2014","2","소방원론","3","Halon 1211의 성질에 관한 설명으로 틀린 것은?","","상온, 상압에서 기체이다.","전기의 전도성이 없다.","공기보다 무겁다.","짙은 갈색을 나타낸다.","4"
"소방설비기사(기계분야)","2014","2","소방원론","4","다음 중 조연성 가스에 해당하는 것은?","","일산화탄소","산소","수소","부탄","2"
"소방설비기사(기계분야)","2014","2","소방원론","5","화재에 대한 설명으로 옳지 않은 것은?","","인간이 제어하여 인류의 문화, 문명의 발달을 가져오게 한 근본적인 존재를 말한다.","불을 사용하는 사람의 부주의와 불안정한 상태에서 발생되는 것을 말한다.","불로 인하여 사람의 신체, 생명 및 재산상의 손실을 가져다주는 재앙을 말한다.","실화, 방화로 발생하는 연소현상을 말하며 사람에게 유익하지 모한 해로운 불을 말한다.","1"
"소방설비기사(기계분야)","2014","2","소방원론","6","다음 중 가연물의 제거와 가장 관련이 없는 소화방법은?","","촛불을 입김으로 불어서 끈다.","산불 화재 시 나무를 잘라 없앤다.","팽창 진주암을 사용하여 진화한다.","가스화재 시 중간밸브를 잠근다.","3"
"소방설비기사(기계분야)","2014","2","소방원론","7","위험물 탱크에 압력이 0.3MPa 이고 온도가 0℃ 인 가스가 들어 있을 때 화재로 인하여 100℃ 까지 가열되었다면 압력은 약 몇 MPa 인가? (단, 이상기체로 가정한다.)","","0.41","0.52","0.63","0.74","1"
"소방설비기사(기계분야)","2014","2","소방원론","8","소화를 하기 위한 산소농도를 알 수 있다면 CO$_2$ 소화약제 사용 시 최소 소화농도를 구하는 식은?","O","CO$_2$[%] = 21 × $\\frac{100 - O_2\\%}{100}$","CO$_2$[%] = $\\frac{21 - O_2\\%}{21}$ × 100","CO$_2$[%] = 21 × $\\frac{O_2\\%}{100} - 1$","CO$_2$[%] = $\\frac{21 × O_2\\%}{100} - 1$","2"
"소방설비기사(기계분야)","2014","2","소방원론","9","다음 중 pH 9 정도의 물을 보호액으로 하여 보호액 속에 저장하는 물질은?","","나트륨","탄화칼슘","칼륨","황린","4"
"소방설비기사(기계분야)","2014","2","소방원론","10","다음 중 인화점이 가장 낮은 물질은?","","산화프로필렌","이황화탄소","메틸알코올","등유","1"
"소방설비기사(기계분야)","2014","2","소방원론","11","가연성 가스의 화재 위험성에 대한 설명으로 옳지 않은 것은?","","연소한계가 낮을수록 위험하다.","온도가 높을수록 위험하다.","인화점이 높을수록 위험하다.","연소범위가 넓을수록 위험하다.","3"
"소방설비기사(기계분야)","2014","2","소방원론","12","화재 시 발생하는 연소가스 중 인체에서 혈액의 산소운반을 저해하고 두통, 근육조절의 장애를 일으키는 것은?","","CO$_2$","CO","HCN","H$_2$S","2"
"소방설비기사(기계분야)","2014","2","소방원론","13","소화작용을 크게 4가지로 구분할 때 이에 해당하지 않는 것은?","","질식소화","제거소화","기압소화","냉각소화","3"
"소방설비기사(기계분야)","2014","2","소방원론","14","다음 중 이산화탄소의 3중점에 가장 가까운 온도는?","","-48℃","-57℃","-62℃","-75℃","2"
"소방설비기사(기계분야)","2014","2","소방원론","15","다음 중 Flash over를 가장 옳게 표현한 것은?","","소화현상의 일종이다.","건물 외부에서 연소가스의 소멸현상이다.","실내에서 폭발적인 화재의 확대현상이다.","폭발로 인한 건물의 붕괴현상이다.","3"
"소방설비기사(기계분야)","2014","2","소방원론","16","내화건축물과 비교한 목조건축물 화재의 일반적인 특징을 옳게 나타낸 것은?","","고온, 단시간형","저온, 단시간형","고온, 장시간형","저온, 장시간형","1"
"소방설비기사(기계분야)","2014","2","소방원론","17","동식물유류에서 '요오드값이 크다' 라는 의미를 옳게 설명한 것은?","","불포화도가 높다.","불건성유이다.","자연발화성이 낮다.","산소와의 결합이 어렵다.","1"
"소방설비기사(기계분야)","2014","2","소방원론","18","다음 중 내화구조에 해당하는 것은?","","두께 1.2㎝ 이상의 석고판 위에 석면 시멘트판을 붙인 것","철근콘크리트조의 벽으로서 두께가 10㎝ 이상인 것","철망모르타르로서 그 바름 두께가 2㎝ 이상인 것","심벽에 흙으로 맞벽치기 한 것","2"
"소방설비기사(기계분야)","2014","2","소방원론","19","연기의 감광계수(m$^{-1}$)에 대한 설명으로 옳은 것은?","","0.5는 거의 앞이 보이지 않을 정도이다.","10은 화재 최성기 때의 농도이다.","0.5는 가시거리가 20~30m 정도이다.","10은 연기감지기가 작동하기 직전의 농도이다.","2"
"소방설비기사(기계분야)","2014","2","소방원론","20","열전달의 대표적인 3가지 방법에 해당하지 않는 것은?","","전도","복사","대류","대전","4"
"소방설비기사(기계분야)","2014","2","소방유체역학","21","관내에 흐르는 유체의 흐름을 구분하는 데 사용되는 레이놀즈수의 물리적인 의미는?","","관성력/중력","관성력/탄성력","관성력/점성력","관성력/압축력","3"
"소방설비기사(기계분야)","2014","2","소방유체역학","22","역카르노 냉동사이클이 1800kw의 냉동효과를 나타내며 냉동실 내부온도는 270K로 유지된다. 이 사이클이 300K인 주위에 열에너지를 방출할 경우, 냉동사이클에 요구되는 동력은 몇 kw 인가?","","200","300","500","1200","1"
"소방설비기사(기계분야)","2014","2","소방유체역학","23","절대압력을 가장 적절히 표현한 것은?","","절대압력 = 대기압력 + 게이지압력","절대압력 = 대기압력 - 게이지압력","절대압력 = 표준대기압력 + 게이지압력","절대압력 = 표준대기압력 - 게이지압력","1"
"소방설비기사(기계분야)","2014","2","소방유체역학","24","하겐-포아젤(Hagen-Poiseuille)식에 관한 설명으로 옳은 것은?","","수평 원관 속의 난류 흐름에 대한 유량을 구하는 식이다.","수평 원관 속의 층류 흐름에서 레이놀즈수와 유량과의 관계식이다.","수평 원관 속의 층류 및 난류 흐름에서 마찰손실을 구하는 식이다.","수평 원관 속의 층류 흐름에서 유량, 관경, 점성계수, 길이, 압력강하 등의 관계식이다.","4"
"소방설비기사(기계분야)","2014","2","소방유체역학","25","반지름이 같은 4분원 모양의 두 수문 AB와 CD에 작용하는 단위폭당 수직정수력의 크기의 비는?(단, 대기압은 무시하며 물속에서 A와 C의 압력은 같다.)","O","1:1","1:(1-π/4)","1:2/3","(1-π/4):1","1"
"소방설비기사(기계분야)","2014","2","소방유체역학","26","압력(P$_1$)이 100kPa, 온도(T$_1$)가 300k 인 이상기체가 'PV$^{1.4}$=일정' 인 폴리트로픽 과정을 거쳐 압력 (P$_2$)이 400kPa 까지 압축된다. 최종상태의 온도(T$_2$)는 얼마인가?","","300k","446k","535k","644k","2"
"소방설비기사(기계분야)","2014","2","소방유체역학","27","캐비테이션에 관한 설명으로 옳은 것은?","","캐비테이션은 물의 온도가 낮거나 흡입거리가 길수록 발생하기 쉽다.","원심펌프의 경우 캐비테이션 발생의 가장 큰 원인은 깃 이면의 압력강하이다.","공동현상은 펌프의 설치 위치와 관계없이 임펠러의 속도 증가로 인한 압력강하에 기인한다.","원심펌프의 공동현상을 방지하기 위해서는 펌프의 회전수를 낮추고 단흡입 펌프로 교체한다.","2"
"소방설비기사(기계분야)","2014","2","소방유체역학","28","외부표면의 온도가 24℃, 내부표면의 온도가 24.5℃ 일 때, 높이 1.5m, 폭 1.5m, 두께 0.5㎝인 유리창을 통한 열전달률은 얼마인가? (단, 유리창의 열전도율(k)은 0.8W/m·k이다.)","","180W","200W","1800W","18000W","1"
"소방설비기사(기계분야)","2014","2","소방유체역학","29","오일러의 운동방정식은 유체운동에 대하여 어떠한 관계를 표시하는가?","","유체입자의 운동경로와 힘의 관계를 나타낸다.","유선에 따라 유체의 질량이 어떻게 변화하는가를 표시한다.","유체가 가지는 에너지와 이것이 하는 일과의 관계를 표시한다.","비점성 유동에서 유선상의 한 점을 통과하는 유체입자의 가속도와 그것에 미치는 힘과의 관계를 표시한다.","4"
"소방설비기사(기계분야)","2014","2","소방유체역학","30","펌프에 의하여 유체에 실제로 주어지는 동력은? (단, L$_w$는 동력(㎾), γ는 물의 비중량(N/m$^3$), Q는 토출량(m$^3$/min), H는 전양정(m), g는 중력가속도(m/s$^2$)이다.)","O","L$_w$ = $\\frac{γQH}{102 × 60}$","L$_w$ = $\\frac{γQH}{1000 × 60}$","L$_w$ = $\\frac{γQHg}{102 × 60}$","L$_w$ = $\\frac{γQHg}{1000 × 60}$","2"
"소방설비기사(기계분야)","2014","2","소방유체역학","31","수평으로 놓인 관로에서, 입구의 관 지름이 65㎜, 유속이 2.5m/s 이며 출구의 관 지름이 40mm라고 한다. 입구에서의 압력이 350㎪ 이라면 출구에서의 압력은 약 몇 ㎪ 인가? (단, 마찰손실은 무시하고 유체의 밀도는 1000㎏/m$^3$로 한다.)","","311","321","332","341","3"
"소방설비기사(기계분야)","2014","2","소방유체역학","32","그림과 같은 면적 A$_1$인 원형관의 출구에 노즐이 볼트로 연결되어 있으면 노즐 끝의 면적은 A$_2$이고 노즐 끝(2 지점)에서 물의 속도는 v, 물의 밀도는 ρ이다. 볼트 전체에 작용하는 힘이 F$_B$일 때, 1 지점에서의 압력(게이지압력)을 구하는 식은?","O","$\\frac{F_B}{A_1} = ρV^2(1 + \\frac{A_2}{A_1})$","$\\frac{F_B}{A_1} = ρV^2(1 - \\frac{A_2}{A_1} \\cdot \\frac{A_2}{A_1})$","$\\frac{F_B}{A_1} = ρV^2(1 - \\frac{A_1}{A_2})$","$\\frac{F_B}{A_1} = ρV^2(1 - \\frac{A_2}{A_1} \\cdot \\frac{A_2}{A_1})$","2"
"소방설비기사(기계분야)","2014","2","소방유체역학","33","고가 수조의 높이는 해발 250m이고, 수조로부터 물을 공급받는 소화전은 해발 200m이다. 연결배관에 흐름이 없다고 가정하고 물의 온도가 20℃일 때 소화전에서의 정수압력은 약 몇 ㎪ 인가? (단, 물의 비중량은 20℃에서 9.8kN/m$^3$이다.)","","245","490","1960","2450","2"
"소방설비기사(기계분야)","2014","2","소방유체역학","34","체적탄성계수가 2.1475x 10$^9$㎩인 물의 체적을 0.25% 압축시키려면 몇 ㎩의 압력이 필요한가?","","4.93x 10$^5$","6.75x 10$^5$","4.23x 10$^6$","5.37x 10$^6$","4"
"소방설비기사(기계분야)","2014","2","소방유체역학","35","그림과 같은 물탱크에서 원형형상의 출구를 통해 물이 유출되고 있다. 출구의 형상을 동일한 단면적의 사각형으로 변경했을 때 유출되는 유량의 변화는? (단, 사각 및 원형 형상 출구의 손실계수는 각각 0.5 및 0.04이다.)","O","0.00044m$^3$/s 만큼 증가한다.","0.00044m$^3$/s 만큼 감소한다.","0.00088m$^3$/s 만큼 증가한다.","0.00088m$^3$/s 만큼 감소한다.","2"
"소방설비기사(기계분야)","2014","2","소방유체역학","36","축소 확대 노즐에서 노즐 안을 포화증기가 가역단열과정으로 흐른다. 유동 중 엔탈피의 감소는 462kJ/kg이고, 입구에서의 속도가 무시할 정도로 작다면 노즐 출구에서의 속도는 몇 m/s인가?","","30","49","678","961","4"
"소방설비기사(기계분야)","2014","2","소방유체역학","37","일반적인 유체에 관한 설명으로 옳지 않은 것은?","","작은 전단력에도 저항하지 못하고 쉽게 변형한다.","유체가 정지상태에 있을 때는 전단력을 받지 않는다.","일반적으로 액체의 전단력은 온도가 올라갈수록 증가한다.","유체에 작용하는 압력은 절대압력과 계기압력으로 구분할 수 있다.","3"
"소방설비기사(기계분야)","2014","2","소방유체역학","38","비중 0.92인 빙산이 비중 1.025의 바닷물 수면에 떠 있다. 수면 위에 나온 빙산의 체적이 150m$^3$이면 빙산의 전체적은 약 몇 m$^3$ 인가?","","1314","1464","1725","1875","2"
"소방설비기사(기계분야)","2014","2","소방유체역학","39","2단식 터보팬을 6000rpm으로 회전시킬 경우, 풍량은 0.5 m$^3$/min, 축동력은 0.049kW이었다. 만약, 터보팬 회전수를 8000rpm으로 바꾸어 회전시킬 경우 축동력은 약 몇 kW 인가?","","0.0207","0.207","0.116","1.161","3"
"소방설비기사(기계분야)","2014","2","소방유체역학","40","풍동에서 유속을 측정하기 위하여 피토 정압관을 사용하였다. 이때 비중이 0.8인 알코올 높이 차이가 10㎝ 가 되었다. 압력이 101.3㎪이고, 온도가 20℃일 때 풍동에서 공기의 속도는 약 몇 m/s 인가? (단, 공기의 기체상수는 287 N·m/kg·K이다.)","","26.5","28.5","29.4","36.1","4"
"소방설비기사(기계분야)","2014","2","소방관계법규","41","공동 소방안전관리자 선임대상 특정소방대상물의 기준으로서 옳은 것은?","","복합건축물로서 연면적이 1000m$^2$이상인 것 또는 층수가 10층 이상인 것","복합건축물로서 연면적이 2000m$^2$이상인 것 또는 층수가 10층 이상인 것","복합건축물로서 연면적이 3000m$^2$이상인 것 또는 층수가 5층 이상인 것","복합건축물로서 연면적이 5000m$^2$이상인 것 또는 층수가 5층 이상인 것","4"
"소방설비기사(기계분야)","2014","2","소방관계법규","42","다음 중 화재원인조사의 종류가 아닌 것은?","","발화원인조사","재산피해조사","연소상황조사","피난상황조사","2"
"소방설비기사(기계분야)","2014","2","소방관계법규","43","소방본부장이나 소방서장이 소방시설공사가 공사감리 결과보고서대로 완공되었는지 완공검사를 위한 현장 확인할 수 있는 대통령령으로 정하는 특정소방대상물이 아닌 것은?","","노유자시설","문화집회 및 운동시설","1000m$^2$ 미만의 공동주택","지하상가","3"
"소방설비기사(기계분야)","2014","2","소방관계법규","44","위험물 제조소에는 보기 쉬운 곳에 '위험물 제조소' 라는 표시를 한 표지를 기준에 따라 설치하여야 하는데 다음 중 표지의 기준으로 적합한 것은?","","표지의 한 변의 길이는 0.3m이상, 다른 한 변의 길이는 0.6m이상인 직사각형으로 하며, 표지의 바탕은 백색으로 문자는 흑색으로 한다.","표지의 한 변의 길이는 0.2m이상, 다른 한 변의 길이는 0.4m이상인 직사각형으로 하며, 표지의 바탕은 백색으로 문자는 흑색으로 한다.","표지의 한 변의 길이는 0.2m이상, 다른 한 변의 길이는 0.4m이상인 직사각형으로 하며, 표지의 바탕은 흑색으로 문자는 백색으로 한다.","표지의 한 변의 길이는 0.3m이상, 다른 한 변의 길이는 0.6m이상인 직사각형으로 하며, 표지의 바탕은 흑색으로 문자는 백색으로 한다.","1"
"소방설비기사(기계분야)","2014","2","소방관계법규","45","소방시설의 하자가 발생한 경우 소방시설공사업자는 관계인으로부터 그 사실을 통보 받은 날로부터 며칠 이내에 이를 보수하거나 보수일정을 기록한 하자보수계획을 관계인에게 알려야 하는가?","","3일 이내","5일 이내","7일 이내","14일 이내","1"
"소방설비기사(기계분야)","2014","2","소방관계법규","46","소방시설관리업의 기술인력으로 등록된 소방기술자는 실무교육을 몇 년마다 1회 이상 받아야 하며, 실무교육기관의 장은 교육일정 몇 일전까지 교육대상자에게 알려야하는가?","","2년, 7일전","3년, 7일전","2년, 10일전","3년, 10일전","3"
"소방설비기사(기계분야)","2014","2","소방관계법규","47","승강기 등 기계장치에 의한 주차시설로서 자동차 몇 대 이상 주차할 수 있는 시설을 할 경우, 소방본부장 또는 소방서장의 건축허가 등의 동의를 받아야 하는가?","","10대","20대","30대","50대","2"
"소방설비기사(기계분야)","2014","2","소방관계법규","48","제품검사에 합격하지 않은 제품에 합격표시를 하거나 합격표시를 위조 또는 변조하여 사용한 사람에 대한 벌칙은?(관련 규정 개정전 문제로 여기서는 기존 정답인 1번을 누르면 정답 처리됩니다. 자세한 내용은 해설을 참고하세요.)","","300만원 이하의 벌금","500만원 이하의 벌금","1000만원 이하의 벌금","15000만원 이하의 벌금","1"
"소방설비기사(기계분야)","2014","2","소방관계법규","49","위험물시설의 설치 및 변경에 있어서 허가를 받지 아니하고 제조소 등을 설치하거나 그 위치, 구조 또는 설비를 변경할 수 없는 경우는?","","주택의 난방시설(공동주택의 중앙난방시설은 제외)을 위한 저장소 또는 취급소","농예용으로 필요한 난방시설 또는 건조시설을 위한 20배 이하의 저장소","공업용으로 필요한 난방시설 또는 건조시설을 위한 20배 이하의 저장소","수산용으로 필요한 난방시설 또는 건조시설을 위한 20배 이하의 저장소","3"
"소방설비기사(기계분야)","2014","2","소방관계법규","50","옥외탱크저장소에 설치하는 방유제의 설치기준으로 옳지 않은 것은?","","방유제 내의 면적은 60000 m$^2$이하로 할 것","방유제의 높이는 0.5m이상 3m이하로 할 것","방유제의 내의 옥외저장탱크의 수는 10이하로 할 것","방유제는 철근콘크리트 또는 흙으로 만들 것","1"
"소방설비기사(기계분야)","2014","2","소방관계법규","51","소방특별조사의 세부 항목에 대한 사항으로 옳지 않은 것은?","","소방대상물 및 관계지역에 대한 강제처분·피난명령에 관한 사항","소방안전관리 업무 수행에 관한 사항","자체점검 및 정기적 점검 등에 관한 사항","소방계획서의 이행에 관한 사항","1"
"소방설비기사(기계분야)","2014","2","소방관계법규","52","건축허가 등의 동의 대상물로서 건축허가 등의 동의를 요구하는 때 동의교구서에 첨부하여야 하는 서류로서 옳지 않은 것은?","","건축허가신청서 및 건축허가서","소방시설설계업 등록증과 자본금 내역서","소방시설 설치계획표","소방시설(기계·전기분야)의 층별 평면도 및 층별 계통도","2"
"소방설비기사(기계분야)","2014","2","소방관계법규","53","주유취급소의 고정주유설비의 주위에는 주유를 받으려는 자동차 등이 출입할 수 있도록 너비와 길이는 몇 m 이상의 콘크리트 등으로 포장한 공지를 보유하여야 하는가?","","너비 10m이상, 길이 5m이상","너비 10m이상, 길이 10m이상","너비 15m이상, 길이 6m이상","너비 20m이상, 길이 8m이상","3"
"소방설비기사(기계분야)","2014","2","소방관계법규","54","소방대상물의 관계인에 해당하지 않는 사람은?","","소방대상물의 소유자","소방대상물의 점유자","소방대상물의 관리자","소방대상물을 검사 중인 소방공무원","4"
"소방설비기사(기계분야)","2014","2","소방관계법규","55","자동화재속보설비를 설치하여야 하는 특정소방대상물은?","","연면적 800m$^2$인 아파트","연면적 800m$^2$인 기숙사","바닥면적이 1000m$^2$인 층이 있는 발전시설","바닥면적이 500m$^2$인 층이 있는 노유자시설","4"
"소방설비기사(기계분야)","2014","2","소방관계법규","56","지정수량의 몇 배 이상의 위험물을 취급하는 제조소에는 피뢰침을 설치하여야 하는가? (단, 제6류 위험물을 취급하는 위험물제조소는 제외)","","5배","10배","50배","100배","2"
"소방설비기사(기계분야)","2014","2","소방관계법규","57","위험물을 취급하는 건축물에 설치하는 채광 및 조명설비 설치의 원칙적인 기준으로 적합하지 않는 것은?","","모든 조명등은 방폭등으로 할 것","전선은 내화.내열전선으로 할 것","점멸스위치는 출입구 바깥 부분에 설치할 것","채광설비는 불연재료로 할 것","1"
"소방설비기사(기계분야)","2014","2","소방관계법규","58","특수가연물의 저장 및 취급 기준으로 옳지 않은 것은?","","품명별로 구분하여 쌓을 것","쌓는 높이는 10m 이하로 할 것","쌓는 부분의 바닥면적은 300m$^2$ 이하가 되도록 할 것","쌓는 부분의 바닥면적 사이는 1m 이상이 되도록 할 것","3"
"소방설비기사(기계분야)","2014","2","소방관계법규","59","1급 소방안전관리대상물의 공공기관 소방안전관리자에 대한 강습교육의 과목과 시간으로 옳지 않는 것은? (문제 오류로 실제 시험에서는 모두 정답처리 되었습니다. 여기서는 1번을 누르면 정답 처리 됩니다.)","","방염성능기준 및 방염대상물품 - 1시간","소방관계법령 - 4시간","구조 및 응급처치교육 - 4시간","소방실무 - 21시간","1"
"소방설비기사(기계분야)","2014","2","소방관계법규","60","각 시·도의 소방업무에 필요한 경비의 일부를 국가가 보조하는 대상이 아닌 것은?","","전산설비","소방헬리콥터","소방관서용 청사 건축","소방용수시설장비","4"
"소방설비기사(기계분야)","2014","2","소방기계시설의 구조 및 원리","61","옥내소화전이 1층에 4개, 2층에 4개, 3층에 2개가 설치된 소방대상물이 있다. 옥내소화전 설비를 위해 필요한 최소 수원의 양은?(2021년 04월 01일 개정된 기준 적용됨)","","2.6m$^3$","5.2m$^3$","10.4m$^3$","13m$^3$","2"
"소방설비기사(기계분야)","2014","2","소방기계시설의 구조 및 원리","62","옥내 소화전 함의 재질을 합성수지 재료로 할 경우 두께는 몇 mm 이상이어야 하는가?","","1.5","2","3","4","4"
"소방설비기사(기계분야)","2014","2","소방기계시설의 구조 및 원리","63","물분무소화설비의 자동식 기동장치 내용으로 적합하지 않는 것은?","","자동화재탐지설비의 감지기 작동 시 연동하여 경보를 발한다.","폐쇄형 스프링클러헤드의 개방과 연동하여 경보를 발한다.","가압송수장치의 기동과 연동하여 경보를 발한다.","가압송수장치 및 자동개방밸브를 기동할 수 있어야한다.","3"
"소방설비기사(기계분야)","2014","2","소방기계시설의 구조 및 원리","64","구조대의 돛천을 구조대의 가로방향으로 봉합하는 경우 아래 그림과 같이 돛천을 겹치도록 하는 것이 좋다고 하는데 그 이유에 대해서 가장 적합한 것은?","O","둘레 길이가 밑으로 갈수록 작아지는 것을 방하기 위하여","사용자가 강하 시 봉합부분에 걸리지 않게 하기 위하여","봉합부가 몹시 굳어지는 것을 방자하기 위하여","봉합부의 인장강도를 증가시키기 위하여","2"
"소방설비기사(기계분야)","2014","2","소방기계시설의 구조 및 원리","65","분말소화설비에서 분말소화약제 압송 중에 개방되지 않는 밸브는?","","크리닝밸브","가스도입밸브","주 개방 밸브","선택밸브","1"
"소방설비기사(기계분야)","2014","2","소방기계시설의 구조 및 원리","66","다음 중 스프링클러 설비의 소화수 공급계통의 자동경보장치와 직접 관계가 있는 장치는 어느 것인가?","","수압개폐장치","유수검지장치","물올림장치","일제개방밸브장치","2"
"소방설비기사(기계분야)","2014","2","소방기계시설의 구조 및 원리","67","다음 중 수동식소화기의 사용방법으로 맞는 것은?","","소화기는 한사람이 쉽게 사용할 수 있어야 하며 조작시 인체에 부상을 유발하지 아니하는 구조이어야 한다.","바람이 불 때는 바람이 불어오는 방향으로 방사하여야 한다.","불길의 윗 부분에 약제를 방출하고 가까이에서 전방으로 향하여 방사한다.","개방되어 있는 실내에서는 질식의 우려가 있으므로 사용하지 않는다.","1"
"소방설비기사(기계분야)","2014","2","소방기계시설의 구조 및 원리","68","다음 중 간이 스프링클러 설비를 상수도설비에서 직접 연결하여 배관 및 밸브 등을 설치할 경우 설치하지 않는 것은?","","체크밸브","압력조절밸브","개폐표시형 개폐밸브","수도용 계량기","2"
