Test Name,Year,Session,Subject,Number,Question,Question_image,Option 1,Option 2,Option 3,Option 4,Answer
화재감식평가기사,2020,"1,2",화재조사론,1,다음 중 A급 화재에서만 발생할 수 있는 위험현상으로 옳은 것은?,,보일 오버(boil over),슬롭 오버(slop over),플레임 오버(flame over),프로스 오버(froth over),3
화재감식평가기사,2020,"1,2",화재조사론,2,"가솔린의 연소범위(vol%)가 1.4~7.6일 때 위험도로 옳은 것은? (단, 소수 둘째자리에서 반올림할 것)",,0.8,1.2,4.4,6.4,3
화재감식평가기사,2020,"1,2",화재조사론,3,화재현장의 관찰 방법으로 틀린 것은?,,소실 붕괴된 부분에서는 복원적인 관점에서 관찰한다.,발화원인이 될 수 있는 가연물에 유의하여 조사한다.,건물 구조재 수용품 등의 소실 상황을 통하여 연소의 방향을 고려한다.,소손 및 탄화 정도가 강한 부분에서 약한 부분으로 이동하며 관찰한다.,4
화재감식평가기사,2020,"1,2",화재조사론,4,다음 중 화재현장 출입금지구역의 범위를 확대하여야 할 이유로 옳지 않은 것은?,,진화 후에 행방불명자를 확인한 경우,구조물 등이 광범위하게 소손되어 바닥에 연소 낙하물이나 퇴적물이 많이 쌓인 경우,건물 전체가 소손된 상황으로 연소 진행방향이 확인되지 않을 때,발화지점 부근의 목격상황에 대한 진술이 제각기 달라 발화지점이 불명확할 때,1
화재감식평가기사,2020,"1,2",화재조사론,5,소방기본법령상 화재조사전담부서에서 갖추어야 할 발굴 장비로 옳지 않은 것은?,,전동그라인더,슈미트해머,다용도 칼,빗자루,2
화재감식평가기사,2020,"1,2",화재조사론,6,다음 중 가연성 물질에 해당하는 것은?,,아르곤,산화알루미늄,일산화탄소,헬륨,3
화재감식평가기사,2020,"1,2",화재조사론,7,화재조사 및 보고규정상 건물의 동수 산정방법에 관한 설명 중 옳은 것은?,,목조 또는 내화조 건물이 격벽으로 방화구획되어 있는 경우 2개의 동으로 본다.,구조에 관계없이 지붕 및 실이 하나로 연결되어 있는 것은 2개의 동으로 본다.,"건물의 외벽을 이용하여 실을 만들어 헛간, 작업실 및 사무실 등의 용도로 사용하고 있는 것은 주건물과 1동으로 본다.","독립된 건물과 건물 사이에 차광막, 비막이 등의 덮개를 설치하고 그 밑을 통로 등으로 사용하는 경우는 동일동으로 본다.",3
화재감식평가기사,2020,"1,2",화재조사론,8,다음 중 폭발 위력의 지표로 사용될 수 있는 자료로 옳지 않은 것은?,,파편의 비행거리,무너진 벽의 종류와 구조,폭발 시점,폭심부의 크기 및 깊이,3
화재감식평가기사,2020,"1,2",화재조사론,9,이산화탄소 소화약제의 주된 소화효과로 옳은 것은?,,냉각효과,질식효과,부촉매효과,억제효과,2
화재감식평가기사,2020,"1,2",화재조사론,10,다음 중 화재현장에서 확보해야하는 화재현장의 관계자의 특징으로 가장 거리가 먼 것은?,,화상을 입었거나 의류가 타버린 자,의류가 물에 젖어 있거나 오손되어 있는 자,현장부근에 말쑥한 정장차림의 구경하고 있는 자,가재도구를 집어 들고 있거나 물건을 반출하고 있는 자,3
화재감식평가기사,2020,"1,2",화재조사론,11,다음 중 발굴이 끝난 후의 화재 전 상황으로 복원하는 요령으로 옳지 않은 것은?,,"형체가 소실되어 배치가 불가능한 것은 대용품을 사용하되, 대용품이라는 것이 인식되도록 한다.",관계인을 입회시켜 복원상황을 확인시킨다.,잔존물이 파손되지 않도록 잦은 위치이동은 하지 않는다.,불명확한 것은 예측을 통하여 복원한다.,4
화재감식평가기사,2020,"1,2",화재조사론,12,"소방기본법령상 '화재조사전담부서의 설치, 운영 등'의 조항에 명시된 내용으로 옳지 않은 것은?",,화재조사자의 포상,화재조사자의 자격,화재조사전담부서장의 업무,화재조사에 필요한 장비 및 시설,1
화재감식평가기사,2020,"1,2",화재조사론,13,다음 중 화재플럼(Fire Plume)에 의해 수직벽면에 생성되는 패턴으로 옳지 않은 것은?,,V 패턴,모래시계 패턴,도넛형태 패턴,U 패턴,3
화재감식평가기사,2020,"1,2",화재조사론,14,다음의 건물 구획실 화재에 대한 설명 중 옳은 것은?,,일반적으로 최성기의 구획실 화재 온도는 500~600℃까지 도달한다.,연기의 이동은 소화작용에서 발생하는 부력에 의존한다.,환기지배형 화재에서는 CO와 연기의 발생량이 많아진다.,대부분의 구획실과 건물은 최성기에서 연료지배형이 된다.,3
화재감식평가기사,2020,"1,2",화재조사론,15,화재 시 발생하는 박리 현상(spalling)의 원인에 대한 설명으로 옳은 것은?,,콘크리트에 포함된 수분의 증발 및 팽창,철근 또는 철망 및 주변 콘크리트 간의 불균일한 수축,콘크리트 혼합물과 골재 간의 균일한 팽창,화재에 노출된 표면과 슬래브 내장재 간의 균일한 팽창,1
화재감식평가기사,2020,"1,2",화재조사론,16,다음의 구획실 화재 성장단계에 대한 설명 중 옳은 것은?,,초기→플래시오버→쇠퇴기→최성기→자유연소 순으로 진행된다.,자유연소단계는 환기지배형 연소이며 복사열에 의해 확산된다.,플래시오버 현상은 최성기 전에 주로 발생한다.,"최성기는 연료지배형 연소단계이며, 접염방식으로 확산된다.",3
화재감식평가기사,2020,"1,2",화재조사론,17,다음 중 환기지배형 화재에 대한 설명으로 옳은 것은?,,대부분 화재 초기에 발생한다.,연료공급에 좌우된다.,환기량이 크다.,불완전연소에 가깝다.,4
화재감식평가기사,2020,"1,2",화재조사론,18,목재 균열흔의 종류로 옳지 않은 것은?,,고소흔,열소흔,완소흔,감소흔,1
화재감식평가기사,2020,"1,2",화재조사론,19,전도 열전달 형태와 관계되는 법칙으로 적합한 것은?,,퓨리에(Fourier)의 법칙,플랭크(Planck)의 법칙,뉴튼(Newton)의 법칙,피크(Fick)의 법칙,1
화재감식평가기사,2020,"1,2",화재조사론,20,다음 중 화재조사자가 유의해야 할 사항으로 옳은 것은?,,관계자 또는 목격자의 진술에 근거하여 주관적 방법으로 접근한다.,정확한 화재조사를 위해서는 개인의 권리를 침해할 수도 있다.,조사결과에 대한 보안 유지와 언론보도에 신중해야 한다.,타 조사기관 상호간에는 비밀을 유지하여야 한다.,3
화재감식평가기사,2020,"1,2",화재감식론,21,가스사고 형태별 분류에 해당하지 않는 것은?,,폭발,질식,중독,재질 불량,4
화재감식평가기사,2020,"1,2",화재감식론,22,발화요인 분류 중 화학적 요인에 해당되지 않는 것은?,,역화,혼촉발화,자연발화,금수성 물질이 물과 접촉,1
화재감식평가기사,2020,"1,2",화재감식론,23,전선의 소선 일부가 끊어져 발생하는 국부적인 저항치 증가 현상으로 나타나는 전기화재 현상에 해당하는 것은?,,트래킹,아산화동,반단선,그래파이트,3
화재감식평가기사,2020,"1,2",화재감식론,24,방화에 사용되는 촉진제로 거리가 먼 것은?,,아세톤,시너,톨루엔,수산화나트륨,4
화재감식평가기사,2020,"1,2",화재감식론,25,플라스틱의 일반적인 연소특성으로 틀린 것은?,,폴리염화비닐은 연소되면 염화수소 가스가 발생한다.,"열가소성 플라스틱에는 아미노수지, 페놀수지, 에폭시수지 등이 있다.",플라스틱은 일반적으로 저분자 물질과 달리 온도에 따른 상변화가 명확하지 않다.,열경화성 플라스틱은 화염에 노출되면 표면이 고체 숯과 같이 되는 경향 때문에 내부로의 연소확대가 지연된다.,2
화재감식평가기사,2020,"1,2",화재감식론,26,상대습도별 산불발생위험도에 대한 설명으로 틀린 것은?,,상대습도가 60% 이상이면 산불이 매우 발생하기 쉽다.,상대습도가 40~50%면 산불이 발생하기 쉽고 연소 진행이 빠르다.,상대습도가 50~60%면 산불이 발생할 수 있으나 연소 진행이 느리다.,상대습도가 40% 이하면 산불 발생 시 진화가 곤란할 정도로 연소 진행이 빠르다.,1
화재감식평가기사,2020,"1,2",화재감식론,27,유연탄의 자연발화 위험성에 대한 설명으로 틀린 것은?,,주변온도가 높을수록 산화반응이 촉진된다.,괴상은 분말상보다 자연발화를 일으키기 쉽다.,채탄 직후의 석탄은 자연발화의 위험이 크다.,자연발화는 저탄장 등에 대량으로 쌓아둔 곳에서 일어나기 쉽다.,2
화재감식평가기사,2020,"1,2",화재감식론,28,"나무, 천, 종이 및 가구와 같은 가연성 물질의 화재 분류(class)는?",,Class A,Class B,Class C,Class D,1
화재감식평가기사,2020,"1,2",화재감식론,29,물질의 상태에 대한 설명으로 옳은 것은?,,물의 증발잠열은 80cal/g이다.,분자는 액체 상태일 때 가장 자유롭게 운동할 수 있다.,온도 변화없이 상태 변화를 위해 필요한 열을 잠열이라 한다.,액체상태에서 열을 흡수하여 에너지가 증가하면 고체상태가 된다.,3
화재감식평가기사,2020,"1,2",화재감식론,30,항공기의 열전대 화재경고장치(thermocouple fire warning system) 중 배선시스템의 구성요소가 아닌 것은?,,감지 회로(detector circuit),알람 회로(alarm circuit),단락 회로(short circuit),시험 회로(test circuit),3
화재감식평가기사,2020,"1,2",화재감식론,31,차량 충전장치와 시동장치에 대한 설명으로 틀린 것은?,,"충전장치는 교류발전기(alternator), 레귤레이터(regulator)로 구성되며, 시동장치에는 스타터가 있다.","정류기 내에 있는 다이오드가 과전류 등으로 인해 그 기능을 잃은 경우, 다이오드가 소실되는 경우가 있다.",챠콜 캐니스터의 보디(body)는 금속재가 많은 점에서 2차적으로 착화하여도 연소되지 않으므로 관찰이 용이하다.,"배터리 단자는 납 또는 납 합금으로 되어있어 화재열로 용이하게 녹아버리므로, 화재감식 시 배터리배선 터미널부의 용융 등도 확인한다.",3
화재감식평가기사,2020,"1,2",화재감식론,32,임황(林況)과 산불과의 관계에 대한 설명으로 옳은 것은?,,활엽수는 침엽수보다 산불위험성이 높다.,동령림은 이령림보다 산불위험성이 높다.,혼효림은 단순림보다 산불위험성이 높다.,수종별로 비교하면 음수는 양수보다 산불위험성이 높다.,2
화재감식평가기사,2020,"1,2",화재감식론,33,다음 표의 가스들을 위험도가 높은 물질부터 순서대로 나열한 것은?\n\n| 종류 | 폭발하한선[vol%] | 폭발상한선[vol%] |\n|---|---|---|\n| 수소 | 4.0 | 75.0 |\n| 산화에틸렌 | 3.0 | 80.0 |\n| 이황화탄소 | 1.25 | 44.0 |\n| 아세틸렌 | 2.5 | 81.0 |,,아세틸렌 > 산화에틸렌 > 이황화탄소 > 수소,아세틸렌 > 산화에틸렌 > 수소 > 이황화탄소,이황화탄소 > 아세틸렌 > 수소 > 산화에틸렌,이황화탄소 > 아세틸렌 > 산화에틸렌 > 수소,4
화재감식평가기사,2020,"1,2",화재감식론,34,유류성분 감정기구인 가스크로마토그래피 분석의 장점으로 틀린 것은?,,물질이 유사한 여러 성분의 혼합계 분리에 매우 유효하다.,현장조사 시 휴대 및 가스 포집이 간편하며 성분판별이 가능하다.,가스 상태로 분석하기 때문에 조작도 간단하고 시간도 빠르다.,각 성분을 검출하여 그 양을 전기적인 신호로 기록계에 저장하고 도형적으로 기록함으로써 분석결과가 객관적이다.,2
화재감식평가기사,2020,"1,2",화재감식론,35,미소화원과 유염화원의 특징으로 옳은 것은?,,유염화원이 무염화원보다 에너지량(열량)이 적다.,유염화원은 무염화원보다 연소 확대에 필요한 시간이 짧다.,유염화원은 가연물과 접촉 시 바로 착화할 가능성이 무염화원보다 적다.,무염화원의 연소흔적은 깊이 탄 것은 보이지 않으며 연소범위가 넓은 경향을 보인다.,2
화재감식평가기사,2020,"1,2",화재감식론,36,방화의 주요 동기가 아닌 것은?,,실수,복수심,경제적 이익,범죄은폐,1
화재감식평가기사,2020,"1,2",화재감식론,37,다음 중 담뱃불 접촉에 의한 물질의 착화 가능성이 가장 낮은 것은?,,톱밥류,마른 건초류,구겨진 신문지류,가솔린 증기,4
화재감식평가기사,2020,"1,2",화재감식론,38,그림과 같은 3상 부하회로에 있어서 부하전류가 20A일 때 부하의 선간전압 $V_{LL}$은 얼마인가?,O,100,$100\sqrt{2}$,$100\sqrt{3}$,200,3
화재감식평가기사,2020,"1,2",화재감식론,39,차량 배터리의 내부에서 화원이 될 가능성이 있는 원인에 속하지 않는 것은?,,외부 단자의 이완,과충전에 의한 과열,과충전에 의한 용단스파크불꽃,배터리 전해액 부족에 의한 내부 쇼트,1
화재감식평가기사,2020,"1,2",화재감식론,40,방화행위의 입증요소로 틀린 것은?,,방화재료의 입수 경위가 밝혀져야 한다.,방화를 한 장소 및 소훼물이 있어야 한다.,방화의 수단과 방법이 실현가능하여야 한다.,방화의 수단이 가능한지 추상적으로 검토되어야 한다.,4
화재감식평가기사,2020,"1,2",증거물관리 및 법과학,41,관계자에게 질문할 경우 유의해야 하는 사항으로 틀린 것은?,,질문자는 자기신분을 밝힌다.,피질문자에 대한 선입견을 배제한다.,"관계자에는 초기소화자, 피난자, 출동한 소방관도 포함된다.",실체적 진실을 밝히기 위해서는 어느 정도의 유도질문이나 상대방의 감정을 도발하는 질문기법도 필요하다.,4
화재감식평가기사,2020,"1,2",증거물관리 및 법과학,42,비디오카메라에 대한 설명으로 틀린 것은?,,"목격자, 소유자 거주인, 혐의자와의 면담에서 사용할 수 있다.",비디오카메라의 장점은 보는 각도를 점차 이동하며 화재현장을 나타내는 것이다.,주밍-인(zooming-in)이나 과장확대기법을 적극적으로 사용한다.,가장 큰 장점으로 점진적으로 시각의 움직임에 의해 화재현장을 보여주는 능력이 있다.,3
화재감식평가기사,2020,"1,2",증거물관리 및 법과학,43,연소범위에 영향을 미치는 요인에 대한 설명으로 틀린 것은?,,온도가 높아질수록 연소범위는 좁아진다.,고온·고압의 경우 연소범위는 더욱 넓어진다.,압력이 높아지면 하한값은 크게 변하지 않으나 상한값은 높아진다.,혼합기를 이루는 공기의 산소농도가 높을수록 연소범위는 넓어진다.,1
화재감식평가기사,2020,"1,2",증거물관리 및 법과학,44,가스크로마토그래피(GC) 분석을 위한 용매추출법 중 잔류물을 추출하기 위한 용액으로 틀린 것은?,,크실렌,η-펜탄,이황화탄소,η-헥산,1
화재감식평가기사,2020,"1,2",증거물관리 및 법과학,45,화재사 또는 흡연과 관련된 CO-Hb의 농도에 관한 설명으로 맞는 것은?,,일반적으로 비흡연자의 CO-Hb 농도는 0.01%이다.,40% 이상의 CO-Hb 농도는 CO자체만으로 사망할 수 있는 수치이다.,일반적으로 하루 두갑 이상 흡연하는 사람의 CO-Hb 농도는 3~8%이다.,"40%이하의 CO-Hb 농도는 산소 부족, 심정지 또는 열화상으로 사망할 수 있다.",2
화재감식평가기사,2020,"1,2",증거물관리 및 법과학,46,냉온수기 자동온도 조절장치에서 절연체의 오염에 의한 트래킹 화재가 발생한 경우 수거하여야 할 증거물로 맞는 것은?,,응축기,시즈히터,압축기,서모스탯,4
화재감식평가기사,2020,"1,2",증거물관리 및 법과학,47,화재현장 사진촬영에 대한 설명으로 틀린 것은?,,현장사진은 자료 확보를 위하여 충분하게 촬영한다.,연소 및 탄화된 형태를 조사자 시각에서 객관화하여 촬영한다.,발화건물 내부 촬영 시 소실된 부분을 국부적으로 촬영한다.,"불필요한 피사체(인물 등) 촬영 금지, 접사 촬영 시 배경막 설치 후 촬영한다.",3
화재감식평가기사,2020,"1,2",증거물관리 및 법과학,48,화재증거물 사진의 촬영 및 유의사항에 관한 설명으로 틀린 것은?,,화재증거물은 오물을 제거하고 나서 찍는다.,접사로 촬영하는 경우 셔터스피드를 이용해 피사계 심도를 조절한다.,접사 촬영이 필요할 경우 매크로렌즈(접사용) 및 링스트로보 등을 활용한다.,피사계 심도는 어느 정해진 시간 동안에 초점이 맞는 가장 멀리 있는 사물과 가장 가까이 있는 사물의 거리이다.,2
화재감식평가기사,2020,"1,2",증거물관리 및 법과학,49,물리적 증거물의 감정 및 시험에 대한 설명으로 틀린 것은?,,"발화 지점, 화재 특정 원인, 화재 확산에 기여한 요인 판별",물리적 증거물의 화학 조성을 확인하기 위한 감정 및 시험,물리적 증거물의 작동이나 오작동 또는 고장을 판단하기 위하여 설계가 충분한지 여부를 판별,실험실이나 다른 시험기관이 수행할 수 있는 특정 실험방법 및 제한사항에 관계없이 공정성을 위해 화재조사관 단독으로 감정 및 시험 실시,4
화재감식평가기사,2020,"1,2",증거물관리 및 법과학,50,화상의 위험도에 큰 영향을 미치는 인자는?,,심도(沈度),온도(溫度),질병(疾病),범위(範圍),4
화재감식평가기사,2020,"1,2",증거물관리 및 법과학,51,화재 증거물의 수송으로 권장할 만한 가장 적절한 방법은?,,직접운반,제3자 전달,우편배송,화물로의 배송,1
화재감식평가기사,2020,"1,2",증거물관리 및 법과학,52,전기기기 또는 구성품에 대한 증거물 수집 방법으로 틀린 것은?,,전기적 증거물이 발견된 상태를 가능한 한 그대로 보존해야 한다.,제품 내 전기적 특이점이 발견된다면 해당 부분만 수거하는 것이 효과적이다.,일부 남은 전선 피복을 검사 할 수 있도록 가능한 전선을 길게 수집해야 한다.,전기기기를 전체적으로 제거하는 것이 불가능한 경우 제자리에 안전하게 놓는 것이 좋다.,2
화재감식평가기사,2020,"1,2",증거물관리 및 법과학,53,화재증거물수집관리규칙에 포함되는 내용이 아닌 것은?,,증거물의 포장,증거물 감정 절차,증거물의 상황기록,초상권 및 개인정보 보호,2
화재감식평가기사,2020,"1,2",증거물관리 및 법과학,54,화재증거물수집관리규칙상 현장사진 및 비디오 촬영 시 유의사항에 대한 설명으로 틀린 것은?,,최초 도착하였을 때의 원상태를 그대로 촬영하고 진압 순서에 따라 촬영,현장사진 및 비디오 촬영할 때에는 연소확대 경로 및 증거물 기록에 대한 번호표와 화살표를 표시 후에 촬영,"증거물을 촬영할 때에는 그 소재와 상태가 명백히 나타나도록 하며, 필요에 따라 구분이 용이하게 번호표 등을 넣어 촬영","화재현장의 특정한 증거물 등을 촬영함에 있어서는 그 길이, 폭 등을 명백히 하기 위하여 측정용 자 또는 대조 도구를 사용하여 촬영",1
화재감식평가기사,2020,"1,2",증거물관리 및 법과학,55,열에 의한 재성형이 불가능한 합성 고분자 화합물의 종류로 맞는 것은?,,테프론,폴리에틸렌,멜라민수지,폴리아크릴로니트릴,3
화재감식평가기사,2020,"1,2",증거물관리 및 법과학,56,화재현장에서 수집된 증거물의 오염에 관한 설명으로 맞는 것은?,,물리적 증거물 대부분의 오염은 운반하는 과정에서 발생한다.,증거물 보관용기는 오염지역에서 떨어진 곳에 보관하여야 한다.,증거물의 오염방지를 위하여 화재조사관의 맨손으로 직접 수집하는 것이 원칙이다.,"증거물 용기는 개봉상태로 유지하며, 실험실에서 조사를 마친 후 봉인되어야 한다.",2
화재감식평가기사,2020,"1,2",증거물관리 및 법과학,57,증거물 수집용기 중 유리병의 장점이 아닌 것은?,,휘발성 액체의 증발을 방지한다.,내부의 증거물 확인이 용이하다.,장기 저장 시 증거물의 악화를 줄여 준다.,크기가 다양하여 많은 양을 저장할 수 있다.,4
화재감식평가기사,2020,"1,2",증거물관리 및 법과학,58,일반적인 방화 현장에서 나타나는 패턴이 아닌 것은?,,U형 패턴,독립연소 패턴,포어(pour) 패턴,트레일러(trailer) 패턴,1
화재감식평가기사,2020,"1,2",증거물관리 및 법과학,59,화재현장의 증거물 시료 채취 시 유의사항으로 아닌 것은?,,가급적 증거물 전체를 수집 또는 채취,동일한 물질이 있었을 때는 채취하지 않고 내용만 기술,"감정의뢰서에 증거물을 수집, 채취한 경과와 사건개요를 기술","채취된 증거물의 물질이 상이할 때에는 서로 섞이지 않도록 분리하여 채취, 보관",2
화재감식평가기사,2020,"1,2",증거물관리 및 법과학,60,화재 당시 살아있었음을 나타내는 생활반응으로 맞는 것은?,,시반이 없다.,머리가 그을렸다.,기도에 매연이 부착되었다.,피부가 진피까지 탄화되었다.,3
화재감식평가기사,2020,"1,2",화재조사보고 및 피해평가,61,"다음은 주택화재 현장에 출동한 화재조사관이 조사한 내용이다. 해당 화재조사관이 국가화재정보시스템 유형별 조사서 중 시설용도 항목에 입력한 사항으로 맞는 것은?\n\n1개 동의 주택으로 쓰이는 바닥면적의 합계가 680m$^2$, 건물 층수는 4층이며, 주택 내 여러 세대가 복도식으로 주거생활을 할 수 있는 구조로 되어 있다. 또한 주방 가스레인지 및 싱크대 등이 소형되었다.",,시설용도: 주거시설-단독주택-다세대주택,시설용도: 주거시설-공동주택-연립주택,시설용도: 주거시설-기타주택-다세대주택,시설용도: 주거시설-도시형주택-연립주택,2
화재감식평가기사,2020,"1,2",화재조사보고 및 피해평가,62,건물의 일부를 개수 또는 보수한 경우에 있어서의 경과연수의 산정 기준 적용에 관한 설명으로 틀린 것은?,,재설치비의 50%미만 개·보수한 경우 : 최초 설치연도 기준,재설치비의 50%이상 개·보수한 경우 : 최초 설치연도 기준,재설치비의 80%이상 개·보수한 경우 : 개·보수한 때를 기준으로 하여 경과연수를 산정,재설치비의 50~80% 미만을 각각 개·보수한 경우 : 최초 설치연도를 기준으로 한 경과연수와 개·보수한 때를 기준으로 한 경과연수를 합산하고 평균하여 경과연수를 산정,2
화재감식평가기사,2020,"1,2",화재조사보고 및 피해평가,63,"재고자산의 상품 중 견본품, 전시품, 진열품에 대한 화재피해액 산정 시 우선 적용사항으로 맞는 것은?",,시장거래가격으로 산정한다.,구입가의 50%로 일괄 산정한다.,구입가의 50~80%를 피해액으로 한다.,구입가에 감가수정한 가격으로 산정한다.,3
화재감식평가기사,2020,"1,2",화재조사보고 및 피해평가,64,화재조사 및 보고규정 상 화재건수를 결정할 때 1건의 화재 결정으로 틀린 것은?,,"동일 대상물에서 발화점이 2개소이며, 누전점이 동일한 화재",동일 대상물에서 발화점이 3개소로서 낙뢰에 의한 다발화재,동일 대상물에서 발화점이 4개소로서 지진에 의한 다발화재,각기 다른 사람에 의한 방화나 불장난으로 동일 대상물에서 발화한 화재,4
화재감식평가기사,2020,"1,2",화재조사보고 및 피해평가,65,재고자산의 화재 피해액 산정에 관한 사항으로 맞는 것은?,,판매 및 일반관리비의 미실현 이익 내지 미실현 비용을 포함한다.,재고자산 중 반제품은 구입 후 사용하지 않고 보관중인 소모품을 의미한다.,재고자산은 구입비용 자체가 피해액이 되므로 감가공제는 하지 않는다.,재고자산의 구입비에는 운반비 등 구입경비와 판매비용은 포함하지 않는다.,3
화재감식평가기사,2020,"1,2",화재조사보고 및 피해평가,66,화재발생종합보고서 작성 시 질문기록서 작성을 생략할 수 있는 대상으로 맞는 것은?,,선박 화재,자동차 화재,건축·구조물 화재,전봇대 화재,4
화재감식평가기사,2020,"1,2",화재조사보고 및 피해평가,67,화재조사 및 보고규정 상 화재피해액 산정기준으로 틀린 것은?,,차량은 전부손해의 경우 시중매매가격으로 한다.,임야의 입목은 전부손해의 경우 감정가격으로 한다.,미술공예품은 전부손해의 경우 감정가격으로 한다.,기타피해 물품은 피해당시의 현재가를 재구입비로 하여 피해액을 산정한다.,2
