"Test Name","Year","Session","Subject","Number","Question","Question_image","Option 1","Option 2","Option 3","Option 4","Answer"
"화재감식평가기사","2018","4","화재조사보고 및 피해평가","72","화재조사 및 보고규정에 따른 민원인이 제출한 화재사후 조사의뢰서의 내용에 따라 사후 조사를 실시한 후 작성을 생략할 수 있는 서류는?","","화재현황 조사서","화재피해 조사서","화재현장 조사서","화재현장 출동보고서","4"
"화재감식평가기사","2018","4","화재조사보고 및 피해평가","73","특수한 경우의 피해액 산정 우선 적용사항 기준 중 틀린 것은?","","중고구입기계장치 및 집기비품의 제작년도를 알 수 없는 경우 신품가액의 30~50%를 재구입비로 하여 피해액을 산정한다.","중고기계장치 및 중고집기비품의 시장거래가격이 신품가격보다 높을 경우 신품가액을 재구입비로 하여 피해액을 산정한다.","공구 및 기구, 집기비품, 가재도구를 일괄하여 피해액을 산정할 경우 재구입비의 50%를 피해액으로 한다.","재고자산의 상품 중 견본품, 전시품, 진열품에 대해서는 구입가의 30~50%를 피해액으로 한다.","4"
"화재감식평가기사","2018","4","화재조사보고 및 피해평가","74","소방·방화시설 활용조사서 소화시설의 기재사항이 아닌 것은?","","소화기구","옥외소화전","연결송수관설비","물분무등소화설비","3"
"화재감식평가기사","2018","4","화재조사보고 및 피해평가","75","화재유형별 조사서(건축·구조물 화재)의 특정소방대상물의 분류항목이 아닌 것은?","","지하구","초고층시설","근린생활시설","문화집회 및 운동시설","2"
"화재감식평가기사","2018","4","화재조사보고 및 피해평가","76","재고자산의 화재피해액 산정 시 회계장부에 현재가액이 확인된 경우의 산정기준으로 옳은 것은?","","회계장부상 현재가액×손해율","재고자산의 출고가액×손해율","재고자산의 회전율×손해율","연간매출액÷손해율","1"
"화재감식평가기사","2018","4","화재조사보고 및 피해평가","77","화재발생종합보고서 작성 시 질문기록서의 작성을 생략할 수 있는 화재는?","","건축·구조물 화재","임야 화재","자동차 화재","선박 화재","2"
"화재감식평가기사","2018","4","화재조사보고 및 피해평가","78","영업시설의 화재로 인한 소손 정도에 따른 손해율이 40%인 경우는?","","영업시설의 일부를 교체 또는 수리하거나 도장 내지 도배가 필요한 경우","손상정도가 다소 심하여 상당부분 교체 내지 수리가 필요한 경우","불에 타거나 변형되고 그을음과 수침 정도가 심한 경우","부분적인 소손 및 오염의 경우","1"
"화재감식평가기사","2018","4","화재조사보고 및 피해평가","79","신축 후 20년 된 블록조 슬래브지붕의 주택에 화재가 발생하여 450m$^2$가 소실된 경우의 화재피해액은? (단, 내용연수 50년, 신축단가 450천원, 손해율 70%이다.)","","96390천원","85050천원","56700천원","93200천원","1"
"화재감식평가기사","2018","4","화재조사보고 및 피해평가","80","잔존물 제거비의 계산 방법으로 옳은 것은?","","산정대상 피해액×10%","산정대상 피해액×20%","화재 재구입비×10%","화재 재구입비×20%","1"
"화재감식평가기사","2018","4","화재조사관계법규","81","화재로 인한 재해보상과 보험가입에 관한 법률에 따른 특수건물의 소유자가 특약부화재보험에 가입하지 아니한 경우 최대 몇 만원 이하의 벌금에 처하는가?","","500","300","150","100","1"
"화재감식평가기사","2018","4","화재조사관계법규","82","불을 놓아 사람이 주거로 사용하거나 사람이 현존하는 건조물, 기차, 전차, 자동차, 선박, 항공기 또는 광갱을 소훼한 자에 대한 죄명은?","","현주건조물 등에의 방화죄","현조건조물 등에의 방화죄","일반건조물 등에의 방화죄","공용건조물 등에의 방화죄","1"
"화재감식평가기사","2018","4","화재조사관계법규","83","소방기본법에 따른 화재조사를 하기 위하여 소방서장의 보고 또는 자료 제출 명령을 위반하여 보고 또는 자료 제출을 하지 아니한 관계인에 대한 벌칙 기준으로 옳은 것은?","","20만원 이하의 과태료","200만원 이하의 과태료","300만원 이하의 벌금","5년 이하의 징역 또는 5000만원 이하의 벌금","2"
"화재감식평가기사","2018","4","화재조사관계법규","84","소방기본법령에 따른 소방본부(거점소방서 포함) 화재조사전담부서에 갖추어야 할 장비 및 시설 기준 중 다음 ( ) 안에 알맞은 것은?\n\n구분 기자재명 및 시설규모\n화재조사분석실 화재조사분석실 구성장비를 유효하게 보존 사용할 수 있는 ( )m$^2$ 이상의 실","","20","30","40","50","2"
"화재감식평가기사","2018","4","화재조사관계법규","85","형법에 따른 공용건조물 등에의 방화 기준 중 다음 ( ) 안에 알맞은 것은?\n\n불을 놓아 공용 또는 공익에 공하는 건조물, 기차, 전차, 자동차, 선박, 항공기 또는 광갱을 소훼한 자는 ( )에 처한다.","","무기 또는 3년 이상의 징역","2년 이상의 유기징역","5년 이하의 징역","1년 이상의 10년 이하의 징역","1"
"화재감식평가기사","2018","4","화재조사관계법규","86","화재조사 및 보고규정에 따른 건물의 화재 피해액 산정기준으로 옳은 것은?","","표준단가(m$^2$당) × 소실면적 × [1-0.9 × 경과년수/내용년수] × 손해율","표준단가(m$^2$당) × 소실면적 × [1-0.8 × 경과년수/내용년수] × 손해율","신축단가(m$^2$당) × 소실면적 × [1-0.9 × 경과년수/내용년수] × 손해율","신축단가(m$^2$당) × 소실면적 × [1-0.8 × 경과년수/내용년수] × 손해율","4"
"화재감식평가기사","2018","4","화재조사관계법규","87","화재조사 및 보고규정에 따른 용어의 정리 중 다음 ( ) 안에 알맞은 것은?\n\n- ( ⓐ )이란 피해물의 경제적 내용연수가 다한 경우 잔존하는 가치의 재구입비에 대한 비율을 말한다.\n- ( ⓑ )이란 화재와 관계되는 물건, 성분, 성질 등 이와 관련된 모든 현상에 대하여 그 결과를 보고하는 것을 말한다.","","ⓐ 잔가율, ⓑ 감식","ⓐ 잔가율, ⓑ 감정","ⓐ 최종잔가율, ⓑ 감식","ⓐ 최종잔가율, ⓑ 감정","4"
"화재감식평가기사","2018","4","화재조사관계법규","88","소방기본법에 따른 화재의 원인 및 피해조사 기준 중 다음 ( )안에 알맞은 것은?\n\n- ( ⓐ ), 소방본부장 또는 소방서장은 화재의 원인 및 피해 등에 대한 조사를 하여야 한다.\n- 화재조사의 방법 및 전담조사반의 운영과 화재조사 자격 등 화재조사에 필요한 사항은 ( ⓑ )으로 정한다.","","ⓐ 소방청장, ⓑ 행정안전부령","ⓐ 시·도지사, ⓑ 행정안전부령","ⓐ 소방청장, ⓑ 대통령령","ⓐ 시·도지사, ⓑ 대통령령","1"
"화재감식평가기사","2018","4","화재조사관계법규","89","화재로 인한 재해보상과 보험가입에 관한 법령에 따른 특수건물의 기준 중 다음 ( ) 안에 알맞은 것은?\n\n- 의료법에 따른 병원급 의료기관으로 사용하는 건물로서 연면적의 합계가 ( ⓐ )m$^2$ 이상인 건물\n- 호텔업관련법에 따른 특목장업으로 사용하는 부분의 바닥면적의 합계가 ( ⓑ )m$^2$ 이상인 건물","","ⓐ 1000, ⓑ 3000","ⓐ 2000, ⓑ 2000","ⓐ 2000, ⓑ 3000","ⓐ 3000, ⓑ 2000","4"
"화재감식평가기사","2018","4","화재조사관계법규","90","화재로 인한 재해보상과 보험가입에 관한 법률에 따른 한국화재보험협회가 보험계약을 체결할 때 또는 보험계약을 갱신할 때마다 해당 특수건물의 화재예방 및 소화시설의 안전점검을 대통령령으로 정하는 바에 따라 일정 기간 하지 않을 수 있는 대상기준 중 틀린 것은?","","산업안전보건법에 따라 공정안전보고서를 작성하는 건물로서 총리령으로 정하는 위험도가 낮은 특수건물","고압가스 안전관리법에 따라 안전성향상계획을 작성하는 건물로서 총리령으로 정하는 위험도가 낮은 특수건물","화재예방, 소방설치·유지 및 안전관리에 관한 법률에 따라 소방정밀점검을 받은 건물로서 총리령으로 정하는 위험도가 낮은 특수건물","안전점검 결과 총리령으로 정하는 화재위험도지수가 낮은 특수건물","3"
"화재감식평가기사","2018","4","화재조사관계법규","91","소방기본법령에 따른 용접 또는 용단 작업장에서 불꽃을 사용하는 용접·용단기구 사용에 있어서 지켜야 하는 사항 중 다음 ( ) 안에 알맞은 것은? (단, 산업안전보건법에 따른 안전조치의 적용을 받는 사업장의 경우는 제외한다.)\n\n- 용접 또는 용단 작업장 주변 반경 ( ⓐ )m 이내에는 가연물을 쌓아두거나 놓아두지 말 것. 다만, 가연물의 제거가 곤란하여 방지포 등으로 방호조치를 한 경우는 제외한다.","","ⓐ 10, ⓑ 5","ⓐ 5, ⓑ 10","ⓐ 7, ⓑ 5","ⓐ 5, ⓑ 7","1"
"화재감식평가기사","2018","4","화재조사관계법규","92","형법에 따른 화재에 있어서 진화용의 시설 또는 물건을 은닉 또는 손괴하거나 기타 방법으로 진화를 방해한 자는 최대 몇 년 이하의 징역에 처하는가?","","3","5","7","10","4"
"화재감식평가기사","2018","4","화재조사관계법규","93","소방기본법령에 따른 화재원인조사의 종류가 아닌 것은?","","연소상황 조사","발화원인 조사","인명피해 조사","소방시설 등 조사","3"
"화재감식평가기사","2018","4","화재조사관계법규","94","화재로 인한 재해보상과 보험가입에 관한 법률에 따른 특약부화재보험의 보험금액 기준 중 틀린 것은?","","화재보험 : 특수건물의 시가에 해당하는 금액","손해배상책임을 담보하는 보험에 해당하는 부분 중 사망의 경우 : 피해자 1명마다 1억원 이상으로서 대통령령으로 정하는 금액","손해배상책임을 담보하는 보험에 해당하는 부분 중 부상의 경우 : 피해자 1명마다 사망자에 대한 보험금액의 범위에서 대통령령으로 정하는 금액","화재보험 시가의 결정에 관한 기준은 총리령으로 정함","2"
"화재감식평가기사","2018","4","화재조사관계법규","95","화재조사 및 보고규정에 따른 화재범위가 2 이상의 관할구역에 걸친 화재의 경우의 화재 건수의 결정기준으로 옳은 것은?","","선착대가 소속된 소방서에서 1건의 화재로 한다.","2개 소방서에서 각각 1건의 화재로 한다.","발화 소방대상물의 소재지를 관할하는 소방서에서 1건의 화재로 한다.","화재피해범위가 가장 넓은 소방서에서 1건의 화재로 한다.","3"
"화재감식평가기사","2018","4","화재조사관계법규","96","화재에 대한 손해배상 책임이 없는 경우로 옳은 것은?","","화재로 타인의 생명을 해한 자","고의로 인한 화재로 타인의 재산에 손해를 가한 자","과실로 인한 화재로 타인의 재산에 손해를 가한 자","화재로 재산에 손해를 가한 미성년자가 그 행위에 대한 책임을 변식할 능력이 없는 자","4"
"화재감식평가기사","2018","4","화재조사관계법규","97","화재조사 및 보고규정에 따른 조사본부장의 책임이 아닌 것은?","","조사요원 등의 지휘감독과 화재조사 집행","현장보존, 정보관리 및 관계기관에서의 협조","조사기록 서류 등의 분석 및 관리","조사본부 운영 및 총괄에 관한 사항처리","3"
"화재감식평가기사","2018","4","화재조사관계법규","98","민법에 따른 불법행위 및 배상책임에 관한 기준 중 틀린 것은?","","고의 또는 과실로 인한 위법행위로 타인에게 손해를 가한 자는 그 손해를 배상할 책임이 있다.","배상의무자는 그 손해가 고의 또는 중대한 과실에 의한 것이고, 그 배상으로 인하여 배상자의 생계에 중대한 영향을 미치게 될 경우에는 법원에 그 배상액의 경감을 청구할 수 있다.","불법행위로 인한 손해배상의 청구권은 피해자나 그 법정대리인이 그 손해 및 가해자를 안 날로부터 3년간 이를 행사하지 아니하면 시효로 인하여 소멸한다.","도급인은 수급인이 그 일에 관하여 제삼자에게 가한 손해를 배상할 책임이 없다. 그러나 도급 또는 지시에 관하여 도급인에게 중대한 과실이 있는 때에는 그러하지 아니하다.","2"
"화재감식평가기사","2018","4","화재조사관계법규","99","화재조사 및 보고규정에 따른 건물의 동수 산정 기준 중 틀린 것은?","","주요구조부가 하나로 연결되어 있는 것은 1동으로 한다. 다만, 건널 복도 등으로 2이상의 동에 연결되어 있는 것은 그 부분을 절반으로 분리하여 각 동으로 본다.","건물의 외벽을 이용하여 실을 만들어 작업실 용도로 사용하고 있는 것은 주건물과 다른 동으로 본다.","구조에 관계없이 지붕 및 실이 하나로 연결되어 있는 것은 같은 동으로 본다.","목조 건물의 경우 격벽으로 방화구획이 되어 있는 경우 같은 동으로 한다.","2"
"화재감식평가기사","2018","4","화재조사관계법규","100","제조물책임법에 따른 손해배상의 청구권은 피해자 또는 그 법정대리인이 손해, 손해배상 책임을 지는 자를 모두 알게 된 날부터 몇 년간 행사하지 아니하면 시효의 완성으로 소멸하는가?","","3","5","7","10","1"