Test Name,Year,Session,Subject,Number,Question,Question_image,Option 1,Option 2,Option 3,Option 4,Answer
소방시설관리사,2020,1,소방시설의 구조원리,114,옥외 소화전설비의 화재안전기준상 소화전함 설치기준으로 옳지 않은 것은?,,옥외소화전이 10개 이하 설치된 때에는 옥외소화전마다 5m 이내의 장소에 1개 이상의 소화전함을 설치하여야 한다.,옥외소화전이 11개 이상 30개 설치된 때에는 11개 이상의 소화전함을 각각 분산하여 설치하여야 한다.,옥외소화전이 31개 이상 설치된 때에는 옥외소화전 2개마다 1개 이상의 소화전함을 설치하여야 한다.,가압송수장치의 조작부 또는 그 부근에는 가압송수장치의 기동을 명시하는 적색등을 설치하여야 한다.,3
소방시설관리사,2020,1,소방시설의 구조원리,115,물분무소화설비의 화재안전기준상 수원의 저수량 기준으로 옳은 것은?,,컨베이어 벨트 등은 벨트부분의 바닥면적 1m$^2$에 대하여 8L/min로 20분간 방수할 수 있는 양 이상으로 할 것,차고 또는 주차장은 그 바닥면적 1m$^2$에 대하여 10L/min로 20분간 방수 할 수 있는 양 이상으로 할 것,절연유 봉입 변압기는 바닥부분을 제외한 표면적을 합한 면적 1m$^2$에 대하여 8L/min로 20분간 방수 할 수 있는 양 이상으로 할 것,"케이블트레이, 케이블덕트 등은 투영된 바닥면적 1m$^2$에 대하여 12L/min로 20분간 방수 할 수 있는 양 이상으로 할 것",4
소방시설관리사,2020,1,소방시설의 구조원리,116,"지상 11층의 내화구조 건물에서 특별피난계단용 부속실의 급기 가압용 송풍기의 동력(kW)은 약 얼마인가요?\n\n• 풍 누설량 : 2.1m/s\n• 풍 보충량 : 0.75m/s\n• 송풍기 모터효율 : 50%\n• 송풍기 압력 : 1,000Pa\n• 전달계수 : 1.1\n• 송풍기 풍량의 여유율 : 15%",,1.68,7.21,16.8,72.1,2
소방시설관리사,2020,1,소방시설의 구조원리,117,할로겐화합물 및 불활성기체소화설비의 화재안전기준상 용어의 정의로 옳지 않은 것은?,,"'할로겐화합물 및 불활성기체소화약제'란 할로겐화합물(할론 1301, 할론 2402, 할론 1211 제외) 및 불활성기체로서 전기적으로 전도성이며 휘발성이 있거나 증발 후 잔여 물을 남기지 않는 소화약제를 말한다.","'할로겐화합물 및 불활성기체소화약제'란 불소, 염소, 브롬 또는 요오드 중 하나 이상의 원소를 포함하고 있는 유기화합물을 기본성분으로 하는 소화약재를 말한다.","'불활성기체소화약제'란 헬륨, 네온, 아르곤 또는 질소가스 중 하나 이상의 원소를 기본 성분으로 하는 소화약제를 말한다",'충전밀도'란 용기의 단위용적당 소화약제의 중량의 비율을 말한다.,1
소방시설관리사,2020,1,소방시설의 구조원리,118,이산화탄소 소화설비 화재안전기준상 호스릴이산화탄소 소화설비 설치 기준으로 옳지 않은 것은?,,방호대상물의 각 부분으로부터 하나의 호스접결구까지의 수평거리가 15m 이하가 되도록 할 것,노즐은 20℃에서 하나의 노즐마다 50kg/min 이상의 소화약제를 방사할 수 있는 것으로 할 것,소화약제 저장용기는 호스릴을 설치하는 장소마다 설치 할 것,화재시 현저하게 연기가 찰 우려가 없는 장소로서 지상 1층 및 피난층에 있는 부분으로서 지상에서 수동 또는 원격조작에 따라 개방할 수 있는 개구부의 유효면적의 합계가 바닥면적의 15% 이상이 되는 부분에 설치 할 수 있다.,2
소방시설관리사,2020,1,소방시설의 구조원리,119,"피난기구의 화재안전기준이다. ( )에 들어갈 피난기구로 옳은 것은?\n\n피난기구를 설치하는 개구부는 서로 동일 것. 다만, ( ㄱ )·( ㄴ )·( ㄷ )·미끄럼대에 설치되는 피난기구(다수인 피난장비는 제외한다.)가 피난 상 지장이 없는 것에 있어서는 그러지 아니하다.",,"ㄱ: 구조대, ㄴ: 피난교, ㄷ: 피난용트랩","ㄱ: 구조대, ㄴ: 피난교, ㄷ: 간이완강기","ㄱ: 피난교, ㄴ: 피난용트랩, ㄷ: 피난사다리","ㄱ: 피난교, ㄴ: 피난용트랩, ㄷ: 간이완강기",4
소방시설관리사,2020,1,소방시설의 구조원리,120,연결송수관설비의 화재안전기준상 송수구가 부설된 옥내소화전을 설치한 특정소방대상물 중 방수구를 설치하지 않아도 되는 층은?,,지하층의 층수가 2 이하인 숙박시설의 지하층,지하층의 층수가 2 이하인 창고시설의 지하층,지하층의 층수가 2 이하인 관람장의 지하층,지하층의 층수가 2 이하인 공장의 지하층,1
소방시설관리사,2020,1,소방시설의 구조원리,121,소방시설의 내진설계 기준상 수평배관 흔들림 방지 버팀대 설치기준으로 옳은 것은?,,횡방향 흔들림 방지 버팀대의 설계하중은 설치된 위치의 좌우 5m를 포함한 15m내의 배관에 작용하는 횡방향수평지진하중으로 산정한다.,"횡방향 흔들림 방지 버팀대는 대관구경에 관계없이 모든 주배관, 교차배관에 설치하여야 한다.",마지막 버팀대와 배관 단부 사이의 거리는 2m를 초과하지 않아야 한다.,버팀대의 간격은 중심선 기준으로 최대간격이 15m를 초과하지 않아야 한다.,2
소방시설관리사,2020,1,소방시설의 구조원리,122,특별피난계단의 계단실 및 부속실 제연설비의 화재안전기준상 수직풍도에 따른 배출기준으로 옳지 않은 것은?,,배출댐퍼는 두께 1.5mm 이상의 강판 또는 이와 동등 이상의 성능이 있는 것으로 설치하여야 하며 비 내식성 재료의 경우에는 부식방지 조치를 할 것,수직풍도의 내부면은 두께 0.5mm 이상의 아연도금강판 또는 동등이상의 내식성·내열성이 있는 것으로 마감되는 접합부에 대하여는 통기성이 없도록 조치할 것,화재층의 옥내의 설치된 화재감지기의 동작에 따라 전층의 댐퍼가 개방될 것,열기류에 노출되는 송풍기 및 그 부품들은 250℃의 온도에서 1시간 이상 가동상태를 유지할 것,3
소방시설관리사,2020,1,소방시설의 구조원리,123,"특별피난계단의 계단실 및 부속실 제연설비의 화재안전기준상 제연구역으로부터 공기가 누설하는 출입문의 틈새면적을 산출하는 기준이다. ( )에 들어갈 값으로 옳은 것은?\n\nA = (L / $\ell$) × Ad\nA : 출입문의 틈새(m$^2$)\nL : 출입문 틈새의 길이(m)\n$\ell$ : 피연부문이 설치되어 있는 경우에는 5.6, 쌍여닫이문이 설치되어 있는 경우에는 9.2, 숨겨기의 출입문이 설치되어 있는 경우에는 8.0으로 할 것\nAd : 피연부문으로 제연구역의 설비 측으로 열리도록 설치하는 경우에는 ( ㄱ ), 비상개구의 설치로 열리도록 설치하는 경우에는 ( ㄴ ), 쌍여닫이문의 경우에는 ( ㄷ ), 숨겨기의 출입문에 대하여는 0.06으로 할 것",,"ㄱ: 0.01, ㄴ: 0.02, ㄷ: 0.03","ㄱ: 0.02, ㄴ: 0.03, ㄷ: 0.04","ㄱ: 0.03, ㄴ: 0.04, ㄷ: 0.05","ㄱ: 0.04, ㄴ: 0.05, ㄷ: 0.06",1
소방시설관리사,2020,1,소방시설의 구조원리,124,"바닥면적이 가로 30m, 세로 20m인 아래의 특정소방대상물에서 소화기구의 능력 단위를 산정한 값으로 옳은 것은? (단, 건축물의 주요 구조부는 내화구조가 아님)\n\nㄱ. 소방시설\nㄴ. 장래식장\nㄷ. 위락시설\nㄹ. 교육연구시설",,"ㄱ: 6, ㄴ: 12, ㄷ: 20, ㄹ: 3","ㄱ: 12, ㄴ: 6, ㄷ: 12, ㄹ: 6","ㄱ: 6, ㄴ: 6, ㄷ: 12, ㄹ: 3","ㄱ: 12, ㄴ: 12, ㄷ: 20, ㄹ: 6",1
소방시설관리사,2020,1,소방시설의 구조원리,125,"내화건축물의 소화용수설비 최소 유효저수량(m$^3$)은? (단, 소수점이하의 수는 1로 본다.)\n\n• 지상 8층\n• 각 층의 바닥면적은 각각 5,000m$^2$\n• 내지면적은 25,000m$^2$",,60,80,100,120,2
