"Test Name","Year","Session","Subject","Number","Question","Question_image","Option 1","Option 2","Option 3","Option 4","Answer"
"위험물산업기사","2007","2","일반화학","1","C$_3$H$_3$O$_2$인 실험식을 가지는 물질의 분자량이 142일 때 분자식에 해당하는 것은?","","C$_6$H$_6$O$_4$","C$_9$H$_9$O$_6$","C$_{12}$H$_{12}$O$_8$","C$_{15}$H$_{15}$O$_{10}$","1"
"위험물산업기사","2007","2","일반화학","2","고체 유기물질을 정제하는 과정에서 이 물질이 순수한 상태인지를 알아보기 위한 조사 방법으로 다음 중 가장 적합한 방법은 무엇인가?","","육안 관찰","녹는점 측정","광학현미경 분석","전도도 측정","2"
"위험물산업기사","2007","2","일반화학","3","어떤 원자의 K, L, M 전자껍질에 전자가 완전히 채워진다면 이 원자가 가지는 전자의 총 수는 몇 개 인가?","","10","18","28","32","3"
"위험물산업기사","2007","2","일반화학","4","0.05[몰/L]의 H$_2$SO$_4$ 수용액의 pH는 얼마인가?","","1","2","3","4","1"
"위험물산업기사","2007","2","일반화학","5","상온에서 1L의 순수한 물이 전리 되었을 때 [H$^+$]과 [OH$^-$]는 각각 얼마나 존재하는가? (단, [H$^+$]과 [OH$^-$] 순이다.)","","1.008×10$^{-7}$g, 17.008×10$^{-7}$g","1000 ×1/18g, 1000 × 17/18g","18.016×10$^{-7}$g, 18.016×10$^{-7}$g","1.008×10$^{-14}$g, 17.008×10$^{-14}$g","1"
"위험물산업기사","2007","2","일반화학","6","일반적으로 환원제가 될 수 있는 물질이 아닌 것은?","","수소를 내기 쉬운 물질","전자를 잃기 쉬운 물질","산소와 화합하기 쉬운 물질","발생기의 산소를 내는 물질","4"
"위험물산업기사","2007","2","일반화학","7","벤젠에 수소 원자 한개는 -CH$_3$기로, 또 다른 수소원자 한개는 -OH기로 치환되었다면 이성질체 수는 몇 개 인가?","","1","2","3","4","3"
"위험물산업기사","2007","2","일반화학","8","다음 중 바닥상태의 칼슘의 제일 끝 전자가 수용될 수 있는 오비탈 (에너지 준위가 가장 높은 오비탈)은?","","3S","3P","3D","4S","4"
"위험물산업기사","2007","2","일반화학","9","다음 금속의 쌍으로 전기 화학 전지를 만들 때 외부 전류가 화살표 방향으로 흐르게 되는 것은?","","ZN --> AG","FE --> AG","CU --> FE","ZN --> CU","3"
"위험물산업기사","2007","2","일반화학","10","Na$_2$CO$_3$×10H$_2$O 을 전조한 공기 중에 놓아두면 일부분의 결정수를 잃어 Na$_2$CO$_3$×H$_2$O의 조성으로 된다. 이와 같은 현상을 무엇이라 하는가?","","산화","풍해","용융","삼투","2"
"위험물산업기사","2007","2","일반화학","11","탄소, 수소, 산소로 되어있는 유기화합물 15g이 있다. 이것을 완전 연소시켜 CO$_2$ 22g, H$_2$O 9g를 얻었다. 처음 물질 중 산소는 몇 g 있었는가?","","4g","6g","8g","10g","3"
"위험물산업기사","2007","2","일반화학","12","CO$_2$ 44g 을 만들려면 C$_3$H$_8$분자가 약 몇 개 완전 연소해야 하는가?","","2.01×10$^{23}$","2.01×10$^{22}$","6.02×10$^{23}$","6.02×10$^{22}$","1"
"위험물산업기사","2007","2","일반화학","13","요소 6g 을 물에 녹여 1000L 로 만든 용액의 27°C 에서의 삼투압은 약 몇 atm인가?","","1.26×10$^{-1}$","1.26×10$^{-2}$","2.46×10$^{-3}$","2.56×10$^{-4}$","3"
"위험물산업기사","2007","2","일반화학","14","어떤 기체의 확산 속도는 SO$_2$의 2배 이다. 이 기체의 분자량은 얼마인가?","","8","16","32","64","2"
"위험물산업기사","2007","2","일반화학","15","A물질을 물에 용해시켰더니 온도가 내려갔다. 이사실로서 A물질의 용해과정에서 알 수 있는 것은?","","발열과정 이므로 온도를 높이면 용해도가 증가한다.","발열과정 이므로 온도를 높이면 용해도가 감소한다.","흡열과정 이므로 온도를 높이면 용해도가 증가한다.","흡열과정 이므로 온도를 높이면 용해도가 감소한다.","3"
"위험물산업기사","2007","2","일반화학","16","95Wt%황산의 비중은 1.84이다. 이 황산의 몰 농도는 약 얼마인가?","","4.5","8.9","17.8","35.6","3"
"위험물산업기사","2007","2","일반화학","17","유기화합물을 질량 분석한 결과 C 84%, H 16% 의 결과를 얻었다. 다음 중 이 물질에 해당하는 실험식은?","","C$_5$H","C$_2$H$_2$","C$_7$H$_8$","C$_7$H$_{16}$","4"
"위험물산업기사","2007","2","일반화학","18","아레니우스의 이론에 의한 산.염기 정의에 따르면 다음 반응에서 산에 해당하는 물질은?\n\n$CO_3^{-2} + H_2O \rightarrow HCO_3^- + OH^-$","O","H$_2$O와 HCO$_3^-$","H$_2$O와 CO$_3^{-2}$","CO$_3^{-2}$와 HCO$_3^-$","CO$_3^{-2}$와 OH$^-$","1"
"위험물산업기사","2007","2","일반화학","19","다음 중 에탄올과 구조이성질체의 관계에 있는 것은?","","CH$_3$OCH$_3$","CH$_3$COOH","CH$_3$CHO","CH$_3$OH","1"
"위험물산업기사","2007","2","일반화학","20","질산칼륨의 물에 대한 용해도는 40°C 와 10°C에서 각각 60과 20이다. 40°C 에서 포화용액 800g을 만들어 10°C까지 냉각하면 몇 g의 질산칼륨이 석출하겠는가?","","100","200","300","400","2"
"위험물산업기사","2007","2","화재예방과 소화방법","21","화학포 소화약제의 반응식에서 황산알루미늄과 탄산수소나트륨의 이론상 몰비는 얼마인가? (단, 몰비는 황산 알루미늄 : 탄산수소나트륨이다.)","","1:2","1:6","2:1","6:1","2"
"위험물산업기사","2007","2","화재예방과 소화방법","22","화재를 잘 일으킬 수 있는 경우에 대한 설명 중 틀린 것은?","","산소와 친화력이 클수록 연소가 잘 된다.","온도가 상승하면 보통 연소가 잘 된다.","열전도율이 좋을수록 연소가 잘된다.","공기와의 접촉을 잘 시킬수록 연소가 잘 일어난다.","3"
"위험물산업기사","2007","2","화재예방과 소화방법","23","화재예방상 이황화탄소의 액면위에 물을 채워두는 이유로 가장 옳은 것은?","","공기와 접촉하면 발화하기 때문에","산소와 접촉하면 산화하기 때문에","불순물을 물에 용해시키기 위해","가연성 증기의 발생을 방지하기 위해","4"
"위험물산업기사","2007","2","화재예방과 소화방법","24","다음 중 전기의 불량도체로 정전기가 발생되기 쉽고 폭발범위가 가장 넓은 위험물은?","","아세톤","톨루엔","에틸알콜","에틸에테르","4"
"위험물산업기사","2007","2","화재예방과 소화방법","25","정전기를 유효하게 제거하는 방법에서 공기중의 상대 습도는 몇 % 이상 되게 하여야 하는가?","","50%","60%","70%","80%","3"
"위험물산업기사","2007","2","화재예방과 소화방법","26","인화점이 38°C미만인 제 4류 위험물 취급을 주된 작업내용으로 하는 장소에 스프링클러설비를 설치할 경우 확보하여야 하는 1분당 방사밀도는 몇 L/M$^3$ 이상 이어야 하는가? (단, 살수기준면적은 250M$^2$ 이다)","","12.2","13.9","15.5","16.3","4"
"위험물산업기사","2007","2","화재예방과 소화방법","27","이산화탄소의 특성에 관한 내용으로 틀린 것은?","","전기의 전도성이 있다.","냉각 및 압축에 의하여 액화될 수 있다.","공기보다 약 1.52배 무겁다.","일반적으로 무색, 무취의 기체이다.","1"
"위험물산업기사","2007","2","화재예방과 소화방법","28","옥내 소화전 설비의 기준으로 옳지 않은 것은?","","옥내소화전함에는 그 표면에 '소화전'이라고 표시하여야 한다.","옥내 소화전함의 상부의 벽면에 적색의 표시등을 설치하여야 한다.","표시등 불빛은 부착면과 10도 이상의 각도가 되는 방향으로 8M 이내에서 쉽게 식별할 수 있어야 한다.","호스접속구는 바닥면으로 부터 1.5M 이하의 높이에 설치하여야 한다.","3"
"위험물산업기사","2007","2","화재예방과 소화방법","29","제조소에서 취급하는 제 4류 위험물의 최대수량의 합이 지정수량의 12만배 이상 24만배 미만인 사업소의 자체 소방대에 두는 화학소방자동차의 대수의 기준은 ?","","1대","2대","3대","4대","2"
"위험물산업기사","2007","2","화재예방과 소화방법","30","할로겐 화합물인 HALON 1001 의 분자식은?","","CH$_3$BR","CCL$_4$","CF$_2$BR$_2$","CF$_2$BR","1"
"위험물산업기사","2007","2","화재예방과 소화방법","31","위험물 제조소에 '화기주의'라고 표시한 게시판을 설치하는 경우 몇 류 위험물의 제조소인가?","","제 1류 위험물","제 2류 위험물","제 4류 위험물","제 5류 위험물","2"
"위험물산업기사","2007","2","화재예방과 소화방법","32","가연성 물질에 따라 분류한 화재 종류가 옳게 연결된 것은?","","A급 화재 - 유류","B급 화재 - 섬유","C급 화재 - 전기","D급 화재 - 플라스틱","3"
"위험물산업기사","2007","2","화재예방과 소화방법","33","옥내소화전설비의 기준에서 큐비클식 비상전원 전용수전설비는 당해 수전설비의 전면에 폭 얼마이상의 공지를 보유하여야하는가?","","0.5M","1.0M","1.5M","2.0M","2"
"위험물산업기사","2007","2","화재예방과 소화방법","34","분말 소화설비의 기준에서 가압용 또는 축압용 가스로 사용하도록 지정한 것은?","","헬륨","질소","일산화탄소","아르곤","2"
"위험물산업기사","2007","2","화재예방과 소화방법","35","1기압, 100°C 에서 물 36g 이 모두 기화되었다. 생성된 기체는 약 몇 L 인가?","","11.2","22.4","44.8","61.2","4"
"위험물산업기사","2007","2","화재예방과 소화방법","36","94%드라이아이스 100g 은 표준상태에서 몇 L의 CO$_2$가 되는가?","","22.40","47.85","50.90","62.74","2"
"위험물산업기사","2007","2","화재예방과 소화방법","37","분말소화설비는 분말 소화설비의 기준에서 정하는 소화약제의 약을 몇 초 이내에 균일하게 방사하여야 하는가?","","15","30","45","60","2"
"위험물산업기사","2007","2","화재예방과 소화방법","38","다음 소화설비 중 능력단위가 1.0 인 것은?","","삽 1개를 포함한 마른모래 50L","삽 1개를 포함한 마른모래 150L","삽 1개를 포함한 팽창질석 100L","삽 1개를 포함한 팽창질석 160L","4"
"위험물산업기사","2007","2","화재예방과 소화방법","39","강화액 소화기에 한냉지역 및 겨울에도 얼지 않도록 첨가하는 물질은 무엇인가?","","탄산칼륨","질소","사염화탄소","아세틸렌","1"
"위험물산업기사","2007","2","화재예방과 소화방법","40","제 1류 위험물 중 알칼리금속 과산화물의 소화방법에서 적응성이 있는 소화약제는?","","탄산수소염류분말","인산염류 분말","이산화탄소","할로겐 화합물","1"
"위험물산업기사","2007","2","위험물의 성질과 취급","41","KClO$_4$에 대한 설명 중 옳지 않은 것은?","","황색 또는 갈색의 사방정계 결정이다.","에테르에 녹지 않는다.","에탄올에 녹지 않는다.","열분해 하면 산소와 염화칼륨으로 분해 된다.","1"
"위험물산업기사","2007","2","위험물의 성질과 취급","42","물질의 자연발화를 방지하기 위한 조치로서 틀린 것은?","","직사 일광을 피한다.","저장실의 온도를 낮춘다.","촉매 역활을 하는 물질과 분리하여 저장한다.","저장실의 습도를 높인다.","4"
"위험물산업기사","2007","2","위험물의 성질과 취급","43","다음 위험물 중 소화시 물을 사용할 수 없는 것은?","","과산화나트륨","염소산나트륨","염소산칼륨","과염소산칼륨","1"
"위험물산업기사","2007","2","위험물의 성질과 취급","44","과망간산칼륨의 성질에 대한 설명 중 틀린 것은?","","가열하면 약 240°C 에서 분해한다.","가열 분해시 이산화망간과 물이 생성된다.","흑자식의 결정이다.","물에 녹으면 살균력을 나타낸다.","2"
"위험물산업기사","2007","2","위험물의 성질과 취급","45","옥내저장탱크와 탱크전용실의 벽 사이 및 옥내저장탱크 상호간에는 몇 M 이상의 간격을 유지하여야 하는가?","","0.3","0.5","1.0","1.5","2"
"위험물산업기사","2007","2","위험물의 성질과 취급","46","황린이 자연발화하기 쉬운 이유에 대한 설명으로 가장 옳은 것은?","","끓는점이 낮고 증기압이 높기 때문","인화점이 낮고 가연성이기 때문","조해성이 강하고 공기중의 수분에 의해 쉽게 분해되기 때문","산소와 친화력이 강하고 착화온도가 낮기 때문","4"
"위험물산업기사","2007","2","위험물의 성질과 취급","47","황린을 물 속에 저장할 때 인화수소의 발생을 방지하기 위한 물의 pH는 얼마 정도가 좋은가?","","4","5","7","9","4"
"위험물산업기사","2007","2","위험물의 성질과 취급","48","CaC$_2$ 의 성질을 설명한 것 중 틀린 것은?","","시판품은 흑회색의 불규칙한 고체 덩어리이다.","물과 반응하여 생석회와 산소가 생성된다.","고온에서 질소가스와 반응하여 석회질소가 된다.","비중은 약 2.2 정도로 물보다 무겁다.","2"
"위험물산업기사","2007","2","위험물의 성질과 취급","49","지정수량 이상의 위험물을 차량으로 운반할 때 게시판의 색상에 대한 설명으로 옳은 것은?","","흑색바탕에 청색의 도료로 위험물 이라고 게시한다","흑색바탕에 황색의 반사도료로 위험물이라고 게시한다.","적색바탕에 흰색의 반사도료로 위험물이라고 게시한다.","적색바탕에 흑색의 도료로 위험물 이라고 게시한다.","2"
"위험물산업기사","2007","2","위험물의 성질과 취급","50","다음 중 금속 나트륨의 보호액으로 가장 적당한 것은?","","페놀","파라핀.","아세트산","에틸알코올","2"
"위험물산업기사","2007","2","위험물의 성질과 취급","51","위험물 운반시에 혼재가 금지된 위험물로 올바르게 짝지어 놓은 것은? (단, 지정수량의 1/10 초과이다.)","","제1류 위험물과 제2류 위험물","제2류 위험물과 제5류 위험물","제3류 위험물과 제4류 위험물","제6류 위험물과 제1류 위험물","1"
"위험물산업기사","2007","2","위험물의 성질과 취급","52","제 4류 위험물 중에 물에 잘 녹지 않으며 물보다 가볍고 인화점이 0°C 이하인 것은?","","에테르","메탄올","니트로벤졸","아세트알데히드","1"
"위험물산업기사","2007","2","위험물의 성질과 취급","53","테레핀유의 인화점은 약 몇 °C 인가?","","15","35","55","75","2"
"위험물산업기사","2007","2","위험물의 성질과 취급","54","피크린산에 대한 설명 중 옳지 않은 것은?","","공업용은 보통 휘황색의 침상결정이다.","단독으로도 충격 및 마찰에 매우 민감하여 폭발할 위험이 있어 장기간 보관이 어렵다.","알코올, 에테르 벤젠 등에 녹는다.","착화점은 약 300°C 이고 융점이 약 122°C이다.","2"
"위험물산업기사","2007","2","위험물의 성질과 취급","55","황화린에 대한 설명으로 옳은 것은?","","P$_4$S$_3$은 회색의 비결정성 분말로 자연발화성이 있으므로 습기와 산화제의 접촉을 피한다.","P$_4$S$_3$의 연소생성물은 P$_2$O$_5$와 H$_3$PO$_4$ 이다.","P$_4$S$_7$은 조해성이 있고, 더운물에 분해하여 H$_2$S가 발생한다.","P$_2$S$_5$은 공기 중에 약 90°C 에서 발화하고 냉수에 급격히 분해하여 SO$_3$가스가 발생한다.","3"
"위험물산업기사","2007","2","위험물의 성질과 취급","56","제 2류 위험물은 어떤 성질의 물질인가?","","산화성고체","가연성고체","자연발화성 물질","자기 반응성 물질","2"
"위험물산업기사","2007","2","위험물의 성질과 취급","57","위험물의 운반용기 외부에 표시 하여야 하는 주의사항을 틀리게 연결한 것은?","","염소산 암모늄 - 화기 . 충격 주의 및 가연물 접촉주의","철분 - 화기주의 및 물기엄금","아세틸퍼옥사이드 - 화기엄금 및 충격주의","과염소산 - 물기엄금 및 가연물 접촉주의","4"
"위험물산업기사","2007","2","위험물의 성질과 취급","58","다음 중 분자량이 약 144이고 비중이 약 2.36 인 물질로 물과 접촉 되었을 때 CH$_4$를 발생시키는 것은?","","탄화알루미늄","탄화망간.","탄화마크네슘","탄화베릴륨","1"
"위험물산업기사","2007","2","위험물의 성질과 취급","59","질산염류 90KG , 유황20KG ,등유2000L, 실린더유3000L 를 저장하고 있을 경우 각각의 지정수량의 배수의 총합은 얼마인가?","","2","3","4","5","2"
"위험물산업기사","2007","2","위험물의 성질과 취급","60","다음 물질 중 증기비중이 가장 작은 것은?","","이황화탄소","아세톤","아세트알데히드","에테르","3"