Test Name,Year,Session,Subject,Number,Question,Question_image,Option 1,Option 2,Option 3,Option 4,Answer
산업안전기사,2015,3,전기위험방지기술,75,인체 감전사고 방지책으로써 가장 좋은 방법은?,,중성선을 접지한다.,단상 3선식을 채택한다.,"변압기의 1, 2차를 접지한다.",계통을 비접지 방식으로 한다.,4
산업안전기사,2015,3,전기위험방지기술,76,전기로 인한 위험방지를 위하여 전기 기계ㆍ기구를 적정하게 설치하고자 할 때의 고려사항이 아닌 것은?,,전기적 기계적 방호수단의 적정성,"습기, 분진 등 사용 장소의 주위 환경",비상전원설비의 구비와 접지극의 매설깊이,전기 기계ㆍ기구의 충분한 전기적 용량 및 기계적 강도,3
산업안전기사,2015,3,전기위험방지기술,77,접지공사 종류별 접지저항 값의 규정을 옳게 나타낸 것은? (관련 규정 개정전 문제로 여기서는 기존 정답인 1번을 누르면 정답 처리됩니다. 자세한 내용은 해설을 참고하세요.),,제1종 접지공사 : 10Ω 이하,제2종 접지공사 : 150Ω 이하,제3종 접지공사 : 10Ω 이하,특별 제3종 접지공사 : 100Ω 이하,1
산업안전기사,2015,3,전기위험방지기술,78,"인체의 전기저항 R을 1000Ω이라고 할 때 위험한계 에너지의 최저는 약 몇 J 인가? (단, 통전 시간은 1초이다.)",,17.33,27.23,37.33,47.23,2
산업안전기사,2015,3,전기위험방지기술,79,금속제 외함을 가지는 사용전압이 60V를 초과하는 저압의 기계 기구로서 사람이 쉽게 접촉할 우려가 있는 장소에 시설하는 것에 전기를 공급하는 전로에 지락이 발생하였을 때 자동적으로 전로를 차단하는 누전차단기를 설치하여야 한다. 누전차단기를 설치하지 않는 경우는?,,기계ㆍ기구를 습한 장소에 시설하는 경우,기계ㆍ기구가 유도 전동기의 2차측 전로에 접속된 저항기인 경우,대지전압이 200V 이하인 기계ㆍ기구를 물기가 있는 곳에 시설하는 경우,기계ㆍ기구를 건조한 장소에 시설하고 습한 장소에서 조작하는 경우로 제어전압이 교류 100V 미만인 경우,2
산업안전기사,2015,3,전기위험방지기술,80,정전작업 시 작업전 조치하여야할 실무사항으로 틀린것은?,,단락 접지기구의 철거,잔류전하의 방전,검전기에 의한 정전확인,개로개폐기의 잠금 또는 표시,1
산업안전기사,2015,3,화학설비위험방지기술,81,산업안전보건기준에 관한 규칙에서 규정하고 있는 급성독성물질의 정의에 해당되지 않는 것은?,,"가스 LC$_{50}$(쥐, 4시간 흡입)이 2500ppm 이하인 화학 물질","LD$_{50}$(경구, 쥐)이 킬로그램당 300밀리그램-(체중) 이하인 화학물질","LD$_{50}$(경피, 쥐)이 킬로그램당 1000밀리그램-(체중) 이하인 화학물질","LD$_{50}$(경피, 토끼)이 킬로그램당 2000밀리그램-(체중) 이하인 화학물질",4
산업안전기사,2015,3,화학설비위험방지기술,82,다음 중 금속화재는 어떤 종류의 화재에 해당 되는가?,,A급,B급,C급,D급,4
산업안전기사,2015,3,화학설비위험방지기술,83,위험물 또는 가스에 의한 화재를 경보하는 기구에 필요한 설비가 아닌 것은?,,간이완강기,자동화재감지기,축전지설비,자동화재수신기,1
산업안전기사,2015,3,화학설비위험방지기술,84,다음 중 고체연소의 종류에 해당하지 않는 것은?,,표면연소,증발연소,분해연소,혼합연소,4
산업안전기사,2015,3,화학설비위험방지기술,85,다음 중 반응 또는 운전압력이 3psig 이상인 경우 압력계를 설치하지 않아도 무관한 것은?,,반응기,탑조류,밸브류,열교환기,3
산업안전기사,2015,3,화학설비위험방지기술,86,다음 중 광분해 반응을 일으키기 가장 쉬운 물질은?,,AgNO$_3$,Ba(NO$_3$)$_2$,Ca(NO$_3$)$_2$,KNO$_3$,1
산업안전기사,2015,3,화학설비위험방지기술,87,"공기 중 아세톤의 농도가 200ppm(TLV 500ppm), 메틸에틸케톤(MEK)의 농도가 100ppm(TLV 200ppm)일 때 혼합 물질의 허용농도는 약 몇 ppm 인가? (단, 두 물질은 서로 상가작용을 하는 것으로 가정한다.)",,150,200,270,333,4
산업안전기사,2015,3,화학설비위험방지기술,88,이산화탄소 및 할로겐화합물 소화약제의 특징으로 가장 거리가 먼 것은?,,소화속도가 빠르다.,소화설비의 보수관리가 용이하다.,전기절연성이 우수하나 부식성이 강하다.,저장에 의한 변질이 없어 장기간 저장이 용이한 편이다.,3
산업안전기사,2015,3,화학설비위험방지기술,89,기상폭발 피해예측의 주요 문제점 중 압력상승에 기인하는 피해가 예측되는 경우에 검토를 요하는 사항으로 거리가 먼 것은?,,가연성 혼합기의 형성 상황,압력 상승시의 취약부 파괴,"물질의 이동, 확산 유해물질의 발생",개구부가 있는 공간 내의 화염전파와 압력상승,3
산업안전기사,2015,3,화학설비위험방지기술,90,분진폭발의 요인을 물리적 인자와 화학적 인자로 분류 할 때 화학적 인자에 해당하는 것은?,,연소열,입도분포,열전도율,입자의 형상,1
산업안전기사,2015,3,화학설비위험방지기술,91,"헥산 1vol%, 메탄 2vol%, 에틸렌 2vol%, 공기 95vol%로 된 혼합가스의 폭발하한계 값(vol%)은 약 얼마인가? (단, 헥산, 메탄, 에틸렌의 폭발하한계 값은 각각 1.1, 5.0, 2.7vol% 이다.)",,2.44,12.89,21.78,48.78,1
산업안전기사,2015,3,화학설비위험방지기술,92,다음 중 관(pipe) 부속품 중 관로의 방향을 변경하기 위하여 사용하는 부속품은?,,니플(nipple),유니온(union),플랜지(flange),엘보우(elbow),4
산업안전기사,2015,3,화학설비위험방지기술,93,다음 중 공업용 가연성 가스 및 독성가스의 저장용기 도색에 관한 설명으로 옳은 것은?,,아세틸렌가스는 적색으로 도색한 용기를 사용한다.,액화염소가스는 갈색으로 도색한 용기를 사용한다.,액화석유가스는 주황색으로 도색한 용기를 사용한다.,액화암모니아가스는 황색으로 도색한 용기를 사용한다.,2
산업안전기사,2015,3,화학설비위험방지기술,94,다음 중 제시한 두 종류 가스가 혼합될 때 폭발 위험이 가장 높은 것은?,,"염소, CO$_2$","염소, 아세틸렌","질소, CO$_2$","질소, 암모니아",2
산업안전기사,2015,3,화학설비위험방지기술,95,물이 관 속을 흐를 때 유동하는 물 속의 어느 부분의 정압이 그 때의 물의 증기압보다 낮을 경우 물이 증발하여 부분적으로 증기가 발생되어 배관의 부식을 초래하는 경우가 있다. 이러한 현상을 무엇이라 하는가?,,서어징(surging),공동현상(cavitation),비말동반(entrainment),수격작용(water hammering),2
산업안전기사,2015,3,화학설비위험방지기술,96,다음 짝지어진 물질의 혼합 시 위험성이 가장 낮은 것은?,,폭발성물질 - 금수성물질,금수성물질 - 고체환원성물질,가연성물질 - 고체환원성물질,고체산화성물질 - 고체환원성물질,3
산업안전기사,2015,3,화학설비위험방지기술,97,반응기 중 관형반응기의 특징에 대한 설명으로 옳지 않은 것은?,,전열면적이 작아 온도조절이 어렵다.,가는 관으로 된 긴 형태의 반응기이다.,처리량이 많아 대규모 생산에 쓰이는 것이 많다.,기상 또는 액상 등 반응속도가 빠른 물질에 사용된다.,1
산업안전기사,2015,3,화학설비위험방지기술,98,다음 중 자연발화의 방지법으로 적절하지 않은 것은?,,통풍을 잘 시킬 것,습도가 낮은 곳을 피할 것,저장실의 온도 상승을 피할 것,공기가 접촉되지 않도록 불활성액체 중에 저장할 것,2
산업안전기사,2015,3,화학설비위험방지기술,99,공정안전보고서에 관한 설명으로 옳지 않은 것은?,,공정안전보고서를 작성할 때에는 산업안전보건위원회의 심의를 거쳐야 한다.,공정안전보고서를 작성 할 때에 산업안전보건위원회가 설치되어 있지 아니한 사업장의 경우에는 근로자대표의 의견을 들어야 한다.,공정안전보고서의 내용을 변경하여야 할 사유가 발생한 경우에는 14일 이내 고용노동부장관의 승인을 득한 후 보완하여야 한다.,"고용노동부장관은 정하는 바에 따라 공정안전보고서의 이행 상태를 정기적으로 평가하고, 그 결과에 따른 보완 상태가 불량한 사업장의 사업주에게는 공정안전보고서를 다시 제출하도록 명할 수 있다.",3
산업안전기사,2015,3,화학설비위험방지기술,100,다음 중 주수소화를 하여서는 아니 되는 물질은?,,적린,금속분말,유황,과망간산칼륨,2
산업안전기사,2015,3,건설안전기술,101,히빙(heaving)현상에 대한 안전대책이 아닌 것은?,,굴착주변을 웰 포인트(well point)공법과 병행한다.,시트파일(sheet pile) 등의 근입심도를 검토한다.,굴착저면에 토사 등 인공중력을 감소시킨다.,굴착배면의 상재하중을 제거하여 토압을 최대한 낮춘다.,3
산업안전기사,2015,3,건설안전기술,102,지름이 15cm이고 높이가 30cm인 원기둥 콘크리트 공시체에 대해 압축강도시험을 한 결과 460kN에 파괴되었다. 이 때 콘크리트 압축강도는?,,16.2 MPa,21.5 MPa,26 MPa,31.2 MPa,3
산업안전기사,2015,3,건설안전기술,103,굴착공사에 있어서 비탈면붕괴를 방지하기 위하여 행하는 대책이 아닌 것은?,,지표수의 침투를 막기 위해 표면배수공을 한다.,지하수위를 내리기 위해 수평배수공을 설치한다.,비탈면 하단을 성토한다.,비탈면 상부에 토사를 적재한다.,4
산업안전기사,2015,3,건설안전기술,104,사면의 붕괴형태의 종류에 해당되지 않는 것은?,,사면의 측면부 파괴,사면선 파괴,사면내 파괴,바닥면 파괴,1
산업안전기사,2015,3,건설안전기술,105,철골 작업을 할 때 악천후에는 작업을 중지하여야 하는데 그 기준으로 옳은 것은?,,강설량이 분당 1cm 이상인 경우,강우량이 시간당 1cm 이상인 경우,풍속이 초당 10m 이상인 경우,기온이 35℃ 이상인 경우,3
산업안전기사,2015,3,건설안전기술,106,추락방지망의 그물코 크기의 기준으로 옳은 것은?,,5cm 이하,10cm 이하,20cm 이하,30cm 이하,2
산업안전기사,2015,3,건설안전기술,107,온도가 하강함에 따라 토중수가 얼어 부피가 약 9% 정도 증대하게 됨으로써 지표면이 부풀어오르는 현상은?,,동상현상,역화현상,리칭현상,액상화현상,1
산업안전기사,2015,3,건설안전기술,108,강관을 사용하여 비계를 구성할 때의 설치기준으로 옳지 않은 것은?(2022년 10월 18일 개정된 규정 적용됨),,비계기둥의 간격은 띠장방향에서는 1.85m 이하로 한다.,띠장간격은 1m 이하로 설치한다.,비계기둥의 제일 윗부분으로부터 31m 되는 지점 밑부분의 비계기둥은 2개의 강관으로 묶어 세운다.,비계기둥간의 적재하중은 400kg을 초과하지 않도록한다.,2
산업안전기사,2015,3,건설안전기술,109,작업장으로 통하는 장소 또는 작업장 내에 근로자가 사용하기 위한 안전한 통로를 설치할 때 그 설치기준으로 옳지 않은 것은?,,통로에는 75럭스(Lux)이상의 조명시설을 하여야 한다.,통로의 주요한 부분에는 통로표시를 하여야 한다.,수직갱에 가설된 통로의 길이가 10m 이상일 때에는7m 이내마다 계단참을 설치하여야 한다.,경사가 15°를 초과하는 경우에는 미끄러지지 아니하는 구조로 하여야 한다.,3
산업안전기사,2015,3,건설안전기술,110,흙막이 지보공을 설치하였을 때 정기점검 사항에 해당되지 않는 것은?,,검지부의 이상유무,버팀대의 긴압의 정도,침하의 정도,"부재의 손상, 변형, 부식, 변위 및 탈락의 유무와 상태",1
산업안전기사,2015,3,건설안전기술,111,지하매설물의 인접작업 시 안전지침과 거리가 먼 것은?,,사전조사,매설물의 방호조치,지하매설물의 파악,소규모 구조물의 방호,4
산업안전기사,2015,3,건설안전기술,112,구조물의 해체 작업 시 해체 작업계획서에 포함하여야 할 사항으로 틀린 것은?,,해체의 방법 및 해체순서 도면,해체물의 처분계획,주변 민원 처리계획,현장 안전 조치 계획,3
산업안전기사,2015,3,건설안전기술,113,토사붕괴의 방지공법이 아닌 것은?,,경사공,배수공,압성토공,공작물의 설치,1
산업안전기사,2015,3,건설안전기술,114,터널작업 시 자동경보장치에 대하여 당일의 작업시작 전 점검하여야 할 사항으로 틀린 것은?,,검지부의 이상 유무,조명시설의 이상 유무,경보장치의 작동 상태,계기의 이상 유무,2
산업안전기사,2015,3,건설안전기술,115,거푸집동바리 등을 조립하는 경우에 준수해야 할 기준으로 옳지 않은 것은?,,"동바리의 상하고정 및 미끄러짐 방지조치를 하고, 하중의 지지상태를 유지할 것",강재와 강재와의 접속부 및 교차부는 볼트ㆍ클램프 등 전용철물을 사용하여 단단히 연결할 것,파이프서포트를 제외한 동바리로 사용하는 강관은 높이 2m 이내마다 수평연결재를 2개 방향으로 만들고 수평연결재의 변위를 방지할 것,동바리로 사용하는 파이프서포트는 4개 이상 이어서 사용하지 않도록 할 것,4
산업안전기사,2015,3,건설안전기술,116,차량계 건설기계에 해당되지 않는 것은?,,불도저,콘크리트 펌프카,드래그 셔블,가이데릭,4
산업안전기사,2015,3,건설안전기술,117,화물을 차량계 하역운반기계에 싣는 작업 또는 내리는 작업을 할 때 해당 작업의 지휘자에게 준수하도록 하여야 하는 사항과 거리가 먼 것은?,,하중이 한쪽으로 치우쳐서 효율적으로 적재되도록 할 것,작업순서 및 그 순서마다의 작업방법을 정하고 작업을 지휘할 것,기구와 공구를 점검하고 불량품을 제거할 것,해당 작업을 하는 장소에 관계 근로자가 아닌 사람이 출입하는 것을 금지할 것,1
산업안전기사,2015,3,건설안전기술,118,액상화현상 방지를 위한 안전대책으로 옳지 않는 것은?,,모래입경이 가늘고 균일한 모래층 지반으로 치환,입도가 불량한 재료를 입도가 양호한 재료로 치환,지하수위를 저하시키고 포화도를 낮추기 위해 deep well을 사용,밀도를 증가하여 한계간극비 이하로 상대밀도를 유지하는 방법 강구,1
산업안전기사,2015,3,건설안전기술,119,안전관리계획의 작성내용과 거리가 먼 것은?,,건설공사의 안전관리 조직,산업안전보건관리비 집행방법,공사장 및 주변 안전관리 계획,통행안전시설 설치 및 교통소통계획,2
산업안전기사,2015,3,건설안전기술,120,낙하물에 의한 위험방지 조치의 기준으로서 옳은 것은?,,높이가 최소 2m 이상인 곳에서 물체를 투하하는 때에는 적당한 투하설비를 갖춰야 한다.,낙하물방지망을 높이 12m 이내마다 설치한다.,방호선반 설치시 내민 길이는 벽면으로부터 2m 이상으로 한다.,낙하물방지망의 설치각도는 수평면과 30~40°를 유지한다.,3
