Test Name,Year,Session,Subject,Number,Question,Question_image,Option 1,Option 2,Option 3,Option 4,Answer
산업안전산업기사,2008,3,건설안전기술,83,옥백의 안정조건에서 활동에 대한 저항력은 중력에 작용하는 수평력보다면 최소 몇 배 이상 되어야 하는가?,,1.0배,1.5배,2.0배,3.0배,2
산업안전산업기사,2008,3,건설안전기술,84,터널 건설작업의 터널 내부에서 항거나 아크를 사용하는 경우 필하 설치하도록 법으로 규정하고 있는 설비는?,,대피설비,소화설비,출전설비,자연설비,2
산업안전산업기사,2008,3,건설안전기술,85,건설공사현장의 가설공사에 사용되는 비계발판에서의 방판폭 치수 기준으로 옳은 것은?,,30cm 이상,40cm 이상,50cm 이상,60cm 이상,2
산업안전산업기사,2008,3,건설안전기술,86,해체 공사시 안전시험 준수내용으로 옳지 않은 것은?,,사용기계기구 등를 인영하거나 내릴 때에는 와이어 로프로 묵어서 작업한다.,적정한 위치에 대피소를 설치하여야 한다,전도작업을 수행할 때에는 작업자 이외의 작업자를 대피시킨 후 전도시키도록 한다,"강풍, 폭우, 폭설 등 악천후에는 작업을 중지한다.",1
산업안전산업기사,2008,3,건설안전기술,87,건설업 산업안전보건관리비의 출락방지용 안전시설비 항목에 속하지 않는 것은?,,출락방지용 안전방망,작업발판과,개구부 덮개,안전난간,2
산업안전산업기사,2008,3,건설안전기술,88,건설업 중 유해·위험방지계획서 재출대상 사업 규모에 해당되지 않는 것은?,,터널건설 공사,일이가 150미터인 굴착공사,지상높이가 25미터인 굴착공사,최대지간길이가 55미터인 교량건설 공사,3
산업안전산업기사,2008,3,건설안전기술,89,다음 중 흙에 과한 전단시험의 출류가 아닌 것은?,,작업선연시험,일축압축시험,삼축압축시험,CBR시험,4
산업안전산업기사,2008,3,건설안전기술,90,흙나무 비계를 설치할 때 첫 번째 띠장을 설치할 높이는 지상으로부터 얼마 이하인가?,,2미터 이하,3미터 이하,4미터 이하,5미터 이하,2
산업안전산업기사,2008,3,건설안전기술,91,암석 낙하의 우려가 있을 때 검고한 해드가드를 설치해야 하는 건설기계의 출류가 아닌 것은?,,불도저,트랙터,드래그스벨,스크레이퍼,4
산업안전산업기사,2008,3,건설안전기술,92,통과 등에 의한 위험방지에 관한 기준으로 틀린 것은?,,인근의 항다 작업으로 침하가 발생하여 구축물의 통과위험에 예상할 경우를 근린 및 파출을 방지하여야 한다.,건넥에서의 촉백의 붕괴에 따른 로프자재의 위험를 미칠 우려가 있를 때에는 지보공를 설치한다.,높이가 2미터 이상인 장소로부터 물체를 투하하는 때에는 투하설비를 설치하거나 감시인를 배치한다.,작업으로 인하여 물체가 낙하 또는 비래할 위험이 있를 때에는 방호망반의 설치 등 발요한 조치를 취한다.,3
산업안전산업기사,2008,3,건설안전기술,93,다음 보기 중 철골공사를 중지하여야 하는 경우에 해당하는 것은?,,풍숙이 6m/sec인 경우,풍숙이 9m/sec인 경우,강우량이 0.5mm/hr인 경우,강우량이 1.3mm/hr인 경우,4
산업안전산업기사,2008,3,건설안전기술,94,"부두, 안벽 등 하역작업을 하는 장소에 대하여 부두 또는 안백의 선을 따라 등분의 설치를 설치할 때 등분의 최소 폭은?",,70cm,80cm,90cm,100cm,3
산업안전산업기사,2008,3,건설안전기술,95,다음 중 거푸집 조립순서를 올게 나열한 것은?,,기둥 → 보받이 내측벽 → 콘본 → 작은보 → 비닥판 → 내벽 → 외벽,외벽 → 보받이 내측벽 → 콘본 → 작은보 → 비닥판 → 내벽 → 기둥,기둥 → 보받이 내측벽 → 작은보 → 콘본 → 비닥판 → 내벽 → 외벽,기둥 → 무받이 내측벽 → 비닥판 → 콘본 → 작은보 → 내벽 → 외벽,1
산업안전산업기사,2008,3,건설안전기술,96,사다리 기둥 설치시 기둥과 지면 사이에 유지해야 하는 각도는 최대 몇 도 이하이어야 하는가?,,60° 이하,65° 이하,70° 이하,75° 이하,4
산업안전산업기사,2008,3,건설안전기술,97,재해사고를 예방하기 위해 크레인에 설치된 방호장치가 아닌 것은?,,과부하 방지장치,브레이크장치,관과방지장치,버킷장치,4
산업안전산업기사,2008,3,건설안전기술,98,옥백 측조를 위한 굴착작업에 대한 다음 설명 중 옳지 않은 것은?,,수평 방향으로 연석적으로 시공한다.,하나의 구간을 굴착하면 방지하지 말고 즉시 볼페방지 조치를 취한다.,"낙석의 우려가 있는 절취허면에 숏크리트, 모르타르 등으로 방호 한다.",작업 위치의 작우에 대피 동로를 확보한다.,1
산업안전산업기사,2008,3,건설안전기술,99,콘크리트 양생작업에 대한 다음 설명 중 가장 부적당한 것은?,,콘크리트 타설 후 수화작용를 돕기 위한 작업이다.,금겸한 건조 및 한랭에 대해 보호한다.,일광을 최대한 도입하여 수화작용를 촉진하도록 한다.,보동포틀랜드 시멘트를 사용했을 경우 일평균기온이 15°C이상이면 최소 5일간 습윤상대를 유지한다.,3
산업안전산업기사,2008,3,건설안전기술,100,다음 중 철골보 인양작업시의 준수사항으로 옳지 않은 것은?,,인양율 있이어로프의 체결지점은 수평부재의 1/4지점를 기준으로 한다.,인양을 있이어로프의 매달기 각도는 양면 60°를 기준으로 한다.,톤들리거나 선회하지 않도록 유도 로프로 유도한다.,후크는 용접의 경우 용접구격을 반드시 확인한다.,1
