Test Name,Year,Session,Subject,Number,Question,Question_image,Option 1,Option 2,Option 3,Option 4,Answer
산업안전기사,2015,2,안전관리론,1,다음 중 교육심리학의 학습이론에 관한 설명으로 옳은 것은?,,파블로프(Pavlov)의 조건반사설은 맹목적 시행을 반복하는 가운데 자극과 반응이 결합하여 행동하는 것이다.,레윈(Lewin)의 장설은 후천적으로 얻게 되는 반사 작용으로 행동을 발생시킨다는 것이다.,톨만(Tolman)의 기호형태설은 학습자의 머리 속에 인지적 지도 같은 인지구조를 바탕으로 학습하려는 것이다.,"손다이크(Thorndike)의 시행착오설은 내적, 외적의 전체구조를 새로운 시점에서 파악하여 행동하는 것이다.",3
산업안전기사,2015,2,안전관리론,2,다음 중 헤드십(head-ship)의 특성으로 옳지 않은 것은?,,권한의 근거는 공식적이다.,지휘의 형태는 권위주의적이다.,상사와 부하와의 사회적 간격은 좁다.,상사와 부하와의 관계는 지배적이다.,3
산업안전기사,2015,2,안전관리론,3,다음 중 하인리히 방식의 재해코스트 산정에 있어 직접비에 해당되지 않은 것은?,,간병급여,신규채용비용,직업재활급여,상병(傷病)보상연금,2
산업안전기사,2015,2,안전관리론,4,다음 중 무재해운동의 이념에서 '선취의 원칙'을 가장 적절하게 설명한 것은?,,사고의 잠재요인을 사후에 파악하는 것,근로자 전원의 일체감을 조성하여 참여하는 것,"위험요소를 사전에 발견, 파악하여 재해를 예방하거나 방지하는 것",관리감독자 또는 경영층에서의 자발적 참여로 안전 활동을 촉진하는 것,3
산업안전기사,2015,2,안전관리론,5,다음 중 안전·보건교육계획의 수립시 고려할 사항으로 가장 거리가 먼 것은?,,현장의 의견을 충분히 반영한다.,대상자의 필요한 정보를 수집한다.,안전교육시행체계와의 연관성을 고려한다.,정부 규정에 의한 교육에 한정하여 실시한다.,4
산업안전기사,2015,2,안전관리론,6,다음 중 몇 사람의 전문가에 의하여 과제에 관한 견해를 발표한 뒤에 참가자로 하여금 의견이나 질문을 하게 하여 토의하는 방법을 무엇이라 하는가?,,심포지엄(Symposium),버즈 세션(Buzz session),케이스 메소드(case method),패널 디스커션(Panel discussion),1
산업안전기사,2015,2,안전관리론,7,"다음 중 산업안전보건법령상 사업내 안전·보건교육에 있어 관리감독자의 정기안전보건 교육 내용에 해당하는 것은? (단, 기타 산업안전보건법 및 일반관리에 관한 사항은 제외한다.)",,작업 개시 전 점검에 관한 사항,정리정돈 및 청소에 관한 사항,작업공정의 유해·위험과 재해 예방대책에 관한 사항,기계·기구의 위험성과 작업의 순서 및 동선에 관한 사항,3
산업안전기사,2015,2,안전관리론,8,다음 중 위험예지훈련에 있어 Touch and call에 관한 설명으로 가장 적절한 것은?,,현장에서 팀 전원이 각자의 왼손을 맞잡아 원을 만들어 팀 행동목표를 지적확인하는 것을 말한다.,현장에서 그때 그 장소의 상황에서 즉응하여 실시하는 위험예지활동으로 즉시즉응법이라고도 한다.,작업자가 위험작업에 임하여 무재해를 지향하겠다는 뜻을 큰소리로 호창하면서 안전의식수준을 제고하는 기법이다.,한 사람 한 사람의 위험에 대한 감수성 향상을 도모하기 위한 삼각 및 원포인트 위험예지훈련을 통합한 활용기법이다.,1
산업안전기사,2015,2,안전관리론,9,산업안전보건법령상 같은 장소에서 행하여지는 사업으로서 사업의 일부를 분리하여 도급을 주어하는 사업의 경우 산업재해를 예방하기 위한 조치로 구성·운영하는 안전·보건에 관한 협의체의 회의 주기로 옳은 것은?,,매월 1회 이상,2개월 간격의 1회 이상,3개월 내의 1회 이상,6개월 내의 1회 이상,1
산업안전기사,2015,2,안전관리론,10,다음 중 재해예방을 위한 시정책인 '3E'에 해당하지 않는 것은?,,Education,Energy,Engineering,Enforcement,2
산업안전기사,2015,2,안전관리론,11,"다음 중 산업안전보건법령상 안전·보건표지의 색채의 색도기준이 잘못 연결된 것은? (단, 색도기준은 KS에 따른 색의 3속성에 의한 표시방법에 따른다.)",,빨간색 - 7.5R 4/14,노란색 - 5Y 8.5/12,파란색 - 2.5PB 4/10,흰색 - N0.5,4
산업안전기사,2015,2,안전관리론,12,다음 중 부주의의 발생 현상으로 흔미한 정신상태에서 심신의 피로나 단조로운 반복작업시 일어나는 현상은?,,의식의 과잉,의식의 집중,의식의 우회,의식 수준의 저하,4
산업안전기사,2015,2,안전관리론,13,"다음 중 레윈(Lewin.K)에 의하여 제시된 인간의 행동에 관한 식을 올바르게 표현한 것은? (단, B는 인간의 행동, P는 개체, E는 환경, f는 함수관계를 의미한다.)",,B = f(P.E),B = f(P+1)B,P = E.f(B),E = f(B+1)P,1
산업안전기사,2015,2,안전관리론,14,"베어링을 생산하는 사업장에 300명의 근로자가 근무하고 있다. 1년에 21건의 재해가 발생하였다면 이 사업장에서 근로자 1명이 평생 작업시 약 몇 건의 재해를 당할 수 있겠는가? (단, 1일 8시간씩, 1년에 300일 근무하며, 평생근로 시간은 10만시간으로 가정한다.)",,1건,3건,5건,6건,2
산업안전기사,2015,2,안전관리론,15,다음 중 점검시기에 따른 안전점검의 종류로 볼 수 없는 것은?,,수시점검,개인점검,정기점검,일상점검,2
산업안전기사,2015,2,안전관리론,16,다음 중 구체적인 동기유발요인과 가장 거리가 먼 것은?,,작업,성과,권력,독자성,1
산업안전기사,2015,2,안전관리론,17,다음 중 산업재해조사표를 작성할 때 기입하는 상해의 종류에 해당하는 것은?,,낙하·비래,유해광선 노출,중독·질식,이상온도 노출·접촉,3
산업안전기사,2015,2,안전관리론,18,다음 중 방진마스크의 구비 조건으로 적절하지 않은 것은?,,흡기밸브는 미약한 호흡에 대하여 확실하고 예민하게 작동하도록 할 것,쉽게 착용되어야 하고 착용하였을 때 안면부가 안면에 밀착되어 공기가 새지 않을 것,여과재는 여과성능이 우수하고 인체에 장해를 주지 않을 것,흡·배기밸브는 외부의 힘에 의하여 손상되지 않도록 흡·배기 저항이 높을 것,4
산업안전기사,2015,2,안전관리론,19,다음 중 인간의 적성과 안전과의 관계를 가장 올바르게 설명한 것은?,,"사고를 일으키는 것은 그 작업에 적성이 맞지 않는 사람이 그 일을 수행한 이유이므로, 반드시 적성검사를 실시하여 그 결과에 따라 작업자를 배치하여야 한다.","인간의 감각기별 반응시간은 시각, 청각, 통각 순으로 빠르므로 비상시 비상등을 먼저 켜야 한다.",사생활에 중대한 변화가 있는 사람이 사고를 유발할 가능성이 높으므로 그러한 사람들에게는 특별한 배려가 필요하다.,일반적으로 집단의 심적 태도를 교정하는 것보다 개인의 심적 태도를 교정하는 것이 더 용이하다.,3
산업안전기사,2015,2,안전관리론,20,"산업안전보건법상 산업안전보건위원회의 사용자위원에 해당되지 않는 것은? (단, 각 사업장은 해당하는 사람을 선임하여 하는 대상 사업장으로 한다.)",,안전관리자,해당 사업장의 부서의 장,산업보건의,명예산업안전감독관,4
산업안전기사,2015,2,인간공학 및 시스템안전공학,21,다음 중 실효온도(Effective Temperature)에 대한 설명으로 틀린 것은?,,체온계로 입안의 온도를 측정하여 기준으로 한다.,실제로 감각되는 온도로서 실감온도라고 한다.,"온도, 습도 및 공기 유동이 인체에 미치는 열효과를 나타낸 것이다.",상대습도 100% 일 때의 건구온도에서 느끼는 것과 동일한 온감이다.,1
산업안전기사,2015,2,인간공학 및 시스템안전공학,22,다음 중 보전효과의 평가로 설비종합효율을 계산하는 식으로 옳은 것은?,,설비종합효율 = 속도가동률×정미가동률,설비종합효율 = 시간가동률×성능가동률×양품률,설비종합효율 = (부하시간-정지시간)/부하시간,설비종합효율 = 정미가동률×시간가동률×양품률,2
산업안전기사,2015,2,인간공학 및 시스템안전공학,23,염산을 취급하는 A업체에서는 신설 설비에 관한 안전성 평가를 실시해야 한다. 다음 중 정성적 평가단계에 있어 설계와 관련된 주요 진단 항목에 해당하는 것은?,,공장 내의 배치,제조공정의 개요,재평가 방법 및 계획,안전·보건교육 훈련계획,1
산업안전기사,2015,2,인간공학 및 시스템안전공학,24,그림과 같이 FT도에서 활용하는 논리게이트의 명칭으로 옳은 것은?(문제 오류로 실제 시험에서는 1번 2번이 정답 처리되었습니다. 여기서는 1번을누르면 정답 처리 됩니다.),O,억제 게이트,제어 게이트,배타적 OR 게이트,우선적 AND 게이트,1
산업안전기사,2015,2,인간공학 및 시스템안전공학,25,"인간의 위치 동작에 있어 눈으로 보지 않고 손을 수평 면상에서 움직이는 경우 짧은 거리는 지나치고, 긴 거리는 못 미치는 경향이 있는데 이를 무엇이라고 하는가?",,사정효과(Range effect),간격효과(Distance effect),손동작효과(Hand action effect),반응효과(Reaction effect),1
산업안전기사,2015,2,인간공학 및 시스템안전공학,26,"주어진 자극에 대해 인간이 갖는 변화감지역을 표현하는 데에는 웨버(Webber)의 법칙을 이용한다. 이 때 웨버(Webber) 비의 관계식으로 옳은 것은? (단, 변화감지역을 ΔI, 표준자극을 I라 한다.)",,웨버(Webber)의 비 = $\\frac{\\Delta I}{I}$,웨버(Webber)의 비 = $\\frac{I}{\\Delta I}$,웨버(Webber)의 비 = $\\Delta I \\times I$,웨버(Webber)의 비 = $\\frac{\\Delta I - I}{I}$,1
산업안전기사,2015,2,인간공학 및 시스템안전공학,27,다음 중 동작경제의 원칙에 있어 '신체사용에 관한 원칙'에 해당하지 않는 것은?,,두 손의 동작은 동시에 시작해서 동시에 끝나야 한다.,손의 동작은 유연하고 연속적인 동작이어야 한다.,"공구, 재료 및 제어장치는 사용하기 가까운 곳에 배치해야 한다.",동작이 급작스럽게 크게 바뀌는 직선 동작은 피해야 한다.,3
산업안전기사,2015,2,인간공학 및 시스템안전공학,28,"실린더 블록에 사용하는 가스켓의 수명은 평균 10000시간이며, 표준편차는 200시간으로 정규분포를 따른다. 사용시간이 9600시간일 경우 이 가스켓의 신뢰도는 약 얼마인가? (단, 표준정규분포상 Z$_1$=0.8413, Z$_2$=0.9772 이다.)",,84.13%,88.73%,92.72%,97.72%,4
산업안전기사,2015,2,인간공학 및 시스템안전공학,29,다음 중 인간공학을 나타내는 용어로 적절하지 않은 것은?,,ergonomics,human factors,human engineering,customize engineering,4
산업안전기사,2015,2,인간공학 및 시스템안전공학,30,다음 중 결함수분석의 기대효과와 가장 관계가 먼 것은?,,사고원인 규명의 간편화,시간에 따른 원인 분석,사고원인 분석의 정량화,시스템의 결함 진단,2
산업안전기사,2015,2,인간공학 및 시스템안전공학,31,인체 계측 중 운전 또는 워드 작업과 같이 인체의 각 부분이 서로 조화를 이루며 움직이는 자세에서의 인체치수를 측정하는 것을 무엇이라 하는가?,,구조적 치수,정적 치수,외곽 치수,기능적 치수,4
산업안전기사,2015,2,인간공학 및 시스템안전공학,32,말소리의 질에 대한 객관적 측정 방법으로 명료도 지수를 사용하고 있다. 그림에서와 같은 경우 명료도 지수는 약 얼마인가?,O,0.38,0.68,1.38,5.68,3
산업안전기사,2015,2,인간공학 및 시스템안전공학,33,"휴식 중 에너지소비량은 1.5kcal/min이고, 어떤 작업의 평균 에너지소비량이 6kcal/min이라고 할 때 60분간 총 작업시간 내에 포함되어야 하는 휴식시간은 약 몇 분인가? (단, 기초대사를 포함한 작업에 대한 평균 에너지소비량의 상한은 5kcal/min이다.)",,10.3,11.3,12.3,13.3,4
산업안전기사,2015,2,인간공학 및 시스템안전공학,34,"Rasmussen은 행동을 세 가지로 분류하였는데, 그 분류에 해당하지 않는 것은?",,숙련 기반 행동(skill-based behavior),지식 기반 행동(knowledge-based behavior),경험 기반 행동(experience-based behavior),규칙 기반 행동(rule-based behavior),3
산업안전기사,2015,2,인간공학 및 시스템안전공학,35,"다음 중 복잡한 시스템을 설계, 가공하기 전의 구상단계에서 시스템의 근본적인 위험성을 평가하는 가장 기초적인 위험도 분석기법은?",,예비위험분석(PHA),결함수 분석법(FTA),운용 안전성 분석(OSA),고장의 형과 영향분석(FMEA),1
산업안전기사,2015,2,인간공학 및 시스템안전공학,36,다음 중 FTA에서 활용하는 최소 컷셋(Minimal cut sets)에 관한 설명으로 옳은 것은?,,해당 시스템에 대한 신뢰도를 나타낸다.,컷셋 중에 타 컷셋을 포함하고 있는 것을 배제하고 남은 컷셋들을 의미한다.,어느 고장이나 에러를 일으키지 않으면 재해가 일어나지 않는 시스템의 신뢰성이다.,기본사상이 일어나지 않을 때 정상사상(Top event)이 일어나지 않는 기본사상의 집합이다.,2
산업안전기사,2015,2,인간공학 및 시스템안전공학,37,"다음은 유해.위험방지계획서의 제출에 관한 설명이다. ( ) 안의 내용으로 옳은 것은?\\n\\n산업안전보건법령상 제출대상 사업으로 제조업의 영역 유해.위험방지계획서를 제출하려면 관련 서류를 첨부하여 해당 작업 시작 ( ㉠ ) 까지, 건설업의 경우 해당 공사의 착공 ( ㉡ ) 까지 관련 기관에 제출하여야 한다.",,"(ㄱ) : 15일 전, (ㄴ) : 전날","(ㄱ) : 15일 전, (ㄴ) : 7일 전","(ㄱ) : 7일 전, (ㄴ) : 전날","(ㄱ) : 7일 전, (ㄴ) : 3일 전",1
산업안전기사,2015,2,인간공학 및 시스템안전공학,38,다음 중 청각적 표시장치의 설계에 관한 설명으로 가장 거리가 먼 것은?,,신호를 멀리 보내고자 할 때에는 낮은 주파수를 사용하는 것이 바람직하다.,배경 소음의 주파수와 다른 주파수의 신호를 사용하는 것이 바람직하다.,신호가 장애물을 돌아가야 할 때에는 높은 주파수를 사용하는 것이 바람직하다.,경보는 청취자에게 위험 상황에 대한 정보를 제공하는 것이 바람직하다.,3
산업안전기사,2015,2,인간공학 및 시스템안전공학,39,"다음 중 시스템 안전계획(SSPP, System Safety Program Plan)에 포함되어야 할 사항으로 가장 거리가 먼 것은?",,안전조직,안전성의 평가,안전자료의 수집과 갱신,시스템의 신뢰성 분석비용,4
산업안전기사,2015,2,인간공학 및 시스템안전공학,40,다음 중 감각적으로 물리현상을 왜곡하는 지각현상에 해당하는 것은?,,주의산만,착각,피로,무관심,2
산업안전기사,2015,2,기계위험방지기술,41,다음 중 산업안전보건법령상 아세틸렌 가스용접장치에 관한 기준으로 틀린 것은?,,전용의 발생기실을 옥외에 설치한 경우에는 그 개구부를 다른 건축물로부터 1.5m 이상 떨어지도록 하여야 한다.,아세틸렌 용접장치를 사용하여 금속의 용접.용단 또는 가열작업을 하는 경우에는 게이지 압력이 127kPa을 초과하는 압력의 아세틸렌을 발생시켜 사용해서는 아니 된다.,전용의 발생기실을 설치하는 경우 벽은 불연성 재료로 하고 철근 콘크리트 또는 그 밖에 이와 동등 하거나 그 이상의 강도를 가진 구조로 하여야 한다.,"전용의 발생기실은 건물의 최상층에 위치하여야 하며, 화기를 사용하는 설비로부터 1m를 초과하는 장소에 설치하여야 한다.",4
산업안전기사,2015,2,기계위험방지기술,42,다음 중 프레스를 제외한 사출성형기(射出成形機).주형 조형기(鑄型造形機) 및 형단조기 등에 관한 안전조치 사항으로 틀린 것은?,,근로자의 신체 일부가 말려들어갈 우려가 있는 경우에는 양수조작식 방호장치를 설치하여 사용한다.,게이트가드식 방호장치를 설치할 경우에는 인터록(연동)장치를 사용하여 문을 닫지 않으면 동작되지 않는 구조로 한다.,"연 1회 이상 자체검사를 실시하고, 이상 발견 시에는 그것에 상응하는 조치를 이행하여야 한다.","기계의 히터 등의 가열부위, 감전우려가 있는 부위에는 방호덮개를 설치하여 사용한다.",3
산업안전기사,2015,2,기계위험방지기술,43,비파괴 검사 방법 중 육안으로 결함을 검출하는 시험법은?,,방사선 투과시험,와류 탐상시험,초음파 탐상시험,자분 탐상시험,4
산업안전기사,2015,2,기계위험방지기술,44,"와이어로프의 파단하중을 P(kg), 로프가닥수를 N, 안전 하중을 Q(kg)라고 할 때 다음 중 와이어로프의 안전율 S를 구하는 산식은?",,$S = NP$,$S = \\frac{QP}{N}$,$S = \\frac{NQ}{P}$,$S = \\frac{NP}{Q}$,4
산업안전기사,2015,2,기계위험방지기술,45,무부하 상태에서 지게차로 20km/h의 속도로 주행할 때 좌우 안정도는 몇 % 이내이어야 하는가?,,37%,39%,41%,43%,1
산업안전기사,2015,2,기계위험방지기술,46,선반작업 시 발생하는 칩(chip)으로 인한 재해를 예방하기 위하여 칩을 짧게 끊어지게 하는 것은?,,방진구,브레이크,칩 브레이커,덮개,3
산업안전기사,2015,2,기계위험방지기술,47,다음 중 선반의 안전장치 및 작업시 주의사항으로 잘못된 것은?,,선반의 바이트는 되도록 짧게 물린다.,방진구는 공작물의 길이가 지름의 5배 이상일 때 사용한다.,선반의 베드 위에는 공구를 올려놓지 않는다.,칩 브레이커는 바이트에 직접 설치한다.,2
산업안전기사,2015,2,기계위험방지기술,48,"완전회전식 클러치 기구가 있는 동력프레스에서 양수기동식 방호장치의 안전거리는 얼마 이상이어야 하는가? (단, 확동클러치의 봉합개소의 수는 8개, 분당 행정수는 250SPM을 가진다.)",,240mm,360mm,400mm,420mm,1
산업안전기사,2015,2,기계위험방지기술,49,동력식 수동대패에서 손이 끼지 않도록 하기 위해서 덮개 하단과 가공재를 송급하는 측의 테이블 면과의 틈새는 최대 몇 mm 이하로 조절해야 하는가?,,8mm 이하,10mm 이하,12mm 이하,15mm 이하,1
산업안전기사,2015,2,기계위험방지기술,50,산업안전보건법령에서 정한 양중기의 종류에 해당하지 않는 것은?,,크레인,도르래,곤돌라,리프트,2
산업안전기사,2015,2,기계위험방지기술,51,다음 중 연삭기의 방호대책으로 적절하지 않은 것은?,,"탁상용 연삭기의 덮개에는 워크레스트 및 조정편을 구비하여야 하며, 워크레스트는 연삭숫돌과의 간격을 3mm 이하로 조정할 수 있는 구조이어야 한다.",연삭기 덮개의 재료는 인장강도의 값(단위:MPa)에 신장도(단위:%)의 20배를 더한 값이 754.5 이상이어야 한다.,연삭숫돌을 교체한 후에는 3분 이상 시운전을 한다.,연삭숫돌의 회전속도시험은 제조 후 규정 속도의 0.5배로 안전시험을 한다.,4
산업안전기사,2015,2,기계위험방지기술,52,페일 세이프(fail safe)의 기계설계상 본질적 안전화에 대한 설명으로 틀린 것은?,,구조적 fail safe : 인간이 기계 등의 취급을 잘못해도 그것이 바로 사고나 재해와 연결되는 일이 없는 기능을 말한다.,fail-passive : 부품이 고장 나면 통상적으로 기계는 정지하는 방향으로 이동한다.,fail-active : 부품이 고장 나면 기계는 경보를 울리는 가운데 짧은 시간 동안의 운전이 가능하다.,fail-operational : 부품의 고장이 있어도 기계는 추후의 보수가 될 때까지 안전한 기능을 유지하며 이것은 병렬계통 또는 대기여분(Stand-by redundancy) 계통으로 한 것이다.,1
산업안전기사,2015,2,기계위험방지기술,53,"광전자식 방호장치의 광선에 신체의 일부가 감지된 후로부터 급정지기구가 작동개시 하기까지의 시간이 40ms이고, 광축의 설치거리가 96mm일 때 급정지기구가 작동개시한 때로부터 프레스기의 슬라이드가 정지될 때까지의 시간은 얼마인가?",,15ms,20ms,25ms,30ms,2
산업안전기사,2015,2,기계위험방지기술,54,산업안전보건기준에 관한 규칙에 따라 기계.기구 및 설비의 위험예방을 위하여 사업주는 회전축.기어.풀리 및 풀라이휠 등에 부속되는 키.핀 등의 기계요소는 어떠한 형태로 설치하여야 하는가?,,개방형,돌출형,묻힘형,고정형,3
산업안전기사,2015,2,기계위험방지기술,55,"다음 설명은 보일러의 장해 원인 중 어느 것에 해당되는가?\\n\\n보일러 수면에 용해고형분이나 수분이 발생, 증기 중에 다량 함유되어 증기의 순도를 저하시킴으로써 관내 응축수가 생겨 워터햄머의 원인이 되고 증기과 열기나 터빈 등의 고장의 원인이 된다.",,프라이밍(priming),포밍(forming),캐리오버(carry over),역화(back fire),3
산업안전기사,2015,2,기계위험방지기술,56,다음 중 설비의 진단방법에 있어 비파괴시험이나 검사에 해당하지 않는 것은?,,피로시험,음향탐상검사,방사선투과시험,초음파탐상검사,1
산업안전기사,2015,2,기계위험방지기술,57,산업안전보건법령에 따라 산업용 로봇의 작동범위에서 그 로봇에 관하여 교시 등의 작업을 할 때 작업 시작 전 점검사항이 아닌 것은?,,외부 전선의 피복 또는 외장의 손상 유무,매니퓰레이터(manipulator) 작동의 이상 유무,제동장치 및 비상정지장치의 기능,윤활유의 상태,4
산업안전기사,2015,2,기계위험방지기술,58,롤러기의 방호장치 설치 시 유의해야 할 사항으로 거리가 먼 것은?,,손으로 조작하는 급정지장치의 조작부는 롤러기의 전면 및 후면에 각각 1개씩 수평으로 설치하여야 한다.,앞면 롤러의 표면속도가 30m/min 미만인 경우 급정지 거리는 앞면 롤러 원주의 1/2.5 이하로 한다.,작업자의 복부로 조작하는 급정지장치는 높이가 밑면으로부터 0.8m 이상 1.1m 이내에 설치되어야 한다.,급정지장치의 조작부에 사용하는 줄은 사용 중 늘어져서는 안되며 충분한 인장강도를 가져야 한다.,2
산업안전기사,2015,2,기계위험방지기술,59,다음 중 가스용접토치가 과열되었을 때 가장 적절한 조치 사항은?,,아세틸렌과 산소 가스를 분출시킨 상태로 물속에서 냉각시킨다.,아세틸렌가스를 멈추고 산소 가스만을 분출시킨 상태로 물속에서 냉각시킨다.,산소 가스를 멈추고 아세틸렌가스만을 분출시킨 상태로 물속에서 냉각시킨다.,아세틸렌가스만을 분출시킨 상태로 팁 클리너를 사용하여 팁을 소제하고 공기 중에서 냉각시킨다.,2
산업안전기사,2015,2,기계위험방지기술,60,프레스 작업 중 부주의로 프레스의 페달을 밟는 것에 대비하여 페달에 설치하는 것을 무엇이라 하는가?,,클램프,로크너트,커버,스프링 와셔,3
산업안전기사,2015,2,전기위험방지기술,61,다음 ( ) 안에 들어갈 내용으로 알맞은 것은?\\n\\n과전류보호장치는 반드시 접지선외의 전로에 (    )로 연결하여 과전류 발생시 전로를 자동으로 차단하여 발 것,,직렬,병렬,임시,직병렬,1
산업안전기사,2015,2,전기위험방지기술,62,제 3종 접지공사를 시설하여야 하는 장소가 아닌 것은?(관련 규정 개정전 문제로 여기서는 기존 정답인 3번을 누르면 정답 처리됩니다. 자세한 내용은 해설을 참고하세요.),,금속몰드 배선에 사용하는 몰드,고압계기용 변압기의 2차측 전로,고압용 금속제 케이블트레이 계통의 금속트레이,400V 미만의 저압용 기계기구의 철제 및 금속제 외함,3
산업안전기사,2015,2,전기위험방지기술,63,"3300/220V, 20kVA인 3상 변압기에서 공급받고 있는 저압전선로의 절연부분 전선과 대지간의 절열저항 최소값은 약 몇 Ω 인가? (단, 변압기 저압측 1단자는 제2종 접지공사를 시행함)(2021년 KEC 규정 변경으로 인하여 접지관련 문제는 출제되지 않습니다. 여기서는 4번을 누르면 정답 처리 됩니다.)",,1240,2794,4840,8383,4
