Test Name,Year,Session,Subject,Number,Question,Question_image,Option 1,Option 2,Option 3,Option 4,Answer
산업위생관리산업기사,2014,1,산업환기,74,"주관에 45°로 분지관이 연결되어 있을 때 주관 입구와 속도압은 10mmH$_2$O로 같고, 압력손실계수는 각각 0.2와 0.28이다. 이 때 주관과 분지관의 합류로 인한 압력손실은 약 얼마인가?",,3mmH$_2$O,5mmH$_2$O,7mmH$_2$O,9mmH$_2$O,2
산업위생관리산업기사,2014,1,산업환기,75,국소배기장치의 덕트를 설계하여 설치하고자 한다. 덕트는 직경 200mm의 직관 및 곡관을 사용하도록 하였다. 이 때 마찰손실을 감소시키기 위하여 곡관부위의 새우곡관등은 최소 몇 개 이상이 가장 적당한가?,,2,3,4,5,4
산업위생관리산업기사,2014,1,산업환기,76,국소배기장치가 효과적인 기능을 발휘하기 위해서는 후드를 통해 배출되는 것과 같은 양의 공기가 외부로부터 보충되어야 한다. 이것을 무엇이라 하는가?,,테이크 오프(take off),충만실(plenum chamber),메이크업 에어(make up air),인 앤 아웃 에어(in & out air),3
산업위생관리산업기사,2014,1,산업환기,77,다음 중 신체의 열 생산과 주변 환경 사이의 열교환식(heat balance equation)과 관련이 없는 것은 무엇인가?,,대류,증발,복사,전도,4
산업위생관리산업기사,2014,1,산업환기,78,일반적으로 사용하고 있는 흡착탑 점검을 위하여 압력계를 이용하여 흡착탑 차압을 측정하고자 한다. 다음 중 차압의 측정방법과 측정 범위로 가장 적절한 것은?,O,image_2014_1_78_1,image_2014_1_78_2,image_2014_1_78_3,image_2014_1_78_4,2
산업위생관리산업기사,2014,1,산업환기,79,일반적으로 국소배기장치의 기본 설계를 위한 다음 과정 중 가장 먼저 실시하여야 하는 것은?,,제어속도 결정,반송속도 결정,후드의 크기 결정,배관의 배치와 설치장소 결정,1
산업위생관리산업기사,2014,1,산업환기,80,자유공간에 떠 있는 직경 20cm인 원형개구 후드의 개구면으로부터 20cm 떨어진 곳의 입자를 흡인하려고 한다. 제어풍속을 0.8m/s으로 할 때 필요환기량은 약 얼마인가?,,5.8m$^3$/min,10.5m$^3$/min,20.7m$^3$/min,30.4m$^3$/min,3
