Test Name,Year,Session,Subject,Number,Question,Question_image,Option 1,Option 2,Option 3,Option 4,Answer
산업안전산업기사,2009,3,건설안전기술,81,콘크리트 타설할 때 안전에 유의하여야 할 사항으로 옳지 않은 것은?,,"콘크리트를 지는 도중에는 거푸집, 지보공 등의 이상유무를 확인한다.",진동기 사용시 지나친 진동은 거푸집 도괴의 원인이 될 수 있으므로 적절히 사용해야 한다.,최상부의 슬래브는 되도록 이어붓기를 하고 어러면에 나누어 콘크리트를 다설한다.,타워에 안결되어 있는 슈트의 점속은 확실한지 확인한다.,3
산업안전산업기사,2009,3,건설안전기술,82,다음 공사구본에서 유해위험방지계획서를 제출해야 할 사업장은?,,"최대 지간길이가 40m이고 전체길이가 1,000m인 교량공사","연면적 4,000m$^2$인 종합병원 공사","연면적 3,000m$^2$인 종교시설 공사","연면적 6,000m$^2$인 지하도 상가 공사",4
산업안전산업기사,2009,3,건설안전기술,83,다음 중 흙의 동상방지 대책으로 옳지 않은 것은?,,동결되지 않는 흙으로 치환한다.,지하수위를 낮춘다.,지하수위 상승에 세립률를 쌓는다.,지반의 출를 화하약제천하하여 동결온도를 낮춘다.,3
산업안전산업기사,2009,3,건설안전기술,84,가설구조를 무저의 강석이 부족하여 가툴고 긴 무저가 알축력에 의하여 파괴되는 현상으로 옳은 것은?,,좌굴,단설변형,한계변형,횔변형,1
산업안전산업기사,2009,3,건설안전기술,85,히빙(heaving)현상은 주로 어떤 경우에 발생하는가?,,흙를 다를 경우,모래 지반에 물이 침투할 경우,연악점토 지반를 굴착할 경우,건조 흙를 굴착할 경우,3
산업안전산업기사,2009,3,건설안전기술,86,다음 중 출락재해의 발생를 위해 설치하는 시설이라고 볼 수 없는 것은?,,안전방망,방중사틀(sheet),개구부 덮개,3,4
산업안전산업기사,2009,3,건설안전기술,87,콘크리트의 종류 중 수중공사에 주로 이용되며 가루딩 조립하고 공깃가 적어 콘크리트를 그 시이에 주입하여 형석하는 콘크리트는?,,프리팩크리트,한중크리트,경량크리트,석유보강콘크리트,1
산업안전산업기사,2009,3,건설안전기술,88,구조를 해체 작업을 기계기구와 직접적으로 관계가 없는 것은?,,대형브레이커,암세기,헨드브레이커,착압기,4
산업안전산업기사,2009,3,건설안전기술,89,출락에 의한 위험방지와 관련된 다음 내용 중 ( )에 알맞은 것은?\n\n사업주는 높이 또는 깊이가 ( )미터를 초과하는 장소에서 작업를 하는 대에는 단널를 충사하는 근로자가 안전하게 승강하기 위한 갈섭율리프트 등의 설비를 설치하며야 한다.,,0.1,1.5,2,2.5,3
산업안전산업기사,2009,3,건설안전기술,90,항다기를 사용하는 경우에 도과방지를 위해 존수하여야 하는 사항으로 옳지 않은 것은?,,업역지반에 설치를 때는 각부의 침하를 방지하기 위하여 깔판·깔목 등를 사용할 것,버팀출만으로 상단부품을 안정시키는 때에는 버팀출를 2개를 하고 같은 관석에서 일면이석을 교차시볼 것,각부 또는 가다가 미관결친 우려가 있는 때에는 알등 또는 설기를 사용하여 긱부 또는 가다를 고정시볼 것,평형추를 사용하여 안정시키는 때에는 평형추의 이동을 방지하기 위하여 가대에 견고하게 부착시킬 것,2
산업안전산업기사,2009,3,건설안전기술,91,근로자의 출락 등에 의한 위험를 방지하기 위하여 안전난간를 설치할 때 준수하여야 할 기준으로 옳지 않은 것은?,,업적난간대는 경사로의 표면으로부터 90cm 이상 120cm 이하에서 설치할 것,상부난간대는 지상으의 표면으로부터 90cm 이상 120cm 이하에서 설치할 것,난간기등은 상부난간대와 중간난간대를 견고하게 때 발훔를 수 있도록 적정간격를 유지할 것,난간대는 지름 1.5cm 이상의 금속제 파이프나 그 이상의 강도를 가진 재료를 것,4
산업안전산업기사,2009,3,건설안전기술,92,압축박기 해머(hammer)중 연약지반에 적합하고 상대적으로 소음이 적은 것은?,,드롭 해머(drop hammer),디첼 해머(diesel hammer),스팀 해머(steam hammer),비이브로 해머(vibro hammer),4
산업안전산업기사,2009,3,건설안전기술,93,해제작업를 수행하기 전에 해제계획에 포함되어야 하는 사항이 아닌 것은?,,부재 손실·변형·부식 등에 관한 조사계획서,해체 작업을 기계·기구 등의 작업계획서,해체의 방법 및 해체 순서도면,해체작업을 하억류 등의 사용계획서,1
산업안전산업기사,2009,3,건설안전기술,94,다음 중 굴착면의기울기 기준으로 옳지 않은 것은?(2021년 11월 19일 개정된 규정 적용함),,통화암 - 1 : 1.0,연 암 - 1 : 1.0,정 암 - 1: 1.0,건지 - 1: 0.5 ~ 1 : 1,3
산업안전산업기사,2009,3,건설안전기술,95,아스발트 포장도로의 파세률적 또는 암석제거에 적절한 장비는?,,스크레이퍼,로울러,리퍼,드래그라인,3
산업안전산업기사,2009,3,건설안전기술,96,콘크리트 타설시 거푸집의 출압에 영향를 미치는 인자들에 대한 설명으로 옳지 않은 것은?,,습합포가 클수록 측압은 크다.,거푸집의 강석이 클수록 측압은 크다.,철근량이 알줄수록 측압은 작다.,타설 숙도가 느릴수록 측압은 크다.,4
산업안전산업기사,2009,3,건설안전기술,97,다음 중 건설업 산업안전보건관리비 계상 및 사용기준에서의 안전관리비 대성액을 의미하는 것은?,,출공자금액,직접재료비와 간접노무의 함,간접인건비와 직접노무의 함,직·간접재료비와 직접노무비의 함,4
산업안전산업기사,2009,3,건설안전기술,98,자휘게 건설기계를 사용하여 작업를 할 때 작업계획에 포함되어야 할 사항이 아닌 것은?,,사용장소는 자휘게 건설기계의 종류 및 능력,차량계 건설기계의 운행 경로,차량계 건설기계에 의한 작업방법,제동장치 및 조정장치 기능의 이상 유무,4
산업안전산업기사,2009,3,건설안전기술,99,있이어로프나 철선 등를 이용하여 상부지점에서 작업율받를 매다는 형석의 비계로서 간를 완목도장이나 장소 등의 작업에서 사용되는 비계는?,,브라켓 비계,달비계,이동식 비계,말비계,2
산업안전산업기사,2009,3,건설안전기술,100,건설현장에서 근로자가 안전하게 통행할 수 있도록 통로에 설지하는 조명의 조도 기준은?,,65 lux,75 lux,85 lux,95 lux,2
