Test Name,Year,Session,Subject,Number,Question,Question_image,Option 1,Option 2,Option 3,Option 4,Answer
산업안전산업기사,2008,3,안전관리론,1,"A 사업장의 연간근로시간수가 110만시간이고, 이 기간 중 재해가 12건 발생하여 120일의 근로손실이 발생하였다면 이 사업장의 도수율은 약 얼마인가?",,0.11,1.11,10.91,109,3
산업안전산업기사,2008,3,안전관리론,2,다음 중 무재해 운동의 이념 3원칙과 거리가 먼 것은?,,본질 원칙,공감의 원칙,참가의 원칙,선적 해결의 원칙,2
산업안전산업기사,2008,3,안전관리론,3,다음 중 하인리히의 사고연쇄발동이론(도미노 이론)에서 사고를 예방하기 위한 직접의 제거대상은 것은?,,유전적 요소,개인적 결함,사회적 환경,불안전한 행동 및 상태,4
산업안전산업기사,2008,3,안전관리론,4,허즈버그(Herzberg)의 동기·위생이론 중에서 위생요인에 해당하지 않는 것은?,,보수,책임감,작업조건,관리감독,2
산업안전산업기사,2008,3,안전관리론,5,다음 중 S-R 이론에 대한 설명으로 가장 적절한 것은?,,학습을 자극에 의한 반응으로 보는 이론,학습은 자극에 의한 무반응의 강도,학습은 유전과 환경사이의 반응,학습과 학습자로에 관한 이론,1
산업안전산업기사,2008,3,안전관리론,6,안전교육 훈련의 기법 중 하나드 학과의 5단계 교수법을 순서대로 나열한 것은?,,출결 → 연습 → 준비 → 교시 → 총평,준비 → 교시 → 연습 → 출결 → 총평,교시 → 준비 → 연습 → 총평 → 출결,총평 → 준비 → 연습 → 교시 → 출결,2
산업안전산업기사,2008,3,안전관리론,7,안전교육의 방법 중 프로그램 학습법(programmed self - instruction method)에 관한 설명으로 틀린 것은?,,개별비가 적게 들어 쉽게 적용할 수 있다.,수업의 모든 단계에서 적용이 가능하다.,한 번 개발된 프로그램 자료는 계속하기 어렵다.,수강자들이 학습이 가능한 시간대의 특이 넓다.,1
산업안전산업기사,2008,3,안전관리론,8,"어느 공장의 연간 재해율을 조사한 결과 도수율이 120이고, 강도율이 1.2 일 때 이 공장의 재해 1건당 근로손실일수는 얼미인가?",,0.01,1,10,100,4
산업안전산업기사,2008,3,안전관리론,9,다음 중 위험에지존트 기초 4R(리온드) 기법에서 2R(리온드)에 해당되는 내용은?,,사실를 파악한다.,요인를 찾아낸다.,행동계획을 정한다.,대책를 선정한다.,2
산업안전산업기사,2008,3,안전관리론,10,다음 중 리더십에 대한 설명으로 틀린 것은?,,조직원에 의하여 선출된다.,지휘의 형태는 민주주의적이다.,조직원과의 사회적 간격이 넓다.,권한의 근거는 개인의 능력에 의한다.,3
산업안전산업기사,2008,3,안전관리론,11,다음 중 기업과정에 있어 '파지(retention)'에 대한 설명으로 가장 적절한 것은?,,사물의 인상을 마음속에 간직하는 것,사물의 보존된 인상를 다시 의식으로 떠요르는 것,과거의 경험이 어떤 형태로 미래의 행동에 영향를 추는 작용,과거의 학습 경험를 통하여 학습된 행동이나 내용이 지속되는 것,4
산업안전산업기사,2008,3,안전관리론,12,안전교육의 방법 중 TWI(Trainining Within Industry for supervisor)의 교육내용에 해당하지 않는 것은?,,작업지도기법(JIT),작업개선기법(JMT),인간관계 관리기법(JRT),작업환경 개선기법(JET),4
산업안전산업기사,2008,3,안전관리론,13,재해의 발생 형태 분류 중 사람이 명면상으로 넘어졌든 경우를 무엇이라고 하는가?,,추락,충돌,전도,협착,3
산업안전산업기사,2008,3,안전관리론,14,다음 중 안전·보건표지의 색채와 사용 사례가 올바르게 연결된 것은?,,녹색 - 특성행위의 지시 및 시설의 고지,빨강 - 화학물질 취급장소에서의 유해·위험 경고,노랑 - 소화설비 및 그 장소,파랑 - 사람 또는 자물의 통행표지,2
산업안전산업기사,2008,3,안전관리론,15,"작업 중 경정, 그리 용구붙와 등에 의하여 정신를 빼앗기는 것에 해당되는 것은?",,의식의 과잉,의식의 중단,의식의 우회,의식수준의 저하,3
산업안전산업기사,2008,3,안전관리론,16,다음은 스트레스에 대한 반응 중 무엇에 해당하는가?\n\n어동생이나 남동생를 얻게 되면서 손가락를 빠는 것과 같이 어린 시절의 버릇를 나타낸다.,,투사,억압,증화,되행,4
산업안전산업기사,2008,3,안전관리론,17,다음 중 재해 발생의 원인별 분류서 물적 원인으로 볼 수 없는 것은?,,불안전한 설계,방호장치의 통호본,주변 환기의 부족,안전장치의 제거,4
산업안전산업기사,2008,3,안전관리론,18,버드(Frank Bird)의 도미노 이론를 올바르게 나열한 것은?,,기본원인 → 제어의 부족 → 직접원인 → 사고 → 상해,기본원인 → 직접원인 → 제어의 부족 → 사고 → 상해,제어의 부족 → 기본원인 → 직접원인 → 사고 → 상해,제어의 부족 → 직접원인 → 기본원인 → 상해 → 사고,3
산업안전산업기사,2008,3,안전관리론,19,매슬로우(Maslow)의 욕구 5단계 이론 중 2단계의 욕구에 해당하는 것은?,,안전 욕구,사회적 욕구,존경의 욕구,자아 실현의 욕구,1
산업안전산업기사,2008,3,안전관리론,20,다음 중 당식교육에 있어 교육의 3요소로 볼 수 없는 것은?,,주체,객체,매개체,일상,4
산업안전산업기사,2008,3,인간공학 및 시스템안전공학,21,다음 중 시스템의 신뢰도를 증가시키는 방법으로 볼 수 없는 것은?,,무통의 개선,Fail safe 설계,중복 설계,기능 우선의 목점한 설계,4
산업안전산업기사,2008,3,인간공학 및 시스템안전공학,22,다음 중 자극반응시간(reaction time)이 가장 빠른 감각은?,,시각,청각,촉각,통각,2
산업안전산업기사,2008,3,인간공학 및 시스템안전공학,23,"다음 중 산업안전보건법에 따라 상시 작업에 종사하는 장소에서 보틈작업를 하고자 할 때 작업면의 창소 조도(Lux)를 올은 것은? (단, 작업장소 측정시 측정값의 작업장소이며, 관광새로를 취급하지 않는 장소이다.)",,75,150,300,750,2
산업안전산업기사,2008,3,인간공학 및 시스템안전공학,24,제어장치의 래버를 2cm 이동시켰더니 표시장치의 지침이 8cm 이동하였다. 이 계기의 제표시비(C/D)는 얼미인가?,,0.15,0.25,0.35,0.45,2
산업안전산업기사,2008,3,인간공학 및 시스템안전공학,25,다음 중 소음을 측정하는 기본 단위에 해당하는 것은?,,지멘스(S),데시벨(dB),루멘(lumen),거스트(Gust),2
산업안전산업기사,2008,3,인간공학 및 시스템안전공학,26,다음 중 직렬 구조를 갖는 시스템의 특성으로 틀린 것은?,,요소(물체) 중 어느 하나가 고장이면 시스템도 고장이다.,요소의 수가 적을수록 시스템의 신뢰도는 높아진다.,요소의 수가 많을수록 시스템의 수명은 짧아진다.,시스템의 수명은 요소 중에서 수명이 가장 긴 것으로 정해진다.,4
산업안전산업기사,2008,3,인간공학 및 시스템안전공학,27,다음 중 시스템의 수명곡선에서 초기 고장 기간의 고장 형태로 옳은 것은?,,감소형,증가형,일정형,양족형,1
산업안전산업기사,2008,3,인간공학 및 시스템안전공학,28,출력되는 값을 정확히 읽어야 하는 경우에 가장 적합한 시각적 표시장치의 형태는?,,동침형,동목형,수식형,계수형,4
산업안전산업기사,2008,3,인간공학 및 시스템안전공학,29,다음 시스템의 안전해석 기법 중 인간의 과오(Human error)를 정량적으로 평가할 수 있는 기법은?,,THERP,PHA,FMEA,MORT,1
산업안전산업기사,2008,3,인간공학 및 시스템안전공학,30,FTA 도표에 사용되는 논리기호 중 'AND GATE'에 해당하는 것은?,O,image_2008_3_30_1,image_2008_3_30_2,image_2008_3_30_3,image_2008_3_30_4,1
산업안전산업기사,2008,3,인간공학 및 시스템안전공학,31,다음 중 인간이 현존하는 기계를 능가하는 기능은?,,예기치 못한 사건들를 감지한다.,반복적인 작업를 신뢰성 있게 수행한다.,앞으화된 정보를 신속하게 대량으로 보관한다.,일부신호에 대해 신속하고 일면성 있는 반응를 한다.,1
산업안전산업기사,2008,3,인간공학 및 시스템안전공학,32,"프레스공정에서 모든 방향으로 빛를 발하는 정광면에서 2m 떨어진 곳의 조도가 500Lux 있다면, 4m 떨어진 곳에서의 조도는 몇 Lux 인가?",,50,100,125,250,3
산업안전산업기사,2008,3,인간공학 및 시스템안전공학,33,화학설비에 대한 안전성 평가 중 정량적 평가의 항목이 아닌 것은?,,온도,공정,취급 물질,화학설비의 용량,2
산업안전산업기사,2008,3,인간공학 및 시스템안전공학,34,다음 중 조종자를 측각적으로 식별하기 위하여 암호화 할 때 사용하는 방법으로 볼 수 없는 것은?,,현상를 이용한 암호화,표면 촉감를 이용한 암호화,크기를 이용한 암호화,전기적 자극를 이용한 암호화,4
산업안전산업기사,2008,3,인간공학 및 시스템안전공학,35,"다음과 같은 FT도에서 정상사상 'A'의 발생 확률은 약 얼마인가? (단, 현 아래의 수치는 각 사상에 대한 발생확률이다.)",O,0.04,0.44,0.63,0.99,2
산업안전산업기사,2008,3,인간공학 및 시스템안전공학,36,인체 측정치의 응용원칙에서 최대치를 적용하여 반영하는 경우가 아닌 것은?,,선반의 높이,출입로의 크기,비스나 슬겨용 천석간의 거리,외이어로프의 사용 중량,1
산업안전산업기사,2008,3,인간공학 및 시스템안전공학,37,다음 중 인간의 오류모델에 있어서 실질 해석를 설묘하거나 똑표를 이해하고 착각하여 행하는 경우를 무엇이라 하는가?,,착오(Mistake),실수(Slip),건망증(Lapse),위반(Violation),1
산업안전산업기사,2008,3,인간공학 및 시스템안전공학,38,다음 중 소음에 의한 정력손실이 가장 크게 나타나는 주파수대는?,,1000,2000,4000,8000,3
산업안전산업기사,2008,3,인간공학 및 시스템안전공학,39,다음 중 산업안전보건법상 안전·보건표지의 종류와 색채가 올바르게 연결된 것은?,,"고온경고 : 바탕은 파란색, 관련 그림은 흰색","세안장치 : 바탕은 흰색, 기본 모형 및 관련 부호는 녹색","경언 : 바탕은 노랑, 기본 모형·관련 부호 및 그림은 검정","등급구호표지 : 바탕은 흰색, 기본 모형은 빨강색, 관련 부호 및 그림은 검정색",2
산업안전산업기사,2008,3,인간공학 및 시스템안전공학,40,수리하여 사용이 가능한 시스템에서 고장과 고장사이의 정상동작시간을 통적하는 용어산전를 무엇이라 하는가?,,MDT,MTBF,MTTR,MTBR,2
산업안전산업기사,2008,3,기계위험방지기술,41,"연삭숫툴의 비갈자름이 300 mm인면, 평형 플렌지의 비갈지름은 몇 mm 이상이어야 하는가?",,100 mm,150 mm,200 mm,250 mm,1
산업안전산업기사,2008,3,기계위험방지기술,42,산업안전기준에 관한 규칙 중 연삭기 안전 대책에서 연삭숫돌의 교체로 옳은 것은?,,작업시간 전 2분 이상 시운전 한다.,작업시간 전 3분 이상 시운전 한다.,연삭숫돌의 교체시 3분 이상 시운전 한다.,연삭숫돌의 교체시 5분 이상 시운전 한다.,3
산업안전산업기사,2008,3,기계위험방지기술,43,선반에서 절삭 중 창을 자동적으로 끊어 추는 바이트에 설치된 안전장치는?,,커버,박전구,보안경,힘 브레이커,4
산업안전산업기사,2008,3,기계위험방지기술,44,프레스기에서 슬라이드 행정길이가 몇 mm 이상일 때 손쳐 내기식 방호장치를 사용해야 하는가?,,10 mm,20 mm,30 mm,40 mm,3
산업안전산업기사,2008,3,기계위험방지기술,45,보일러에서 압력제한 스위치의 역할은?,,최고 사용압력과 상응압력 사이에서 보일러의 버너 연소를 자단,최고 사용압력과 상응압력 사이에서 급수펌프 작동를 제한,최고 사용압력 도달시 과열된 공기를 대기에 방출하여 압력 조절,"위험압력시 버너, 급수펌프 및 고차 수위조절 장치 등를 통제하여 일정압력 유지",1
산업안전산업기사,2008,3,기계위험방지기술,46,하역운반기계인 컨베이어의 종류로 거리가 먼 것은?,,벨트 컨베이어,체인 컨베이어,플러 컨베이어,롤러 컨베이어,4
산업안전산업기사,2008,3,기계위험방지기술,47,"양측이의 있이어로프의 안전계수는 얼마 이상으로 해야 하나? (단, 화물의 하중를 직접 지지하는 경우)",,5.0 이상,7.0 이상,9.0 이상,11.0 이상,1
산업안전산업기사,2008,3,기계위험방지기술,48,피복금속 아크용접 작업시 생기는 현란에 대한 설명 중 틀린 것은?,,스패터(spatter):용융된 금속의 작은 입자가 튀어나와 모재에 붙어있는 것,언더컷(under cut):용접면 경계부근에 Arc로 인해서 용축 파내어 홈이 생긴 것,크레이터(crater):용착금속 속에 남아있는 가스로 인한 구멍,오버랩(overlap):용축된 금속이 모재와 잘 융융되지 않고 표면에 덮어있는 상태,3
산업안전산업기사,2008,3,기계위험방지기술,49,"보일러의 안로방호장치가 2개 이상 설치된 경우, 최고사용압력 이하에서 1개가 작동되고, 다를 안로방호장치는 얼마에서 작동되도록 추칙하여야 하는가?",,최고사용압력 1.0배 이하,최고사용압력 1.1배 이하,최고사용압력 1.25배 이하,최고사용압력 1.5배 이하,1
산업안전산업기사,2008,3,기계위험방지기술,50,안전계수 5인 체인의 최대 설계응력이 1kN 이라면 이 체인이 극한 강도는 얼미인가?,,5 kN,6 kN,10 kN,12 kN,1
산업안전산업기사,2008,3,기계위험방지기술,51,"다음 중 근로자에게 위험을 미칠 우려가 있는 공작기계에서 보게, 율 등를 설치해야 하는 경우와 가장 거리가 먼 것은?",,"연삭기 또는 평삭기의 테이를, 평삭기 헤 등의 현질 끝",신반으로부터 돌출하여 회전하고 있는 가곰를 부근,물날 접촉예방장치가 설치된 완형톱(동제가공용 등은 물기계 제외) 기계의 위험부위,띠틀기계의 위험한 틀날(절단부분 제외)부위,3
산업안전산업기사,2008,3,기계위험방지기술,52,"산업안전기준에 관한 규칙에서 회전시험을 할 때, 미리 비파괴검사를 실시해야 하는 고속회전체는?",,"회전축의 중량이 1톤을 초과하고, 원주속도가 25m/s 이상인 것","회전축의 중량이 5톤을 초과하고, 원주속도가 25m/s 이상인 것","회전축의 중량이 1톤을 초과하고, 원주속도가 120m/s 이상인 것","회전축의 중량이 5톤을 초과하고, 원주속도가 120m/s 이상인 것",3
산업안전산업기사,2008,3,기계위험방지기술,53,"로울러의 말목원경의 저반 60mm의 거리에 가드를 설치하고자 할 때 가드 개구부의 간격은 얼미인가? (단, 위험점이 전동체가 아닌 경우임)",,12mm,15mm,18mm,20mm,2
산업안전산업기사,2008,3,기계위험방지기술,54,"금성자기구가 있는 안전 1랭장 프레스에서 광전자식 방호장치에서 광선이 신체의 일부가 감지된 후로부터 금성자 기구의 작동작동시기지의 시간이 40ms 이고, 금성자 기구의 작동작동량이 몇 mm 이상이면 인전거리는 몇 mm 이상이어야 하나?",,65mm,76mm,85mm,96mm,4
산업안전산업기사,2008,3,기계위험방지기술,55,목재가공용 둥근툴에 설치해야 하는 분할날의 두께는?,,"툴날 두께의 1.1배 이상이고, 툴날의 지진폭 이하이어야 한다.","툴날 두께의 1.1배 이상이고, 툴날의 지진폭 이상이어야 한다.","툴날 두께의 1.1배 이내이고, 툴날의 지진폭 이상이어야 한다.","툴날 두께의 1.1배 이내이고, 툴날의 지진폭 이하이어야 한다.",1
산업안전산업기사,2008,3,기계위험방지기술,56,"시압주기 작업장의 출입구(비상구 제외)를 설치할 때, 존수사항이 아닌 것은?",,"출입구의 위치, 수 및 크기가 작업장의 용도와 특성에 적절하다.",근로자가 업의로 열고 닫를 수 있도록 할 것,주록적이 하억운반기계용인 출입구에는 인접하여 부행자용 출입구를 설치할 것,양명개페식의 들문와 설치하여 있는 출입구에서 접촉에 의해서 근로자에게 위험를 미칠 우려가 있는 때에는 경보장치를 할 것,2
산업안전산업기사,2008,3,기계위험방지기술,57,"산업용 로봇에 접근하여 위험이 발생될 우려에 대비해서, 사용되는 방호장치로 적합하지 않은 것은?",,요인연일석,초음파 센서,안전매트,요인볼륨,4
산업안전산업기사,2008,3,기계위험방지기술,58,동력을 사용하여 중량물를 매달어 상하 및 차우(수평 또는 선회를 말한다.)로 운반하는 것를 목석으로 하는 기계는?,,크레인,리프트,곤돌라,승강기,1
산업안전산업기사,2008,3,기계위험방지기술,59,홍기(Bombe)의 도석으로 연결이 잘못된 것은?,,산소 - 청색,아세틸렌 - 황색,역화석유가스 - 회색,수소 - 주황색,1
산업안전산업기사,2008,3,기계위험방지기술,60,산업용 로봇의 교시 등의 작업 수행시 불의의 작동 또는 잘 못된 조작에 따른 위험을 방지하기 위한 조치사항으로 거리 가 먼 것은?,,작업 중 로봇의 작동 상태를 수시로 확인하기 위하여 주 변에 방책 등을 설치해서는 안된다.,"이상을 발견할 때의 조치에 대한 지침을 정하고, 그에 따라 작업을 하도록 한다.",작업 중에는 담당자 이외의 자가 로봇의 가동 스위치를 조작할 수 없도록 필요한 조치를 한다.,"로봇의 조작 방법 및 순서에 관한 지침을 정하고, 그에 따라 작업을 하도록 한다.",1
산업안전산업기사,2008,3,전기 및 화학설비위험방지기술,61,정기설비에서 제1종 접지공사는 접지저항을 몇 Ω 이하로 해야 하는가?,,5,10,50,100,2
산업안전산업기사,2008,3,전기 및 화학설비위험방지기술,62,"방폭구조 중 전폐구조를 하고 있으며, 외부의 폭발성 가스가 내부로 침입하여 내부에서 폭발하더라도 용기는 그 압력에 견디고, 내부의 표명을 안전한 가스에 화될 우려가 없도록 안틀어진 구조는?",,안전증방폭구조,본질안전방폭구조,유입방폭구조,내압방폭구조,4
산업안전산업기사,2008,3,전기 및 화학설비위험방지기술,63,"A 가스의 폭발하한계가 4.1vol%, 폭발상한계가 62vol% 일 때 이 가스의 위험도는 약 얼마인가?",,8.94,12.75,14.12,16.12,3
산업안전산업기사,2008,3,전기 및 화학설비위험방지기술,64,다음 중 폭발위험장소의 분류가 0중인 장소에서 사용할 수 있는 방폭구조는?,,안전증방폭구조,내압방폭구조,유입방폭구조,본질안전방폭구조,4
산업안전산업기사,2008,3,전기 및 화학설비위험방지기술,65,다음 중 중기순폭법에 대한 설명으로 틀린 것은?,,대기 중에 대량의 가연성 가스 및 기화하기 쉬운 가연성 액체가 누출되어 발화해에 의해 발화한다.,증기운폭발은 일촉의 가스폭발이다.,증기운폭발은 주로 배세공장에서 발생한다.,LNG가 누출될 때에도 증기운폭발를 할 수 있다.,3
산업안전산업기사,2008,3,전기 및 화학설비위험방지기술,66,다음 중 회재의 종류와 그 회재급수가 올바르게 연결된 것은?,,목재에 의한 화재 - A급 화재,전기에 의한 화재 - D급 화재,유류에 의한 화재 - C급 화재,금속에 의한 화재 - B급 화재,1
산업안전산업기사,2008,3,전기 및 화학설비위험방지기술,67,"다음 중 액체계의 과온한 상승 압력의 방출에 이용되고, 실작압력이 덮었을 때 압력상승에 비례하여 개방정도가 커지는 밸브는?",,릴리프밸브,체크밸브,안전밸브,통기밸브,1
산업안전산업기사,2008,3,전기 및 화학설비위험방지기술,68,휘발유를 저장하던 이동저장탱크에 둘러나 경유를 이동저장탱크의 발부본으로부터 주입할 때에 액표면이 주입관의 경상불부틀를 넘는 경우 그 주입배관내의 유속은 몇 m/s 이하로 하여야 하는가?,,0.5,1,1.5,2,2
산업안전산업기사,2008,3,전기 및 화학설비위험방지기술,69,다음 중 이산화탄소 및 할로겐화물 소화기의 소화약제에 대한 특징으로 틀린 것은?,,소화숙도가 빠르다.,장기기 자정이 가능하다.,주로 냉각호과에 의한 소화방식이다.,전기절연석이 커서 전기기계류의 화재에 사용된다.,3
산업안전산업기사,2008,3,전기 및 화학설비위험방지기술,70,다음 중 정압를 구분하는데 있어 고압에 해당하는 것은?(2021년 개정된 KEC 규정 적용률),,직류 500V,직류 1000V,교류 5000V,교류 8000V,3
산업안전산업기사,2008,3,전기 및 화학설비위험방지기술,71,"부피조성이 메탄 65%, 에탄 20%, 프로판 15% 인 혼합 가스의 폭발하한계는 약 얼마인가? (단, 메탄, 에탄, 프로판의 폭발하한계는 각각 5.0vol%, 3.0vol%, 2.1vol% 이다.)",,2.63,3.73,4.83,5.93,2
산업안전산업기사,2008,3,전기 및 화학설비위험방지기술,72,다음 중 연소의 3요소가 아닌 것은?,,연쇄반응,정화원,산소공급원,가연물,1
산업안전산업기사,2008,3,전기 및 화학설비위험방지기술,73,다음 중 정전기 발생의 방지대책이 아닌 것은?,,설비에 대전 방지재를 사용한다.,설비 주위의 공기를 가습한다.,배관내 액체의 유속를 재한한다.,설비의 주변에 자외선를 조사한다.,4
산업안전산업기사,2008,3,전기 및 화학설비위험방지기술,74,기계·기구의 철대 및 외함의 접지공사 충방이 훨게 연결된 것은?,,400V 미만인 자압률의 것 - 제1종 접지공사,400V 이상의 자압률의 것 - 제2종 접지공사,고압율의 것 - 제3종 접지공사,특별고압율의 것 - 제1종 접지공사,4
산업안전산업기사,2008,3,전기 및 화학설비위험방지기술,75,산업안전보건법상 대지전압이 150V를 초과하는 이동형의 전기가계·기구를 건조한 쟁소에서 25A 인 곳에 전측 되이 하는 누전차단기의 작동시간으로 옳은 것은?,,0.01초 이내,0.03초 이내,0.05초 이내,0.1초 이내,2
산업안전산업기사,2008,3,전기 및 화학설비위험방지기술,76,"초석이라고도 부르기도 하며, 촉석화와의 주원료로 사용 되는 선쇄과 물정호 화기가 좋은 냉색스에 보관해야 할 물질은?",,질산칼륨,질산나트륨,질산암요늄,과염소산나트륨,1
산업안전산업기사,2008,3,전기 및 화학설비위험방지기술,77,강전사고시 인체에 영향를 추는 상실세동전류와 통전시간의 관계를 올바르게 설명한 것은?,,실심세동전류는 통전시간에 따라 달라지며 비례한다.,실심세동전류는 통전시간의 재곱에 비례한다.,실심세동전류는 통전시간의 정비례한다.,실심세동전류는 통전시간의 세제곱에 비례한다.,1
산업안전산업기사,2008,3,전기 및 화학설비위험방지기술,78,다음 중 고체물질의 연소 종류가 아닌 것은?,,표면연소,증발연소,자기연소,확산연소,4
산업안전산업기사,2008,3,전기 및 화학설비위험방지기술,79,다음 중 글로우 코로나(Glow Corona)에 대한 설명으로 틀린 것은?,,연압이 2000V 정도에 도달하면 코로나가 발생하는 전극의 끝단에 자색의 광막이 나타난다.,"회로에 액인한 전류계가 삽입되어 있으면, 수 ㎂정도의 전류가 흐르는 것를 알지할 수 있다.",전압를 상승시키던 전류도 접차로 증가하여 스파크 방전에 의해 전극간이 교락된다.,GlowCorona는 습도에 의하여 큰 영향를 받는다.,4
산업안전산업기사,2008,3,전기 및 화학설비위험방지기술,80,다음 중 산업안전보건법에 따라 위험물질의 출류를 분류할 때 잘못 분류한 것은?,,"폭발한계농도의 하한이 20%이며, 상한과 하한의 차가 10%인 가스는 가연성 가스이다.",대기압에서 인화점이 45°C 인 기연성 액체는 인화성 물질이다.,농도가 25% 인 황산은 부식성 물질이다.,취에 대한 결구투여 실험시 LD$_{50}$ 이 100mg/kg인 물질은 독성 물질이다.,1
산업안전산업기사,2008,3,건설안전기술,81,강관비계의 1스팬(span)에 걸리는 최대 적재하중은 몇 kg을 초과하지 않아야 하는가?,,200kg,300kg,400kg,500kg,3
산업안전산업기사,2008,3,건설안전기술,82,건설현장 전기계해 중 간접접촉에 대한 방지대책이 아닌 것은?,,보호철연,안전전압 이하의 전기기기 사용,보호접지,출전부에 방호앙 또는 절연덮개 설치,4
