Test Name,Year,Session,Subject,Number,Question,Question_image,Option 1,Option 2,Option 3,Option 4,Answer
산업위생관리기사,2008,1,물리적유해인자관리,70,1 촉광의 광원으로부터 한 단위 입체작으로 나가는 광속의 단위를 무엇이라 하는가?,,룩스(Lux),램버트(Lambert),캔들(Candle),루멘(Lumen),4
산업위생관리기사,2008,1,물리적유해인자관리,71,다음 중 마이크로파의 생체작용과 가장 거리가 먼 것은?,,체표면은 조기에 온감을 느낀다.,"중추신경에 대해서는 300~1,200MHz 의 주파수 범위에서 가장 민감하다.","500～1,000Hz의 마이크로파는 백내장을 일으킨다.","백혈구의 증가, 혈소판의 감소 등을 나타낸다.",3
산업위생관리기사,2008,1,물리적유해인자관리,72,전리방사선의 흡수선량이 생체에 영향을 주는 정도로 표시하는 선당량(생체실효선량)의 단위는?,,R,Ci,Sv,Gy,3
산업위생관리기사,2008,1,물리적유해인자관리,73,"음의 크기 sone 과 음의 크기레벨 phon 과의 관계를 올바르게 나타낸 것은? (단, sone는 S, phon 은 L로 표현한다.)",,S=2$^{(L-40)/10}$,S=3$^{(L-40)/10}$,S=4$^{(L-40)/10}$,S=5$^{(L-40)/10}$,1
산업위생관리기사,2008,1,물리적유해인자관리,74,다음 중 피부 투과력이 가장 큰 것은?,,적외선,α선,β선,X선,4
산업위생관리기사,2008,1,물리적유해인자관리,75,다음 중 레이저(LASER)에 감수성이 가장 큰 신체부위는?,,대뇌,눈,갑상선,혈액,2
산업위생관리기사,2008,1,물리적유해인자관리,76,다음 중 저압환경에서의 생체작용에 관한 내용을 틀린 것은?,,"고공증상으로 항공치통, 항공이염 등이 있다.",고공성 폐수종은 어른보다 아이들에게서 많이 발생한다.,급성고산병의 가장 특정적인 것은 흥분성이다.,급성고산병의 비가역적이다.,4
산업위생관리기사,2008,1,물리적유해인자관리,77,실효복사(effective radiation)온도의 의미로 가장 적절한 것은?,,건구온도와 습구온도의 차,습구온도와 흑구온도의 차,습구온도와 복구온도의 차,흑구온도와 기온의 차,4
산업위생관리기사,2008,1,물리적유해인자관리,78,소음계(Sound Level meter)로 소음측정시 A 및 C 특성으로 측정하였다. 만약 C 특성으로 측정한 값이 A특성으로 측정한 값보다 휠씬 크다면 소음의 주파수영역은 어떻게 추정이 되겠는가?,,저주파수가 주성분이다.,중주파수가 주성분이다.,고주파수가 주성분이다.,중 및 고주파수가 주성분이다.,1
산업위생관리기사,2008,1,물리적유해인자관리,79,"고열로 인한 건강장해로 발한에 의한 체열방출이 장해됨으로써 체내에 열이 축적되어 발생하며 1차적인 증상으로 정신착란, 의식결여, 경련 또는 혼수, 건조하고 높은 피부온도, 체온상승(직장 온도 41℃) 등이 나타나는 열중증의 명칭은?",,열허탈(heat collapse),열경련(heat cramps),열사병(heat stroke),열소모(heat exhaustion),3
산업위생관리기사,2008,1,물리적유해인자관리,80,다음 중 전신진동에 의한 건강장해의 설명으로 틀린 것은?,,진동수 3Hz 이하이면 신체가 함께 움직여 motion sickness 와 같은 동요감을 느낀다.,진동수 4~12Hz에서 압박감과 동틍감을 받게 된다.,진동수 20~30Hz에서는 시력 및 청력장애가 나타나기 시작한다.,진동수 60~90Hz에서는 두개골이 공명하기 시작하여 안구가 공명한다.,4
산업위생관리기사,2008,1,산업독성학,81,화학물질의 상호작용인 길항작용 중 배분적 길항작용에 대하여 가장 적절히 설명한 것은?,,두 물질이 생체에서 서로 반대되는 생리적 기능을 갖는 관계로 동시에 투여한 경우 독성이 상쇄 또는 감소되는 경우,두 물질을 동시에 투여한 경우 상호반응에 의하여 독성이 감소되는 경우,"독성물질의 생체과정인 흡수, 분포, 생전환, 배설등의 변화를 일으켜 독성이 낮아지는 경우",두 물질이 생체내에서 같은 수용체에 결합하는 관계로 인하여 동시 투여시 경쟁관례로 인하여 독성이 감소되는 경우,3
산업위생관리기사,2008,1,산업독성학,82,다음 중 유기분진에 의한 진폐증에 해당하는 것은?,,석면폐증,규폐증,면페증,활석폐증,3
산업위생관리기사,2008,1,산업독성학,83,다음 중 비소에 대한 설명으로 틀린 것은?,,5가보다는 3가의 비소화합물이 독성이 강하다.,장기간 노출시 치아산식증을 일으킨다.,급성중독은 용혈성 빈혈을 일으킨다.,분말은 피부 또는 점막에 작용하여 염증 또는 궤양을 일으킨다.,2
산업위생관리기사,2008,1,산업독성학,84,방향족 탄화수소 중 저농도에 장기간 노출되어 만성중독을 일으키는 경우에 가장 위험하다고 할 수 있는 유기용제는?,,벤젠,톨루엔,클로로포름,사염화탄소,1
산업위생관리기사,2008,1,산업독성학,85,국제암연구위원회(IARC)의 발암물질 구분 기준에서 인체 발암성 가능물질(Group 2B)의 종류에 해당되는 물질은?,,벤젠,카드뮴,카페인,클로로포름,4
산업위생관리기사,2008,1,산업독성학,86,다음 중 납중독의 임상증상과 가장 거리가 먼 것은?,,위장장해,신경 및 근육계통의 장해,호흡기 계통의 장해,중추신경장해,3
산업위생관리기사,2008,1,산업독성학,87,카드뮴에 노출되었을 때 체내의 주된 축적 기관은?,,"간, 신장, 장관벽","심장, 뇌, 비장","뼈, 피부, 근육","혈액, 신경, 모발",1
산업위생관리기사,2008,1,산업독성학,88,다음 중 크롬에 급성중독의 특징으로 가장 알맞은 것은?,,혈액장해,신장장해,피부습진,중추신경장해,2
산업위생관리기사,2008,1,산업독성학,89,다음 중 직업성 피부염을 평가할 때 실시하는 가장 중요한 임상시험은?,,생체시험(in vivo test),실험생체시험(in vitro test),첩포시험(patch test),에임즈시험(ames assey),3
산업위생관리기사,2008,1,산업독성학,90,다음 중 벤젠의 생물학적 노출지표로 이용되는 주 대사산물은?,,마뇨산,메틸마뇨산,페놀,삼수산화벤젠,3
산업위생관리기사,2008,1,산업독성학,91,화학물질의 생리적 작용에 의한 분류에서 종말기관지 및 폐포점막 자극제에 해당되는 유해가스는?,,불화수소,염화수소,아황산가스,이산화질소,4
산업위생관리기사,2008,1,산업독성학,92,상대적 독성(수치는 독성의 크기)이 '2＋0→10'의 형태로 나타나는 화학적 상호작용은?,,상가작용(additive),가승작용(potenriation),상쇄작용(antagonism),상승작용(synergistic),2
산업위생관리기사,2008,1,산업독성학,93,다음 중 카드뮴의 만성중독 증상에 해당하지 않는 것은?,,신장기능장해,폐기능장해,골격계 장해,중추신경장해,4
산업위생관리기사,2008,1,산업독성학,94,유해물질의 경구투여용량에 따른 반응범위를 결정하는 독성검사에서 얻은 용량-반응 곡선(dose-response curve)에서 실험동물군의 50%가 일정시간 동안 죽는 치사량을 나타내는 것은?,,LC$_{50}$,LD$_{50}$,ED$_{50}$,TD$_{50}$,2
산업위생관리기사,2008,1,산업독성학,95,다음 중 수은중독 증상으로만 나열된 것은?,,"비중격천공, 인두염","구내염, 근육진전","급성뇌증, 신근쇠약","단백뇨, 칼슘대사 장애",2
산업위생관리기사,2008,1,산업독성학,96,"구리의 독성에 대한 인체실험 결과 안전흡수량이 체중 kg당 0.009mg 이었다. 1일 8시간 작업시의 허용 농도는 약 몇 mg/m$^3$ 인가? (단, 근로자의 평균 체중은 70kg, 작업시의 폐환기율은 1.45m$^3$/h 로 가정한다.)",,0.035,0.048,0.056,0.064,2
산업위생관리기사,2008,1,산업독성학,97,'니트로벤젠'의 화학물질의 영향에 대한 생물학적 모니터링 대상으로 옳은 것은?,,혈액에서의 메타헤모글로빈,요에서의 마노산,요에서의 저분자량 단백질,적혈구에서의 ZPP,1
산업위생관리기사,2008,1,산업독성학,98,다음 중 생물학적 모니터링을 위한 시료가 아닌 것은?,,공기 중 유해인자,혈액 중의 유해인자나 대사산물,요 중의 유해인자나 대사산물,호기(Exhales Air) 중의 유해인자나 대사산물,1
산업위생관리기사,2008,1,산업독성학,99,다음 중 중추신경 억제작용이 가장 큰 것은?,,알칸,알코올,에테르,에스테르,1
산업위생관리기사,2008,1,산업독성학,100,다음 중 위험도를 나타내는 지표가 아닌 것은?,,발생률,상대위험비,기여위험비,교차비,1
