Test Name,Year,Session,Subject,Number,Question,Question_image,Option 1,Option 2,Option 3,Option 4,Answer
산업안전기사,2012,3,안전관리론,1,안전인증대상 보호구 중 안전모의 시험성능기준 항목이 아닌 것은?,,내수성,턱끈풀림,가연성,충격흡수성,3
산업안전기사,2012,3,안전관리론,2,학습지도의 형태 중 참가자에게 일정한 역할을 주어 실제적으로 연기를 시켜봄으로써 자기의 역할을 보다 확실히 인식시키는 방법은?,,포럼(forum),심포지엄(symposium),롤 플레잉(role playing),케이스 메소드(case method),3
산업안전기사,2012,3,안전관리론,3,다음 중 안전점검보고서에 수록될 주요 내용으로 적절하지 않은 것은?,,작업현장의 현 배치 상태와 문제점,안전교육 실시 현황 및 추진 방향,안전관리 스텝의 인적사항,안전방침과 중점개선 계획,3
산업안전기사,2012,3,안전관리론,4,다음 중 산업재해 발생시 조치 순서로 가장 적절한 것은?,,긴급처리 → 재해조사 → 원인결정 → 대책수립 → 실시계획 → 실시 → 평가,긴급처리 → 원인결정 → 재해조사 → 대책수립 → 실시 → 평가,긴급처리 → 재해조사 → 원인결정 → 실시계획 → 실시 → 대책수립 → 평가,긴급처리 → 실시계획 → 재해조사 → 대책수립 → 평가 → 실시,1
산업안전기사,2012,3,안전관리론,5,다음 중 산업안전보건법상 사업주가 안전·보건조치의무를 이행하지 아니하여 발생한 중대재해가 연간 2건이 발생 하였을 경우 조치하여야 하는 사항에 해당하는 것은?(관련 규정 개정전 문제로 여기서는 기존 정답인 2번을 누르면 정답 처리됩니다. 자세한 내용은 해설을 참고하세요.),,보건관리자 선임,안전보건개선계획의 수립,안전관리자의 증원,물질안전보건자료의 작성,2
산업안전기사,2012,3,안전관리론,6,산업안전보건법에 따라 안전보건개선계획의 수립·시정 명령을 받은 사업주는 고용노동부장관이 정하는 바에 따라 안전보건개선계획서를 작성하여 그 명령을 받은 날부터 몇 일 이내에 관할 지방고용노동관서의 장에게 제출하여야 하는가?,,15일,30일,45일,60일,4
산업안전기사,2012,3,안전관리론,7,불안전한 행동을 예방하기 위하여 수정해야 할 조건 중 시간의 소요가 짧은 것부터 장시간 소요되는 순서대로 올바르게 연결된 것은?,,집단행동 - 개인행위 - 지식 - 태도,지식 - 태도 - 개인행위 - 집단행위,태도 - 지식 - 집단행위 - 개인행위,개인행위 - 태도 - 지식 - 집단행위,2
산업안전기사,2012,3,안전관리론,8,다음 중 무재해운동 기본이념(3원칙)에 해당하지 않는 것은?,,무의 원칙,선취의 원칙,참가의 원칙,최고경영자의 경영 원칙,4
산업안전기사,2012,3,안전관리론,9,다음 중 브레인스토밍(Brain-storming) 기법의 4원칙에 관한 설명으로 옳은 것은?,,주제와 관련이 없는 내용은 발표할 수 없다.,동료의 의견에 대하여 좋고 나쁨을 평가한다.,"발표순서를 정하고, 동일한 발표기회를 부여한다.",타인의 의견에 대하여는 수정하여 발표할 수 있다,4
산업안전기사,2012,3,안전관리론,10,다음 중 인간관계 관리기법에 있어 구성원 상호간의 선호도를 기초로 집단 내부의 동태적 상호관계를 분석하는 방법으로 가장 적절한 것은?,,소시오매트리(sociometry),그리드 훈련(grid training),집단역할(group dynamic),감수성 훈련(sensitivity training),1
산업안전기사,2012,3,안전관리론,11,다음 중 학습의 전개단계에서 주제를 논리적으로 체계화함에 있어 적용하는 방법으로 적절하지 않은 것은?,,적게 사용하는 것에서 많이 사용하는 것으로,미리 알려져 있는 것에서 미지의 것으로,전체적인 것에서 부분적인 것으로,간단한 것에서 복잡한 것으로,1
산업안전기사,2012,3,안전관리론,12,다음 중 피로검사 방법에 있어 심리적인 방법의 검사 항목에 해당하는 것은?,,호흡순환기능,연속반응시간,대뇌피질 활동,혈색소 농도,2
산업안전기사,2012,3,안전관리론,13,"A 사업장의 강도율이 2.5이고, 연간 재해발생건수가 12건, 연간총근로시간수가 120만 시간일 때 이 사업장의 종합 재해지수는 약 얼마인가?",,1.6,5,27.6,230,2
산업안전기사,2012,3,안전관리론,14,다음 중 상황성 누발자의 재해유발원인에 해당하는 것은?,,주의력 산만,저지능,설비의 결함,도덕성 결여,3
산업안전기사,2012,3,안전관리론,15,다음 중 'Near Accident'에 관한 내용으로 가장 적절한 것은?,,사고가 일어난 인접지역,사망사고가 발생한 중대재해,사고가 일어난 지점에 계속 사고가 발생하는 지역,사고가 일어나더라도 손실을 전혀 수반하지 않는 재해,4
산업안전기사,2012,3,안전관리론,16,기업내 정형교육 중 TWI(Training Within Industry)의 교육 내용과 가장 거리가 먼 것은?,,Job Standardization Training,Job Instruction Training,Job Method Training,Job Relation Training,1
산업안전기사,2012,3,안전관리론,17,"다음 중 산업안전보건법상 사업내 안전.보건교육에 있어 근로자 정기안전.보건교육의 내용이 아닌 것은? (단, 산업안전보건법 및 일반관리에 관한 사항은 제외한다.)",,표준안전작업방법 및 지도 요령에 관한 사항,산업보건 및 직업병 예방에 관한 사항,유해.위험 작업환경 관리에 관한 사항,건강증진 및 질병 예방에 관한 사항,1
산업안전기사,2012,3,안전관리론,18,다음 중 재해코스트 산출에 있어 직접비에 해당하지 않은 것은?,,장례비,요양비,장해 보상비,설비의 수리비 및 손실비,4
산업안전기사,2012,3,안전관리론,19,다음 중 안전교육의 기본방향으로 가장 적합하지 않은 것은?,,안전작업을 위한 교육,사고사례중심의 안전교육,생산활동 개선을 위한 교육,안전의식 향상을 위한 교육,3
산업안전기사,2012,3,안전관리론,20,"산업안전보건법상 안전.보건표지의 종류 중 바탕은 파란색, 관련 그림은 흰색을 사용하는 표지는?",,사용금지,세안장치,몸균형상실경고,안전복착용,4
산업안전기사,2012,3,인간공학 및 시스템안전공학,21,다음 중 시스템의 수명 및 신뢰성에 관한 설명으로 틀린 것은?,,수리가 가능한 시스템의 평균 수명은 평균 고장율(MTBF)과 비례관계가 성립한다.,직렬시스템을 구성하는 부품들 중에서 최소 수명을 갖는 부품에 의해 시스템의 수명이 정해진다.,리던던시 설계와 디레이팅을 시스템 설계 기술로 적용하면 시스템 고유의 신뢰성을 증가시킬 수 있다.,수리가 불가능한 n개의 구성요소가 병렬구조를 갖는 설비는 중복도(n-1)가 늘어날수록 수명이 길어진다.,1
산업안전기사,2012,3,인간공학 및 시스템안전공학,22,다음 중 근력에 영향을 주는 요인을 가장 관계가 적은 것은?,,식성,동기,성별,훈련,1
산업안전기사,2012,3,인간공학 및 시스템안전공학,23,중복사상이 있는 FT(Fault Tree)에서 모든 컷셋(cut set)을 구한 경우에 최소 컷셋(minimal cut set)으로 옳은 것은?,,모든 컷셋이 바로 최소 컷셋이다.,모든 컷셋에서 중복되는 컷셋만이 최소 컷셋이다.,최소 컷셋은 시스템의 고장을 방지하는 기본 고장들의 집합이다.,중복되는 사상의 컷셋 중 다른 컷셋에 포함되는 셋을 제거한 컷셋과 중복되지 않는 사상의 컷셋을 합한 것이 최소 컷셋이다.,4
산업안전기사,2012,3,인간공학 및 시스템안전공학,24,"다음 설명에서 해당하는 용어를 올바르게 나타낸 것은?\n\n㉠ : 요구된 기능을 실행하고자 하여도\n필요한 물건, 정보, 에너지 등의 공급이 없기 때\n문에 작업자가 움직이려고 해도 움직일\n수 없으므로 발생하는 과오\n\n㉡ : 작업자 자신으로부터 발생한 과오",,(ㄱ) : Secondary Error (ㄴ) : Command Error,(ㄱ) : Command Error (ㄴ) : Primary Error,(ㄱ) : Primary Error (ㄴ) : Secondary Error,(ㄱ) : Command Error (ㄴ) : Secondary Error,2
산업안전기사,2012,3,인간공학 및 시스템안전공학,25,시스템 안전 프로그램에 대하여 안전 점검 기준에 따른 평가를 내리는 시점은 시스템의 수명주기 중 어느 단계 인가?,,구상단계,설계단계,생산단계,운전단계,4
산업안전기사,2012,3,인간공학 및 시스템안전공학,26,자동생산시스템에서 3가지 고장 유형에 따라 각기 다른색의 신호등에 불이 들어오고 운전원은 색에 따라 다른 조종 장치를 조작하도록 하려고 한다. 이 때 운전원이 신호를 보고 어떤 장치를 조작해야 할지를 결정하기까지 걸리는 시간을 예측하기 위해서 사용할 수 있는 이론은?,,웨버(Weber) 법칙,피츠(Fitts) 법칙,힉-하이만(Hick-Hyman) 법칙,학습효과(learning effect) 법칙,3
산업안전기사,2012,3,인간공학 및 시스템안전공학,27,다음 중 인간-기계 체제(Man-machine system)의 연구 목적으로 가장 적절한 것은?,,정보 저장의 극대화,운전시 피로의 극소화,시스템의 신뢰성 극대화,안전을 극대화시키고 생산능률을 향상,4
산업안전기사,2012,3,인간공학 및 시스템안전공학,28,다음 중 촉감의 일반적인 척도의 하나인 2점 문턱값(two-point threshold)이 감소하는 순서대로 나열된 것은?,,손바닥 → 손가락 → 손가락 끝,손가락 → 손바닥 → 손가락 끝,손가락 끝 → 손가락 → 손바닥,손가락 끝 → 손바닥 → 손가락,1
산업안전기사,2012,3,인간공학 및 시스템안전공학,29,다음 중 중추신경계 피로(정신 피로)의 척도로 사용할 수 있는 시각적 점멸융합주파수(VFF)를 측정할 때 영향을 주는 변수에 관한 설명으로 틀린 것은?,,휘도만 같다면 색상은 영향을 주지 않는다.,표적과 주변의 휘도가 같을 때 최대가 된다.,조명 강도의 대수치에 선형적으로 반비례한다.,사람들 간에는 큰 차이가 있으나 개인의 경우 일관성이 있다.,3
산업안전기사,2012,3,인간공학 및 시스템안전공학,30,다음 중 표시장치에 나타나는 값들이 계속적으로 변하는 경우에는 부적합하며 인접한 눈금에 대한 지침의 위치를 파악할 필요가 없는 경우의 표시장치 형태로 가장 적합한 것은?,,정목 동침형,정침 동목형,동목 동침형,계수형,4
산업안전기사,2012,3,인간공학 및 시스템안전공학,31,다음 [표]는 불꽃놀이용 화학물질취급설비에 대한 정량적 평가이다. 해당 항목에 대한 위험등급이 올바르게 연결된 것은?\n\n| 항목 | A (10점) | B (5점) | C (2점) | D (0점) |\n| --- | --- | --- | --- | --- |\n| 취급물질 | O | O | O |  |\n| 조작 |  | O |  | O |\n| 화학설비의 용량 | O |  | O |  |\n| 온도 | O | O |  |  |\n| 압력 |  | O | O | O |,,"취급물질-Ⅰ등급, 화학설비의 용량-Ⅰ등급","온도-Ⅰ등급, 화학설비의 용량-Ⅱ등급","취급물질-Ⅰ등급, 조작-Ⅳ등급","온도-Ⅱ등급, 압력-Ⅲ등급",4
산업안전기사,2012,3,인간공학 및 시스템안전공학,32,"프레스기의 안전장치 수명은 지수분포를 따르며, 평균 수명은 100시간이다. 새로 구입한 안전장치가 향후 50시간 동안 고장 없이 작동할 확률(A)과 이미 100시간을 사용한 안전장치가 향후 50시간 이상 견딜 확률(B)은 각각 얼마인가?",,"A : 0.606, B : 0.606","A : 0.990, B : 0.606","A : 0.990, B : 0.951","A : 0.951, B : 0.606",1
산업안전기사,2012,3,인간공학 및 시스템안전공학,33,"남성 작업자가 티셔츠(0.09 clo), 속옷(0.05 clo), 가벼운 바지(0.26 clo), 양말(0.04 clo), 신발(0.04 clo)을 착용하고 있을 때 총보온율(clo)값은 얼마인가?",,0.26,0.48,1.184,1.28,2
산업안전기사,2012,3,인간공학 및 시스템안전공학,34,다음 중 소음에 의한 청력손실이 가장 크게 나타나는 주파수대는?,,2000Hz,4000Hz,10000Hz,20000Hz,2
산업안전기사,2012,3,인간공학 및 시스템안전공학,35,다음 중 부울대수의 관계식으로 틀린 것은?,,$A + AB = A$,$A(A + B) = A + B$,$A + \\overline{A}B = A + B$,$A + \\overline{A} = 1$,2
산업안전기사,2012,3,인간공학 및 시스템안전공학,36,다음 중 동작경제의 원칙으로 틀린 것은?,,가능한 한 관성을 이용하여 작업을 한다.,공구의 기능을 결합하여 사용하도록 한다.,휴식시간을 제외하고는 양손이 같이 쉬도록 한다.,작업자가 작업 중에 자세를 변경할 수 있도록 한다.,3
산업안전기사,2012,3,인간공학 및 시스템안전공학,37,산업안전보건법에 따라 유해위험방지계획서의 제출대상 사업은 해당 사업으로서 전기 계약용량이 얼마 이상인 사업을 말하는가?,,150kW,200kW,300kW,500kW,3
산업안전기사,2012,3,인간공학 및 시스템안전공학,38,[그림]과 같이 FTA로 분석된 시스템에서 현재 모든 기본 사상에 대한 부품이 고장난 상태이다. 부품 X1 부터 부품 X5 까지 순서대로 복구한다면 어느 부품을 수리 완료하는 순간부터 시스템은 정상가동이 되겠는가?,O,X$_1$,X$_2$,X$_3$,X$_4$,3
산업안전기사,2012,3,인간공학 및 시스템안전공학,39,"다음 중 복잡한 시스템을 설계, 가동하기 전의 구상단계에서 시스템의 근본적인 위험성을 평가하는 가장 기초적인 위험도 분석 기법은?",,예비위험분석(PHA),결함수분석법(FTA),고장형태와 영향분석(FMEA),운용안전성분석(OSA),1
산업안전기사,2012,3,인간공학 및 시스템안전공학,40,다음 중 인식과 자극의 정보처리 과정에서 3단계에 속하지 않는 것은?,,인지단계,반응단계,행동단계,인식단계,2
산업안전기사,2012,3,기계위험방지기술,41,"프레스기의 금형을 부착.해체 또는 조정하는 작업을 할 때, 근로자의 신체의 일부가 위험한계에 들어갈 때에 슬라이드가 갑자기 작동함으로써 발생하는 근로자의 위험을 방지하기 위해 사용해야 하는 것은?",,방호울,안전블록,시건장치,날접촉예방장치,2
산업안전기사,2012,3,기계위험방지기술,42,금형의 안전화에 관한 설명으로 옳지 않은 것은?,,금형을 설치하는 프레스의 T홈 안길이는 설치 볼트 직경의 2배 이상으로 한다.,"맞춤 핀을 사용할 때에는 헐거움 끼워맞춤으로 하고, 이를 하형에 사용할 때에는 낙하방지의 대책을 세워 둔다.",금형의 사이에 신체 일부가 들어가지 않도록 이동 스리퍼와 다이의 간격은 8mm 이하로 한다.,대형 금형에서 싱크가 헐거워짐이 예상될 경우 싱크만으로 상형을 슬라이드에 설치하는 것을 피하고 볼트를 사용하여 조인다.,2
산업안전기사,2012,3,기계위험방지기술,43,컨베이어(conveyor) 역전방지장치의 형식을 기계식과 전기식으로 구분할 때 기계식에 해당하지 않는 것은?,,라쳇식,밴드식,스러스트식,롤러식,3
산업안전기사,2012,3,기계위험방지기술,44,다음 중 원심기의 안전에 관한 설명으로 적절하지 않은 것은?,,원심기에는 덮개를 설치하여야 한다.,"원심기로부터 내용물을 꺼내거나 원심기의 정비, 청소, 검사, 수리작업을 하는 때에는 운전을 정지 시켜야 한다.",원심기의 최고사용회전수를 초과하여 사용하여서는 아니 된다.,원심기에 과압으로 인한 폭발을 방지하기 위하여 압력방출장치를 설치하여야 한다.,4
산업안전기사,2012,3,기계위험방지기술,45,원통의 내면을 선반으로 절삭시 안전상 주의할 점으로 옳은 것은?,,공작물이 회전 중에 치수를 측정한다.,절삭유가 튀므로 면장갑을 착용한다.,절삭바이트는 공구대에서 길게 나오도록 설치한다.,보안경을 착용하고 작업한다.,4
산업안전기사,2012,3,기계위험방지기술,46,산업안전보건법령상 롤러기에 사용하는 급정지장치 중 작업자의 무릎으로 조작하는 것의 위치로 옳은 것은?,,밑면에서 0.2m 이상 0.4m 이내,밑면에서 0.4m 이상 0.6m 이내,밑면에서 0.8m 이상 1.1m 이내,밑면에서 1.8m 이내,2
산업안전기사,2012,3,기계위험방지기술,47,"기계설비 안전화를 외형의 안전화, 기능의 안전화, 구조의 안전화로 구분할 때 다음 중 구조의 안전화에 해당하는 것은?",,"가공 중에 발생한 예리한 모서리, 버(Burr) 등을 연삭기로 라운딩",기계의 오동작을 방지하도록 자동제어장치 구성,이상발생시 기계를 급정지시킬 수 있도록 동력 차단 장치를 부착하는 조치,열처리를 통하여 기계의 강도와 인성을 향상,4
산업안전기사,2012,3,기계위험방지기술,48,다음 중 비파괴 시험의 종류에 해당하지 않는 것은?,,와류 탐상시험,초음파 탐상시험,인장 시험,방사선 투과시험,3
산업안전기사,2012,3,기계위험방지기술,49,다음 중 컨베이어의 종류가 아닌 것은?,,체인 컨베이어,롤러 컨베이어,스크류 컨베이어,그리드 컨베이어,4
산업안전기사,2012,3,기계위험방지기술,50,프레스 방호장치의 성능 기준에 대한 설명 중 잘못된 것은?,,양수 조작식 방호장치에서 누름버튼의 상호간 내측거리는 300mm 이상으로 한다.,수인식 방호장치는 120SPM 이하의 프레스에 적합하다.,양수 조작식 방호장치는 1행정 1정지기구를 갖춘 프레스 장치에 적합하다.,수인식 방호장치에서 수인끈의 재료는 합성섬유로 직경이 2mm 이상이어야 한다.,4
산업안전기사,2012,3,기계위험방지기술,51,안전율을 구하는 방법으로 옳은 것은?,,안전율 = 허용응력 / 기초강도,안전율 = 허용응력 / 인장강도,안전율 = 인장강도 / 허용응력,안전율 = 안전하중 / 파단하중,3
산업안전기사,2012,3,기계위험방지기술,52,"크레인의 로프에 질량 2000kg의 물건을 10m/s$^2$의 가속도로 감아올릴 때, 로프에 걸리는 총 하중은 약 몇 kN 인가?",,9.6,19.6,29.6,39.6,4
산업안전기사,2012,3,기계위험방지기술,53,"지게차의 중량이 8kN, 화물중량이 2kN, 앞바퀴에서 화물의 무게중심까지의 최단거리가 0.5m 이면 지게차가 안정되기 위한 앞바퀴에서 지게차의 무게중심까지의 거리는 최소 몇 m 이상이어야 하는가?",,0.450m,0.325m,0.225m,0.125m,4
산업안전기사,2012,3,기계위험방지기술,54,"발음원이 이동할 때 그 진행방향 쪽에서는 원래 발음원의 음보다 고음으로, 진행방향 반대쪽에서는 저음으로 되는 현상을 무엇이라고 하는가?",,도플러(Doppler) 효과,마스킹(Masking) 효과,호이겐스(Huygens) 효과,임피던스(Impedance) 효과,1
산업안전기사,2012,3,기계위험방지기술,55,보일러 발생증기의 이상 현상이 아닌 것은?,,역화(Back fire),프라이밍(Priming),포밍(Forming),캐리오버(Carry over),1
산업안전기사,2012,3,기계위험방지기술,56,"산업용 로봇의 작동 범위 내에서 교시 등의 작업을 하는 경우, 작업시작 전 점검사항에 해당하지 않는 것은?",,외부전선의 피복 또는 외장의 손상 유무,매니퓰레이터 작동의 이상 유무,제동장치 및 비상정지장치의 기능,압력방출장치의 기능,4
산업안전기사,2012,3,기계위험방지기술,57,옥내에 통로를 설치할 때 통로 면으로부터 높이 얼마 이내에 장애물이 없어야 하는가?,,1.5m,2.0m,2.5m,3.0m,2
산업안전기사,2012,3,기계위험방지기술,58,산업안전보건법령상 프레스 작업시작 전 점검해야 할 사항에 해당하는 것은?,,언로드 밸브의 기능,하역장치 및 유압장치 기능,권과방지장치 및 그 밖의 경보장치의 기능,1행정 1정지기구.급정지장치 및 비상정지장치의 기능,4
산업안전기사,2012,3,기계위험방지기술,59,일반적으로 장갑을 착용하고 작업해야 하는 것은?,,드릴작업,선반작업,전기용접작업,밀링작업,3
산업안전기사,2012,3,기계위험방지기술,60,"롤러기의 물림점(Nip Point)의 가드 개구부의 간격이 15mm일 때 가드와 위험점 간의 거리는 몇 mm 인가? (단, 위험점이 전동체는 아니다.)",,15,30,60,90,3
산업안전기사,2012,3,전기위험방지기술,61,교류 아크 용접기의 자동전격장치는 전격의 위험을 방지하기 위하여 아크 발생이 중단된 후 약 1초 이내에 출력측 무부하 전압을 자동적으로 몇 [V]이하로 저하시켜야 하는가?,,85,70,50,25,4
산업안전기사,2012,3,전기위험방지기술,62,일반적인 전기화재의 원인과 직접 관계되지 않는 것은?,,과전류,애자의 오손,정전기 스파크(Spark),합선(단락),2
산업안전기사,2012,3,전기위험방지기술,63,"대전물체의 표면전위를 검출전극에 의한 용량분할하여 측정할 수 있다. 대전물체와 검출전극간의 정전용량을 C$_1$, 검출전극과 대지간의 정전용량을 C$_2$, 검출전극의 전위를 V$_e$라 할 때 대전물체의 표면전위 V$_s$를 나타내는 것은?",,$V_s = \\frac{C_1 + C_2}{C_2} V_e$,$V_s = \\frac{C_1 + C_2}{C_1} V_e$,$V_s = \\frac{C_1}{C_1 + C_2} V_e$,$V_s = \\frac{C_2}{C_1 + C_2} V_e$,2
산업안전기사,2012,3,전기위험방지기술,64,다음에서 전기기기 방폭의 기본개념과 이를 이용한 방폭 구조로 볼 수 없는 것은?,,점화원의 격리 - 내압(耐壓)방폭구조,전기기기 안전도의 증강 - 안전증 방폭구조,폭발성 위험분위기 해소 - 유입방폭구조,점화능력의 본질적 억제 - 본질안전 방폭구조,3
산업안전기사,2012,3,전기위험방지기술,65,정전기로 인한 화재폭발을 방지하기 위한 조치가 필요한 설비가 아닌 것은?,,인화성물질을 함유하는 도료 및 접착제 등을 도포하는 설비,위험물을 탱크로리에 주입하는 설비,탱크로리.탱크차 및 드럼 등 위험물 저장설비,위험기계.기구 및 그 수중설비,4
산업안전기사,2012,3,전기위험방지기술,66,"440[V]의 회로에 ELB(누전차단기)를 설치할 때 어느 규격의 ELB를 설치하는 것이 안전한가? (단, 인체저항은 500[Ω]이다.)",,30[mA] 0.1초,30[mA] 0.03초,30[mA] 0.3초,30[mA] 1초,2
산업안전기사,2012,3,전기위험방지기술,67,다음 중 정전기에 대한 설명으로 가장 알맞은 것은?,,"전하의 공간적 이동이 크고, 그것에 의한 자계의 효과가 전계의 효과에 비해 매우 큰 전기","전하의 공간적 이동이 적고, 그것에 의한 자계의 효과가 전계에 비해 무시할 정도의 적은 전기","전하의 공간적 이동이 적고, 그것에 의한 전계의 효과와 자계의 효과가 서로 비슷한 전기","전하의 공간적 이동이 크고, 그것에 의한 자계의 효과와 전계의 효과를 서로 비교할 수 없는 전기",2
산업안전기사,2012,3,전기위험방지기술,68,"대전서열을 올바르게 나열한 것은?(단, (+) ~ (-) 순임)",,폴리에틸렌 - 셀룰로이드 - 염화비닐 - 테프론,셀룰로이드 - 폴리에틸렌 - 염화비닐 - 테프론,염화비닐 - 폴리에틸렌 - 셀룰로이드 - 테프론,테프론 - 셀룰로이드 - 염화비닐 - 폴리에틸렌,1
산업안전기사,2012,3,전기위험방지기술,69,"인체의 저항을 500[Ω]으로 볼 때 심실세동을 일으키는 전류에서의 전기에너지는 약 몇 [J]인가? (단, 심실세동전류는 $\\frac{165}{\\sqrt{T}}$ [mA] 이며, 통전시간 T는 1초 전원은 정현파 교류이다.)",,3.3,13,13.6,272.2,3
산업안전기사,2012,3,전기위험방지기술,70,전기회로 개폐기의 스파크에 의한 화재를 방지하기 위한 대책으로 틀린 것은?,,가연성 분진이 있는 곳은 방폭형으로 한다.,개폐기를 불연성 함에 넣는다.,과전류 차단용 퓨즈는 비포장 퓨즈로 한다.,접촉부분의 산화 또는 나사풀림이 없도록 한다.,3
산업안전기사,2012,3,전기위험방지기술,71,접지저항값을 저하시키는 방법 중 거리가 먼 것은?,,접지봉에 도전성이 좋은 금속을 도금한다.,접지봉을 병렬로 연결한다.,도전성 물질을 접지극 주변의 토양에 주입한다.,접지봉을 땅속 깊이 매설한다.,1
산업안전기사,2012,3,전기위험방지기술,72,"절연물은 여러 가지 원인으로 전기저항이 저하되어 절연불량을 일으켜 위험한 상태가 되는데, 이 절연불량의 주요 원인과 거리가 먼 것은?",,"진동, 충격 등에 의한 기계적 요인",산화 등에 의한 화학적 요인,온도상승에 의한 열적 요인,오염물질 등에 의한 환경적 요인,4
