Test Name,Year,Session,Subject,Number,Question,Question_image,Option 1,Option 2,Option 3,Option 4,Answer
산업안전산업기사,2009,1,건설안전기술,88,항타기 또는 항발기의 권상용 와이어로프의 사용금지 규정 으로 옳지 않은 것은?,,와이어의 한 꼬임에서 끊어진 소선의 수가 7% 이상인 것.,지름의 감소가 호칭지름의 7%를 초과한 것.,"꼬임, 꺾임, 비틀림 등이 있는 것.",이음매가 있는 것.,2
산업안전산업기사,2009,1,건설안전기술,89,는슬하게 쌓여 있는 무레 저반이 물로 포화되어 있을 때 지진이나 충격를 반으면 일시적으로 전단강도를 잃어버리는 현상은?,,모관현상,보일링현상,덕스트로피,액상화현상,2
산업안전산업기사,2009,1,건설안전기술,90,철골공사에서 가동의 건립작업시 행거볼트의 매립에 있어 요구되는 정말도에서 기준명 및 인접 기동의 중심으로부터 얼마 이상 떨어진 장소에 가스전함장치를 설치하여야 하는가?,,3mm,5mm,7mm,10mm,1
산업안전산업기사,2009,1,건설안전기술,91,화물취급작업 중 화물 적재시 준수해야 하는 사항에 속하지 않는 것은?,,침하의 우려가 없는 튼튼한 기반 위에 적재할 것.,충량의 화물은 건물의 관막이나 벽에 기대어 적재할 것.,복안화확 적토로 쌓이 않은 적재물은 조심.,편하중이 생기지 아니하도록 적재할 것.,4
산업안전산업기사,2009,1,건설안전기술,92,항타기 및 항발기를 조립하는 대의 사용전 점검사항이 아닌 것은?,,과부하장치 및 제동장치의 이상유무,권상장치의 브레이크 및 쐐기장치 기능의 이상유무,본체의 연결부의 품림 또는 손상의 유무,권상기의 설치상태의 이상유무,2
산업안전산업기사,2009,1,건설안전기술,93,달비계(곤돌라의 달비계는 제외)의 최대 적재하중을 정하에 있어 달기강선의 안전계수 기준은 얼마인가?,,5 이상,7 이상,8 이상,10 이상,2
산업안전산업기사,2009,1,건설안전기술,94,콘크리트를 다설할 때 거푸집에 작용하는 콘크리트 측압에 크게 영향을 미치지 않는 것은?,,콘크리트 타설 속도,콘크리트 타설 높이,콘크리트 설계기준강도,콘크리트 단위용적율량,1
산업안전산업기사,2009,1,건설안전기술,95,다음 중 스크레이퍼의 용도로 가장 거리가 먼 것은?,,적재,운반,하역,안승,4
산업안전산업기사,2009,1,건설안전기술,96,다음 중 일체기에 의한 건물의 파쇄작업순로를 옳은 것은?,,슬래브 - 기등 - 보 -벽체,기등 - 슬래브 - 보 -벽체,기등 - 보 - 벽체 - 슬래브,슬래브 - 보 -벽체 - 기등,3
산업안전산업기사,2009,1,건설안전기술,97,가설통로 중 경사로에 설치되는 발판의 폭 및 틈새기준으로 옳은 것은?,,"발판폭 30㎝ 이상, 틈 3㎝ 이하","발판폭 40㎝ 이상, 틈 3㎝ 이하","발판폭 30㎝ 이상, 틈 4㎝ 이하","발판폭 40㎝ 이상, 틈 5㎝ 이하",4
산업안전산업기사,2009,1,건설안전기술,98,다음 중 철골작업시 추락재해를 방지하기 위한 설비가 아닌 것은?,,안전대 및 구명줄,트랜치박스,안전난간,추락방지용 방망,4
산업안전산업기사,2009,1,건설안전기술,99,다음 중 터널식 굴착방법과 거리가 먼 것은?,,TBM공법,NATM공법,월드공법,이스밍거공법,2
산업안전산업기사,2009,1,건설안전기술,100,유해.위험방지계획서를 작성하여 제출하여야 하는 노동부령이 정하는 규모의 사업에 해당하지 않는 것은?,,시상 높이가 31미터 이상인 건축물 또는 공작물,연면적 3만제곱미터 이상인 건축물,깊이 10미터 이상인 굴착공사,"다목적댐, 발전율댐 및 저수율댐 1천만톤 이상의 용수전용댐 등의 건설공사",2
