Test Name,Year,Session,Subject,Number,Question,Question_image,Option 1,Option 2,Option 3,Option 4,Answer
산업안전산업기사,2009,3,안전관리론,1,다음 중 OJT(On the Job Training) 교육에 대한 설명으로 적절하지 않는 것은?,,직장의 실정에 맞게 실제적 훈련이 가능하다.,훈련효과에 의한 상호 신뢰이해도가 높아진다.,훈련에 필요한 업무의 중단으로 결손이 따른다.,다수의 근로자들에게 조직적 훈련이 가능하다.,4
산업안전산업기사,2009,3,안전관리론,2,A 사업장에서 발생한 990회의 사고 중 사망재해가 3건이었다면 하인리히의 재해구성비율에 따를 경우 경상은 몇 건 정도가 예상되겠는가?,,60건,87건,120건,330건,2
산업안전산업기사,2009,3,안전관리론,3,다음 중 인지(認知)과정에서 생길 수 있는 착오의 원인으로 볼 수 없는 것은?,,심리적 능력한계,감각자단 현상,자기기술 과신,정보량의 저장한계,3
산업안전산업기사,2009,3,안전관리론,4,다음 중 인적(人的) 안전대책과 가장 거리가 먼 것은?,,안전관리 체제의 확립,안전관리 표준의 작성,설계 단계에서부터의 안전화,안전교육 훈련의 실시,3
산업안전산업기사,2009,3,안전관리론,5,토의의 종에서 참가자에게 일정한 역할를 주어서 실제적으로 연기를 시켜봄으로써 자기의 역할를 보다 확실히 인식시키는 방법에 해당하는 것은?,,포럼(forum),심포지엄(symposium),버즈 세션(buzz session),롤 플레잉(role playing),4
산업안전산업기사,2009,3,안전관리론,6,파브로브(pavlov)의 조건반사설에 의한 학습이론의 원리에 해당되지 않는 것은?,,일관성의 원리,시각의 원리,강도의 원리,존비성의 원리,4
산업안전산업기사,2009,3,안전관리론,7,안전인증 방톡마스크에서 활로제용 정화통 외부 측면의 표시색으로 옳은 것은?,,갈색,회색,녹색,노란색,2
산업안전산업기사,2009,3,안전관리론,8,"다음 중 산업안전보건법상 사업내 안전·보건교육에 있어 채용시의 교육내용으로 옳은 것은? (단, 기타 안전·보건관리에 필요한 사항은 제외한다.)",,기계·기구의 위험설과 안전작업방법에 관한 사항,표준안전작업방법에 관한 사항,안전보건교지에 관한 사항,작업성 질환 예방에 관한 사항,1
산업안전산업기사,2009,3,안전관리론,9,다음 중 안전모에 있어 착장체의 구성요소에 해당되지 않는 것은?,,턱끈,마리고정대,마리받침고리,마리받침끈,1
산업안전산업기사,2009,3,안전관리론,10,산업안전보건법에 따라 안전 · 보건표지에 사용된 색책의 색도기준이 ‘2.5Y 8/12' 일 때 이 색채의 명도 값으로 옳은 것은?,,2.5,8,12,08월 12일,2
산업안전산업기사,2009,3,안전관리론,11,다음 중 재해예방의 4원칙에 해당되지 않는 것은?,,사실 보본의 원칙,원인 연계의 원칙,손실 우연의 원칙,예방 가능의 원칙,1
산업안전산업기사,2009,3,안전관리론,12,안전교육 과정 중 피교육자가 스스로 행할으로서만 얻어지는 교육은?,,안전지식의 교육,안전기능의 교육,안전태도의 교육,안전의식의 교육,2
산업안전산업기사,2009,3,안전관리론,13,다음 중 허즈버그(Herzberg)의 동기 및 위생요인에 대한 설명으로 옳은 것은?,,위생요인으로 직무의 내용이 해당된다.,위생요인으로 직무의 확정이 해당된다.,동기요인으로 대인 관계가 해당된다.,동기요인으로 작업 조건이 해당된다.,2
산업안전산업기사,2009,3,안전관리론,14,인간의 행동 측성에 관한 다음의 레윈(Lewin)의 법칙에서 각 인자에 대한 설명으로 옳지 아닌 것은?\n\nB=$f$(P·E),,B : 행동,$f$ : 함수관계,P : 개체,E : 기술,4
산업안전산업기사,2009,3,안전관리론,15,"상시근로자가 100명인 사업장에서 3개월 동안 재해 발생 건수가 5건, 불안전한 행동의 발견조치 건수가 10건, 안전을 보건수가 5건, 불안전한 상태와 지적이 20건이고, 안전보건기 3건 이었다면 이 사업장의 안전율를 약 얼미인가? (단, 근로자는 1일 8시간씩 월 25일를 근무하였다.)",,0.63,0.72,633.33,716.67,3
산업안전산업기사,2009,3,안전관리론,16,다음 중 상해의 종류별 분류에 해당하지 않는 것은?,,골절,충돌,동상,신소결린,4
산업안전산업기사,2009,3,안전관리론,17,다음 중 안전·보건표지에 있어 분자 및 빨간색 또는 노란색에 대한 보조색으로 사용하기에 부적합한 색은?,,녹색,흰색,검정색,파란색,3
산업안전산업기사,2009,3,안전관리론,18,다음 중 무재해 운동의 기본이념 3가지에 해당하지 않는 것은?,,무의 원칙,참가의 원칙,자주 활동의 원칙,선취 해결의 원칙,3
산업안전산업기사,2009,3,안전관리론,19,다음 중 매슬로우(Maslow)의 욕구위계이론 5단계를 올바르게 나열한 것은?,,생리적 욕구 → 안전의 욕구 → 사회적 욕구 → 존경의 욕구 → 자아 실현의 욕구,생리적 욕구 → 안전의 욕구 → 사회적 욕구 → 자아 실현의 욕구 → 존경의 욕구,안전의 욕구 → 생리적 욕구 → 사회적 욕구 → 자아 실현의 욕구 → 존경의 욕구,안전의 욕구 → 생리적 욕구 → 사회적 욕구 → 존경의 욕구 → 자아 실현의 욕구,1
산업안전산업기사,2009,3,안전관리론,20,산업안전보건법상 안전검사대상 유해·위험기계에 해당 하지 않는 것은?,,프레스,리프트,전기 용접기,산업용 원심기,3
산업안전산업기사,2009,3,인간공학 및 시스템안전공학,21,화학설비에 대한 안전성 평가를 위해 준비해야 하는 관계자료와 가장 거리가 먼 것은?,,운전요령,일금현황,공정계통도,화학설비배치도,2
산업안전산업기사,2009,3,인간공학 및 시스템안전공학,22,인간이 확각으로 느끼는 소리의 크기를 측정하는 2가지 척도를 손(sone)과 폰(phon)이 있다. 다음 중 40phon 은 몇 sone 에 해당하는가?,,1,2,4,8,1
산업안전산업기사,2009,3,인간공학 및 시스템안전공학,23,"다음 설명에 해당하는 설비 보전 방식은?\n\n""설비를 항상 정상, 양호한 상태로 유지하기 위한 정기적인 검사와 초기의 단계에서 선능의 저하나 고장을 제거하던가 조정 또는 수봇하기 위한 설비의 보수 활동을 의미한다.",,예방보전(preventive maintenance),보전예방(maintenance prevention),개량보전(corrective maintenance),사후보전(Break-down maintenance),1
산업안전산업기사,2009,3,인간공학 및 시스템안전공학,24,사람 눈의 굴절률를 나타내는 디옵터(dioptor)를 구하는 식으로 옳은 것은?,,1/cm 단위의 초점거리,1/inch 단위의 초점거리,1/feet 단위의 초점거리,1/m 단위의 초점거리,4
산업안전산업기사,2009,3,인간공학 및 시스템안전공학,25,1cd 의 점광원에서 1m 떨어진 곳에서의 조도가 2 lux이었다. 동일한 조건에서 3m 떨어진 곳에서의 조도는 약 몇 lux 인가?,,0.11,0.22,0.33,0.67,2
산업안전산업기사,2009,3,인간공학 및 시스템안전공학,26,다음 중 소음에 의한 청력손실이 가장 크게 나타나는 주파수대는?,,2000Hz,4000Hz,10000Hz,20000Hz,2
산업안전산업기사,2009,3,인간공학 및 시스템안전공학,27,다음 중 인간-기계 체계의 기본 기능이 아닌 것은?,,감지,정보 보관,제환,행동,3
산업안전산업기사,2009,3,인간공학 및 시스템안전공학,28,"그림과 같은 시스템에서 펌프 A 의 신뢰도는 0.999, 밸브 B 와 C 의 신뢰도가 모두 0.99 일 경우 전체의 신뢰도는 얼마 인가?",O,0.9810909,0.9820101,0.9867204,0.9989001,4
산업안전산업기사,2009,3,인간공학 및 시스템안전공학,29,결함수분석법(FTA)에서 특정 조합의 기본사상들이 모두 발생하였을 때 정상사상을 일으키는 기본사상의 집합를 무엇이라고 하는가?,,패스 셋(path set),컷 셋(cut set),최소 패스 셋(minimal path set),최소 컷 셋(minimal cut set),2
산업안전산업기사,2009,3,인간공학 및 시스템안전공학,30,다음 중에서 효제측 활동에 대한 생리학적 측정방법으로 가장 거리가 먼 것은?,,심박수,EMG,EEG,에너지소비량,3
산업안전산업기사,2009,3,인간공학 및 시스템안전공학,31,화학설비에 대한 안전성 평가 5단계 중 제4단계인 안전대책의 세부사항으로 적절하지 않은 것은?,,보건,평가계획,관리적 대책,설비 등에 관한 대책,2
산업안전산업기사,2009,3,인간공학 및 시스템안전공학,32,"공정도(process chart)에 사용되는 기호 중 현재료, 부품 또는 제품 등의 검사를 의미하는 기호는?",,image_2009_3_32_1,image_2009_3_32_2,image_2009_3_32_3,image_2009_3_32_4,1
산업안전산업기사,2009,3,인간공학 및 시스템안전공학,33,다음 중 부출 배치의 4원칙으로 틀린 것은?,,중요성의 원칙,사용빈도의 원칙,사용방법의 원칙,기능별 배치의 원칙,3
산업안전산업기사,2009,3,인간공학 및 시스템안전공학,34,다음 중 FT도에 사용되는 기호의 명칭으로 옳은 것은?,O,억제 게이트,부정게이트,배타적 OR 게이트,우선적 AND 게이트,1
산업안전산업기사,2009,3,인간공학 및 시스템안전공학,35,인간-기계 시스템(Man-Machine system)에서 인간과 기계에 록 시스템(Lock system)를 설치할 때 다음 설명 중 옳은 것은?,,기계와 인간의 사이에는 인트라록 시스템(Intra lock system)를 둔다.,인티록 시스템(Inter lock system)과 인트라록 시스템(Intra lock system)를 둔다.,트랜스록 시스템(Trans lock system)과 인티록 시스템(Inter lock system) 사이에는 인트라록 시스템(Intra lock system)를 둔다.,트랜스록 시스템(Trans lock system)과 인트라룩 시스템 (Intra lock system) 사이에는 인터록 시스템(Inter lock system)을 둔다.,2
산업안전산업기사,2009,3,인간공학 및 시스템안전공학,36,인간과 기계가 중고발는 정보교환에 있어서 N 개 대안이 있을 경우 각 대안의 식별 활률를 p건고 를 때 정보량(H)를 구하는 식으로 옳은 것은?,,$H=\log_2N$,$H=\log N^p$,$H = \log_2 \frac{1}{p}$,$H = \log \frac{1}{p^2}$,3
산업안전산업기사,2009,3,인간공학 및 시스템안전공학,37,다음 중 인간의 실수와 그것으로 인해 생길 수 있는 위험를 정량으로 평가하는 기법은?,,PHA,MORT,THERP,FMECA,3
산업안전산업기사,2009,3,인간공학 및 시스템안전공학,38,다음 중 인체 측정에 관한 설명으로 틀린 것은?,,기능적 인체 치수는 움직이는 몸의 자세로부터 측정하는 것이다.,"일반적으로 인체의 치수측정은 구조적 치수, 기능적 치수, 태만적 치수로 대별된다.",구조적 인체 치수는 표준 자세에서 측정이지 않는 상태를 측정하는 것이다.,마티식 인체계측기를 활용하면 감속복 치환의 상태에서 측정하는 것를 현적으로 한다.,4
산업안전산업기사,2009,3,인간공학 및 시스템안전공학,39,정보를 전송하기 위해 표시장치를 선택하고자 할 때 시각장치보다 청각 장치를 사용하는 것이 효과적인 경우로 옳은 것은?,,정보의 내용이 복잡한 경우,정보의 내용이 후에 재참조되는 경우,수신자가 한 곳에 머물러 있는 경우,정보의 내용이 측각적인 행동를 요구하는 경우,4
산업안전산업기사,2009,3,인간공학 및 시스템안전공학,40,크기를 이용한 조종 장치에서 촉감에 의하여 크기 차이를 정확히 구별할 수 있는 직경과 두께의 최소 차이 값으로 가장 적절한 것은?,,"직경 : 1.3cm, 두께 : 0.95cm","직경 : 2.5cm, 두께 : 1.95cm","직경 : 3.2cm, 두께 : 1.95cm","직경 : 4.5cm, 두께 : 0.95cm",1
산업안전산업기사,2009,3,기계위험방지기술,41,탑상용 연삭기의 방호장치를 그림과 같이 설치할 때 각도 a 와 각곽 b로 가장 옳은 것은?,O,"a : 65° 이내, b : 3mm 이내","a : 60° 이내, b : 3mm 이내","a : 90° 이내, b : 5mm 이내","a : 65° 이내, b : 5mm 이내",1
산업안전산업기사,2009,3,기계위험방지기술,42,연삭숫돌 사용 시 기계에 이상이 없는지 여부를 확인하기 위한 시운전시간으로 가장 적절한 것은?,,"작업시작 전 3분 이상, 연삭숫돌 교체 후 3분 이상","작업시작 전 30초 이상, 연삭숫돌 교체 후 1분 이상","작업시작 전 1분 이상, 연삭숫돌 교체 후 3분 이상","작업시작 전 1분 이상, 연삭숫돌 교체 후 1분 이상",3
산업안전산업기사,2009,3,기계위험방지기술,43,보일러 방증장치 설치 방법를 설명한 것이다. 옳지 않은 것은?,,안로방출장치는 검사가 용이할 위치에 빨느톡이 수평되게 설치된다.,압력방출장치는 가능한 보일러 동체에 직접 설치한다.,압력제한스위치는 보일러의 안력계가 설치된 배관상에 설치한다.,압력방출장치는 최고사용압력이하에서 작동하는 완충정지를 설치해야 인면대 조치를 하여야 한다.,1
산업안전산업기사,2009,3,기계위험방지기술,44,선반 등으로부터 돌출하여 회전하고 있는 가공물이 근로자에게 위험를 미칠 우려가 있는 때에 설치할 방호장치로 가장 적합한 것은?,,슬래브,건널다리,방복,덤개 또는 울,4
산업안전산업기사,2009,3,기계위험방지기술,45,인력운반 작업 시 안전수칙 중 잘못된 것은?,,물건를 들어 올릴 때는 팔과 무룰를 사용하고 허리를 구부린다.,"문반 대상물의 특성에 따라 필요한 보호구를 확인, 착용한다.",화물에 가능한 한 접근하여 화물의 무게중심를 몸에 가깝이 밀착시킨다.,무거운 물건은 굴동 작업으로 하고 보조기구를 이용한다.,1
산업안전산업기사,2009,3,기계위험방지기술,46,크레인 작업 시 3ton의 중량를 걸어 10 m/s$^2$의 가숙도로 감이출릴 때 로프에 걸리는 총 하중를 약 몇 Kgf 인가?,,3000,4052,6061,8459,3
산업안전산업기사,2009,3,기계위험방지기술,47,"개구부에서 위험점까지의 최단거리가 60mm 위치에 롤러가 회전하고 있다. 개구부 간격의 허용한계는 몇 mm 인가? (단, 위험점이 전동체는 아니다.)",,10,12,13,15,4
산업안전산업기사,2009,3,기계위험방지기술,48,선반의 안전장치가 아닌 것은?,,힘 브레이크,금릭레이크,원비산방지 투명판,안전블록,4
산업안전산업기사,2009,3,기계위험방지기술,49,목재가공용 기계의 방호장치로 관련이 적은 것은?,,덮게,반발예방장치,동날검출예방장치,과부하방지장치,4
산업안전산업기사,2009,3,기계위험방지기술,50,연삭기 숫돌의 파괴원인으로 볼 수 없는 것은?,,숫돌의 회전숙도가 너무 빠를 때,숫돌자체에 금열이 있을 때,숫돌의 경면를 사용할 때,숫돌에 과대한 충격를 주게 되는 때,3
산업안전산업기사,2009,3,기계위험방지기술,51,탄게하중 이하의 하중이라도 고온조건에서 일정 하중를 지속적으로 가하면 시간의 경과에 따라 변형이 증가하고 결국은 파고에 이르게 되는 현상은?,,크리프,파로현상,응력 집중,기공 경화,1
산업안전산업기사,2009,3,기계위험방지기술,52,지게차의 헤드가드가 갖추어야 할 조건의 물명으로 틀린 것은?,,헤드가드의 강도는 지게차의 최대하중의 2배가 되는 등분포하중에 견딜 수 있를 것.(지게차의 하중이 4ton를 넘는 경우 4ton을 하중으로 함),상부틀의 각 개구의 폭 또는 길이가 20 ㎝ 이밑일 것,운전자가 앉아서 조작하는 방식의 지게차는 운전자 착석의 상면에서 헤드가드의 상부틀의 하면까지의 높이가 1 m이상 일 것,운전자가 서서 조작하는 지게차는 운전석의 바닥면에서 헤드가드의 상부틀의 하면까지의 높이가 2m이상 일 것,2
산업안전산업기사,2009,3,기계위험방지기술,53,"하용응력과 안전율(>1)의 관계를 올바르게 표현한 것은? (단, 가중강도는 사용조건 및 하중의 종류에 따라 극한 강도, 항복점, 크리프강도, 피로월도 등를 적용한다.)",,하용응력 = 기초강도 $\times$ 안전율,하용응력 = 안전율 / 기초강도,하용응력 = 기초강도 / 안전율,하용응력 = (안전율 $\times$ 기초강도)/2,3
산업안전산업기사,2009,3,기계위험방지기술,54,다음 중 산업용 로봇에의 교시작업를 개시하기 전에 점검하여야 할 사항으로 거리가 옳지 않은 것은?,,비상정지장치의 기능 상태,외부 전연의 피복 손상 유무,메니플레이터 작동의 이상 유무,비상정석인 소울 및 진동의 유무,4
산업안전산업기사,2009,3,기계위험방지기술,55,보일러의 안전한 가동를 위하여 암력방출장치를 2개 설치한 경우에 작동 방법으로 옳은 것은?,,최고의 사용압력 이상에서 2개 동시작동,최고의 사용압력 이하에서 2개 동시작동,최고의 사용압력 이하에서 1개가 작동되고 다른 것은 최 고 사용압력 1.05배 이하에서 작동,최고의 사용압력 이하에서 1개가 작동되고 다른 것은 최고 사용압력 1.1배 이하에서 작동,3
산업안전산업기사,2009,3,기계위험방지기술,56,공정 토치 튼의 점수는 무엇으로 해야 가장 좋은가?,,노화석,철선,전선케이불,팀 플러너,4
산업안전산업기사,2009,3,기계위험방지기술,57,"기계설비기구의 원형점에서 고정물부과 회전부위이 만드는 위험점이 이니고, 릴점부터 동면 틀의 틀날 등과 같이 회전하는 운동부 자체의 위험이나 운동하는 기계부분자체의 위험점에서 초래되는 위험정은?",,물합점,절단점,끼입점,협착점,2
산업안전산업기사,2009,3,기계위험방지기술,58,무부하상태 기준으로 구내 최고숙도가 20km/h인 지게차의 주행시 차우 안정도 기준은 몇% 이내인가?,,37%,39%,18%,4%,1
산업안전산업기사,2009,3,기계위험방지기술,59,재철공장에서는 주괴(ingot)를 운반하는 대 수로 컨베이어를 사용하고 있다. 컨베이어에 대한 방호조치로 틀린 것은?,,이 근로자의 신체의 일부가 안겨드는 등 근로자에게 위험를 미를 우려가 있는 때 및 비상시에는 즉시 컨베이어 등의 운전를 정지시를 수 있는 장치를 설치하여야 한다.,운전중의 낙하에 인한어 근로자가 낙하물에 맞을 위험이 있는 때에는 덮해 컨베이어 등에 보게 또는 울를 설치하는 등 낙어방지를 위한 조치를 하여야 한다.,수평섭대로안 컨베이어는 컨베이어의 일부분이나 전부 갖하 등에 의한 회물 또는 운반구의 이를 및 역주행를 방지하는 장치를 갖추어야 한다.,운전 중인 컨베이어 등의 위로 근로자를 넘어갓도록 하는 때에는 근로자의 위험를 방지하기 위하여 건널다리를 설치하는 등 필요한 조치를 하여야 한다.,3
산업안전산업기사,2009,3,기계위험방지기술,60,"중이, 천, 금속박 등를 풀레시키는 로울러기로서 근로자에게 위험를 미를 우려가 있는 부위에 설치해야 할 방호장치에 해당하는 것은?",,방호판,안내 로울러,과부하방지장치,반발예방장치,2
산업안전산업기사,2009,3,전기 및 화학설비위험방지기술,61,화학공정에서 반응를 시키기 위한 조작 조건에 해당되지 않는 것은?,,반응 온도,반응 농도,반응 높이,반응 압력,3
산업안전산업기사,2009,3,전기 및 화학설비위험방지기술,62,인체가 현서진 정이이는 상태이거나 금속석의 저기·기계 장치의 구조등에 안체의 일부가 상시 접촉되어 있는 상태에서의 허용접촉전압으로 옳은 것은?,,2.5V 이하,25V 이하,50V 이하,75V 이하,2
산업안전산업기사,2009,3,전기 및 화학설비위험방지기술,63,다음 가스 중 위험도가 가장 큰 것은?,,수소,아세틸렌,프로판,암모니아,2
산업안전산업기사,2009,3,전기 및 화학설비위험방지기술,64,다음 중 고압활선작업에 필요한 보호구에 해당하지 않는 것은?,,절연대,철연강각,AE형 안전모,철연장화,1
산업안전산업기사,2009,3,전기 및 화학설비위험방지기술,65,"황산 5vol%, 메탄 4vol%, 에틸렌 1vol% 로 구성된 혼합가스의 연소하한값은 약 얼미인가? (단, 각 가스의 공기 중 연소하한값은 약 얼미인가? (단, 각 가스의 공기 중 연소하한값은 황산은 1.1vol%, 메탄은 5vol%, 에틸렌은 2.7vol% 이다.)",,0.58,1.75,2.72,3.72,2
산업안전산업기사,2009,3,전기 및 화학설비위험방지기술,66,"대기 중에 대량의 가연성 가스가 유출되거나 대량의 가연성 액체가 유출하여 그것으로부터 발생하는 증기가 공기와 를 할해서 가연성 출합기체를 형성하고, 정화원에 의하여 발생하는 폭발를 무엇이라 하는가?",,UVCE,BLEVE,Detonation,Boil over,1
산업안전산업기사,2009,3,전기 및 화학설비위험방지기술,67,전기기가 절연물의 출변 중 최고 하용온도가 가장 높은 절연계급은?,,Y중,A중,F중,C중,4
산업안전산업기사,2009,3,전기 및 화학설비위험방지기술,68,다음 중 가연성 분진의 폭발 메카니즘으로 옳은 것은?,,퇴적분진 → 비산 → 분산 → 발화현 발생 → 독발,발화현 발생 → 퇴적분진 → 비산 → 분산 → 독발,퇴적분진 → 발화현 발생 → 분산 → 비산 → 독발,발화현 발생 → 비산 → 분산 → 워적분진 → 독발,1
산업안전산업기사,2009,3,전기 및 화학설비위험방지기술,69,프로판(C3H8) 1물이 완전연소하기 위한 산소의 화학양론계수는 얼미인가?,,2,3,4,5,4
산업안전산업기사,2009,3,전기 및 화학설비위험방지기술,70,저압전로에서 그 전로에 지락이 생겼를 경우에 0.5초 이내에 자동적으로 전로를 차단하는 장치를 시설하는 경우 제3종 접지공사와 특별 제3종 접지 공사의 저항값은 자동차단 기의 정격감도 전류에 따라 달라지는데 정격감도 전류가 30mA 일 경우 접지저항값으로 옳은 것은?,,150Ω이하,300Ω이하,500Ω이하,1000Ω이하,3
산업안전산업기사,2009,3,전기 및 화학설비위험방지기술,71,정전기 방전의 출류 중 보드제의 표면을 따라서 star-check 마크를 거치는 나목가지 형태의 방향를 수반하는 것은?,,기충방전,연면방전,물꽃방전,고압방전,2
산업안전산업기사,2009,3,전기 및 화학설비위험방지기술,72,다음 중 발화점에 대한 설명으로 옳은 것은?,,점화원에 의해 붙이 붙를 수 있는 최저 온도,점화원에 의해 붙이 붙를 수 있는 최저 증기농도,주위의 열로 인하여 스스로 붙이 붙를 수 있는 최저 증기농도,주위의 열로 인하여 스스로 붙이 붙를 수 있는 최저 온도,4
산업안전산업기사,2009,3,전기 및 화학설비위험방지기술,73,다음 중 산업안전보건법상 폭발성 물질에 해당하지 않는 것 은?,,하이드라진,아조화합물,유기과산화물,황인,4
산업안전산업기사,2009,3,전기 및 화학설비위험방지기술,74,황은 소화기는 연소의 요소를 제거함으로서 소화작용를 하는가?,,물화현,가연물,연쇄반응,탄화물,3
산업안전산업기사,2009,3,전기 및 화학설비위험방지기술,75,다음 중 위험도가 가장 높은 톡전경로는?,,오른손 - 등,원손 - 오른손,원손 - 발,오른손 - 가슴,4
산업안전산업기사,2009,3,전기 및 화학설비위험방지기술,76,다음 중 연소반응에 해당하지 않는 것은?,,$C + O_2 \to CO_2$,$2N_2 + O_2 \to 2NO$,$2H_2 + O_2 \to 2H_2O$,$C_4H_{10} + 6.5O_2 \to4CO_2 + 5H_2O$,2
산업안전산업기사,2009,3,전기 및 화학설비위험방지기술,77,방폭구조 전기기계·기구의 선정기준에 있어 가스폭발 위험장소의 제1중 장소에 사용할 수 없는 방폭구조는?,,내압방폭구조,안전증방폭구조,본질안전방폭구조,비점화방폭구조,4
산업안전산업기사,2009,3,전기 및 화학설비위험방지기술,78,전로의 사용전압과 전호의 전선 상호간 및 전로와 대지간의 절연저항이 알줄 연결된 것은?,,사용전압이 110V 인 경우 0.1MΩ 이상,사용전압이 220V 인 경우 0.2MΩ 이상,사용전압이 440V 인 경우 0.3MΩ 이상,사용전압이 550V 인 경우 0.4MΩ 이상,3
산업안전산업기사,2009,3,전기 및 화학설비위험방지기술,79,다음 중 정전기의 발생요인으로 적절하지 않은 것은?,,도전성 재료에 의한 발생,박리에 의한 발생,유동에 의한 발생,마물에 의한 발생,1
산업안전산업기사,2009,3,전기 및 화학설비위험방지기술,80,다음 중 이세틸렌은 어느 물질에 용해시켜 보관하는가?,,아세톤,벤젠,기를,물,1
