Test Name,Year,Session,Subject,Number,Question,Question_image,Option 1,Option 2,Option 3,Option 4,Answer
산업위생관리기사,2006,2,물리적유해인자관리,76,빛과 밝기으 단위에 관한 설명으로 틀린 것은?,,광원으로부터 나오는 빛의 세기를 광속이라 한다.,루멘(Lumen)은 1촉광의 광원으로부터 단위 입체각으로 나가는 광속의 단위이다.,조도는 어떤 면에 들어오는 광속의 양에 비례하고 입사면의 단면적에 반비례한다.,광도의 단위로는 칸델라(Candela)를 사용한다.,1
산업위생관리기사,2006,2,물리적유해인자관리,77,사람이 느끼는 최소 진동치는?,,35±5 dB,45±5 dB,55±5 dB,65±5 dB,3
산업위생관리기사,2006,2,물리적유해인자관리,78,인공호흡용 혼합가스 중 헬륨-산소 혼합가스에 관한 설명으로 틀린 것은?,,헬륨은 분자량이 작아서 호흡저항이 적다.,헬륨은 고압 하에서 마취작용이 약하다.,헬륨은 질소보다 확산속도가 작아 인체 흡수속도를 줄일 수 있다.,헬륨은 체외로 배출되는 시간이 질소에 비하여 50%정도 밖에 걸리지 않는다.,3
산업위생관리기사,2006,2,물리적유해인자관리,79,레이저(Lasers: Light amplification by simulated Emission of Radiation)에 관한 설명으로 틀린 것은?,,레이저광 중 에너지의 양을 지속적으로 축척하여 강력한 파동을 발생시키는 것을 지속파라고 한다.,레이저광을 출력이 대단히 강력하고 극히 좁은 파장범위를 갖기 때문에 쉅게 산란하지 않는다.,레이저광에 가장 민감한 표적기관은 눈이다.,"파장, 조사량 또는 시간 및 개인의 감수성에 따라 피부에 홍반, 수포형성, 색소침착 등이 생긴다.",1
산업위생관리기사,2006,2,물리적유해인자관리,80,다음 중 1초 동안에 3.7×10¹⁰개의 원자 붕괴가 일어나는 방사선 물질량을 1로 하는 단위는?,,렌트겐(R),퀴리(Ci),레드(Red),렘(Rem),2
산업위생관리기사,2006,2,산업독성학,81,"독성물질의 생체과정인 흡수, 분포, 생전환, 배설 등에 변화를 일으켜 독성이 낮아지는 길항작용의 종류로 적절한 것은?",,화학적 길항작용,기능적 길항작용,배분적 길항작용,수용체 길항작용,3
산업위생관리기사,2006,2,산업독성학,82,'벤지딘'에 장기간 직업적으로 폭로되었을 때 암이 발생 될 수 있는 인체 부위로 가장 적절한 것은?,,피부,뇌,폐,방광,4
산업위생관리기사,2006,2,산업독성학,83,급성중독의 특징으로 심한 신장장해로 과뇨증이 오며 더 진전되면 무뇨증을 일으켜 요독증으로 10일 안에 사망에 이르게 하는 물질은?,,베릴륨,크롬,벤젠,비소,2
산업위생관리기사,2006,2,산업독성학,84,질병의 발생빈도 측정을 위한 '유병율'에 관한 설명으로 틀린 것은?,,여러가지 인자에 영향을 받아 위험성을 실제적으로 나타내지 못한다.,어느 시점에 해당 집단의 작업자 중(직업병을 가진 사람 포함)에서 직업병을 가지고 있는 사람의 숫적 비율이다.,인구집단 내에 존재하고 있는 환자 수를 표현한 것이다.,특정기간 위험에 노출된 인구 중 새로 발생한 환자의 수로 나타낸다.,4
산업위생관리기사,2006,2,산업독성학,85,납중독을 확인하는데 이용되는 시험내용과 거리가 먼 것은?,,혈중의 납,헴(Heme)의 대사,신경전달속도,β-ALA 이동시험,4
산업위생관리기사,2006,2,산업독성학,86,역학조사방법과 가장 거리가 먼 것은?,,단면연구,환자-대조군연구,신경전달속도,코호트연구,3
산업위생관리기사,2006,2,산업독성학,87,생물학적 모니터링을 위한 시료가 아닌 것은?,,호기 중의 유해인자 대사산물,요 중의 유해인자나 대사산물,혈액 중의 유해인자나 대사산물,흡기 중의 유해인자나 대사산물,4
산업위생관리기사,2006,2,산업독성학,88,화학물질에 의한 다단계 암 발생 이론에서 적용되는 단계와 가장 거리가 먼 것은?,,진행,촉진,조정,개시,3
산업위생관리기사,2006,2,산업독성학,89,"간의 장해인 중심소엽성 괴사를 일으키는 대표적인 물질은? (단, 지방족 할로겐 탄화수소)",,사염화탄소,톨루엔,노말헥산,클로로포름,1
산업위생관리기사,2006,2,산업독성학,90,TD₅₀(Toxin Dose)에 대한 설명으로 가장 적절한 것은?,,실험동물의 50%에서 심각한 독성반응이 나타나는 양,실험동물의 50%가 심각한 독성반응으로 죽게 되는 양,실험동물의 50%에서 관찰 가능한 가역적 독성반응이 나타나는 양,실험동물의 50%에서 독성의 양-반응관계가 성립되는 양,1
산업위생관리기사,2006,2,산업독성학,91,알레르기성 접촉피부염에 관한 설명으로 틀린 것은?,,항원에 노출되고 일정시간이 지난 후에 다시 노출되었을 때 세포매개성 과민반응에 의하여 부작용의 결과이다.,알레르기성 반응은 극소량 노출에 의해서도 피부염이 발생할 수 있는 것이 특징이다.,알레르기 원에 노출되고 이 물질이 알레르기 원으로 작용하기 위해서 일정기간이 소요되며 그 기간을 휴지기간이라 한다.,"알레르기 반응을 일으키는 관련세포는 대식세포, 림프구, 랑거한스 세포로 구분된다.",3
산업위생관리기사,2006,2,산업독성학,92,다음 분진 중 악성 중피종(mesothelioma)을 유발시키는 것은?,,석면,실리카,활석,주석,1
산업위생관리기사,2006,2,산업독성학,93,산업역학에서 이용되는 상대위험도가 '1'일 때 의미하는 것은?,,노출과 질병발생 사이의 연관 없음,노출 군 전부가 발병하였음.,질병의 위험이 증가함.,질병에 대한 방어효과가 있음,1
산업위생관리기사,2006,2,산업독성학,94,유해물질 중 '망간'에 대한 설명으로 틀린 것은?,,만성중독은 3가 이상의 망간화합물에 의해서 발생한다.,"전기용접봉 제조업, 도자기 제조업에서 발생된다.",질병의 위험이 증가함.,질병에 대한 방어효과가 있음,1
산업위생관리기사,2006,2,산업독성학,95,크롬 중독에 관한 설명 중 틀린 것은?,,"크롬중독 시 BAL, Ca-EDTA 복용은 효과가 없다.",크롬은 생체에 필수적인 금속으로서 결핍 시에는 인슐린의 증가로 인한 대사장애를 일으킨다.,"만성중독 증상은 피부증상, 호흡기증상, 폐암 등이 있다.","체내에 흡수된 크롬은 간장, 신장, 폐 및 골수에 축적되며, 대부분 대변을 통해 배설된다.",3
산업위생관리기사,2006,2,산업독성학,96,점 돌연변이의 주요기전과 가장 거리가 먼 내용은?,,염기의 치환,염기의 합성,염기의 삽입,염기의 탈락,3
산업위생관리기사,2006,2,산업독성학,97,다음 중 '세 기관지 및 폐포 점막 자극제'로 가장 적절한 것은?,,포스겐,크롬산,아황산가스,불화수소,1
산업위생관리기사,2006,2,산업독성학,98,폭로물질에 대하여 간장이 표적 장기가 되는 이유와 가장 거리가 먼 것은?,,간장은 체액의 전해질 및 PH를 조절하여 신체의 항상성 유지 등의 신체조정역활을 수행하기 때문에 폭로에 민감하다.,간장은 혈액의 흐름이 매우 풍부하기 때문에 혈액을 통하여 쉅게 침투가 가능하다.,간장은 매우 복합적인 기능을 수행하기 때문에 기능의 손상가능성이 매우 높다.,간장은 문정액을 통하여 소화기계로부터 혈액을 공급받기 때문에 소화기관을 통하여 흡수된 독성물질의 일차표적이 된다.,1
산업위생관리기사,2006,2,산업독성학,99,이황화탄소에 관한 설명으로 틀린 것은?,,중추신경계에 대한 특징적인 독성작용으로 심한 급성 혹은 아급성 뇌병증을 유발한다.,휘발성이 매우 높은 무색 액체이다.,대부분 상기도를 통해서 체내에 흡수된다.,생물학적 폭로지표로 요중 삼염화아세트산 검사가 이용된다.,4
산업위생관리기사,2006,2,산업독성학,100,다음의 유기용제 중 특이증상이 '간 장해'인 것으로 가장 적절한 것은?,,염화탄화수소,벤젠,노말헥산,에틸렌그리콜에테르,1
