"Test Name","Year","Session","Subject","Number","Question","Question_image","Option 1","Option 2","Option 3","Option 4","Answer"
"지방9급","2016","A","재난관리론","1","재난 및 안전관리 기본법 상 안전관리계획의 작성권자에 대한 설명으로 옳지 않은 것은?","","국가안전관리기본계획의 수립지침은 국무총리가 작성한다.","국가안전관리기본계획은 국민안전처장관이 작성한다.","관계 중앙행정기관의 장은 소관 업무에 관한 집행계획을 작성한다.","재난관리책임기관의 장은 집행계획에 따라 세부집행계획을 작성한다.","2"
"지방9급","2016","A","재난관리론","2","자연재해대책법 시행령 상 우수유출저감대책을 수립해야 되는 건축 협의 대상의 기준으로 옳은 것은?","","건축 협의 대상 중 대지면적이 1,000 m$^2$ 이상이거나 건축 연면적이 2,000 m$^2$ 이상인 건축","건축 협의 대상 중 대지면적이 1,500 m$^2$ 이상이거나 건축 연면적이 2,000 m$^2$ 이상인 건축","건축 협의 대상 중 대지면적이 1,500 m$^2$ 이상이거나 건축 연면적이 2,500 m$^2$ 이상인 건축","건축 협의 대상 중 대지면적이 2,000 m$^2$ 이상이거나 건축 연면적이 3,000 m$^2$ 이상인 건축","4"
"지방9급","2016","A","재난관리론","3","국가위기관리 기본지침에 의한 위기경보의 구분 개념 가운데 '징후활동이 비교적 활발하고 국가위기로 발전할 경향성이 나타남'의 상태에 발령하는 경보단계는?","","관심(Blue)","주의(Yellow)","경계(Orange)","심각(Red)","2"
"지방9급","2016","A","재난관리론","4","재난 및 안전관리 기본법 상 안전관리기구에 대한 설명이다. ㉠ ～ ㉢에 들어갈 내용을 바르게 연결한 것은?\n\n재난관리를 위한 안전관리기구 중 중앙안전관리위원회의 위원장은 ( ㉠ )이(가) 되고, 안전정책조정위원회의 위원장은 ( ㉡ )이(가), 중앙재난안전대책본부장은 ( ㉢ )이 된다.","","대통령 / 국무총리 / 행정자치부장관","국무총리 / 국민안전처장관 / 국민안전처장관","국무총리 / 국민안전처장관 / 행정자치부장관","대통령 / 국무총리 / 국민안전처장관","2"
"지방9급","2016","A","재난관리론","5","재난 및 안전관리 기본법 상 사회재난에 해당하지 않는 것은?","","철도 사고로 인한 수도권 철도망 마비","댐 붕괴 사고로 인한 도시 침수","유성체의 추락·충돌로 인한 재난","두 개군 이상에 걸친 구제역 발생","3"
"지방9급","2016","A","재난관리론","6","재난 및 안전관리 기본법 상 정부부처 업무에 대한 설명으로 옳은 것은?","","특별재난지역의 선포를 건의 받은 국무총리는 해당 지역을 특별재난지역으로 선포할 수 있다.","국민안전처장관은 3년마다 재난 및 안전관리 사업의 효과성 및 효율성을 평가하고, 그 결과를 관계 중앙행정기관의 장에게 통보하여야 한다.","국민안전처장관은 재난관리책임기관의 재난 및 안전관리 실태를 점검하기 위하여 정부합동안전점검단을 편성하여 안전점검을 실시할 수 있다.","국무총리는 대통령령으로 정하는 재난이 발생하거나 발생할 우려가 있는 경우 중앙안전관리위원회의 심의를 거쳐 재난 사태를 선포할 수 있다.","3"
"지방9급","2016","A","재난관리론","7","재난에 의한 환자이송 시 조치사항에 대한 설명으로 옳은 것만을 모두 고른 것은?\n\nㄱ. 중증도분류표는 중증도 분류에 따라 환자의 발목이나 의류에 부착한다.\nㄴ. 긴급환자, 중상환자, 지연환자의 순으로 이송한다.\nㄷ. 비응급(경상)환자는 구급차로 이송한다.\nㄹ. 긴급환자의 경우는 원칙적으로 구급차 1대당 1인을 이송한다.","","ㄱ, ㄴ","ㄱ, ㄹ","ㄴ, ㄹ","ㄴ, ㄷ","3"
"지방9급","2016","A","재난관리론","8","재난 및 안전관리 기본법 상 정부합동 재난원인조사에 대한 설명으로 옳지 않은 것은?","","국민안전처장관은 재난의 발생 원인과 재난발생 시 대응과정에 관한 조사·분석·평가를 효율적으로 수행하기 위하여 정부 합동 재난원인조사단을 편성할 수 있다.","재난원인조사단은 재난원인조사를 위하여 필요하면 관계 기관의 장 또는 관계인에게 자료제출 등의 요청을 할 수 있다.","국민안전처장관은 재난원인조사 결과를 관계 기관의 장에게 통보하거나 개선권고 등의 필요한 조치를 요청할 수 있다.","재난원인조사단은 대통령령으로 정하는 바에 따라 재난발생 원인조사 결과를 국무총리에게 보고하여야 한다.","4"
"지방9급","2016","A","재난관리론","9","재난 및 안전관리 기본법 상 재난신고 및 재난상황의 보고와 관련한 설명으로 옳지 않은 것은?","","해양경비안전서장은 자신의 관할구역에서 재난상황이 발생한 경우 즉시 국민안전처장관, 관계 재난관리주관기관의 장 및 시·도지사에게 보고하여야 한다.","해외재난국민의 가족 등은 해외재난국민의 생사확인 등을 국민안전처장관에게 요청할 수 있다.","해양경비안전서장은 재난발생을 신고받거나 통보받은 경우에는 즉시 관계 재난관리책임기관의 장에게 통보하여야 한다.","재난신고를 받은 시장·군수·구청장과 그 밖의 관계 행정기관의 장은 관할 긴급구조기관의 장에게 통보하여야 한다.","2"
"지방9급","2016","A","재난관리론","10","풍수해보험법 상 풍수해보험사업에 대한 설명으로 옳지 않은 것은?","","국가와 지방자치단체는 보험목적물이 농어업재해보험에 가입되어있는 경우, 보험료의 일부를 지원할 수 있다.","풍수해보험사업은 국민안전처장관이 관장하고, 풍수해보험과 관련된 분쟁은 금융분쟁조정위원회에서 조정한다.","풍수해보험사업의 보험기간은 1년을 기본 단위로 한다.","보험목적물이 담보로 제공된 경우 외에는 보험금을 지급받을 수 있는 권리를 압류할 수 없다.","1"
"지방9급","2016","A","재난관리론","11","지역의 자율적인 방재 기능을 강화하기 위하여 지역주민, 봉사단체, 방재 관련 업체, 전문가 등으로 지역자율방재단을 구성·운영할 수 있는 근거가 되는 법률은?","","자연재해대책법","민방위기본법","재난 및 안전관리 기본법","비영리민간단체 지원법","1"
"지방9급","2016","A","재난관리론","12","재난 및 안전관리 기본법 시행령 상 재난관리주관기관이 나머지 셋과 다른 재난 및 사고 유형은?","","공동구 재난(국토교통부가 관장하는 공동구는 제외)","유해화학물질 유출 사고","해양에서 발생한 유도선 등의 수난 사고","위험물 사고","2"
"지방9급","2016","A","재난관리론","13","재난 및 안전관리 기본법 상 재난관리체계 등과 관련하여 국민안전처장관이 정기적으로 할 수 있는 평가 사항이 아닌 것은?","","재난발생 위험이 높은 분야의 안전관리체계 및 안전관리규정","재난에 대응할 조직의 구성 및 정비 실태","대규모재난의 발생에 대비한 단계별 예방·대응 및 복구과정","공공기관의 재난관리체계","4"
"지방9급","2016","A","재난관리론","14","기상특보 발표기준의 해당범위에 대한 설명으로 옳지 않은 것은?","","실효습도 35 % 이하가 24시간 이상 지속될 것으로 예상될 때 건조주의보를 발령한다.","6시간 강우량이 110 mm 이상 예상될 때 호우경보를 발령한다.","산지는 24시간 신적설이 30 cm 이상이 예상될 때 대설경보를 발령한다.","산지는 풍속 24 m/s 이상 또는 순간풍속이 30 m/s 이상이 예상될 때 강풍경보를 발령한다.","1"
"지방9급","2016","A","재난관리론","15","기업의 방재 및 위기관리의 개념 중 비즈니스 운영의 연속성을 유지하기 위한 방법론으로 자연, 인간, 기술에 관련된 각종 요인으로 발생하는 사고 또는 긴급사태로 인하여 비즈니스 운영상에 문제가 생길 경우 적정 시간 안에 순차적으로 업무 비즈니스 사이클을 회복하기 위해 계획을 수립하는 프로세스는?","","BCM(Business Continuity Management)","BIA(Business Impact Analysis)","BCP(Business Continuity Planning)","BCCM(Business Crisis Continuity Management)","3"
"지방9급","2016","A","재난관리론","16","재해구호법 상 이재민 구호에 대한 설명으로 옳지 않은 것은?","","구호활동을 효율적으로 하기 위하여 시·도 및 시·군·구에 구호센터를 두고 있다.","구호대상은 자연재해만 해당되며, 사회재난은 포함되지 않는다.","의연금품을 모집하려는 자는 국민안전처장관의 허가를 받아야 한다.","구호지원기관으로 대한적십자사와 전국재해구호협회가 있다.","2"
"지방9급","2016","A","재난관리론","17","재난관리 법령 흐름에 대한 설명으로 옳지 않은 것은?","","1961년에는 전북 남원과 경북 영주에 홍수가 발생하여 국가 차원에서 '하천법'과 '수난구호법'이 제정되었다.","1967년에는 호우나 폭풍뿐만 아니라, 폭설과 해일 등이 포함된 '풍수해대책법'이 추가로 제정되었고, 1975년에는 안보의 필요성으로 '민방위기본법'이 제정되었다.","1980 ～ 90년대 전반기에는 자연재난 및 인적재난과 관련하여 '농어업재해대책법', '소방법', '철도법', '도로법', '건축법' 등의 개별 법령들이 개정되었다.","1990년대 후반기에는 범국가 차원의 재난전담관리 시스템과 법령 정비의 필요성이 대두되어, '재난 및 안전관리 기본법'을 제정하여 시행함으로써 국가 재난대비 법령의 기본 틀을 갖추게 되었다.","4"
"지방9급","2016","A","재난관리론","18","미국의 연방재난관리청(FEMA)에 대한 설명으로 옳지 않은 것은?","","1979년 재난관리재조직계획에 따라 설립되었으며 미국의 재난관리기능을 통합하는 계기가 되었다.","FEMA는 인적재난, 자연재난, 환경재난 등을 포괄 대응한다.","FEMA는 연방정부 및 지방정부의 재난관리기구를 구성·운영한다.","본부는 워싱턴시 특별행정구역에 있고 미국 전역 10개소에 지역사무소를 설치·운영한다.","3"
"지방9급","2016","A","재난관리론","19","자연재해대책법 상 지역별 방재계획 수립을 위한 기준이 되는 방재성능목표에 대한 설명으로 옳지 않은 것은?","","홍수, 호우 등으로부터 재해를 예방하기 위하여 설정·공표한 목표 강우량으로, 시간당 강우량과 연속강우량으로 표현된다.","국민안전처장관은 방재시설의 성능이 지역별 방재성능목표에 부합하는지를 평가한다.","특별시장·광역시장·시장 및 군수는 해당 특별시·광역시(광역시에 속하는 군은 제외)·시 및 군에 대한 10년 단위의 지역별 방재성능목표를 설정하여야 한다.","특별시장·광역시장·시장 및 군수는 방재성능목표를 공표한 날로부터 5년마다 타당성 여부를 검토하여 필요한 경우에는 변경·공표하여야 한다.","2"
"지방9급","2016","A","재난관리론","20","재난 및 안전관리 기본법 상 다음 설명에 해당하는 기구는?\n\n○ 평상 시 재난 및 안전관리 위험요소 및 취약시설의 모니터링·제보 기능을 한다.\n○ 재적위원 4분의 1 이상이 회의 소집을 요청하는 경우 회의가 소집될 수 있다.\n○ 기구 내에 재난긴급대응단을 둘 수 있다.","","중앙안전관리위원회","중앙재난방송협의회","중앙안전관리민관협력위원회","안전정책조정위원회","3"