"Test Name","Year","Session","Subject","Number","Question","Question_image","Option 1","Option 2","Option 3","Option 4","Answer"
"국가7급","2020","나","도시계획","1","다음 인물과 그에 대한 내용으로 옳지 않은 것은?","","랑팡(P. L'Enfant) - 워싱턴 D.C.(Washington D.C.) 계획","비트루비우스(Vitruvius) - 6각형 이상도시 계획","푸리에(C. Fourier) - 팔랑스테리(Phalanstery) 계획","히포다무스(Hippodamus) - 격자형 도시 계획","2"
"국가7급","2020","나","도시계획","2","도시·군기본계획 수립 시 생활권에 대한 설명으로 옳은 것은?","","생활권은 시·군을 위계별로 구분하지 않고, 하나의 생활권은 관리의 적정규모가 될 수 있도록 설정한다.","생활권별 인구밀도계획은 노후건축물, 교통수요를 고려하여 수용가능한 인구배분계획이 될 수 있도록 한다.","권역생활권은 자치구(구), 군이 1개 이상으로, 특광역시, 대도시에 적용가능한 생활권이다.","중생활권은 근린주구 크기로서 초등학교·중학교의 보행에 의한 통학권을 가지는 일상생활권이다.","3"
"국가7급","2020","나","도시계획","3","다음 도시들의 출현 시기를 순서대로 바르게 나열한 것은?\nㄱ. 밀레투스(Miletus) ㄴ. 우르(Ur)\nㄷ. 캔버라(Canberra) ㄹ. 필라델피아(Philadelphia)","","ㄱ → ㄴ → ㄹ → ㄷ","ㄱ → ㄷ → ㄴ → ㄹ","ㄴ → ㄱ → ㄷ → ㄹ","ㄴ → ㄱ → ㄹ → ㄷ","4"
"국가7급","2020","나","도시계획","4","도시 및 주거환경정비법 상 환지방식이 가능한 정비사업에 해당하는 것은?","","주거환경개선사업","가로주택정비사업","경제기반형 도시재생사업","재건축사업","1"
"국가7급","2020","나","도시계획","5","국토의 계획 및 이용에 관한 법률 상 도시지역으로 결정·고시된 것이라고 의제할 수 없는 지역은?","","항만법 제2조제4호에 따른 항만구역으로서 도시지역에 연접한 공유수면","전원개발촉진법 상 송·변전설비만을 설치하기 위한 전원개발사업구역","산업입지 및 개발에 관한 법률 제2조제8호가목에 따른 국가산업단지","어촌·어항법 제17조제1항에 따른 어항구역으로서 도시지역에 연접한 공유수면","2"
"국가7급","2020","나","도시계획","6","토지이용계획에서 토지용도별 수요 추정에 대한 설명으로 옳은 것은?","","순밀도는 유동인구를 주택부지로 나누어 산정한다.","상업용지 면적은 중력모형(Gravity Model), 컨버스모형(Converse Model), 선형모형(Linear Model), GIS 중첩모형(GIS Overlay Model) 등으로 구할 수 있다.","상업용 토지의 수요는 건축연면적을 적정 건폐율로 나누어 산정한다.","주거용 토지의 수요는 목표연도에 예측된 인구를 인구밀도로 나누어 산정한다.","4"
"국가7급","2020","나","도시계획","7","공청회를 의무적으로 개최하여야 하는 경우가 아닌 것은?","","국토의 계획 및 이용에 관한 법률에 따라 시장이 지구단위계획을 수립하는 경우","경관법에 따라 광역시장이 경관계획을 수립하는 경우","도시개발법령에 따라 도지사가 도시개발사업을 시행하려는 구역의 면적이 100만 제곱미터 이상인 도시개발구역을 지정하는 경우","국토의 계획 및 이용에 관한 법률에 따라 시장이 광역도시계획을 변경하려는 경우","1"
"국가7급","2020","나","도시계획","8","교통계획에서 통행(Trip)에 대한 설명으로 옳지 않은 것은?","","사람의 이동행위를 측정하는 단위이다.","사람의 이동행위와 교통 간 연관관계의 해석이나 교통빈도의 파악에 적절한 분석단위이다.","교통목적, 기점, 종점, 교통수단, 이동경로, 시간대, 이동거리 등이 통행의 속성이다.","모든 사람이 공동 교통목적을 달성하기 위하여 출발지에서 목적지까지 이동하는 전체 이동과정이다.","4"
"국가7급","2020","나","도시계획","9","교통계획의 4단계 수요추정법 중 출발지(Origin)에서 목적지(Destination)로 향하는 통행량을 산정하는 것은?","","수단선택(Modal Split)","통행분포(Trip Distribution)","통행배정(Trip Assignment)","통행발생(Trip Generation)","2"
"국가7급","2020","나","도시계획","10","자연재해대책법령상 우수유출저감시설 중 저류시설에 해당하지 않는 것은?","","광장저류","공원저류","운동장저류","건축물저류","1"
"국가7급","2020","나","도시계획","11","국토의 계획 및 이용에 관한 법률 상 공동구에 대한 설명으로 옳지 않은 것은?","","공동구의 설치에 필요한 비용은 법률에 특별한 규정이 있는 경우를 제외하고는 공동구 점용예정자와 사업시행자가 부담한다.","공동구관리자는 대통령령으로 정하는 바에 따라 1년에 1회 이상 공동구의 안전점검을 실시하여야 하며, 안전점검결과 이상이 있다고 인정되는 때에는 지체 없이 정밀안전진단·보수·보강 등 필요한 조치를 하여야 한다.","공동구관리자는 공동구의 설치·관리에 관한 주요 사항의 심의 또는 자문을 하게 하기 위하여 공동구협의회를 둘 수 있다.","공동구관리자는 10년마다 해당 공동구의 안전 및 유지관리계획을 수립·시행하여야 한다.","4"
"국가7급","2020","나","도시계획","12","국토의 계획 및 이용에 관한 법률 상 방재지구는?","","화재의 위험을 예방하기 위하여 필요한 지구","문화적·생태적으로 보존가치가 큰 시설 및 지역의 보호와 보존을 위하여 필요한 지구","풍수해, 산사태, 지반의 붕괴, 그 밖의 재해를 예방하기 위하여 필요한 지구","오염물질 배출시설, 청소년 유해시설 등 특정시설의 입지를 제한할 필요가 있는 지구","3"
"국가7급","2020","나","도시계획","13","국토의 계획 및 이용에 관한 법령상 지구단위계획 수립 시 고려해야 할 사항으로 명시되지 않은 것은?","","지역 공동체의 활성화","안전하고 지속가능한 생활권의 조성","해당 용도지역의 특성","도시의 균형 발전","4"
"국가7급","2020","나","도시계획","14","경관법 상 경관계획이 수립된 지역에서 시행할 수 있는 경관사업에 해당하지 않는 것은?","","가로환경의 정비 및 개선을 위한 사업","지역의 녹화와 관련된 사업","주거지역의 재건축사업","야간경관의 형성 및 정비를 위한 사업","3"
"국가7급","2020","나","도시계획","15","자연재해대책법령상 지역자율방재단에 대한 설명으로 옳지 않은 것은?","","시장·군수·구청장이 효율적 운영을 위하여 필요하다고 인정하는 경우 읍·면·동 단위로도 구성·운영할 수 있다.","행정안전부장관은 지역자율방재단을 활성화하기 위하여 예산을 지원할 수 있다.","시장·군수·구청장은 지역자율방재단원이 재해 예방·대응·복구 활동 등에 참여로 인하여 질병에 걸린 때에는 수당을 지급할 수 있으나 보상금은 지급할 수 없다.","행정안전부장관은 지역자율방재단의 운영 등에 대하여 평가할 수 있다.","3"
"국가7급","2020","나","도시계획","16","도시·군계획시설의 결정·구조 및 설치기준에 관한 규칙 상 저류시설의 결정기준 및 구조·설치기준에 해당하지 않는 것은?","","개발행위 등으로 인하여 저류시설에 토사가 유입되어 강우량이 계획강우량에 미달하는 상태에서 빗물이 저류시설에 흘러넘치지 아니하도록 할 것","퇴적물의 처분이 가능하고 하수도시설과 연계운영이 가능한 구조로 할 것","집중강우로 인하여 급증하는 제내지 및 저지대의 물을 하천으로 내보내기 쉬운 하천변이나 주거환경을 저해하지 아니하는 저지대에 설치할 것","집수 및 배수가 원활하게 이루어지도록 하고, 방류지점이 되는 하천·하수도·수로 등과의 연결이 원활하도록 할 것","3"
"국가7급","2020","나","도시계획","17","국토의 계획 및 이용에 관한 법령상 개발밀도관리구역의 지정기준을 정할 때 고려할 사항으로 옳지 않은 것은?","","당해 지역의 도로율이 국토교통부령이 정하는 용도지역별 도로율에 20퍼센트 이상 미달하는 지역","향후 2년 이내에 당해 지역의 수도에 대한 수요량이 수도시설의 시설용량을 초과할 것으로 예상되는 지역","향후 2년 이내에 당해 지역의 하수발생량이 하수시설의 시설용량을 초과할 것으로 예상되는 지역","향후 2년 이내에 당해 지역의 학생수가 학교수용능력을 10퍼센트 이상 초과할 것으로 예상되는 지역","4"
"국가7급","2020","나","도시계획","18","도시·군기본계획수립지침 상 방재·방범 및 안전계획에 대한 설명으로 옳지 않은 것은?","","연안침식이 진행중이거나 우려되는 지역은 원칙적으로 시가화예정용지 대상지역에서 제외한다.","방수·방화·방조·방풍 등 재해방지 계획과 피해발생을 대비한 방재계획을 수립한다.","상습침수지역을 개발할 때에는 집중호우에 대비하여 저류지를 확보하거나 충분한 광장 및 주차장을 확보하여야 한다.","기후변화, 고령화, 다문화, 정보화 등 도시환경의 여건변화로 인한 재해·범죄의 취약성에 대응할 수 있도록 한다.","3"
"국가7급","2020","나","도시계획","19","자연재해대책법 상 재해영향성검토 및 재해영향평가의 협의대상사업에 해당하지 않는 것은?","","교통시설의 건설","에너지 개발","관광단지 개발 및 체육시설 조성","산지복구 및 골재가공","4"
"국가7급","2020","나","도시계획","20","국토의 계획 및 이용에 관한 법령상 5천 제곱미터 이상으로서 도시·군계획조례로 정하는 면적 이상의 유휴토지 또는 대규모시설의 이전부지가 지구단위계획구역으로 지정되기 위한 요건에 해당하지 않는 지역은?","","도시기능의 재배치 및 정비가 필요한 지역","역세권의 체계적 개발이 필요한 지역","토지의 활용 잠재력이 높고 지역거점 육성이 필요한 지역","지역경제 활성화와 고용창출의 효과가 클 것으로 예상되는 지역","2"